user_input,retrieved_contexts,response,reference,context_precision,context_recall,faithfulness,answer_relevancy
What is the par value of common stock for Tesla?,"['""us-gaap_CommonStockSharesOutstanding"": {\n     ""xbrltype"": ""sharesItemType"",\n     ""nsuri"": ""http://fasb.org/us-gaap/2025"",\n     ""localname"": ""CommonStockSharesOutstanding"",\n     ""presentation"": [\n      ""http://www.tesla.com/role/ConsolidatedBalanceSheetsParenthetical""\n     ],\n     ""lang"": {\n      ""en-us"": {\n       ""role"": {\n        ""terseLabel"": ""Common stock, shares outstanding (in shares)"",\n        ""label"": ""Common Stock, Shares, Outstanding"",\n        ""documentation"": ""Number of shares of common stock outstanding. Common stock represent the ownership interest in a corporation.""\n       }\n      }\n     },\n     ""auth_ref"": [\n      ""r11"",\n      ""r78"",\n      ""r1028"",\n      ""r1046"",\n      ""r1692"",\n      ""r1693""\n     ]\n    },\n    ""us-gaap_CommonStockValue"": {\n     ""xbrltype"": ""monetaryItemType"",\n     ""nsuri"": ""http://fasb.org/us-gaap/2025"",\n     ""localname"": ""CommonStockValue"",\n     ""crdr"": ""credit"",\n     ""calculation"": {\n      ""http://www.tesla.com/role/ConsolidatedBalanceSheets"": {\n       ""parentTag"": ""us-gaap_StockholdersEquity"",\n       ""weight"": 1.0,\n       ""order"": 2.0\n      }\n     },\n     ""presentation"": [\n      ""http://www.tesla.com/role/ConsolidatedBalanceSheets""\n     ],\n     ""lang"": {\n      ""en-us"": {\n       ""role"": {\n        ""terseLabel"": ""Common stock; $0.001 par value; 6,000 shares authorized; 3,751 and 3,216 shares issued and outstanding as of December\\u00a031, 2025 and 2024, respectively"",\n        ""label"": ""Common Stock, Value, Issued"",\n        ""documentation"": ""Aggregate par or stated value of issued nonredeemable common stock (or common stock redeemable solely at the option of the issuer). This item includes treasury stock repurchased by the entity. Note: elements for number of nonredeemable common shares, par value and other disclosure concepts are in another section within stockholders\' equity.""\n       }\n      }\n     },\n     ""auth_ref"": [\n      ""r78"",\n      ""r500"",\n      ""r508"",\n      ""r940"",\n      ""r1226""\n     ]\n    },', '""us-gaap_CommonStockSharesOutstanding"": {\n     ""xbrltype"": ""sharesItemType"",\n     ""nsuri"": ""http://fasb.org/us-gaap/2025"",\n     ""localname"": ""CommonStockSharesOutstanding"",\n     ""presentation"": [\n      ""http://www.tesla.com/role/ConsolidatedBalanceSheetsParenthetical""\n     ],\n     ""lang"": {\n      ""en-us"": {\n       ""role"": {\n        ""terseLabel"": ""Common stock, shares outstanding (in shares)"",\n        ""label"": ""Common Stock, Shares, Outstanding"",\n        ""documentation"": ""Number of shares of common stock outstanding. Common stock represent the ownership interest in a corporation.""\n       }\n      }\n     },\n     ""auth_ref"": [\n      ""r11"",\n      ""r78"",\n      ""r1028"",\n      ""r1046"",\n      ""r1692"",\n      ""r1693""\n     ]\n    },\n    ""us-gaap_CommonStockValue"": {\n     ""xbrltype"": ""monetaryItemType"",\n     ""nsuri"": ""http://fasb.org/us-gaap/2025"",\n     ""localname"": ""CommonStockValue"",\n     ""crdr"": ""credit"",\n     ""calculation"": {\n      ""http://www.tesla.com/role/ConsolidatedBalanceSheets"": {\n       ""parentTag"": ""us-gaap_StockholdersEquity"",\n       ""weight"": 1.0,\n       ""order"": 2.0\n      }\n     },\n     ""presentation"": [\n      ""http://www.tesla.com/role/ConsolidatedBalanceSheets""\n     ],\n     ""lang"": {\n      ""en-us"": {\n       ""role"": {\n        ""terseLabel"": ""Common stock; $0.001 par value; 6,000 shares authorized; 3,751 and 3,216 shares issued and outstanding as of December\\u00a031, 2025 and 2024, respectively"",\n        ""label"": ""Common Stock, Value, Issued"",\n        ""documentation"": ""Aggregate par or stated value of issued nonredeemable common stock (or common stock redeemable solely at the option of the issuer). This item includes treasury stock repurchased by the entity. Note: elements for number of nonredeemable common shares, par value and other disclosure concepts are in another section within stockholders\' equity.""\n       }\n      }\n     },\n     ""auth_ref"": [\n      ""r78"",\n      ""r500"",\n      ""r508"",\n      ""r940"",\n      ""r1226""\n     ]\n    },', ']\n    },\n    ""us-gaap_PreferredStockSharesOutstanding"": {\n     ""xbrltype"": ""sharesItemType"",\n     ""nsuri"": ""http://fasb.org/us-gaap/2025"",\n     ""localname"": ""PreferredStockSharesOutstanding"",\n     ""presentation"": [\n      ""http://www.tesla.com/role/ConsolidatedBalanceSheetsParenthetical""\n     ],\n     ""lang"": {\n      ""en-us"": {\n       ""role"": {\n        ""terseLabel"": ""Preferred stock, shares outstanding (in shares)"",\n        ""label"": ""Preferred Stock, Shares Outstanding"",\n        ""documentation"": ""Aggregate share number for all nonredeemable preferred stock (or preferred stock redeemable solely at the option of the issuer) held by stockholders. Does not include preferred shares that have been repurchased.""\n       }\n      }\n     },\n     ""auth_ref"": [\n      ""r77"",\n      ""r1028"",\n      ""r1046"",\n      ""r1692"",\n      ""r1693""\n     ]\n    },\n    ""us-gaap_PreferredStockValue"": {\n     ""xbrltype"": ""monetaryItemType"",\n     ""nsuri"": ""http://fasb.org/us-gaap/2025"",\n     ""localname"": ""PreferredStockValue"",\n     ""crdr"": ""credit"",\n     ""calculation"": {\n      ""http://www.tesla.com/role/ConsolidatedBalanceSheets"": {\n       ""parentTag"": ""us-gaap_StockholdersEquity"",\n       ""weight"": 1.0,\n       ""order"": 1.0\n      }\n     },\n     ""presentation"": [\n      ""http://www.tesla.com/role/ConsolidatedBalanceSheets""\n     ],\n     ""lang"": {\n      ""en-us"": {\n       ""role"": {\n        ""terseLabel"": ""Preferred stock; $0.001 par value; 100 shares authorized; no shares issued and outstanding"",\n        ""label"": ""Preferred Stock, Value, Issued"",\n        ""documentation"": ""Aggregate par or stated value of issued nonredeemable preferred stock (or preferred stock redeemable solely at the option of the issuer). This item includes treasury stock repurchased by the entity. Note: elements for number of nonredeemable preferred shares, par value and other disclosure concepts are in another section within stockholders\' equity.""\n       }\n      }\n     },\n     ""auth_ref"": [\n      ""r77"",\n      ""r500"",\n      ""r507"",', ']\n    },\n    ""us-gaap_PreferredStockSharesOutstanding"": {\n     ""xbrltype"": ""sharesItemType"",\n     ""nsuri"": ""http://fasb.org/us-gaap/2025"",\n     ""localname"": ""PreferredStockSharesOutstanding"",\n     ""presentation"": [\n      ""http://www.tesla.com/role/ConsolidatedBalanceSheetsParenthetical""\n     ],\n     ""lang"": {\n      ""en-us"": {\n       ""role"": {\n        ""terseLabel"": ""Preferred stock, shares outstanding (in shares)"",\n        ""label"": ""Preferred Stock, Shares Outstanding"",\n        ""documentation"": ""Aggregate share number for all nonredeemable preferred stock (or preferred stock redeemable solely at the option of the issuer) held by stockholders. Does not include preferred shares that have been repurchased.""\n       }\n      }\n     },\n     ""auth_ref"": [\n      ""r77"",\n      ""r1028"",\n      ""r1046"",\n      ""r1692"",\n      ""r1693""\n     ]\n    },\n    ""us-gaap_PreferredStockValue"": {\n     ""xbrltype"": ""monetaryItemType"",\n     ""nsuri"": ""http://fasb.org/us-gaap/2025"",\n     ""localname"": ""PreferredStockValue"",\n     ""crdr"": ""credit"",\n     ""calculation"": {\n      ""http://www.tesla.com/role/ConsolidatedBalanceSheets"": {\n       ""parentTag"": ""us-gaap_StockholdersEquity"",\n       ""weight"": 1.0,\n       ""order"": 1.0\n      }\n     },\n     ""presentation"": [\n      ""http://www.tesla.com/role/ConsolidatedBalanceSheets""\n     ],\n     ""lang"": {\n      ""en-us"": {\n       ""role"": {\n        ""terseLabel"": ""Preferred stock; $0.001 par value; 100 shares authorized; no shares issued and outstanding"",\n        ""label"": ""Preferred Stock, Value, Issued"",\n        ""documentation"": ""Aggregate par or stated value of issued nonredeemable preferred stock (or preferred stock redeemable solely at the option of the issuer). This item includes treasury stock repurchased by the entity. Note: elements for number of nonredeemable preferred shares, par value and other disclosure concepts are in another section within stockholders\' equity.""\n       }\n      }\n     },\n     ""auth_ref"": [\n      ""r77"",\n      ""r500"",\n      ""r507"",', 'format=""ixt:num-dot-decimal"" scale=""0"" id=""f-1594"">29,402,900</ix:nonFraction> Tesla shares, plus expenses of $<ix:nonFraction unitRef=""usd"" contextRef=""c-373"" decimals=""2"" name=""us-gaap:LossContingencyDamagesSoughtValue"" format=""ixt:num-dot-decimal"" scale=""0"" id=""f-1595"">1,120,115.50</ix:nonFraction>. Tesla opposed the fee request, and at Tesla&#8217;s 2024 Annual Meeting of Stockholders, <ix:nonFraction unitRef=""number"" contextRef=""c-373"" decimals=""INF"" name=""tsla:LossContingencyDamagesSoughtDisinterestedVotingSharesInFavorPercentage"" scale=""-2"" id=""f-1596"">72</ix:nonFraction>% of the disinterested voting shares of Tesla, excluding shares owned by Mr. Musk and Kimbal Musk, voted to ratify the 2018 CEO Performance Award. Because Tesla&#8217;s disinterested stockholders voted to ratify the 2018 CEO Performance Award, Mr. Musk and the other director defendants, joined by Tesla, filed a brief seeking to revise the Court&#8217;s January 30, 2024 opinion. On December 2, 2024, the Court issued an opinion denying the motion to revise the Court&#8217;s January 30, 2024 opinion and awarded Plaintiff&#8217;s counsel fees in the amount of $<ix:nonFraction unitRef=""usd"" contextRef=""c-374"" decimals=""-6"" name=""us-gaap:LossContingencyDamagesAwardedValue"" format=""ixt:num-dot-decimal"" scale=""6"" id=""f-1597"">345</ix:nonFraction>&#160;million. A final judgment was entered by the Court, and the director defendants and Tesla appealed the decisions to the Delaware Supreme Court. Tesla and the Director Defendants filed their response briefs on March 11, 2025. Plaintiffs filed their opening brief on April 25, 2025, and reply briefs were filed on May 16, 2025. Oral argument occurred on October 15, 2025. On December 19, 2025, the Delaware Supreme Court reversed the Court of Chancery&#8217;s rescission order, reinstating Mr. Musk&#8217;s 2018 compensation package, and awarded $<ix:nonFraction unitRef=""usd"" contextRef=""c-375"" decimals=""0"" name=""us-gaap:LossContingencyDamagesAwardedValue""', 'format=""ixt:num-dot-decimal"" scale=""0"" id=""f-1594"">29,402,900</ix:nonFraction> Tesla shares, plus expenses of $<ix:nonFraction unitRef=""usd"" contextRef=""c-373"" decimals=""2"" name=""us-gaap:LossContingencyDamagesSoughtValue"" format=""ixt:num-dot-decimal"" scale=""0"" id=""f-1595"">1,120,115.50</ix:nonFraction>. Tesla opposed the fee request, and at Tesla&#8217;s 2024 Annual Meeting of Stockholders, <ix:nonFraction unitRef=""number"" contextRef=""c-373"" decimals=""INF"" name=""tsla:LossContingencyDamagesSoughtDisinterestedVotingSharesInFavorPercentage"" scale=""-2"" id=""f-1596"">72</ix:nonFraction>% of the disinterested voting shares of Tesla, excluding shares owned by Mr. Musk and Kimbal Musk, voted to ratify the 2018 CEO Performance Award. Because Tesla&#8217;s disinterested stockholders voted to ratify the 2018 CEO Performance Award, Mr. Musk and the other director defendants, joined by Tesla, filed a brief seeking to revise the Court&#8217;s January 30, 2024 opinion. On December 2, 2024, the Court issued an opinion denying the motion to revise the Court&#8217;s January 30, 2024 opinion and awarded Plaintiff&#8217;s counsel fees in the amount of $<ix:nonFraction unitRef=""usd"" contextRef=""c-374"" decimals=""-6"" name=""us-gaap:LossContingencyDamagesAwardedValue"" format=""ixt:num-dot-decimal"" scale=""6"" id=""f-1597"">345</ix:nonFraction>&#160;million. A final judgment was entered by the Court, and the director defendants and Tesla appealed the decisions to the Delaware Supreme Court. Tesla and the Director Defendants filed their response briefs on March 11, 2025. Plaintiffs filed their opening brief on April 25, 2025, and reply briefs were filed on May 16, 2025. Oral argument occurred on October 15, 2025. On December 19, 2025, the Delaware Supreme Court reversed the Court of Chancery&#8217;s rescission order, reinstating Mr. Musk&#8217;s 2018 compensation package, and awarded $<ix:nonFraction unitRef=""usd"" contextRef=""c-375"" decimals=""0"" name=""us-gaap:LossContingencyDamagesAwardedValue""', '""r1563""\n     ]\n    },\n    ""us-gaap_SharesIssued"": {\n     ""xbrltype"": ""sharesItemType"",\n     ""nsuri"": ""http://fasb.org/us-gaap/2025"",\n     ""localname"": ""SharesIssued"",\n     ""presentation"": [\n      ""http://www.tesla.com/role/ConsolidatedStatementsofRedeemableNoncontrollingInterestsandEquity""\n     ],\n     ""lang"": {\n      ""en-us"": {\n       ""role"": {\n        ""periodStartLabel"": ""Balance (in shares)"",\n        ""periodEndLabel"": ""Balance (in shares)"",\n        ""label"": ""Shares, Issued"",\n        ""documentation"": ""Number of shares of stock issued as of the balance sheet date, including shares that had been issued and were previously outstanding but which are now held in the treasury.""\n       }\n      }\n     },\n     ""auth_ref"": [\n      ""r11""\n     ]\n    },\n    ""us-gaap_ShortTermInvestments"": {\n     ""xbrltype"": ""monetaryItemType"",\n     ""nsuri"": ""http://fasb.org/us-gaap/2025"",\n     ""localname"": ""ShortTermInvestments"",\n     ""crdr"": ""debit"",\n     ""calculation"": {\n      ""http://www.tesla.com/role/ConsolidatedBalanceSheets"": {\n       ""parentTag"": ""us-gaap_AssetsCurrent"",\n       ""weight"": 1.0,\n       ""order"": 2.0\n      }\n     },\n     ""presentation"": [\n      ""http://www.tesla.com/role/ConsolidatedBalanceSheets"",\n      ""http://www.tesla.com/role/FairValueofFinancialInstrumentsScheduleofCashCashEquivalentsandInvestmentsClassifiedbySecurityTypeDetails""\n     ],\n     ""lang"": {\n      ""en-us"": {\n       ""role"": {\n        ""terseLabel"": ""Short-term investments"",\n        ""label"": ""Short-Term Investments"",\n        ""documentation"": ""Amount of investments including trading securities, available-for-sale securities, held-to-maturity securities, and short-term investments classified as other and current.""\n       }\n      }\n     },\n     ""auth_ref"": [\n      ""r128"",\n      ""r129"",\n      ""r1406""\n     ]\n    },\n    ""us-gaap_SignificantAccountingPoliciesTextBlock"": {\n     ""xbrltype"": ""textBlockItemType"",\n     ""nsuri"": ""http://fasb.org/us-gaap/2025"",', '""r1563""\n     ]\n    },\n    ""us-gaap_SharesIssued"": {\n     ""xbrltype"": ""sharesItemType"",\n     ""nsuri"": ""http://fasb.org/us-gaap/2025"",\n     ""localname"": ""SharesIssued"",\n     ""presentation"": [\n      ""http://www.tesla.com/role/ConsolidatedStatementsofRedeemableNoncontrollingInterestsandEquity""\n     ],\n     ""lang"": {\n      ""en-us"": {\n       ""role"": {\n        ""periodStartLabel"": ""Balance (in shares)"",\n        ""periodEndLabel"": ""Balance (in shares)"",\n        ""label"": ""Shares, Issued"",\n        ""documentation"": ""Number of shares of stock issued as of the balance sheet date, including shares that had been issued and were previously outstanding but which are now held in the treasury.""\n       }\n      }\n     },\n     ""auth_ref"": [\n      ""r11""\n     ]\n    },\n    ""us-gaap_ShortTermInvestments"": {\n     ""xbrltype"": ""monetaryItemType"",\n     ""nsuri"": ""http://fasb.org/us-gaap/2025"",\n     ""localname"": ""ShortTermInvestments"",\n     ""crdr"": ""debit"",\n     ""calculation"": {\n      ""http://www.tesla.com/role/ConsolidatedBalanceSheets"": {\n       ""parentTag"": ""us-gaap_AssetsCurrent"",\n       ""weight"": 1.0,\n       ""order"": 2.0\n      }\n     },\n     ""presentation"": [\n      ""http://www.tesla.com/role/ConsolidatedBalanceSheets"",\n      ""http://www.tesla.com/role/FairValueofFinancialInstrumentsScheduleofCashCashEquivalentsandInvestmentsClassifiedbySecurityTypeDetails""\n     ],\n     ""lang"": {\n      ""en-us"": {\n       ""role"": {\n        ""terseLabel"": ""Short-term investments"",\n        ""label"": ""Short-Term Investments"",\n        ""documentation"": ""Amount of investments including trading securities, available-for-sale securities, held-to-maturity securities, and short-term investments classified as other and current.""\n       }\n      }\n     },\n     ""auth_ref"": [\n      ""r128"",\n      ""r129"",\n      ""r1406""\n     ]\n    },\n    ""us-gaap_SignificantAccountingPoliciesTextBlock"": {\n     ""xbrltype"": ""textBlockItemType"",\n     ""nsuri"": ""http://fasb.org/us-gaap/2025"",', '}\n      }\n     },\n     ""auth_ref"": [\n      ""r560""\n     ]\n    },\n    ""us-gaap_ShareBasedCompensationArrangementByShareBasedPaymentAwardOptionsVestedAndExpectedToVestOutstandingAggregateIntrinsicValue"": {\n     ""xbrltype"": ""monetaryItemType"",\n     ""nsuri"": ""http://fasb.org/us-gaap/2025"",\n     ""localname"": ""ShareBasedCompensationArrangementByShareBasedPaymentAwardOptionsVestedAndExpectedToVestOutstandingAggregateIntrinsicValue"",\n     ""crdr"": ""debit"",\n     ""presentation"": [\n      ""http://www.tesla.com/role/EquityIncentivePlansSummaryofStockOptionRSUandRestrictedStockActivityDetails""\n     ],\n     ""lang"": {\n      ""en-us"": {\n       ""role"": {\n        ""terseLabel"": ""Aggregate intrinsic value, Vested and expected to vest"",\n        ""label"": ""Share-Based Compensation Arrangement by Share-Based Payment Award, Options, Vested and Expected to Vest, Outstanding, Aggregate Intrinsic Value"",\n        ""documentation"": ""Amount by which current fair value of underlying stock exceeds exercise price of fully vested and expected to vest options outstanding. Includes, but is not limited to, unvested options for which requisite service period has not been rendered but that are expected to vest based on achievement of performance condition, if forfeitures are recognized when they occur.""\n       }\n      }\n     },\n     ""auth_ref"": [\n      ""r559""\n     ]\n    },\n    ""us-gaap_ShareBasedCompensationArrangementByShareBasedPaymentAwardOptionsVestedAndExpectedToVestOutstandingNumber"": {\n     ""xbrltype"": ""sharesItemType"",\n     ""nsuri"": ""http://fasb.org/us-gaap/2025"",\n     ""localname"": ""ShareBasedCompensationArrangementByShareBasedPaymentAwardOptionsVestedAndExpectedToVestOutstandingNumber"",\n     ""presentation"": [\n      ""http://www.tesla.com/role/EquityIncentivePlansSummaryofStockOptionRSUandRestrictedStockActivityDetails""\n     ],\n     ""lang"": {\n      ""en-us"": {\n       ""role"": {\n        ""terseLabel"": ""Number of options (in shares), vested and expected to vest"",', '}\n      }\n     },\n     ""auth_ref"": [\n      ""r560""\n     ]\n    },\n    ""us-gaap_ShareBasedCompensationArrangementByShareBasedPaymentAwardOptionsVestedAndExpectedToVestOutstandingAggregateIntrinsicValue"": {\n     ""xbrltype"": ""monetaryItemType"",\n     ""nsuri"": ""http://fasb.org/us-gaap/2025"",\n     ""localname"": ""ShareBasedCompensationArrangementByShareBasedPaymentAwardOptionsVestedAndExpectedToVestOutstandingAggregateIntrinsicValue"",\n     ""crdr"": ""debit"",\n     ""presentation"": [\n      ""http://www.tesla.com/role/EquityIncentivePlansSummaryofStockOptionRSUandRestrictedStockActivityDetails""\n     ],\n     ""lang"": {\n      ""en-us"": {\n       ""role"": {\n        ""terseLabel"": ""Aggregate intrinsic value, Vested and expected to vest"",\n        ""label"": ""Share-Based Compensation Arrangement by Share-Based Payment Award, Options, Vested and Expected to Vest, Outstanding, Aggregate Intrinsic Value"",\n        ""documentation"": ""Amount by which current fair value of underlying stock exceeds exercise price of fully vested and expected to vest options outstanding. Includes, but is not limited to, unvested options for which requisite service period has not been rendered but that are expected to vest based on achievement of performance condition, if forfeitures are recognized when they occur.""\n       }\n      }\n     },\n     ""auth_ref"": [\n      ""r559""\n     ]\n    },\n    ""us-gaap_ShareBasedCompensationArrangementByShareBasedPaymentAwardOptionsVestedAndExpectedToVestOutstandingNumber"": {\n     ""xbrltype"": ""sharesItemType"",\n     ""nsuri"": ""http://fasb.org/us-gaap/2025"",\n     ""localname"": ""ShareBasedCompensationArrangementByShareBasedPaymentAwardOptionsVestedAndExpectedToVestOutstandingNumber"",\n     ""presentation"": [\n      ""http://www.tesla.com/role/EquityIncentivePlansSummaryofStockOptionRSUandRestrictedStockActivityDetails""\n     ],\n     ""lang"": {\n      ""en-us"": {\n       ""role"": {\n        ""terseLabel"": ""Number of options (in shares), vested and expected to vest"",', ""[WEB ARAMASI KAYNAĞI]: Yerel veri tabanında bulunamayan bilgi için internet ve finansal API'ler üzerinden şu güncel veriler elde edilmiştir:\nThe par value of common stock for Tesla is $0.001 per share.""]",The par value of common stock for Tesla is $0.001 per share.,Tesla's common stock has a par value of $0.001 per share.,0.757575757550505,1.0,1.0,1.0000000000000002
What is the par value of common stock for Nvidia?,"['colspan=""3"" style=""background-color:#ffffff;padding:2px 1pt;text-align:left;vertical-align:bottom""><span style=""color:#000000;font-family:\'NVIDIA Sans\',sans-serif;font-size:9pt;font-weight:400;line-height:100%"">Weighted average price per share</span></td><td style=""background-color:#ffffff;padding:2px 0 2px 1pt;text-align:left;vertical-align:bottom""><span style=""color:#000000;font-family:\'NVIDIA Sans\',sans-serif;font-size:9pt;font-weight:400;line-height:100%"">$</span></td><td style=""background-color:#ffffff;padding:2px 0;text-align:right;vertical-align:bottom""><span style=""color:#000000;font-family:\'NVIDIA Sans\',sans-serif;font-size:9pt;font-weight:400;line-height:100%"">49.13&#160;</span></td><td style=""background-color:#ffffff;padding:2px 1pt 2px 0;text-align:right;vertical-align:bottom""></td><td colspan=""3"" style=""background-color:#ffffff;padding:0 1pt""></td><td style=""background-color:#ffffff;padding:2px 0 2px 1pt;text-align:left;vertical-align:bottom""><span style=""color:#000000;font-family:\'NVIDIA Sans\',sans-serif;font-size:9pt;font-weight:400;line-height:100%"">$</span></td><td style=""background-color:#ffffff;padding:2px 0;text-align:right;vertical-align:bottom""><span style=""color:#000000;font-family:\'NVIDIA Sans\',sans-serif;font-size:9pt;font-weight:400;line-height:100%"">17.74&#160;</span></td><td style=""background-color:#ffffff;padding:2px 1pt 2px 0;text-align:right;vertical-align:bottom""></td><td colspan=""3"" style=""background-color:#ffffff;padding:0 1pt""></td><td style=""background-color:#ffffff;padding:2px 0 2px 1pt;text-align:left;vertical-align:bottom""><span style=""color:#000000;font-family:\'NVIDIA Sans\',sans-serif;font-size:9pt;font-weight:400;line-height:100%"">$</span></td><td style=""background-color:#ffffff;padding:2px 0;text-align:right;vertical-align:bottom""><span style=""color:#000000;font-family:\'NVIDIA Sans\',sans-serif;font-size:9pt;font-weight:400;line-height:100%"">15.81&#160;</span></td><td style=""background-color:#ffffff;padding:2px 1pt 2px', '""us-gaap_CommonStockSharesOutstanding"": {\n     ""xbrltype"": ""sharesItemType"",\n     ""nsuri"": ""http://fasb.org/us-gaap/2025"",\n     ""localname"": ""CommonStockSharesOutstanding"",\n     ""presentation"": [\n      ""http://www.nvidia.com/role/ConsolidatedBalanceSheetsParenthetical"",\n      ""http://www.nvidia.com/role/ConsolidatedStatementsofShareholdersEquity""\n     ],\n     ""lang"": {\n      ""en-us"": {\n       ""role"": {\n        ""terseLabel"": ""Common stock, shares outstanding (in shares)"",\n        ""periodStartLabel"": ""Beginning balance, common stock outstanding (in shares)"",\n        ""periodEndLabel"": ""Ending balance, common stock outstanding (in shares)"",\n        ""label"": ""Common Stock, Shares, Outstanding"",\n        ""documentation"": ""Number of shares of common stock outstanding. Common stock represent the ownership interest in a corporation.""\n       }\n      }\n     },\n     ""auth_ref"": [\n      ""r10"",\n      ""r67"",\n      ""r1028"",\n      ""r1046"",\n      ""r1703"",\n      ""r1704""\n     ]\n    },\n    ""us-gaap_CommonStockValue"": {\n     ""xbrltype"": ""monetaryItemType"",\n     ""nsuri"": ""http://fasb.org/us-gaap/2025"",\n     ""localname"": ""CommonStockValue"",\n     ""crdr"": ""credit"",\n     ""calculation"": {\n      ""http://www.nvidia.com/role/ConsolidatedBalanceSheets"": {\n       ""parentTag"": ""us-gaap_StockholdersEquity"",\n       ""weight"": 1.0,\n       ""order"": 2.0\n      }\n     },\n     ""presentation"": [\n      ""http://www.nvidia.com/role/ConsolidatedBalanceSheets""\n     ],\n     ""lang"": {\n      ""en-us"": {\n       ""role"": {\n        ""terseLabel"": ""Common stock, $0.001 par value; 80,000 shares authorized; 24,304 shares issued\\u00a0and outstanding as of January\\u00a025, 2026; 24,477 shares issued\\u00a0and outstanding as of January\\u00a026, 2025"",\n        ""label"": ""Common Stock, Value, Issued"",', '0 2px 1pt;text-align:right;vertical-align:bottom""><span style=""color:#000000;font-family:\'NVIDIA Sans\',sans-serif;font-size:9pt;font-weight:400;line-height:100%""><ix:nonFraction unitRef=""usd"" contextRef=""c-10"" decimals=""-6"" name=""us-gaap:SellingGeneralAndAdministrativeExpense"" format=""ixt:num-dot-decimal"" scale=""6"" id=""f-86"">2,654</ix:nonFraction>&#160;</span></td><td style=""background-color:#ffffff;padding:2px 1pt 2px 0;text-align:right;vertical-align:bottom""/></tr><tr><td colspan=""3"" style=""background-color:#f1f2f2;padding:2px 1pt 2px 37pt;text-align:left;vertical-align:bottom""><span style=""color:#000000;font-family:\'NVIDIA Sans\',sans-serif;font-size:9pt;font-weight:400;line-height:100%"">Total operating expenses</span></td><td colspan=""2"" style=""background-color:#f1f2f2;border-top:1pt solid #000;padding:2px 0 2px 1pt;text-align:right;vertical-align:bottom""><span style=""color:#000000;font-family:\'NVIDIA Sans\',sans-serif;font-size:9pt;font-weight:400;line-height:100%""><ix:nonFraction unitRef=""usd"" contextRef=""c-1"" decimals=""-6"" name=""us-gaap:OperatingExpenses"" format=""ixt:num-dot-decimal"" scale=""6"" id=""f-87"">23,076</ix:nonFraction>&#160;</span></td><td style=""background-color:#f1f2f2;border-top:1pt solid #000;padding:2px 1pt 2px 0;text-align:right;vertical-align:bottom""/><td colspan=""3"" style=""background-color:#f1f2f2;padding:0 1pt""/><td colspan=""2"" style=""background-color:#f1f2f2;border-top:1pt solid #000;padding:2px 0 2px 1pt;text-align:right;vertical-align:bottom""><span style=""color:#000000;font-family:\'NVIDIA Sans\',sans-serif;font-size:9pt;font-weight:400;line-height:100%""><ix:nonFraction unitRef=""usd"" contextRef=""c-9"" decimals=""-6"" name=""us-gaap:OperatingExpenses"" format=""ixt:num-dot-decimal"" scale=""6"" id=""f-88"">16,405</ix:nonFraction>&#160;</span></td><td style=""background-color:#f1f2f2;border-top:1pt solid #000;padding:2px 1pt 2px 0;text-align:right;vertical-align:bottom""/><td colspan=""3"" style=""background-color:#f1f2f2;padding:0 1pt""/><td colspan=""2""', '""r717"",\n      ""r821"",\n      ""r1026"",\n      ""r1140"",\n      ""r1159"",\n      ""r1279"",\n      ""r1557"",\n      ""r1653"",\n      ""r1654""\n     ]\n    },\n    ""us-gaap_LiabilitiesAndStockholdersEquity"": {\n     ""xbrltype"": ""monetaryItemType"",\n     ""nsuri"": ""http://fasb.org/us-gaap/2025"",\n     ""localname"": ""LiabilitiesAndStockholdersEquity"",\n     ""crdr"": ""credit"",\n     ""calculation"": {\n      ""http://www.nvidia.com/role/ConsolidatedBalanceSheets"": {\n       ""parentTag"": null,\n       ""weight"": null,\n       ""order"": null,\n       ""root"": true\n      }\n     },\n     ""presentation"": [\n      ""http://www.nvidia.com/role/ConsolidatedBalanceSheets""\n     ],\n     ""lang"": {\n      ""en-us"": {\n       ""role"": {\n        ""totalLabel"": ""Total liabilities and shareholders\' equity"",\n        ""label"": ""Liabilities and Equity"",\n        ""documentation"": ""Amount of liabilities and equity items, including the portion of equity attributable to noncontrolling interests, if any.""\n       }\n      }\n     },\n     ""auth_ref"": [\n      ""r72"",\n      ""r118"",\n      ""r955"",\n      ""r1245"",\n      ""r1263"",\n      ""r1264"",\n      ""r1479"",\n      ""r1484"",\n      ""r1529"",\n      ""r1648""\n     ]\n    },\n    ""us-gaap_LiabilitiesAndStockholdersEquityAbstract"": {\n     ""xbrltype"": ""stringItemType"",\n     ""nsuri"": ""http://fasb.org/us-gaap/2025"",\n     ""localname"": ""LiabilitiesAndStockholdersEquityAbstract"",\n     ""presentation"": [\n      ""http://www.nvidia.com/role/ConsolidatedBalanceSheets""\n     ],\n     ""lang"": {\n      ""en-us"": {\n       ""role"": {\n        ""terseLabel"": ""Liabilities and Shareholders\' Equity"",\n        ""label"": ""Liabilities and Equity [Abstract]""\n       }\n      }\n     },\n     ""auth_ref"": []\n    },\n    ""us-gaap_LiabilitiesCurrent"": {\n     ""xbrltype"": ""monetaryItemType"",\n     ""nsuri"": ""http://fasb.org/us-gaap/2025"",\n     ""localname"": ""LiabilitiesCurrent"",\n     ""crdr"": ""credit"",\n     ""calculation"": {\n      ""http://www.nvidia.com/role/ConsolidatedBalanceSheets"": {\n       ""parentTag"": ""us-gaap_Liabilities"",\n       ""weight"": 1.0,', 'colspan=""3"" style=""padding:0 1pt""/><td colspan=""3"" style=""padding:2px 1pt;text-align:center;vertical-align:bottom""><span style=""color:#000000;font-family:\'NVIDIA Sans\',sans-serif;font-size:9pt;font-weight:700;line-height:100%"">Total Number <br/>of Shares Purchased <br/>(In millions)</span></td><td colspan=""3"" style=""padding:0 1pt""/><td colspan=""3"" style=""padding:2px 1pt;text-align:center;vertical-align:bottom""><span style=""color:#000000;font-family:\'NVIDIA Sans\',sans-serif;font-size:9pt;font-weight:700;line-height:100%"">Average Price Paid per Share (1)</span></td><td colspan=""3"" style=""padding:0 1pt""/><td colspan=""3"" style=""padding:2px 1pt;text-align:center;vertical-align:bottom""><span style=""color:#000000;font-family:\'NVIDIA Sans\',sans-serif;font-size:9pt;font-weight:700;line-height:100%"">Total Number of Shares Purchased as Part of Publicly Announced Program (In millions)</span></td><td colspan=""3"" style=""padding:0 1pt""/><td colspan=""3"" style=""padding:2px 1pt;text-align:center;vertical-align:bottom""><span style=""color:#000000;font-family:\'NVIDIA Sans\',sans-serif;font-size:9pt;font-weight:700;line-height:100%"">Approximate Dollar Value of Shares that May Yet Be Purchased Under the Program (In billions)</span></td></tr><tr><td colspan=""3"" style=""background-color:#f1f2f2;border-top:1pt solid #000000;padding:2px 1pt;text-align:left;vertical-align:bottom""><span style=""color:#000000;font-family:\'NVIDIA Sans\',sans-serif;font-size:9pt;font-weight:400;line-height:100%"">October 27, 2025 - November 23, 2025</span></td><td colspan=""3"" style=""background-color:#f1f2f2;padding:0 1pt""/><td colspan=""2"" style=""background-color:#f1f2f2;border-top:1pt solid #000000;padding:2px 0 2px 1pt;text-align:right;vertical-align:bottom""><span style=""color:#000000;font-family:\'NVIDIA Sans\',sans-serif;font-size:9pt;font-weight:400;line-height:100%"">5.6&#160;</span></td><td style=""background-color:#f1f2f2;border-top:1pt solid #000000;padding:2px 1pt 2px', '0 2px 1pt;text-align:right;vertical-align:bottom""><span style=""color:#000000;font-family:\'NVIDIA Sans\',sans-serif;font-size:7.5pt;font-weight:400;line-height:100%""><ix:nonFraction unitRef=""usd"" contextRef=""c-26"" decimals=""-6"" name=""us-gaap:StockholdersEquity"" format=""ixt:num-dot-decimal"" scale=""6"" id=""f-245"">42,978</ix:nonFraction>&#160;</span></td><td style=""background-color:#ffffff;border-top:1pt solid #000;padding:2px 1pt 2px 0;text-align:right;vertical-align:bottom""/></tr><tr><td colspan=""3"" style=""background-color:#f1f2f2;padding:2px 1pt;text-align:left;vertical-align:bottom""><span style=""color:#000000;font-family:\'NVIDIA Sans\',sans-serif;font-size:7.5pt;font-weight:400;line-height:100%"">Net income</span></td><td colspan=""2"" style=""background-color:#f1f2f2;border-top:1pt solid #000;padding:2px 0 2px 1pt;text-align:right;vertical-align:bottom""><span style=""color:#000000;font-family:\'NVIDIA Sans\',sans-serif;font-size:7.5pt;font-weight:400;line-height:100%"">&#8212;&#160;</span></td><td style=""background-color:#f1f2f2;border-top:1pt solid #000;padding:2px 1pt 2px 0;text-align:right;vertical-align:bottom""/><td colspan=""3"" style=""background-color:#f1f2f2;padding:0 1pt""/><td colspan=""2"" style=""background-color:#f1f2f2;border-top:1pt solid #000;padding:2px 0 2px 1pt;text-align:right;vertical-align:bottom""><span style=""color:#000000;font-family:\'NVIDIA Sans\',sans-serif;font-size:7.5pt;font-weight:400;line-height:100%"">&#8212;&#160;</span></td><td style=""background-color:#f1f2f2;border-top:1pt solid #000;padding:2px 1pt 2px 0;text-align:right;vertical-align:bottom""/><td colspan=""3"" style=""background-color:#f1f2f2;padding:0 1pt""/><td colspan=""2"" style=""background-color:#f1f2f2;border-top:1pt solid #000;padding:2px 0 2px 1pt;text-align:right;vertical-align:bottom""><span style=""color:#000000;font-family:\'NVIDIA Sans\',sans-serif;font-size:7.5pt;font-weight:400;line-height:100%"">&#8212;&#160;</span></td><td style=""background-color:#f1f2f2;border-top:1pt solid', '0 2px 1pt;text-align:right;vertical-align:bottom""><span style=""color:#000000;font-family:\'NVIDIA Sans\',sans-serif;font-size:7.5pt;font-weight:400;line-height:100%"">(<ix:nonFraction unitRef=""usd"" contextRef=""c-9"" decimals=""-6"" name=""us-gaap:AdjustmentsRelatedToTaxWithholdingForShareBasedCompensation"" format=""ixt:num-dot-decimal"" scale=""6"" id=""f-255"">6,930</ix:nonFraction>)</span></td><td style=""background-color:#ffffff;padding:2px 1pt 2px 0;text-align:right;vertical-align:bottom""/></tr><tr><td colspan=""3"" style=""background-color:#f1f2f2;padding:2px 1pt;text-align:left;vertical-align:bottom""><span style=""color:#000000;font-family:\'NVIDIA Sans\',sans-serif;font-size:7.5pt;font-weight:400;line-height:100%"">Shares repurchased</span></td><td colspan=""2"" style=""background-color:#f1f2f2;padding:2px 0 2px 1pt;text-align:right;vertical-align:bottom""><span style=""color:#000000;font-family:\'NVIDIA Sans\',sans-serif;font-size:7.5pt;font-weight:400;line-height:100%"">(<ix:nonFraction unitRef=""shares"" contextRef=""c-29"" decimals=""-6"" name=""us-gaap:StockRepurchasedAndRetiredDuringPeriodShares"" scale=""6"" id=""f-256"">310</ix:nonFraction>)</span></td><td style=""background-color:#f1f2f2;padding:2px 1pt 2px 0;text-align:right;vertical-align:bottom""/><td colspan=""3"" style=""background-color:#f1f2f2;padding:0 1pt""/><td colspan=""2"" style=""background-color:#f1f2f2;padding:2px 0 2px 1pt;text-align:right;vertical-align:bottom""><span style=""color:#000000;font-family:\'NVIDIA Sans\',sans-serif;font-size:7.5pt;font-weight:400;line-height:100%"">(<ix:nonFraction unitRef=""usd"" contextRef=""c-29"" decimals=""-6"" name=""us-gaap:StockRepurchasedAndRetiredDuringPeriodValue"" scale=""6"" id=""f-257"">1</ix:nonFraction>)</span></td><td style=""background-color:#f1f2f2;padding:2px 1pt 2px 0;text-align:right;vertical-align:bottom""/><td colspan=""3"" style=""background-color:#f1f2f2;padding:0 1pt""/><td colspan=""2"" style=""background-color:#f1f2f2;padding:2px 0 2px 1pt;text-align:right;vertical-align:bottom""><span', '""localname"": ""CommonStockDividendsPerShareDeclared"",\n     ""presentation"": [\n      ""http://www.nvidia.com/role/ConsolidatedStatementsofShareholdersEquityParenthetical""\n     ],\n     ""lang"": {\n      ""en-us"": {\n       ""role"": {\n        ""terseLabel"": ""Cash dividends declared and paid (USD per common share)"",\n        ""label"": ""Common Stock, Dividends, Per Share, Declared"",\n        ""documentation"": ""Aggregate dividends declared during the period for each share of common stock outstanding.""\n       }\n      }\n     },\n     ""auth_ref"": [\n      ""r100""\n     ]\n    },\n    ""us-gaap_CommonStockMember"": {\n     ""xbrltype"": ""domainItemType"",\n     ""nsuri"": ""http://fasb.org/us-gaap/2025"",\n     ""localname"": ""CommonStockMember"",\n     ""presentation"": [\n      ""http://www.nvidia.com/role/ConsolidatedStatementsofShareholdersEquity""\n     ],\n     ""lang"": {\n      ""en-us"": {\n       ""role"": {\n        ""terseLabel"": ""Common\\u00a0Stock Outstanding"",\n        ""label"": ""Common Stock [Member]"",\n        ""documentation"": ""Stock that is subordinate to all other stock of the issuer.""\n       }\n      }\n     },\n     ""auth_ref"": [\n      ""r1269"",\n      ""r1270"",\n      ""r1271"",\n      ""r1273"",\n      ""r1274"",\n      ""r1275"",\n      ""r1276"",\n      ""r1493"",\n      ""r1494"",\n      ""r1496"",\n      ""r1628"",\n      ""r1700"",\n      ""r1703""\n     ]\n    },\n    ""us-gaap_CommonStockParOrStatedValuePerShare"": {\n     ""xbrltype"": ""perShareItemType"",\n     ""nsuri"": ""http://fasb.org/us-gaap/2025"",\n     ""localname"": ""CommonStockParOrStatedValuePerShare"",\n     ""presentation"": [\n      ""http://www.nvidia.com/role/ConsolidatedBalanceSheetsParenthetical""\n     ],\n     ""lang"": {\n      ""en-us"": {\n       ""role"": {\n        ""terseLabel"": ""Common stock, par value (in USD per share)"",\n        ""label"": ""Common Stock, Par or Stated Value Per Share"",\n        ""documentation"": ""Face amount or stated value per share of common stock.""\n       }\n      }\n     },\n     ""auth_ref"": [\n      ""r67""\n     ]\n    },\n    ""us-gaap_CommonStockSharesAuthorized"": {', 'style=""text-align:center""><span style=""color:#000000;font-family:\'NVIDIA Sans\',sans-serif;font-size:9pt;font-weight:700;line-height:120%"">NVIDIA Corporation and Subsidiaries</span></div><div style=""text-align:center""><span style=""color:#000000;font-family:\'NVIDIA Sans\',sans-serif;font-size:9pt;font-weight:700;line-height:120%"">Consolidated Statements of Shareholders\' Equity</span></div><div style=""text-align:center""><span><br/></span></div><div style=""margin-bottom:6pt;text-align:center""><table style=""border-collapse:collapse;display:inline-table;margin-bottom:5pt;vertical-align:text-bottom;width:97.619%""><tr><td style=""width:1.0%""/><td style=""width:45.574%""/><td style=""width:0.1%""/><td style=""width:1.0%""/><td style=""width:6.327%""/><td style=""width:0.1%""/><td style=""width:0.1%""/><td style=""width:0.354%""/><td style=""width:0.1%""/><td style=""width:1.0%""/><td style=""width:6.327%""/><td style=""width:0.1%""/><td style=""width:0.1%""/><td style=""width:0.354%""/><td style=""width:0.1%""/><td style=""width:1.0%""/><td style=""width:7.769%""/><td style=""width:0.1%""/><td style=""width:0.1%""/><td style=""width:0.354%""/><td style=""width:0.1%""/><td style=""width:1.0%""/><td style=""width:9.210%""/><td style=""width:0.1%""/><td style=""width:0.1%""/><td style=""width:0.354%""/><td style=""width:0.1%""/><td style=""width:1.0%""/><td style=""width:6.993%""/><td style=""width:0.1%""/><td style=""width:0.1%""/><td style=""width:0.354%""/><td style=""width:0.1%""/><td style=""width:1.0%""/><td style=""width:7.330%""/><td style=""width:0.1%""/></tr><tr><td colspan=""3"" style=""border-top:1.5pt solid #000;padding:0 1pt""/><td colspan=""9"" style=""border-top:1.5pt solid #000;padding:2px 1pt;text-align:center;vertical-align:bottom""><span style=""color:#000000;font-family:\'NVIDIA Sans\',sans-serif;font-size:7.5pt;font-weight:700;line-height:100%"">Common&#160;Stock<br/>Outstanding</span></td><td colspan=""3"" style=""border-top:1.5pt solid #000;padding:0 1pt""/><td colspan=""3"" style=""border-top:1.5pt solid #000;padding:2px', 'style=""color:#000000;font-family:\'NVIDIA Sans\',sans-serif;font-size:9pt;font-weight:400;line-height:100%""><ix:nonFraction unitRef=""number"" contextRef=""c-66"" decimals=""2"" name=""us-gaap:ShareBasedCompensationArrangementByShareBasedPaymentAwardFairValueAssumptionsExpectedVolatilityRateMinimum"" scale=""-2"" id=""f-496"">31</ix:nonFraction>%-<ix:nonFraction unitRef=""number"" contextRef=""c-66"" decimals=""2"" name=""us-gaap:ShareBasedCompensationArrangementByShareBasedPaymentAwardFairValueAssumptionsExpectedVolatilityRateMaximum"" scale=""-2"" id=""f-497"">67</ix:nonFraction>%</span></div></td></tr><tr><td colspan=""3"" style=""background-color:#ffffff;padding:2px 1pt;text-align:justify;vertical-align:bottom""><span style=""color:#000000;font-family:\'NVIDIA Sans\',sans-serif;font-size:9pt;font-weight:400;line-height:100%"">Dividend yield</span></td><td colspan=""3"" style=""background-color:#ffffff;padding:2px 1pt;text-align:left;vertical-align:bottom""><div style=""text-align:right""><span style=""color:#000000;font-family:\'NVIDIA Sans\',sans-serif;font-size:9pt;font-weight:400;line-height:100%"">&#160;<ix:nonFraction unitRef=""number"" contextRef=""c-64"" decimals=""4"" name=""us-gaap:ShareBasedCompensationArrangementByShareBasedPaymentAwardFairValueAssumptionsExpectedDividendRate"" scale=""-2"" id=""f-498"">0.03</ix:nonFraction>%</span></div></td><td colspan=""3"" style=""background-color:#ffffff;padding:0 1pt""/><td colspan=""3"" style=""background-color:#ffffff;padding:2px 1pt;text-align:left;vertical-align:bottom""><div style=""text-align:right""><span style=""color:#000000;font-family:\'NVIDIA Sans\',sans-serif;font-size:9pt;font-weight:400;line-height:100%""><ix:nonFraction unitRef=""number"" contextRef=""c-65"" decimals=""4"" name=""us-gaap:ShareBasedCompensationArrangementByShareBasedPaymentAwardFairValueAssumptionsExpectedDividendRate"" scale=""-2"" id=""f-499"">0.03</ix:nonFraction>%</span></div></td><td colspan=""3"" style=""background-color:#ffffff;padding:0 1pt""/><td colspan=""3"" style=""background-color:#ffffff;padding:2px', ""[WEB ARAMASI KAYNAĞI]: Yerel veri tabanında bulunamayan bilgi için internet ve finansal API'ler üzerinden şu güncel veriler elde edilmiştir:\nThe par value of common stock for Nvidia (NVDA) is **$0.001** per share. This information is typically found in the company's financial statements or filings. If you need more detailed financial data or context, feel free to ask!""]",The par value of common stock for Nvidia is $0.001 per share.,Nvidia's common stock has a par value of $0.001 per share.,0.34090909089772725,1.0,1.0,1.0
What is the par value of common stock for Amazon?,"['""calculation"": {\n      ""http://www.amazon.com/role/StockholdersEquityScheduledVestingforOutstandingRestrictedStockUnitsDetails"": {\n       ""parentTag"": ""us-gaap_ShareBasedCompensationArrangementByShareBasedPaymentAwardEquityInstrumentsOtherThanOptionsNonvestedNumber"",\n       ""weight"": 1.0,\n       ""order"": 2.0\n      }\n     },\n     ""presentation"": [\n      ""http://www.amazon.com/role/StockholdersEquityScheduledVestingforOutstandingRestrictedStockUnitsDetails""\n     ],\n     ""lang"": {\n      ""en-us"": {\n       ""role"": {\n        ""terseLabel"": ""2027 (in shares)"",\n        ""label"": ""Share-Based Compensation Arrangement By Share-Based Payment Award, Equity Instruments Other Than Options, Vesting, Year Two"",\n        ""documentation"": ""Share-Based Compensation Arrangement By Share-Based Payment Award, Equity Instruments Other Than Options, Vesting, Year Two""\n       }\n      }\n     },\n     ""auth_ref"": []\n    },\n    ""us-gaap_ShareBasedCompensationArrangementByShareBasedPaymentAwardLineItems"": {\n     ""xbrltype"": ""stringItemType"",\n     ""nsuri"": ""http://fasb.org/us-gaap/2025"",\n     ""localname"": ""ShareBasedCompensationArrangementByShareBasedPaymentAwardLineItems"",\n     ""presentation"": [\n      ""http://www.amazon.com/role/DescriptionofBusinessAccountingPoliciesandSupplementalDisclosuresStockBasedCompensationDetails"",\n      ""http://www.amazon.com/role/StockholdersEquityRestrictedStockUnitActivityDetails"",\n      ""http://www.amazon.com/role/StockholdersEquityScheduledVestingforOutstandingRestrictedStockUnitsDetails""\n     ],\n     ""lang"": {\n      ""en-us"": {\n       ""role"": {\n        ""terseLabel"": ""Share-based Compensation Arrangement by Share-based Payment Award [Line Items]"",\n        ""label"": ""Share-Based Compensation Arrangement by Share-Based Payment Award [Line Items]"",\n        ""documentation"": ""Line items represent financial concepts included in a table. These concepts are used to disclose reportable information associated with domain members defined in one or many axes to the table.""', 'id=""f-1607"">Vice President, Worldwide Controller</ix:nonNumeric>, <ix:nonNumeric contextRef=""c-366"" name=""ecd:Rule10b51ArrAdoptedFlag"" format=""ixt:fixed-true"" id=""f-1608"">adopted</ix:nonNumeric> a trading plan intended to satisfy Rule 10b5-1(c) to sell up to <ix:nonFraction unitRef=""shares"" contextRef=""c-367"" decimals=""0"" name=""ecd:TrdArrSecuritiesAggAvailAmt"" format=""ixt:num-dot-decimal"" scale=""0"" id=""f-1609"">9,744</ix:nonFraction> shares of Amazon.com, Inc. common stock over a period ending on <ix:nonNumeric contextRef=""c-366"" name=""ecd:TrdArrExpirationDate"" id=""f-1610"">November 29, 2026</ix:nonNumeric>, subject to certain conditions.</span></div></ix:nonNumeric><ix:nonNumeric contextRef=""c-368"" name=""ecd:MtrlTermsOfTrdArrTextBlock"" id=""f-1611"" escape=""true""><div style=""margin-top:5pt;text-indent:24.75pt""><span style=""color:#000000;font-family:\'Times New Roman\',serif;font-size:10pt;font-weight:400;line-height:120%"">On <ix:nonNumeric contextRef=""c-368"" name=""ecd:TrdArrAdoptionDate"" id=""f-1612"">November 14, 2025</ix:nonNumeric>, <ix:nonNumeric contextRef=""c-368"" name=""ecd:TrdArrIndName"" id=""f-1613"">Andrew R. Jassy</ix:nonNumeric>, <ix:nonNumeric contextRef=""c-368"" name=""ecd:TrdArrIndTitle"" id=""f-1614"">President and Chief Executive Officer</ix:nonNumeric>, <ix:nonNumeric contextRef=""c-368"" name=""ecd:Rule10b51ArrAdoptedFlag"" format=""ixt:fixed-true"" id=""f-1615"">adopted</ix:nonNumeric> a trading plan intended to satisfy Rule 10b5-1(c) to sell up to <ix:nonFraction unitRef=""shares"" contextRef=""c-369"" decimals=""0"" name=""ecd:TrdArrSecuritiesAggAvailAmt"" format=""ixt:num-dot-decimal"" scale=""0"" id=""f-1616"">142,224</ix:nonFraction> shares of Amazon.com, Inc. common stock over a period ending on <ix:nonNumeric contextRef=""c-368"" name=""ecd:TrdArrExpirationDate"" id=""f-1617"">December 31, 2026</ix:nonNumeric>, subject to certain conditions.</span></div></ix:nonNumeric><ix:nonNumeric contextRef=""c-370"" name=""ecd:MtrlTermsOfTrdArrTextBlock"" id=""f-1618"" escape=""true""><div', 'id=""f-1602""\n      unitRef=""shares"">1800</ecd:TrdArrSecuritiesAggAvailAmt>\n    <ecd:TrdArrExpirationDate contextRef=""c-364"" id=""f-1603"">November 4, 2026</ecd:TrdArrExpirationDate>\n    <ecd:MtrlTermsOfTrdArrTextBlock contextRef=""c-366"" id=""f-1604"">&lt;div style=""margin-top:5pt;text-indent:24.75pt""&gt;&lt;span style=""color:#000000;font-family:\'Times New Roman\',serif;font-size:10pt;font-weight:400;line-height:120%""&gt;On November 11, 2025, Shelley L. Reynolds, Vice President, Worldwide Controller, adopted a trading plan intended to satisfy Rule 10b5-1(c) to sell up to 9,744 shares of Amazon.com, Inc. common stock over a period ending on November 29, 2026, subject to certain conditions.&lt;/span&gt;&lt;/div&gt;</ecd:MtrlTermsOfTrdArrTextBlock>\n    <ecd:TrdArrAdoptionDate contextRef=""c-366"" id=""f-1605"">November 11, 2025</ecd:TrdArrAdoptionDate>\n    <ecd:TrdArrIndName contextRef=""c-366"" id=""f-1606"">Shelley L. Reynolds</ecd:TrdArrIndName>\n    <ecd:TrdArrIndTitle contextRef=""c-366"" id=""f-1607"">Vice President, Worldwide Controller</ecd:TrdArrIndTitle>\n    <ecd:Rule10b51ArrAdoptedFlag contextRef=""c-366"" id=""f-1608"">true</ecd:Rule10b51ArrAdoptedFlag>\n    <ecd:TrdArrSecuritiesAggAvailAmt\n      contextRef=""c-367""\n      decimals=""0""\n      id=""f-1609""\n      unitRef=""shares"">9744</ecd:TrdArrSecuritiesAggAvailAmt>\n    <ecd:TrdArrExpirationDate contextRef=""c-366"" id=""f-1610"">November 29, 2026</ecd:TrdArrExpirationDate>\n    <ecd:MtrlTermsOfTrdArrTextBlock contextRef=""c-368"" id=""f-1611"">&lt;div style=""margin-top:5pt;text-indent:24.75pt""&gt;&lt;span style=""color:#000000;font-family:\'Times New Roman\',serif;font-size:10pt;font-weight:400;line-height:120%""&gt;On November 14, 2025, Andrew R. Jassy, President and Chief Executive Officer, adopted a trading plan intended to satisfy Rule 10b5-1(c) to sell up to 142,224 shares of Amazon.com, Inc. common stock over a period ending on December 31, 2026, subject to certain conditions.&lt;/span&gt;&lt;/div&gt;</ecd:MtrlTermsOfTrdArrTextBlock>', '""nsuri"": ""http://fasb.org/us-gaap/2025"",\n     ""localname"": ""ShareBasedCompensationArrangementByShareBasedPaymentAwardEquityInstrumentsOtherThanOptionsNonvestedNumber"",\n     ""calculation"": {\n      ""http://www.amazon.com/role/StockholdersEquityScheduledVestingforOutstandingRestrictedStockUnitsDetails"": {\n       ""parentTag"": null,\n       ""weight"": null,\n       ""order"": null,\n       ""root"": true\n      }\n     },\n     ""presentation"": [\n      ""http://www.amazon.com/role/StockholdersEquityRestrictedStockUnitActivityDetails"",\n      ""http://www.amazon.com/role/StockholdersEquityScheduledVestingforOutstandingRestrictedStockUnitsDetails""\n     ],\n     ""lang"": {\n      ""en-us"": {\n       ""role"": {\n        ""periodStartLabel"": ""Beginning balance (in shares)"",\n        ""periodEndLabel"": ""Ending balance (in shares)"",\n        ""totalLabel"": ""Total (in shares)"",\n        ""label"": ""Share-Based Compensation Arrangement by Share-Based Payment Award, Equity Instruments Other than Options, Nonvested, Number"",\n        ""documentation"": ""The number of non-vested equity-based payment instruments, excluding stock (or unit) options, that validly exist and are outstanding as of the balance sheet date.""\n       }\n      }\n     },\n     ""auth_ref"": [\n      ""r553"",\n      ""r554""\n     ]\n    },\n    ""us-gaap_ShareBasedCompensationArrangementByShareBasedPaymentAwardEquityInstrumentsOtherThanOptionsNonvestedRollForward"": {\n     ""xbrltype"": ""stringItemType"",\n     ""nsuri"": ""http://fasb.org/us-gaap/2025"",\n     ""localname"": ""ShareBasedCompensationArrangementByShareBasedPaymentAwardEquityInstrumentsOtherThanOptionsNonvestedRollForward"",\n     ""presentation"": [\n      ""http://www.amazon.com/role/StockholdersEquityRestrictedStockUnitActivityDetails""\n     ],\n     ""lang"": {\n      ""en-us"": {\n       ""role"": {\n        ""terseLabel"": ""Number\\u00a0of\\u00a0Units"",', '""presentation"": [\n      ""http://www.amazon.com/role/StockholdersEquityAdditionalInformationDetails""\n     ],\n     ""lang"": {\n      ""en-us"": {\n       ""role"": {\n        ""terseLabel"": ""Common shares outstanding plus underlying outstanding stock awards"",\n        ""label"": ""Common Stock, Shares, Outstanding, Including Nonvested Stock Awards"",\n        ""documentation"": ""Common Stock, Shares, Outstanding, Including Nonvested Stock Awards""\n       }\n      }\n     },\n     ""auth_ref"": []\n    },\n    ""us-gaap_CommonStockValue"": {\n     ""xbrltype"": ""monetaryItemType"",\n     ""nsuri"": ""http://fasb.org/us-gaap/2025"",\n     ""localname"": ""CommonStockValue"",\n     ""crdr"": ""credit"",\n     ""calculation"": {\n      ""http://www.amazon.com/role/ConsolidatedBalanceSheets"": {\n       ""parentTag"": ""us-gaap_StockholdersEquity"",\n       ""weight"": 1.0,\n       ""order"": 2.0\n      }\n     },\n     ""presentation"": [\n      ""http://www.amazon.com/role/ConsolidatedBalanceSheets""\n     ],\n     ""lang"": {\n      ""en-us"": {\n       ""role"": {\n        ""terseLabel"": ""Common stock ($0.01 par value; 100,000 shares authorized; 11,108 and 11,246 shares issued; 10,593 and 10,731 shares outstanding)"",\n        ""label"": ""Common Stock, Value, Issued"",\n        ""documentation"": ""Aggregate par or stated value of issued nonredeemable common stock (or common stock redeemable solely at the option of the issuer). This item includes treasury stock repurchased by the entity. Note: elements for number of nonredeemable common shares, par value and other disclosure concepts are in another section within stockholders\' equity.""\n       }\n      }\n     },\n     ""auth_ref"": [\n      ""r66"",\n      ""r503"",\n      ""r509"",\n      ""r905"",\n      ""r1250""\n     ]\n    },\n    ""ecd_CompActuallyPaidVsCoSelectedMeasureTextBlock"": {\n     ""xbrltype"": ""textBlockItemType"",\n     ""nsuri"": ""http://xbrl.sec.gov/ecd/2025"",\n     ""localname"": ""CompActuallyPaidVsCoSelectedMeasureTextBlock"",\n     ""presentation"": [\n      ""http://xbrl.sec.gov/ecd/role/PvpDisclosure""\n     ],', '""r1636"",\n      ""r1712"",\n      ""r1716""\n     ]\n    },\n    ""us-gaap_CommonStockParOrStatedValuePerShare"": {\n     ""xbrltype"": ""perShareItemType"",\n     ""nsuri"": ""http://fasb.org/us-gaap/2025"",\n     ""localname"": ""CommonStockParOrStatedValuePerShare"",\n     ""presentation"": [\n      ""http://www.amazon.com/role/ConsolidatedBalanceSheetsParenthetical""\n     ],\n     ""lang"": {\n      ""en-us"": {\n       ""role"": {\n        ""terseLabel"": ""Common stock, par value (in usd per share)"",\n        ""label"": ""Common Stock, Par or Stated Value Per Share"",\n        ""documentation"": ""Face amount or stated value per share of common stock.""\n       }\n      }\n     },\n     ""auth_ref"": [\n      ""r66""\n     ]\n    },\n    ""us-gaap_CommonStockSharesAuthorized"": {\n     ""xbrltype"": ""sharesItemType"",\n     ""nsuri"": ""http://fasb.org/us-gaap/2025"",\n     ""localname"": ""CommonStockSharesAuthorized"",\n     ""presentation"": [\n      ""http://www.amazon.com/role/ConsolidatedBalanceSheetsParenthetical""\n     ],\n     ""lang"": {\n      ""en-us"": {\n       ""role"": {\n        ""terseLabel"": ""Common stock, authorized (in shares)"",\n        ""label"": ""Common Stock, Shares Authorized"",\n        ""documentation"": ""The maximum number of common shares permitted to be issued by an entity\'s charter and bylaws.""\n       }\n      }\n     },\n     ""auth_ref"": [\n      ""r66"",\n      ""r987""\n     ]\n    },\n    ""us-gaap_CommonStockSharesIssued"": {\n     ""xbrltype"": ""sharesItemType"",\n     ""nsuri"": ""http://fasb.org/us-gaap/2025"",\n     ""localname"": ""CommonStockSharesIssued"",\n     ""presentation"": [\n      ""http://www.amazon.com/role/ConsolidatedBalanceSheetsParenthetical""\n     ],\n     ""lang"": {\n      ""en-us"": {\n       ""role"": {\n        ""terseLabel"": ""Common stock, issued (in shares)"",\n        ""label"": ""Common Stock, Shares, Issued"",', 'decimals=""-6"" name=""us-gaap:PreferredStockValue"" format=""ixt:fixed-zero"" scale=""6"" id=""f-294"">&#8212;</ix:nonFraction>&#160;</span></td><td style=""background-color:#ffffff;padding:2px 1pt 2px 0;text-align:right;vertical-align:bottom""/></tr><tr><td colspan=""3"" style=""background-color:#cceeff;padding:2px 1pt;text-align:left;vertical-align:top""><div style=""padding-left:18pt""><span style=""color:#000000;font-family:\'Times New Roman\',serif;font-size:10pt;font-weight:400;line-height:120%"">Common stock ($<ix:nonFraction unitRef=""usdPerShare"" contextRef=""c-9"" decimals=""INF"" name=""us-gaap:CommonStockParOrStatedValuePerShare"" scale=""0"" id=""f-295""><ix:nonFraction unitRef=""usdPerShare"" contextRef=""c-7"" decimals=""INF"" name=""us-gaap:CommonStockParOrStatedValuePerShare"" scale=""0"" id=""f-296"">0.01</ix:nonFraction></ix:nonFraction> par value; <ix:nonFraction unitRef=""shares"" contextRef=""c-7"" decimals=""INF"" name=""us-gaap:CommonStockSharesAuthorized"" format=""ixt:num-dot-decimal"" scale=""6"" id=""f-297""><ix:nonFraction unitRef=""shares"" contextRef=""c-9"" decimals=""INF"" name=""us-gaap:CommonStockSharesAuthorized"" format=""ixt:num-dot-decimal"" scale=""6"" id=""f-298"">100,000</ix:nonFraction></ix:nonFraction> shares authorized; <ix:nonFraction unitRef=""shares"" contextRef=""c-7"" decimals=""-6"" name=""us-gaap:CommonStockSharesIssued"" format=""ixt:num-dot-decimal"" scale=""6"" id=""f-299"">11,108</ix:nonFraction> and <ix:nonFraction unitRef=""shares"" contextRef=""c-9"" decimals=""-6"" name=""us-gaap:CommonStockSharesIssued"" format=""ixt:num-dot-decimal"" scale=""6"" id=""f-300"">11,246</ix:nonFraction> shares issued; <ix:nonFraction unitRef=""shares"" contextRef=""c-7"" decimals=""-6"" name=""us-gaap:CommonStockSharesOutstanding"" format=""ixt:num-dot-decimal"" scale=""6"" id=""f-301"">10,593</ix:nonFraction> and <ix:nonFraction unitRef=""shares"" contextRef=""c-9"" decimals=""-6"" name=""us-gaap:CommonStockSharesOutstanding"" format=""ixt:num-dot-decimal"" scale=""6"" id=""f-302"">10,731</ix:nonFraction> shares outstanding)</span></div></td><td', '<ecd:NonRule10b51ArrTrmntdFlag contextRef=""c-57"" id=""f-1582"">false</ecd:NonRule10b51ArrTrmntdFlag>\n    <ecd:MtrlTermsOfTrdArrTextBlock contextRef=""c-360"" id=""f-1583"">&lt;div style=""margin-top:5pt;text-indent:24.75pt""&gt;&lt;span style=""color:#000000;font-family:\'Times New Roman\',serif;font-size:10pt;font-weight:400;line-height:120%""&gt;On November 3, 2025, David A. Zapolsky, Senior Vice President, Chief Global Affairs and Legal Officer, adopted a trading plan intended to satisfy Rule 10b5-1(c) to sell up to 64,059 shares of Amazon.com, Inc. common stock over a period ending on November 30, 2026, subject to certain conditions.&lt;/span&gt;&lt;/div&gt;</ecd:MtrlTermsOfTrdArrTextBlock>\n    <ecd:TrdArrAdoptionDate contextRef=""c-360"" id=""f-1584"">November 3, 2025</ecd:TrdArrAdoptionDate>\n    <ecd:TrdArrIndName contextRef=""c-360"" id=""f-1585"">David A. Zapolsky</ecd:TrdArrIndName>\n    <ecd:TrdArrIndTitle contextRef=""c-360"" id=""f-1586"">Senior Vice President, Chief Global Affairs and Legal Officer</ecd:TrdArrIndTitle>\n    <ecd:Rule10b51ArrAdoptedFlag contextRef=""c-360"" id=""f-1587"">true</ecd:Rule10b51ArrAdoptedFlag>\n    <ecd:TrdArrSecuritiesAggAvailAmt\n      contextRef=""c-361""\n      decimals=""0""\n      id=""f-1588""\n      unitRef=""shares"">64059</ecd:TrdArrSecuritiesAggAvailAmt>\n    <ecd:TrdArrExpirationDate contextRef=""c-360"" id=""f-1589"">November 30, 2026</ecd:TrdArrExpirationDate>\n    <ecd:MtrlTermsOfTrdArrTextBlock contextRef=""c-362"" id=""f-1590"">&lt;div style=""margin-top:5pt;text-indent:24.75pt""&gt;&lt;span style=""color:#000000;font-family:\'Times New Roman\',serif;font-size:10pt;font-weight:400;line-height:120%""&gt;On November 10, 2025, Douglas J. Herrington, CEO Worldwide Amazon Stores, adopted a trading plan intended to satisfy Rule 10b5-1(c) to sell up to 132,937 shares of Amazon.com, Inc. common stock over a period ending on December 31, 2026, subject to certain conditions.&lt;/span&gt;&lt;/div&gt;</ecd:MtrlTermsOfTrdArrTextBlock>', '<ecd:TrdArrAdoptionDate contextRef=""c-362"" id=""f-1591"">November 10, 2025</ecd:TrdArrAdoptionDate>\n    <ecd:TrdArrIndName contextRef=""c-362"" id=""f-1592"">Douglas J. Herrington</ecd:TrdArrIndName>\n    <ecd:TrdArrIndTitle contextRef=""c-362"" id=""f-1593"">CEO Worldwide Amazon Stores</ecd:TrdArrIndTitle>\n    <ecd:Rule10b51ArrAdoptedFlag contextRef=""c-362"" id=""f-1594"">true</ecd:Rule10b51ArrAdoptedFlag>\n    <ecd:TrdArrSecuritiesAggAvailAmt\n      contextRef=""c-363""\n      decimals=""0""\n      id=""f-1595""\n      unitRef=""shares"">132937</ecd:TrdArrSecuritiesAggAvailAmt>\n    <ecd:TrdArrExpirationDate contextRef=""c-362"" id=""f-1596"">December 31, 2026</ecd:TrdArrExpirationDate>\n    <ecd:MtrlTermsOfTrdArrTextBlock contextRef=""c-364"" id=""f-1597"">&lt;div style=""margin-top:5pt;text-indent:24.75pt""&gt;&lt;span style=""color:#000000;font-family:\'Times New Roman\',serif;font-size:10pt;font-weight:400;line-height:120%""&gt;On November 11, 2025, Keith B. Alexander, a member of our Board of Directors, adopted a trading plan intended to satisfy Rule 10b5-1(c) to sell up to 1,800 shares of Amazon.com, Inc. common stock over a period ending on November 4, 2026, subject to certain conditions.&lt;/span&gt;&lt;/div&gt;</ecd:MtrlTermsOfTrdArrTextBlock>\n    <ecd:TrdArrAdoptionDate contextRef=""c-364"" id=""f-1598"">November 11, 2025</ecd:TrdArrAdoptionDate>\n    <ecd:TrdArrIndName contextRef=""c-364"" id=""f-1599"">Keith B. Alexander</ecd:TrdArrIndName>\n    <ecd:TrdArrIndTitle contextRef=""c-364"" id=""f-1600"">Board of Directors</ecd:TrdArrIndTitle>\n    <ecd:Rule10b51ArrAdoptedFlag contextRef=""c-364"" id=""f-1601"">true</ecd:Rule10b51ArrAdoptedFlag>\n    <ecd:TrdArrSecuritiesAggAvailAmt\n      contextRef=""c-365""\n      decimals=""0""\n      id=""f-1602""\n      unitRef=""shares"">1800</ecd:TrdArrSecuritiesAggAvailAmt>\n    <ecd:TrdArrExpirationDate contextRef=""c-364"" id=""f-1603"">November 4, 2026</ecd:TrdArrExpirationDate>', 'of Amazon.com, Inc., pursuant to Rule 13a-14(a) under the Securities Exchange Act of 1934.</a></span></div></td></tr><tr style=""height:6pt""><td colspan=""3"" style=""padding:0 1pt""/><td colspan=""3"" style=""padding:0 1pt""/><td colspan=""3"" style=""padding:0 1pt""/></tr><tr><td colspan=""3"" style=""padding:2px 1pt;text-align:left;vertical-align:top""><span style=""color:#000000;font-family:\'Times New Roman\',serif;font-size:10pt;font-weight:400;line-height:120%"">32.1</span></td><td colspan=""3"" style=""padding:0 1pt""/><td colspan=""3"" style=""padding:2px 1pt;text-align:left;vertical-align:bottom""><div><span style=""color:#0000ff;font-family:\'Times New Roman\',serif;font-size:10pt;font-weight:400;line-height:120%;text-decoration:underline""><a style=""-sec-extract:exhibit;color:#0000ff;font-family:\'Times New Roman\',serif;font-size:10pt;font-weight:400;line-height:120%;text-decoration:underline"" href=""amzn-20251231xex321.htm"">Certification of Andrew R. Jassy, President and Chief Executive Officer of Amazon.com, Inc., pursuant to 18 U.S.C. Section 1350.</a></span></div></td></tr></table></div><div style=""height:42.75pt;position:relative;width:100%""><div style=""bottom:0;position:absolute;width:100%""><div style=""-sec-extract:summary;text-align:center""><span style=""color:#000000;font-family:\'Times New Roman\',serif;font-size:10pt;font-weight:400;line-height:120%"">77</span></div></div></div><hr style=""page-break-after:always""/><div style=""min-height:42.75pt;width:100%""><div style=""-sec-extract:summary""><span style=""color:#0000ff;font-family:\'Times New Roman\',serif;font-size:10pt;font-weight:400;line-height:120%;text-decoration:underline""><a style=""-sec-extract:exhibit;color:#0000ff;font-family:\'Times New Roman\',serif;font-size:10pt;font-weight:400;line-height:120%;text-decoration:underline"" href=""#i9e7c0f1183ed47abbb1f061fe4864e14_7"">Table of Contents</a></span></div><div style=""margin-top:14pt;text-indent:11.25pt""><span><br/></span></div></div><div', ""[WEB ARAMASI KAYNAĞI]: Yerel veri tabanında bulunamayan bilgi için internet ve finansal API'ler üzerinden şu güncel veriler elde edilmiştir:\nThe par value of common stock for Amazon (AMZN) is $0.01 per share. This value is set to comply with legal requirements and is a minimal amount that companies typically choose.""]",The par value of common stock for Amazon is $0.01 per share.,Amazon's common stock has a par value of $0.01 per share.,0.2528138528054257,1.0,1.0,0.9999995463980135
What is the par value of common stock for Netflix?,"['sale of up to <ix:nonFraction unitRef=""shares"" contextRef=""c-14"" decimals=""0"" name=""ecd:TrdArrSecuritiesAggAvailAmt"" format=""ixt:num-dot-decimal"" scale=""0"" id=""f-78"">23,430</ix:nonFraction> shares of Netflix common stock.  The plan expires on December 31, 2026, or upon the earlier completion of all authorized transactions under the plan.</span></div></td></tr></table></div><div style=""margin-top:5pt;text-indent:13.5pt""><span style=""color:#000000;font-family:\'Times New Roman\',serif;font-size:10pt;font-weight:400;line-height:120%"">Other than those disclosed above, none of our directors or officers <ix:nonNumeric contextRef=""c-4"" name=""ecd:NonRule10b51ArrAdoptedFlag"" format=""ixt:fixed-false"" id=""f-79"">adopted</ix:nonNumeric> or <ix:nonNumeric contextRef=""c-4"" name=""ecd:NonRule10b51ArrTrmntdFlag"" format=""ixt:fixed-false"" id=""f-80"">terminated</ix:nonNumeric> a &#8220;non-Rule 10b5-1 trading arrangement&#8221; as defined in Item 408 of Regulation S-K.</span></div></ix:nonNumeric><div style=""margin-top:5pt;text-indent:24.75pt""><span><br/></span></div><div id=""ie1400fdbdd2e4bd282737fca9a66fd5a_85""></div><div style=""padding-left:54pt;text-indent:-54pt""><span style=""color:#000000;font-family:\'Times New Roman\',serif;font-size:10pt;font-weight:700;line-height:120%"">Item 9C.</span><span style=""color:#000000;font-family:\'Times New Roman\',serif;font-size:10pt;font-weight:700;line-height:120%;padding-left:16.8pt"">Disclosure Regarding Foreign Jurisdictions that Prevent Inspections</span></div><div style=""margin-top:5pt;text-indent:24.75pt""><span style=""color:#000000;font-family:\'Times New Roman\',serif;font-size:10pt;font-weight:400;line-height:120%"">Not applicable.</span></div><div style=""height:42.75pt;position:relative;width:100%""><div style=""bottom:0;position:absolute;width:100%""><div style=""text-align:center""><span style=""color:#000000;font-family:\'Times New Roman\',serif;font-size:10pt;font-weight:400;line-height:120%"">33</span></div></div></div><div', '""http://www.netflix.com/role/CONSOLIDATEDBALANCESHEETS"": {\n       ""parentTag"": ""us-gaap_StockholdersEquity"",\n       ""weight"": 1.0,\n       ""order"": 1.0\n      }\n     },\n     ""presentation"": [\n      ""http://www.netflix.com/role/CONSOLIDATEDBALANCESHEETS""\n     ],\n     ""lang"": {\n      ""en-us"": {\n       ""role"": {\n        ""terseLabel"": ""Common stock, $0.001 par value; 49,900,000,000 shares authorized at December\\u00a031, 2025 and December\\u00a031, 2024; 4,222,162,150 and 4,277,571,000 issued and outstanding at December\\u00a031, 2025 and December\\u00a031, 2024, respectively"",\n        ""label"": ""Common Stock, Value, Issued"",\n        ""documentation"": ""Aggregate par or stated value of issued nonredeemable common stock (or common stock redeemable solely at the option of the issuer). This item includes treasury stock repurchased by the entity. Note: elements for number of nonredeemable common shares, par value and other disclosure concepts are in another section within stockholders\' equity.""\n       }\n      }\n     },\n     ""auth_ref"": [\n      ""r52"",\n      ""r390"",\n      ""r396"",\n      ""r848"",\n      ""r1145""\n     ]\n    },\n    ""nflx_CommonstockVotingRightsVotes"": {\n     ""xbrltype"": ""integerItemType"",\n     ""nsuri"": ""http://www.netflix.com/20251231"",\n     ""localname"": ""CommonstockVotingRightsVotes"",\n     ""presentation"": [\n      ""http://www.netflix.com/role/StockholdersEquityNarrativeDetails""\n     ],\n     ""lang"": {\n      ""en-us"": {\n       ""role"": {\n        ""terseLabel"": ""Number of voting rights per share"",\n        ""label"": ""Common stock, Voting Rights, Votes"",\n        ""documentation"": ""Common stock, Voting Rights, Votes""\n       }\n      }\n     },\n     ""auth_ref"": []\n    },\n    ""ecd_CompActuallyPaidVsCoSelectedMeasureTextBlock"": {\n     ""xbrltype"": ""textBlockItemType"",\n     ""nsuri"": ""http://xbrl.sec.gov/ecd/2025"",\n     ""localname"": ""CompActuallyPaidVsCoSelectedMeasureTextBlock"",\n     ""presentation"": [\n      ""http://xbrl.sec.gov/ecd/role/PvpDisclosure""\n     ],\n     ""lang"": {', '""weight"": 1.0,\n       ""order"": 1.0\n      }\n     },\n     ""presentation"": [\n      ""http://www.netflix.com/role/CONSOLIDATEDSTATEMENTSOFOPERATIONS"",\n      ""http://www.netflix.com/role/EarningsPerShareScheduleofComputationofEarningsPerShareDetails""\n     ],\n     ""lang"": {\n      ""en-us"": {\n       ""role"": {\n        ""verboseLabel"": ""Basic (in shares)"",\n        ""terseLabel"": ""Weighted-average shares of common stock outstanding (in shares)"",\n        ""label"": ""Weighted Average Number of Shares Outstanding, Basic"",\n        ""documentation"": ""Number of [basic] shares or units, after adjustment for contingently issuable shares or units and other shares or units not deemed outstanding, determined by relating the portion of time within a reporting period that common shares or units have been outstanding to the total time in that period.""\n       }\n      }\n     },\n     ""auth_ref"": [\n      ""r222"",\n      ""r231""\n     ]\n    },\n    ""ecd_YrEndFrValOfEqtyAwrdsGrntdInCvrdYrOutsdngAndUnvstdMember"": {\n     ""xbrltype"": ""domainItemType"",\n     ""nsuri"": ""http://xbrl.sec.gov/ecd/2025"",\n     ""localname"": ""YrEndFrValOfEqtyAwrdsGrntdInCvrdYrOutsdngAndUnvstdMember"",\n     ""presentation"": [\n      ""http://xbrl.sec.gov/ecd/role/PvpDisclosure""\n     ],\n     ""lang"": {\n      ""en-us"": {\n       ""role"": {\n        ""terseLabel"": ""Year-end Fair Value of Equity Awards Granted in Covered Year that are Outstanding and Unvested"",\n        ""label"": ""Year-end Fair Value of Equity Awards Granted in Covered Year that are Outstanding and Unvested [Member]""\n       }\n      }\n     },\n     ""auth_ref"": [\n      ""r1230""\n     ]\n    }\n   }\n  }\n },\n ""std_ref"": {\n  ""r0"": {\n   ""role"": ""http://fasb.org/us-gaap/role/ref/legacyRef"",\n   ""Name"": ""Accounting Standards Codification"",\n   ""Section"": ""45"",\n   ""Paragraph"": ""1"",\n   ""SubTopic"": ""230"",\n   ""Topic"": ""830"",\n   ""Publisher"": ""FASB"",\n   ""URI"": ""https://asc.fasb.org/1943274/2147477401/830-230-45-1""\n  },\n  ""r1"": {\n   ""role"": ""http://fasb.org/us-gaap/role/ref/legacyRef"",', '1pt;text-align:left;vertical-align:top""><div style=""padding-left:4.5pt""><span style=""color:#000000;font-family:\'Times New Roman\',serif;font-size:9pt;font-weight:400;line-height:100%"">(2) Spencer Neumann, Chief Financial Officer, entered into a pre-arranged stock trading plan pursuant to Rule 10b5-1 on October 23, 2025.  Mr. Neumann\'s plan provides for the potential exercise of vested stock options and the associated sale of up to 314,880 shares of Netflix common stock.  The plan expires on December 31, 2026, or upon the earlier completion of all authorized transactions under the plan.</span></div></td></tr><tr><td colspan=""3"" style=""padding:2px 1pt;text-align:left;vertical-align:top""><div style=""padding-left:4.5pt""><span style=""color:#000000;font-family:\'Times New Roman\',serif;font-size:9pt;font-weight:400;line-height:100%"">(3) On October 30, 2025, Greg Peters, Co-CEO and a member of the Board of Directors, terminated a pre-arranged stock trading plan pursuant to Rule 10b5-1, which was adopted on October 30, 2024.  The plan provided for the potential exercise and sale of vested stock options, as well as the sale of Performance Share Units (PSUs) that were expected to vest during the term of the 10b5-1 plan (assuming vest at 100% of the target award amount) for up to 1,585,830 shares of Netflix common stock until November 1, 2027 or the earlier completion of all authorized transactions under the plan.</span></div></td></tr><tr><td colspan=""3"" style=""padding:2px 1pt;text-align:left;vertical-align:top""><div style=""padding-left:4.5pt""><span style=""color:#000000;font-family:\'Times New Roman\',serif;font-size:9pt;font-weight:400;line-height:100%"">(4) Upon termination of Mr. Peters\' prior plan (described in footnote 3), on October 30, 2025, Mr. Peters entered into a pre-arranged stock trading plan pursuant to Rule 10b5-1 that provides for the potential exercise of vested stock options and the associated sale of up to 2,951,230 shares of Netflix common stock.  This figure', 'colspan=""3"" style=""padding:2px 1pt;text-align:left;vertical-align:top""&gt;&lt;div style=""padding-left:4.5pt""&gt;&lt;span style=""color:#000000;font-family:\'Times New Roman\',serif;font-size:9pt;font-weight:400;line-height:100%""&gt;(2) Spencer Neumann, Chief Financial Officer, entered into a pre-arranged stock trading plan pursuant to Rule 10b5-1 on October 23, 2025.  Mr. Neumann\'s plan provides for the potential exercise of vested stock options and the associated sale of up to 314,880 shares of Netflix common stock.  The plan expires on December 31, 2026, or upon the earlier completion of all authorized transactions under the plan.&lt;/span&gt;&lt;/div&gt;&lt;/td&gt;&lt;/tr&gt;&lt;tr&gt;&lt;td colspan=""3"" style=""padding:2px 1pt;text-align:left;vertical-align:top""&gt;&lt;div style=""padding-left:4.5pt""&gt;&lt;span style=""color:#000000;font-family:\'Times New Roman\',serif;font-size:9pt;font-weight:400;line-height:100%""&gt;(3) On October 30, 2025, Greg Peters, Co-CEO and a member of the Board of Directors, terminated a pre-arranged stock trading plan pursuant to Rule 10b5-1, which was adopted on October 30, 2024.  The plan provided for the potential exercise and sale of vested stock options, as well as the sale of Performance Share Units (PSUs) that were expected to vest during the term of the 10b5-1 plan (assuming vest at 100% of the target award amount) for up to 1,585,830 shares of Netflix common stock until November 1, 2027 or the earlier completion of all authorized transactions under the plan.&lt;/span&gt;&lt;/div&gt;&lt;/td&gt;&lt;/tr&gt;&lt;tr&gt;&lt;td colspan=""3"" style=""padding:2px 1pt;text-align:left;vertical-align:top""&gt;&lt;div style=""padding-left:4.5pt""&gt;&lt;span style=""color:#000000;font-family:\'Times New Roman\',serif;font-size:9pt;font-weight:400;line-height:100%""&gt;(4) Upon termination of Mr. Peters\' prior plan (described in footnote 3), on October 30, 2025, Mr. Peters entered into a pre-arranged stock trading plan pursuant to Rule 10b5-1 that', '""http://www.netflix.com/role/StockholdersEquityScheduleofAmountsReclassifiedfromAOCIDetails""\n     ],\n     ""lang"": {\n      ""en-us"": {\n       ""role"": {\n        ""terseLabel"": ""Cost of revenues"",\n        ""verboseLabel"": ""Total amounts presented in the Consolidated Statements of Operations"",\n        ""negatedNetLabel"": ""Cost of Revenues"",\n        ""label"": ""Cost of Revenue"",\n        ""documentation"": ""The aggregate cost of goods produced and sold and services rendered during the reporting period.""\n       }\n      }\n     },\n     ""auth_ref"": [\n      ""r62"",\n      ""r198"",\n      ""r199"",\n      ""r200"",\n      ""r309"",\n      ""r361"",\n      ""r362"",\n      ""r363"",\n      ""r364"",\n      ""r365"",\n      ""r366"",\n      ""r367"",\n      ""r368"",\n      ""r369"",\n      ""r723"",\n      ""r1034"",\n      ""r1417""\n     ]\n    },\n    ""nflx_CostOfRevenuesMember"": {\n     ""xbrltype"": ""domainItemType"",\n     ""nsuri"": ""http://www.netflix.com/20251231"",\n     ""localname"": ""CostOfRevenuesMember"",\n     ""presentation"": [\n      ""http://www.netflix.com/role/DerivativeFinancialInstrumentsandHedgingActivitiesScheduleofGainsLossesonHedgedItemsandDerivativeInstrumentsRecognizedintheConsolidatedStatementofOperationsDetails""\n     ],\n     ""lang"": {\n      ""en-us"": {\n       ""role"": {\n        ""terseLabel"": ""Cost of Revenues"",\n        ""label"": ""Cost of Revenues [Member]"",\n        ""documentation"": ""Cost of Revenues""\n       }\n      }\n     },\n     ""auth_ref"": []\n    },\n    ""nflx_CostOfServicesDecreasedAmortizationFromTaxIncentives"": {\n     ""xbrltype"": ""monetaryItemType"",\n     ""nsuri"": ""http://www.netflix.com/20251231"",\n     ""localname"": ""CostOfServicesDecreasedAmortizationFromTaxIncentives"",\n     ""crdr"": ""credit"",\n     ""presentation"": [\n      ""http://www.netflix.com/role/BalanceSheetComponentsScheduleofAmortizationofContentAssetsDetails""\n     ],\n     ""lang"": {\n      ""en-us"": {\n       ""role"": {\n        ""terseLabel"": ""Tax incentives resulting in lower content amortization"",', 'Rights</span></div><div style=""margin-top:5pt;text-indent:24.75pt""><span style=""color:#000000;font-family:\'Times New Roman\',serif;font-size:10pt;font-weight:400;line-height:120%"">The holders of each share of common stock shall be entitled to <ix:nonFraction unitRef=""vote"" contextRef=""c-1"" decimals=""INF"" name=""nflx:CommonstockVotingRightsVotes"" format=""ixt-sec:numwordsen"" scale=""0"" id=""f-996"">one</ix:nonFraction> vote per share on all matters to be voted upon by the Company&#8217;s stockholders.</span></div><div style=""margin-top:14pt""><span style=""color:#000000;font-family:\'Times New Roman\',serif;font-size:10pt;font-style:italic;font-weight:700;line-height:120%"">Equity Incentive Plans</span></div><div style=""margin-bottom:5pt;margin-top:5pt;text-indent:22.5pt""><span style=""color:#000000;font-family:\'Times New Roman\',serif;font-size:10pt;font-weight:400;line-height:120%"">The Netflix, Inc. 2020 Stock Plan is a stockholder-approved plan that provides for the grant of incentive stock options to employees and for the grant of non-statutory stock options, stock appreciation rights, restricted stock and restricted stock units to employees, directors and consultants.</span></div><div style=""margin-top:14pt""><span style=""color:#000000;font-family:\'Times New Roman\',serif;font-size:10pt;font-style:italic;font-weight:700;line-height:120%"">Restricted Stock Unit Awards</span></div><div style=""margin-top:5pt;text-indent:24.75pt""><span style=""color:#000000;font-family:\'Times New Roman\',serif;font-size:10pt;font-weight:400;line-height:120%"">The Company grants time-based restricted stock unit (&#8220;RSU&#8221;) awards and performance-based restricted stock unit (&#8220;PSU&#8221;) awards to certain executive officers.  RSU awards vest quarterly over a <ix:nonNumeric contextRef=""c-300"" name=""us-gaap:ShareBasedCompensationArrangementByShareBasedPaymentAwardAwardVestingPeriod1"" format=""ixt-sec:durwordsen"" id=""f-997"">three-year</ix:nonNumeric> period subject to the executive&#8217;s', '""presentation"": [\n      ""http://www.netflix.com/role/StockholdersEquityScheduleofActivityRelatedtoStockOptionDetails""\n     ],\n     ""lang"": {\n      ""en-us"": {\n       ""role"": {\n        ""terseLabel"": ""Weighted- Average Remaining Contractual Term (in years)"",\n        ""label"": ""Share-Based Compensation Arrangement by Share-Based Payment Award, Options, Additional Disclosures [Abstract]""\n       }\n      }\n     },\n     ""auth_ref"": []\n    },\n    ""us-gaap_ShareBasedCompensationArrangementByShareBasedPaymentAwardOptionsExercisesInPeriodTotalIntrinsicValue"": {\n     ""xbrltype"": ""monetaryItemType"",\n     ""nsuri"": ""http://fasb.org/us-gaap/2025"",\n     ""localname"": ""ShareBasedCompensationArrangementByShareBasedPaymentAwardOptionsExercisesInPeriodTotalIntrinsicValue"",\n     ""crdr"": ""debit"",\n     ""presentation"": [\n      ""http://www.netflix.com/role/StockholdersEquityScheduleofAmountsRelatedtoOptionExercisesDetails""\n     ],\n     ""lang"": {\n      ""en-us"": {\n       ""role"": {\n        ""terseLabel"": ""Total intrinsic value of options exercised"",\n        ""label"": ""Share-Based Compensation Arrangement by Share-Based Payment Award, Options, Exercises in Period, Intrinsic Value"",\n        ""documentation"": ""Amount of accumulated difference between fair value of underlying shares on dates of exercise and exercise price on options exercised (or share units converted) into shares.""\n       }\n      }\n     },\n     ""auth_ref"": [\n      ""r474""\n     ]\n    },\n    ""us-gaap_ShareBasedCompensationArrangementByShareBasedPaymentAwardOptionsExpirationsInPeriod"": {\n     ""xbrltype"": ""sharesItemType"",\n     ""nsuri"": ""http://fasb.org/us-gaap/2025"",\n     ""localname"": ""ShareBasedCompensationArrangementByShareBasedPaymentAwardOptionsExpirationsInPeriod"",\n     ""presentation"": [\n      ""http://www.netflix.com/role/StockholdersEquityScheduleofActivityRelatedtoStockOptionDetails""\n     ],\n     ""lang"": {\n      ""en-us"": {\n       ""role"": {\n        ""negatedTerseLabel"": ""Expired (in shares)"",', '<dei:DocumentTransitionReport contextRef=""c-1"" id=""f-5"">false</dei:DocumentTransitionReport>\n    <dei:EntityFileNumber contextRef=""c-1"" id=""f-6"">001-35727</dei:EntityFileNumber>\n    <dei:EntityRegistrantName contextRef=""c-1"" id=""f-7"">Netflix, Inc.</dei:EntityRegistrantName>\n    <dei:EntityIncorporationStateCountryCode contextRef=""c-1"" id=""f-8"">DE</dei:EntityIncorporationStateCountryCode>\n    <dei:EntityTaxIdentificationNumber contextRef=""c-1"" id=""f-9"">77-0467272</dei:EntityTaxIdentificationNumber>\n    <dei:EntityAddressAddressLine1 contextRef=""c-1"" id=""f-10"">121 Albright Way</dei:EntityAddressAddressLine1>\n    <dei:EntityAddressCityOrTown contextRef=""c-1"" id=""f-11"">Los Gatos</dei:EntityAddressCityOrTown>\n    <dei:EntityAddressStateOrProvince contextRef=""c-1"" id=""f-12"">CA</dei:EntityAddressStateOrProvince>\n    <dei:EntityAddressPostalZipCode contextRef=""c-1"" id=""f-13"">95032</dei:EntityAddressPostalZipCode>\n    <dei:CityAreaCode contextRef=""c-1"" id=""f-14"">408</dei:CityAreaCode>\n    <dei:LocalPhoneNumber contextRef=""c-1"" id=""f-15"">540-3700</dei:LocalPhoneNumber>\n    <dei:Security12bTitle contextRef=""c-1"" id=""f-16"">Common stock, par value $0.001 per share</dei:Security12bTitle>\n    <dei:TradingSymbol contextRef=""c-1"" id=""f-17"">NFLX</dei:TradingSymbol>\n    <dei:SecurityExchangeName contextRef=""c-1"" id=""f-18"">NASDAQ</dei:SecurityExchangeName>\n    <dei:EntityWellKnownSeasonedIssuer contextRef=""c-1"" id=""f-19"">Yes</dei:EntityWellKnownSeasonedIssuer>\n    <dei:EntityVoluntaryFilers contextRef=""c-1"" id=""f-20"">No</dei:EntityVoluntaryFilers>\n    <dei:EntityCurrentReportingStatus contextRef=""c-1"" id=""f-21"">Yes</dei:EntityCurrentReportingStatus>\n    <dei:EntityInteractiveDataCurrent contextRef=""c-1"" id=""f-22"">Yes</dei:EntityInteractiveDataCurrent>\n    <dei:EntityFilerCategory contextRef=""c-1"" id=""f-23"">Large Accelerated Filer</dei:EntityFilerCategory>\n    <dei:EntitySmallBusiness contextRef=""c-1"" id=""f-24"">false</dei:EntitySmallBusiness>', '<td class=""text""><span style=""color:#000000;font-family:\'Times New Roman\',serif;font-size:10pt;font-weight:700;line-height:120%;padding-left:10pt"">Stockholders&#8217; Equity</span><div style=""margin-top:14pt""><span style=""color:#000000;font-family:\'Times New Roman\',serif;font-size:10pt;font-style:italic;font-weight:700;line-height:120%"">Voting Rights</span></div><div style=""margin-top:5pt;text-indent:24.75pt""><span style=""color:#000000;font-family:\'Times New Roman\',serif;font-size:10pt;font-weight:400;line-height:120%"">The holders of each share of common stock shall be entitled to one vote per share on all matters to be voted upon by the Company&#8217;s stockholders.</span></div><div style=""margin-top:14pt""><span style=""color:#000000;font-family:\'Times New Roman\',serif;font-size:10pt;font-style:italic;font-weight:700;line-height:120%"">Equity Incentive Plans</span></div><div style=""margin-bottom:5pt;margin-top:5pt;text-indent:22.5pt""><span style=""color:#000000;font-family:\'Times New Roman\',serif;font-size:10pt;font-weight:400;line-height:120%"">The Netflix, Inc. 2020 Stock Plan is a stockholder-approved plan that provides for the grant of incentive stock options to employees and for the grant of non-statutory stock options, stock appreciation rights, restricted stock and restricted stock units to employees, directors and consultants.</span></div><div style=""margin-top:14pt""><span style=""color:#000000;font-family:\'Times New Roman\',serif;font-size:10pt;font-style:italic;font-weight:700;line-height:120%"">Restricted Stock Unit Awards</span></div><div style=""margin-top:5pt;text-indent:24.75pt""><span style=""color:#000000;font-family:\'Times New Roman\',serif;font-size:10pt;font-weight:400;line-height:120%"">The Company grants time-based restricted stock unit (&#8220;RSU&#8221;) awards and performance-based restricted stock unit (&#8220;PSU&#8221;) awards to certain executive officers.  RSU awards vest quarterly over a three-year period subject to the executive&#8217;s', ""[WEB ARAMASI KAYNAĞI]: Yerel veri tabanında bulunamayan bilgi için internet ve finansal API'ler üzerinden şu güncel veriler elde edilmiştir:\nThe par value of common stock for Netflix is $0.001 per share.""]",The par value of common stock for Netflix is $0.001 per share.,Netflix's common stock has a par value of $0.001 per share.,0.33164983163877665,1.0,1.0,1.0
What is the par value of common stock for Intel?,"['""calculation"": {\n      ""http://www.intel.com/role/ConsolidatedBalanceSheets"": {\n       ""parentTag"": ""us-gaap_StockholdersEquity"",\n       ""weight"": 1.0,\n       ""order"": 2.0\n      }\n     },\n     ""presentation"": [\n      ""http://www.intel.com/role/ConsolidatedBalanceSheets""\n     ],\n     ""lang"": {\n      ""en-us"": {\n       ""role"": {\n        ""terseLabel"": ""Common stock, $0.001 par value, 10,000 shares authorized; 4,994 shares issued and outstanding (4,330 issued and outstanding in 2024) and capital in excess of par value"",\n        ""label"": ""Common Stocks, Including Additional Paid in Capital"",\n        ""documentation"": ""Amount of par value plus amounts in excess of par value or issuance value for common stock issued.""\n       }\n      }\n     },\n     ""auth_ref"": [\n      ""r105"",\n      ""r106"",\n      ""r157""\n     ]\n    },\n    ""ecd_CompActuallyPaidVsCoSelectedMeasureTextBlock"": {\n     ""xbrltype"": ""textBlockItemType"",\n     ""nsuri"": ""http://xbrl.sec.gov/ecd/2025"",\n     ""localname"": ""CompActuallyPaidVsCoSelectedMeasureTextBlock"",\n     ""presentation"": [\n      ""http://xbrl.sec.gov/ecd/role/PvpDisclosure""\n     ],\n     ""lang"": {\n      ""en-us"": {\n       ""role"": {\n        ""terseLabel"": ""Compensation Actually Paid vs. Company Selected Measure"",\n        ""label"": ""Compensation Actually Paid vs. Company Selected Measure [Text Block]""\n       }\n      }\n     },\n     ""auth_ref"": [\n      ""r1617""\n     ]\n    },\n    ""ecd_CompActuallyPaidVsNetIncomeTextBlock"": {\n     ""xbrltype"": ""textBlockItemType"",\n     ""nsuri"": ""http://xbrl.sec.gov/ecd/2025"",\n     ""localname"": ""CompActuallyPaidVsNetIncomeTextBlock"",\n     ""presentation"": [\n      ""http://xbrl.sec.gov/ecd/role/PvpDisclosure""\n     ],\n     ""lang"": {\n      ""en-us"": {\n       ""role"": {\n        ""terseLabel"": ""Compensation Actually Paid vs. Net Income"",\n        ""label"": ""Compensation Actually Paid vs. Net Income [Text Block]""\n       }\n      }\n     },\n     ""auth_ref"": [\n      ""r1616""\n     ]\n    },\n    ""ecd_CompActuallyPaidVsOtherMeasureTextBlock"": {', 'style=""color:#000000;font-family:\'Intel Clear\',sans-serif;font-size:10pt;font-weight:400;line-height:120%"">2.</font><font style=""color:#000000;font-family:\'Intel Clear\',sans-serif;font-size:10pt;font-weight:400;line-height:120%;padding-left:27.89pt"">Recommend the purchase or sale of any Intel (or that company&#8217;s) Securities. </font></div><div style=""margin-bottom:6pt;padding-left:54pt;text-indent:-36pt""><font style=""color:#000000;font-family:\'Intel Clear\',sans-serif;font-size:10pt;font-weight:400;line-height:120%"">3.</font><font style=""color:#000000;font-family:\'Intel Clear\',sans-serif;font-size:10pt;font-weight:400;line-height:120%;padding-left:27.89pt"">Disclose material non-public information to people within Intel whose jobs do not require them to have that information, or to persons outside Intel, such as family, friends, business associates, investors, and expert consulting firms, unless disclosure is made in accordance with Intel&#8217;s policies regarding the protection or authorized external disclosure of Intel information. Disclosing material non-public information to others who may trade on it is often referred to as &#8220;</font><font style=""color:#000000;font-family:\'Intel Clear\',sans-serif;font-size:10pt;font-style:italic;font-weight:700;line-height:120%"">tipping</font><font style=""color:#000000;font-family:\'Intel Clear\',sans-serif;font-size:10pt;font-weight:400;line-height:120%"">,&#8221; and it is prohibited by the Policy.</font></div><div style=""padding-left:54pt;text-indent:-36pt""><font style=""color:#000000;font-family:\'Intel Clear\',sans-serif;font-size:10pt;font-weight:400;line-height:120%"">4.</font><font style=""color:#000000;font-family:\'Intel Clear\',sans-serif;font-size:10pt;font-weight:400;line-height:120%;padding-left:27.89pt"">Assist anyone engaged in the above activities.</font></div><div><font><br></font></div><div><font style=""color:#000000;font-family:\'Intel Clear\',sans-serif;font-size:10pt;font-weight:400;line-height:120%"">A', '""calculation"": {\n      ""http://www.intel.com/role/InvestmentsMarketableDebtInvestmentsContractualMaturityDetails"": {\n       ""parentTag"": ""us-gaap_AvailableForSaleSecuritiesDebtSecurities"",\n       ""weight"": 1.0,\n       ""order"": 4.0\n      }\n     },\n     ""presentation"": [\n      ""http://www.intel.com/role/InvestmentsMarketableDebtInvestmentsContractualMaturityDetails""\n     ],\n     ""lang"": {\n      ""en-us"": {\n       ""role"": {\n        ""terseLabel"": ""Instruments not due at a single maturity date"",\n        ""label"": ""Debt Securities, Available-for-Sale, Maturity, without Single Maturity Date, Fair Value"",\n        ""documentation"": ""Fair value of investment in debt security measured at fair value with change in fair value recognized in other comprehensive income (available-for-sale), without single maturity date and not allocated over maturity grouping.""\n       }\n      }\n     },\n     ""auth_ref"": [\n      ""r388"",\n      ""r1163"",\n      ""r1795""\n     ]\n    },\n    ""us-gaap_AvailableForSaleSecuritiesDebtSecurities"": {\n     ""xbrltype"": ""monetaryItemType"",\n     ""nsuri"": ""http://fasb.org/us-gaap/2025"",\n     ""localname"": ""AvailableForSaleSecuritiesDebtSecurities"",\n     ""crdr"": ""debit"",\n     ""calculation"": {\n      ""http://www.intel.com/role/InvestmentsMarketableDebtInvestmentsContractualMaturityDetails"": {\n       ""parentTag"": null,\n       ""weight"": null,\n       ""order"": null,\n       ""root"": true\n      }\n     },\n     ""presentation"": [\n      ""http://www.intel.com/role/InvestmentsMarketableDebtInvestmentsContractualMaturityDetails""\n     ],\n     ""lang"": {\n      ""en-us"": {\n       ""role"": {\n        ""totalLabel"": ""Debt Securities, Available-for-Sale, Total"",\n        ""label"": ""Debt Securities, Available-for-Sale"",\n        ""documentation"": ""Amount of investment in debt security measured at fair value with change in fair value recognized in other comprehensive income (available-for-sale).""\n       }\n      }\n     },\n     ""auth_ref"": [\n      ""r383"",\n      ""r432"",\n      ""r996"",\n      ""r1022"",', '""http://www.intel.com/role/ConsolidatedStatementsofCashFlows""\n     ],\n     ""lang"": {\n      ""en-us"": {\n       ""role"": {\n        ""negatedLabel"": ""Payment of dividends to stockholders"",\n        ""label"": ""Payments of Ordinary Dividends, Common Stock"",\n        ""documentation"": ""Amount of cash outflow in the form of ordinary dividends to common shareholders of the parent entity.""\n       }\n      }\n     },\n     ""auth_ref"": [\n      ""r134""\n     ]\n    },\n    ""us-gaap_PaymentsRelatedToTaxWithholdingForShareBasedCompensation"": {\n     ""xbrltype"": ""monetaryItemType"",\n     ""nsuri"": ""http://fasb.org/us-gaap/2025"",\n     ""localname"": ""PaymentsRelatedToTaxWithholdingForShareBasedCompensation"",\n     ""crdr"": ""credit"",\n     ""calculation"": {\n      ""http://www.intel.com/role/ConsolidatedStatementsofCashFlows"": {\n       ""parentTag"": ""us-gaap_NetCashProvidedByUsedInFinancingActivities"",\n       ""weight"": -1.0,\n       ""order"": 11.0\n      }\n     },\n     ""presentation"": [\n      ""http://www.intel.com/role/ConsolidatedStatementsofCashFlows""\n     ],\n     ""lang"": {\n      ""en-us"": {\n       ""role"": {\n        ""negatedTerseLabel"": ""Restricted stock unit withholdings"",\n        ""label"": ""Payment, Tax Withholding, Share-Based Payment Arrangement"",\n        ""documentation"": ""Amount of cash outflow to satisfy grantee\'s tax withholding obligation for award under share-based payment arrangement.""\n       }\n      }\n     },\n     ""auth_ref"": [\n      ""r266""\n     ]\n    },\n    ""us-gaap_PaymentsToAcquireAvailableForSaleSecuritiesDebt"": {\n     ""xbrltype"": ""monetaryItemType"",\n     ""nsuri"": ""http://fasb.org/us-gaap/2025"",\n     ""localname"": ""PaymentsToAcquireAvailableForSaleSecuritiesDebt"",\n     ""crdr"": ""credit"",\n     ""calculation"": {\n      ""http://www.intel.com/role/ConsolidatedStatementsofCashFlows"": {\n       ""parentTag"": ""us-gaap_NetCashProvidedByUsedInInvestingActivities"",\n       ""weight"": -1.0,\n       ""order"": 4.0\n      }\n     },\n     ""presentation"": [', '""localname"": ""SaleOfStockPricePerShareToBeIssued"",\n     ""presentation"": [\n      ""http://www.intel.com/role/EarningsLossPerShareandStockholdersEquityNarrativeDetails""\n     ],\n     ""lang"": {\n      ""en-us"": {\n       ""role"": {\n        ""terseLabel"": ""Price of stock to be sold (in dollars per share)"",\n        ""label"": ""Sale Of Stock, Price Per Share To Be Issued"",\n        ""documentation"": ""Sale Of Stock, Price Per Share To Be Issued""\n       }\n      }\n     },\n     ""auth_ref"": []\n    },\n    ""us-gaap_SalesRevenueNetMember"": {\n     ""xbrltype"": ""domainItemType"",\n     ""nsuri"": ""http://fasb.org/us-gaap/2025"",\n     ""localname"": ""SalesRevenueNetMember"",\n     ""presentation"": [\n      ""http://www.intel.com/role/OperatingSegmentsRevenuebyMajorCustomersDetails""\n     ],\n     ""lang"": {\n      ""en-us"": {\n       ""role"": {\n        ""terseLabel"": ""Revenue Benchmark [Member]"",\n        ""label"": ""Revenue Benchmark [Member]"",\n        ""documentation"": ""Revenue from sale of product and rendering of service and other sources of income, when it serves as benchmark in concentration of risk calculation.""\n       }\n      }\n     },\n     ""auth_ref"": [\n      ""r372"",\n      ""r1783"",\n      ""r1784""\n     ]\n    },\n    ""srt_ScenarioForecastMember"": {\n     ""xbrltype"": ""domainItemType"",\n     ""nsuri"": ""http://fasb.org/srt/2025"",\n     ""localname"": ""ScenarioForecastMember"",\n     ""presentation"": [\n      ""http://www.intel.com/role/AcquisitionsandDivestituresNarrativeDetails""\n     ],\n     ""lang"": {\n      ""en-us"": {\n       ""role"": {\n        ""terseLabel"": ""Forecast"",\n        ""label"": ""Forecast [Member]""\n       }\n      }\n     },\n     ""auth_ref"": [\n      ""r710""\n     ]\n    },\n    ""srt_ScenarioUnspecifiedDomain"": {\n     ""xbrltype"": ""domainItemType"",\n     ""nsuri"": ""http://fasb.org/srt/2025"",\n     ""localname"": ""ScenarioUnspecifiedDomain"",\n     ""presentation"": [\n      ""http://www.intel.com/role/AcquisitionsandDivestituresNarrativeDetails"",\n      ""http://www.intel.com/role/RetirementBenefitPlansDetails""\n     ],\n     ""lang"": {', '""r31"",\n      ""r265"",\n      ""r378"",\n      ""r411""\n     ]\n    },\n    ""us-gaap_ProceedsFromStockPlans"": {\n     ""xbrltype"": ""monetaryItemType"",\n     ""nsuri"": ""http://fasb.org/us-gaap/2025"",\n     ""localname"": ""ProceedsFromStockPlans"",\n     ""crdr"": ""debit"",\n     ""calculation"": {\n      ""http://www.intel.com/role/ConsolidatedStatementsofCashFlows"": {\n       ""parentTag"": ""us-gaap_NetCashProvidedByUsedInFinancingActivities"",\n       ""weight"": 1.0,\n       ""order"": 9.0\n      }\n     },\n     ""presentation"": [\n      ""http://www.intel.com/role/ConsolidatedStatementsofCashFlows""\n     ],\n     ""lang"": {\n      ""en-us"": {\n       ""role"": {\n        ""verboseLabel"": ""Proceeds from sales of common stock through employee equity incentive plans"",\n        ""label"": ""Proceeds from Stock Plans"",\n        ""documentation"": ""The cash inflow associated with the amount received from the stock plan during the period.""\n       }\n      }\n     },\n     ""auth_ref"": [\n      ""r7""\n     ]\n    },\n    ""intc_ProceedsToBeReceivedUnderGovernmentProgram"": {\n     ""xbrltype"": ""monetaryItemType"",\n     ""nsuri"": ""http://www.intel.com/20251227"",\n     ""localname"": ""ProceedsToBeReceivedUnderGovernmentProgram"",\n     ""crdr"": ""debit"",\n     ""presentation"": [\n      ""http://www.intel.com/role/EarningsLossPerShareandStockholdersEquityNarrativeDetails"",\n      ""http://www.intel.com/role/OtherFinancialStatementDetailsGovernmentIncentivesDetails""\n     ],\n     ""lang"": {\n      ""en-us"": {\n       ""role"": {\n        ""terseLabel"": ""Proceeds to be received under government program"",\n        ""label"": ""Proceeds To Be Received Under Government Program"",\n        ""documentation"": ""Proceeds To Be Received Under Government Program""\n       }\n      }\n     },\n     ""auth_ref"": []\n    },\n    ""srt_ProductOrServiceAxis"": {\n     ""xbrltype"": ""stringItemType"",\n     ""nsuri"": ""http://fasb.org/srt/2025"",\n     ""localname"": ""ProductOrServiceAxis"",\n     ""presentation"": [\n      ""http://www.intel.com/role/ContractLiabilitiesDetails"",', '""nsuri"": ""http://fasb.org/us-gaap/2025"",\n     ""localname"": ""StockholdersEquityIncludingPortionAttributableToNoncontrollingInterest"",\n     ""crdr"": ""credit"",\n     ""calculation"": {\n      ""http://www.intel.com/role/ConsolidatedBalanceSheets"": {\n       ""parentTag"": ""us-gaap_LiabilitiesAndStockholdersEquity"",\n       ""weight"": 1.0,\n       ""order"": 5.0\n      }\n     },\n     ""presentation"": [\n      ""http://www.intel.com/role/AccumulatedOtherComprehensiveIncomeLossDetails"",\n      ""http://www.intel.com/role/ConsolidatedBalanceSheets"",\n      ""http://www.intel.com/role/ConsolidatedStatementsofStockholdersEquity"",\n      ""http://www.intel.com/role/EarningsLossPerShareandStockholdersEquityNarrativeDetails""\n     ],\n     ""lang"": {\n      ""en-us"": {\n       ""role"": {\n        ""totalLabel"": ""Total stockholders\' equity"",\n        ""periodStartLabel"": ""Beginning Balance"",\n        ""periodEndLabel"": ""Ending Balance"",\n        ""terseLabel"": ""Increase to total stockholders\' equity"",\n        ""label"": ""Equity, Including Portion Attributable to Noncontrolling Interest"",\n        ""documentation"": ""Amount of equity (deficit) attributable to parent and noncontrolling interest. Excludes temporary equity.""\n       }\n      }\n     },\n     ""auth_ref"": [\n      ""r67"",\n      ""r68"",\n      ""r75"",\n      ""r201"",\n      ""r202"",\n      ""r208"",\n      ""r209"",\n      ""r247"",\n      ""r298"",\n      ""r299"",\n      ""r300"",\n      ""r303"",\n      ""r312"",\n      ""r314"",\n      ""r421"",\n      ""r424"",\n      ""r485"",\n      ""r567"",\n      ""r582"",\n      ""r754"",\n      ""r808"",\n      ""r809"",\n      ""r825"",\n      ""r826"",\n      ""r827"",\n      ""r830"",\n      ""r892"",\n      ""r893"",\n      ""r972"",\n      ""r973"",\n      ""r974"",\n      ""r975"",\n      ""r976"",\n      ""r978"",\n      ""r992"",\n      ""r1037"",\n      ""r1039"",\n      ""r1043"",\n      ""r1054"",\n      ""r1075"",\n      ""r1218"",\n      ""r1219"",\n      ""r1242"",\n      ""r1268"",\n      ""r1285"",\n      ""r1304"",\n      ""r1305"",\n      ""r1331"",\n      ""r1530"",\n      ""r1531"",\n      ""r1548"",\n      ""r1760"",\n      ""r1765"",', 'solid #0070c0;padding:2px 1pt;text-align:left;vertical-align:top""><div style=""margin-top:3pt;padding-left:2.77pt;padding-right:2.77pt""><font style=""color:#000000;font-family:\'Intel Clear\',sans-serif;font-size:10pt;font-weight:700;line-height:120%"">Transactions in Publicly-Traded Options and Other Derivatives</font><font style=""color:#000000;font-family:\'Intel Clear\',sans-serif;font-size:10pt;font-weight:400;line-height:120%"">. These transactions include buying and selling &#8220;put&#8221; options, &#8220;call&#8221; options, and other derivative securities that represent a right to acquire or dispose of, or have a value based on the value of, Intel Securities, </font><font style=""color:#000000;font-family:\'Intel Clear\',sans-serif;font-size:10pt;font-weight:400;line-height:120%;text-decoration:underline"">unless</font><font style=""color:#000000;font-family:\'Intel Clear\',sans-serif;font-size:10pt;font-weight:400;line-height:120%""> the option or derivative is issued directly by Intel.</font></div></td><td colspan=""3"" style=""border-bottom:0.5pt solid #0070c0;border-left:0.5pt solid #0070c0;border-top:0.5pt solid #0070c0;padding:2px 1pt;text-align:left;vertical-align:top""><div style=""margin-bottom:2pt;margin-top:3pt;padding-left:2.77pt;padding-right:2.77pt""><font style=""color:#ff0000;font-family:\'Intel Clear\',sans-serif;font-size:10pt;font-weight:700;line-height:120%"">Prohibited</font><font style=""color:#000000;font-family:\'Intel Clear\',sans-serif;font-size:10pt;font-weight:400;line-height:120%""> </font></div></td><td colspan=""3"" style=""border-bottom:0.5pt solid #0070c0;border-left:0.5pt solid #0070c0;border-right:0.5pt solid #0070c0;border-top:0.5pt solid #0070c0;padding:2px 1pt;text-align:left;vertical-align:top""><div style=""margin-top:3pt;padding-left:2.77pt;padding-right:2.77pt""><font style=""color:#ff0000;font-family:\'Intel Clear\',sans-serif;font-size:10pt;font-weight:700;line-height:120%"">Prohibited</font><font style=""color:#000000;font-family:\'Intel', '""intc_StockPurchasePlanRIghtsMember"": {\n     ""xbrltype"": ""domainItemType"",\n     ""nsuri"": ""http://www.intel.com/20251227"",\n     ""localname"": ""StockPurchasePlanRIghtsMember"",\n     ""presentation"": [\n      ""http://www.intel.com/role/EmployeeEquityIncentivePlansDetails""\n     ],\n     ""lang"": {\n      ""en-us"": {\n       ""role"": {\n        ""terseLabel"": ""Stock Purchase Plan RIghts [Member]"",\n        ""label"": ""Stock Purchase Plan RIghts [Member]"",\n        ""documentation"": ""Rights to acquire stock under the Stock Purchase Plan""\n       }\n      }\n     },\n     ""auth_ref"": []\n    },\n    ""intc_StockToBeIssuedPricePerShare"": {\n     ""xbrltype"": ""perShareItemType"",\n     ""nsuri"": ""http://www.intel.com/20251227"",\n     ""localname"": ""StockToBeIssuedPricePerShare"",\n     ""presentation"": [\n      ""http://www.intel.com/role/EarningsLossPerShareandStockholdersEquityNarrativeDetails""\n     ],\n     ""lang"": {\n      ""en-us"": {\n       ""role"": {\n        ""terseLabel"": ""Stock to be issued, price per share (in dollars per share)"",\n        ""label"": ""Stock To Be Issued, Price Per Share"",\n        ""documentation"": ""Stock To Be Issued, Price Per Share""\n       }\n      }\n     },\n     ""auth_ref"": []\n    },\n    ""intc_StockToBeIssuedSharesNewIssues"": {\n     ""xbrltype"": ""sharesItemType"",\n     ""nsuri"": ""http://www.intel.com/20251227"",\n     ""localname"": ""StockToBeIssuedSharesNewIssues"",\n     ""presentation"": [\n      ""http://www.intel.com/role/EarningsLossPerShareandStockholdersEquityNarrativeDetails""\n     ],\n     ""lang"": {\n      ""en-us"": {\n       ""role"": {\n        ""terseLabel"": ""Stock to be issued (in shares)"",\n        ""label"": ""Stock To Be Issued, Shares, New Issues"",\n        ""documentation"": ""Stock To Be Issued, Shares, New Issues""\n       }\n      }\n     },\n     ""auth_ref"": []\n    },\n    ""us-gaap_StockholdersEquity"": {\n     ""xbrltype"": ""monetaryItemType"",\n     ""nsuri"": ""http://fasb.org/us-gaap/2025"",\n     ""localname"": ""StockholdersEquity"",\n     ""crdr"": ""credit"",\n     ""calculation"": {', '""xbrltype"": ""perShareItemType"",\n     ""nsuri"": ""http://fasb.org/us-gaap/2025"",\n     ""localname"": ""CommonStockParOrStatedValuePerShare"",\n     ""presentation"": [\n      ""http://www.intel.com/role/ConsolidatedBalanceSheetsParenthetical""\n     ],\n     ""lang"": {\n      ""en-us"": {\n       ""role"": {\n        ""verboseLabel"": ""Common stock, par value (in dollars per share)"",\n        ""label"": ""Common Stock, Par or Stated Value Per Share"",\n        ""documentation"": ""Face amount or stated value per share of common stock.""\n       }\n      }\n     },\n     ""auth_ref"": [\n      ""r105""\n     ]\n    },\n    ""us-gaap_CommonStockSharesAuthorized"": {\n     ""xbrltype"": ""sharesItemType"",\n     ""nsuri"": ""http://fasb.org/us-gaap/2025"",\n     ""localname"": ""CommonStockSharesAuthorized"",\n     ""presentation"": [\n      ""http://www.intel.com/role/ConsolidatedBalanceSheetsParenthetical""\n     ],\n     ""lang"": {\n      ""en-us"": {\n       ""role"": {\n        ""verboseLabel"": ""Common stock, shares authorized"",\n        ""label"": ""Common Stock, Shares Authorized"",\n        ""documentation"": ""The maximum number of common shares permitted to be issued by an entity\'s charter and bylaws.""\n       }\n      }\n     },\n     ""auth_ref"": [\n      ""r105"",\n      ""r1266""\n     ]\n    },\n    ""us-gaap_CommonStockSharesIssued"": {\n     ""xbrltype"": ""sharesItemType"",\n     ""nsuri"": ""http://fasb.org/us-gaap/2025"",\n     ""localname"": ""CommonStockSharesIssued"",\n     ""presentation"": [\n      ""http://www.intel.com/role/ConsolidatedBalanceSheetsParenthetical""\n     ],\n     ""lang"": {\n      ""en-us"": {\n       ""role"": {\n        ""verboseLabel"": ""Common stock, shares issued"",\n        ""label"": ""Common Stock, Shares, Issued"",', ""[WEB ARAMASI KAYNAĞI]: Yerel veri tabanında bulunamayan bilgi için internet ve finansal API'ler üzerinden şu güncel veriler elde edilmiştir:\nThe par value of common stock for Intel Corporation (ticker: INTC) is **$0.001** per share. This is a standard nominal value assigned to the stock, which is often significantly lower than the market price.""]",The par value of common stock for Intel Corporation is $0.001 per share.,Intel's common stock has a par value of $0.001 per share.,0.5909090908795455,1.0,1.0,0.9802788481049102
What is the par value of common stock for Bank of America?,"['""weight"": 1.0,\n       ""order"": 1.0\n      }\n     },\n     ""presentation"": [\n      ""http://www.bankofamerica.com/role/ConsolidatedBalanceSheet""\n     ],\n     ""lang"": {\n      ""en-us"": {\n       ""role"": {\n        ""terseLabel"": ""Preferred stock, $0.01 par value; authorized \\u2013 100,000,000 shares; issued and outstanding \\u2013 3,991,164 and 3,877,917 shares"",\n        ""label"": ""Preferred Stock, Redeemable And NonRedeemable, Value"",\n        ""documentation"": ""Aggregate par or stated value of issued nonredeemable and redeemable preferred stock (including Series T which may be exercised, at the option of the holder, through tendering the Series T Preferred Stock or paying cash).""\n       }\n      }\n     },\n     ""auth_ref"": []\n    },\n    ""bac_PreferredStockRedeemableAndNonRedeemableValueBeforeAdjustments"": {\n     ""xbrltype"": ""monetaryItemType"",\n     ""nsuri"": ""http://www.bankofamerica.com/20251231"",\n     ""localname"": ""PreferredStockRedeemableAndNonRedeemableValueBeforeAdjustments"",\n     ""crdr"": ""credit"",\n     ""calculation"": {\n      ""http://www.bankofamerica.com/role/ShareholdersEquityPreferredStockSummaryDetails"": {\n       ""parentTag"": ""us-gaap_PreferredStockIncludingAdditionalPaidInCapital"",\n       ""weight"": 1.0,\n       ""order"": 1.0\n      }\n     },\n     ""presentation"": [\n      ""http://www.bankofamerica.com/role/ShareholdersEquityPreferredStockSummaryDetails""\n     ],\n     ""lang"": {\n      ""en-us"": {\n       ""role"": {\n        ""verboseLabel"": ""Carrying Value Before Adjustments"",\n        ""label"": ""Preferred Stock, Redeemable And NonRedeemable, Value, Before Adjustments"",\n        ""documentation"": ""Preferred Stock, Redeemable And NonRedeemable, Value, Before Adjustments""\n       }\n      }\n     },\n     ""auth_ref"": []\n    },\n    ""bac_PreferredStockRedeemableAndNonRedeemableValueIssuanceCostsAndAdjustments"": {\n     ""xbrltype"": ""monetaryItemType"",\n     ""nsuri"": ""http://www.bankofamerica.com/20251231"",', 'Bank of America</span></div></td><td colspan=""3"" style=""padding:0 1pt""/><td colspan=""3"" style=""padding:0 1pt""/></tr></table></div></div></div><div id=""idd50fa8ccd704ccba7d633a77cae242f_226""></div><hr style=""page-break-after:always""/><div style=""min-height:45pt;width:100%""><div><span><br/></span></div></div><div style=""width:100.000%""><div style=""display:inline-block;vertical-align:top;width:48.706%""><div style=""-sec-extract:summary;margin-top:7pt""><span style=""color:#000000;font-family:\'Franklin Gothic Medium\',sans-serif;font-size:12pt;font-weight:700;line-height:120%"">NOTE 13  </span><ix:nonNumeric contextRef=""c-1"" name=""us-gaap:StockholdersEquityNoteDisclosureTextBlock"" id=""f-4553"" continuedAt=""f-4553-1"" escape=""true""><span style=""color:#e31837;font-family:\'Franklin Gothic Medium\',sans-serif;font-size:12pt;font-weight:700;line-height:120%"">Shareholders&#8217; Equity</span></ix:nonNumeric></div><ix:continuation id=""f-4553-1"" continuedAt=""f-4553-2""><ix:nonNumeric contextRef=""c-1"" name=""us-gaap:DividendsDeclaredTableTextBlock"" id=""f-4554"" escape=""true""><div style=""margin-bottom:5pt;margin-top:5pt""><span style=""color:#000000;font-family:\'Franklin Gothic Medium\',sans-serif;font-size:11pt;font-weight:700;line-height:120%"">Common Stock</span><table style=""border-collapse:collapse;display:inline-table;margin-bottom:5pt;vertical-align:text-bottom;width:100.000%""><tr><td style=""width:1.0%""/><td style=""width:23.973%""/><td style=""width:0.1%""/><td style=""width:0.1%""/><td style=""width:1.274%""/><td style=""width:0.1%""/><td style=""width:1.0%""/><td style=""width:26.038%""/><td style=""width:0.1%""/><td style=""width:0.1%""/><td style=""width:1.274%""/><td style=""width:0.1%""/><td style=""width:1.0%""/><td style=""width:27.218%""/><td style=""width:0.1%""/><td style=""width:0.1%""/><td style=""width:1.274%""/><td style=""width:0.1%""/><td style=""width:1.0%""/><td style=""width:13.949%""/><td style=""width:0.1%""/></tr><tr style=""height:8pt""><td colspan=""3"" style=""border-top:1.5pt solid #e31837;padding:0', '1&#47;1,200</font><font style=""color:#000000;font-family:\'Times New Roman\',serif;font-size:7.8pt;font-weight:400;line-height:120%;position:relative;top:-4.2pt;vertical-align:baseline"">th</font><font style=""color:#000000;font-family:\'Times New Roman\',serif;font-size:12pt;font-weight:400;line-height:120%""> interest in a share of Bank of America Corporation Floating Rate Non-Cumulative Preferred Stock, Series 4</font></div><div style=""margin-top:6pt;padding-left:36pt;text-indent:-18pt""><font style=""color:#000000;font-family:\'Times New Roman\',serif;font-size:12pt;font-weight:400;line-height:120%"">&#8226;&#160;&#160;&#160;&#160;Depositary Shares, each representing a 1&#47;1,200</font><font style=""color:#000000;font-family:\'Times New Roman\',serif;font-size:7.8pt;font-weight:400;line-height:120%;position:relative;top:-4.2pt;vertical-align:baseline"">th</font><font style=""color:#000000;font-family:\'Times New Roman\',serif;font-size:12pt;font-weight:400;line-height:120%""> interest in a share of Bank of America Corporation Floating Rate Non-Cumulative Preferred Stock, Series 5</font></div><div style=""margin-top:6pt;padding-left:36pt;text-indent:-18pt""><font style=""color:#000000;font-family:\'Times New Roman\',serif;font-size:12pt;font-weight:400;line-height:120%"">&#8226;&#160;&#160;&#160;&#160;Depositary Shares, each representing a 1&#47;1,000</font><font style=""color:#000000;font-family:\'Times New Roman\',serif;font-size:7.8pt;font-weight:400;line-height:120%;position:relative;top:-4.2pt;vertical-align:baseline"">th</font><font style=""color:#000000;font-family:\'Times New Roman\',serif;font-size:12pt;font-weight:400;line-height:120%""> interest in a share of 5.375% Non-Cumulative Preferred Stock, Series KK</font></div><div style=""margin-top:6pt;padding-left:36pt;text-indent:-18pt""><font style=""color:#000000;font-family:\'Times New Roman\',serif;font-size:12pt;font-weight:400;line-height:120%"">&#8226;&#160;&#160;&#160;&#160;Depositary Shares, each representing a 1&#47;1,000</font><font', 'With respect to (i) the Listed Legacy Bank of America Depositary Shares, the redemption price per depositary share will be equal to 1&#47;1,000</font><font style=""color:#000000;font-family:\'Times New Roman\',serif;font-size:7.8pt;font-weight:400;line-height:120%;position:relative;top:-4.2pt;vertical-align:baseline"">th</font><font style=""color:#000000;font-family:\'Times New Roman\',serif;font-size:12pt;font-weight:400;line-height:120%""> of the redemption price per share payable with respect to the relevant underlying series of preferred stock, (ii) the Unlisted Legacy Bank of America Depositary Shares, the redemption price per depositary share will be equal to 1&#47;25</font><font style=""color:#000000;font-family:\'Times New Roman\',serif;font-size:7.8pt;font-weight:400;line-height:120%;position:relative;top:-4.2pt;vertical-align:baseline"">th</font><font style=""color:#000000;font-family:\'Times New Roman\',serif;font-size:12pt;font-weight:400;line-height:120%""> of the redemption price per share payable with respect to the relevant underlying series of preferred stock, and (iii) the Legacy ML Depositary Shares, the redemption price per depositary share will be equal to 1&#47;1,200</font><font style=""color:#000000;font-family:\'Times New Roman\',serif;font-size:7.8pt;font-weight:400;line-height:120%;position:relative;top:-4.2pt;vertical-align:baseline"">th</font><font style=""color:#000000;font-family:\'Times New Roman\',serif;font-size:12pt;font-weight:400;line-height:120%""> of the redemption price per share payable with respect to the relevant underlying series of preferred stock.</font></div><div style=""margin-top:6pt;text-indent:36pt""><font style=""color:#000000;font-family:\'Times New Roman\',serif;font-size:12pt;font-weight:400;line-height:120%"">Whenever the Company redeems shares of a series of preferred stock held by the depositary under a deposit agreement, the depositary will redeem as of the same redemption date the number of related depositary shares representing the', '<td class=""nump"">990,000<span></span>\n</td>\n<td class=""text"">&#160;<span></span>\n</td>\n<td class=""text"">&#160;<span></span>\n</td>\n</tr>\n<tr class=""rh"">\n<td class=""pl"" style=""border-bottom: 0px;"" valign=""top""><a class=""a"" href=""javascript:void(0);"" onclick=""Show.showAR( this, \'defref_us-gaap_PlanNameAxis=bac_BankOfAmericaCorporationEquityPlanBACEPMember\', window );"">Bank Of America Corporation Equity Plan (BACEP) | Restricted Stock Units (RSUs)</a></td>\n<td class=""text"">&#160;<span></span>\n</td>\n<td class=""text"">&#160;<span></span>\n</td>\n<td class=""text"">&#160;<span></span>\n</td>\n</tr>\n<tr class=""ro"">\n<td class=""pl"" style=""border-bottom: 0px;"" valign=""top""><a class=""a"" href=""javascript:void(0);"" onclick=""Show.showAR( this, \'defref_us-gaap_ShareBasedCompensationArrangementByShareBasedPaymentAwardLineItems\', window );""><strong>Share-based Compensation Arrangement by Share-based Payment Award [Line Items]</strong></a></td>\n<td class=""text"">&#160;<span></span>\n</td>\n<td class=""text"">&#160;<span></span>\n</td>\n<td class=""text"">&#160;<span></span>\n</td>\n</tr>\n<tr class=""re"">\n<td class=""pl"" style=""border-bottom: 0px;"" valign=""top""><a class=""a"" href=""javascript:void(0);"" onclick=""Show.showAR( this, \'defref_us-gaap_ShareBasedCompensationArrangementByShareBasedPaymentAwardEquityInstrumentsOtherThanOptionsGrantsInPeriod\', window );"">Restricted stock units granted in period (in shares)</a></td>\n<td class=""nump"">107,000<span></span>\n</td>\n<td class=""nump"">121,000<span></span>\n</td>\n<td class=""text"">&#160;<span></span>\n</td>\n</tr>\n<tr class=""ro"">\n<td class=""pl"" style=""border-bottom: 0px;"" valign=""top""><a class=""a"" href=""javascript:void(0);"" onclick=""Show.showAR( this, \'defref_us-gaap_ShareBasedCompensationArrangementByShareBasedPaymentAwardAwardVestingPeriod1\', window );"">Award vesting period</a></td>\n<td class=""text"">4 years<span></span>\n</td>\n<td class=""text"">4 years<span></span>\n</td>\n<td class=""text"">&#160;<span></span>\n</td>\n</tr>\n<tr class=""rh"">', '}\n      }\n     },\n     ""auth_ref"": [\n      ""r94"",\n      ""r1326""\n     ]\n    },\n    ""us-gaap_CommonStockSharesIssued"": {\n     ""xbrltype"": ""sharesItemType"",\n     ""nsuri"": ""http://fasb.org/us-gaap/2025"",\n     ""localname"": ""CommonStockSharesIssued"",\n     ""presentation"": [\n      ""http://www.bankofamerica.com/role/ConsolidatedBalanceSheetParenthetical""\n     ],\n     ""lang"": {\n      ""en-us"": {\n       ""role"": {\n        ""verboseLabel"": ""Common stock issued (in shares)"",\n        ""label"": ""Common Stock, Shares, Issued"",\n        ""documentation"": ""Total number of common shares of an entity that have been sold or granted to shareholders (includes common shares that were issued, repurchased and remain in the treasury). These shares represent capital invested by the firm\'s shareholders and owners, and may be all or only a portion of the number of shares authorized. Shares issued include shares outstanding and shares held in the treasury.""\n       }\n      }\n     },\n     ""auth_ref"": [\n      ""r94""\n     ]\n    },\n    ""us-gaap_CommonStockSharesOutstanding"": {\n     ""xbrltype"": ""sharesItemType"",\n     ""nsuri"": ""http://fasb.org/us-gaap/2025"",\n     ""localname"": ""CommonStockSharesOutstanding"",\n     ""presentation"": [\n      ""http://www.bankofamerica.com/role/ConsolidatedBalanceSheetParenthetical""\n     ],\n     ""lang"": {\n      ""en-us"": {\n       ""role"": {\n        ""verboseLabel"": ""Common stock outstanding (in shares)"",\n        ""label"": ""Common Stock, Shares, Outstanding"",\n        ""documentation"": ""Number of shares of common stock outstanding. Common stock represent the ownership interest in a corporation.""\n       }\n      }\n     },\n     ""auth_ref"": [\n      ""r18"",\n      ""r94"",\n      ""r1326"",\n      ""r1346"",\n      ""r2268"",\n      ""r2269""\n     ]\n    },\n    ""us-gaap_CommonStocksIncludingAdditionalPaidInCapital"": {\n     ""xbrltype"": ""monetaryItemType"",\n     ""nsuri"": ""http://fasb.org/us-gaap/2025"",\n     ""localname"": ""CommonStocksIncludingAdditionalPaidInCapital"",\n     ""crdr"": ""credit"",', '""http://www.bankofamerica.com/role/ShareholdersEquityCommonStockRepurchasesDetails""\n     ],\n     ""lang"": {\n      ""en-us"": {\n       ""role"": {\n        ""verboseLabel"": ""Common Stock, par value $0.01 per share"",\n        ""terseLabel"": ""Common Stock"",\n        ""label"": ""Common Stock [Member]"",\n        ""documentation"": ""Stock that is subordinate to all other stock of the issuer.""\n       }\n      }\n     },\n     ""auth_ref"": [\n      ""r1638"",\n      ""r1639"",\n      ""r1640"",\n      ""r1642"",\n      ""r1643"",\n      ""r1644"",\n      ""r1647"",\n      ""r1904"",\n      ""r1905"",\n      ""r1909"",\n      ""r2165"",\n      ""r2261"",\n      ""r2268""\n     ]\n    },\n    ""us-gaap_CommonStockParOrStatedValuePerShare"": {\n     ""xbrltype"": ""perShareItemType"",\n     ""nsuri"": ""http://fasb.org/us-gaap/2025"",\n     ""localname"": ""CommonStockParOrStatedValuePerShare"",\n     ""presentation"": [\n      ""http://www.bankofamerica.com/role/ConsolidatedBalanceSheetParenthetical""\n     ],\n     ""lang"": {\n      ""en-us"": {\n       ""role"": {\n        ""verboseLabel"": ""Common stock, par value (in dollars per share)"",\n        ""label"": ""Common Stock, Par or Stated Value Per Share"",\n        ""documentation"": ""Face amount or stated value per share of common stock.""\n       }\n      }\n     },\n     ""auth_ref"": [\n      ""r94""\n     ]\n    },\n    ""us-gaap_CommonStockSharesAuthorized"": {\n     ""xbrltype"": ""sharesItemType"",\n     ""nsuri"": ""http://fasb.org/us-gaap/2025"",\n     ""localname"": ""CommonStockSharesAuthorized"",\n     ""presentation"": [\n      ""http://www.bankofamerica.com/role/ConsolidatedBalanceSheetParenthetical""\n     ],\n     ""lang"": {\n      ""en-us"": {\n       ""role"": {\n        ""verboseLabel"": ""Common stock authorized (in shares)"",\n        ""label"": ""Common Stock, Shares Authorized"",\n        ""documentation"": ""The maximum number of common shares permitted to be issued by an entity\'s charter and bylaws.""\n       }\n      }\n     },\n     ""auth_ref"": [\n      ""r94"",\n      ""r1326""\n     ]\n    },\n    ""us-gaap_CommonStockSharesIssued"": {', 'style=""text-align:justify;text-indent:13.5pt""><span style=""color:#000000;font-family:\'Franklin Gothic Book\',sans-serif;font-size:9pt;font-weight:400;line-height:120%"">Bank of America is one of the world&#8217;s largest financial institutions, serving individual consumers, small- and middle-market businesses, institutional investors, large corporations and governments with a full range of banking, investing, asset management and other financial and risk management products and services. Our principal executive offices are located in the Bank of America Corporate Center, 100 North Tryon Street, Charlotte, North Carolina 28255.</span></div><div style=""text-align:justify;text-indent:13.5pt""><span style=""color:#000000;font-family:\'Franklin Gothic Book\',sans-serif;font-size:9pt;font-weight:400;line-height:120%"">Bank of America&#8217;s website is www.bankofamerica.com, and the Investor Relations portion of our website is https://investor.bankofamerica.com. We use our website to distribute company information, including as a means of disclosing material, non-public information and for complying with our disclosure obligations under Regulation FD. We routinely post and make accessible financial and other information regarding the Corporation on our website. Investors should monitor our website, including the Investor Relations portion of our website, in addition to our press releases, U.S. Securities and Exchange Commission (SEC) filings, public conference calls and webcasts. Our Annual Reports on Form 10-K, Quarterly Reports on Form 10-Q, Current Reports on Form 8-K and amendments to those reports filed or furnished pursuant to Section 13(a) or 15(d) of the Securities Exchange Act of 1934 (Exchange Act) are available on the Investor Relations portion of our website as soon as reasonably practicable after we electronically file such reports with, or furnish them to, the SEC and at the SEC&#8217;s website, www.sec.gov. Notwithstanding the foregoing, the information contained', '},\n    ""bac_PreferredStockRedeemableAndNonRedeemableValueIssuanceCostsAndAdjustments"": {\n     ""xbrltype"": ""monetaryItemType"",\n     ""nsuri"": ""http://www.bankofamerica.com/20251231"",\n     ""localname"": ""PreferredStockRedeemableAndNonRedeemableValueIssuanceCostsAndAdjustments"",\n     ""crdr"": ""debit"",\n     ""calculation"": {\n      ""http://www.bankofamerica.com/role/ShareholdersEquityPreferredStockSummaryDetails"": {\n       ""parentTag"": ""us-gaap_PreferredStockIncludingAdditionalPaidInCapital"",\n       ""weight"": -1.0,\n       ""order"": 2.0\n      }\n     },\n     ""presentation"": [\n      ""http://www.bankofamerica.com/role/ShareholdersEquityPreferredStockSummaryDetails""\n     ],\n     ""lang"": {\n      ""en-us"": {\n       ""role"": {\n        ""negatedTerseLabel"": ""Issuance costs and certain adjustments"",\n        ""label"": ""Preferred Stock, Redeemable And NonRedeemable, Value, Issuance Costs And Adjustments"",\n        ""documentation"": ""Preferred Stock, Redeemable And NonRedeemable, Value, Issuance Costs And Adjustments""\n       }\n      }\n     },\n     ""auth_ref"": []\n    },\n    ""us-gaap_PreferredStockRedemptionAmount"": {\n     ""xbrltype"": ""monetaryItemType"",\n     ""nsuri"": ""http://fasb.org/us-gaap/2025"",\n     ""localname"": ""PreferredStockRedemptionAmount"",\n     ""crdr"": ""credit"",\n     ""presentation"": [\n      ""http://www.bankofamerica.com/role/ShareholdersEquityPreferredStockNarrativeDetails""\n     ],\n     ""lang"": {\n      ""en-us"": {\n       ""role"": {\n        ""terseLabel"": ""Redemption of preferred stock"",\n        ""label"": ""Preferred Stock, Redemption Amount"",\n        ""documentation"": ""The redemption (or callable) amount of currently redeemable preferred stock. Includes amounts representing dividends not currently declared or paid but which will be payable under the redemption features or for which ultimate payment is solely within the control of the issuer.""\n       }\n      }\n     },\n     ""auth_ref"": [\n      ""r53"",\n      ""r92"",\n      ""r992""\n     ]\n    },\n    ""us-gaap_PreferredStockSharesAuthorized"": {', 'Stock, par value $0.01 per share </font></div><div style=""margin-top:6pt;padding-left:36pt;text-indent:-18pt""><font style=""color:#000000;font-family:\'Times New Roman\',serif;font-size:12pt;font-weight:400;line-height:120%"">&#8226;&#160;&#160;&#160;&#160;Depositary Shares, each representing a 1&#47;1,000</font><font style=""color:#000000;font-family:\'Times New Roman\',serif;font-size:7.8pt;font-weight:400;line-height:120%;position:relative;top:-4.2pt;vertical-align:baseline"">th</font><font style=""color:#000000;font-family:\'Times New Roman\',serif;font-size:12pt;font-weight:400;line-height:120%""> interest in a share of Floating Rate Non-Cumulative Preferred Stock, Series E</font></div><div style=""margin-top:6pt;padding-left:36pt;text-indent:-18pt""><font style=""color:#000000;font-family:\'Times New Roman\',serif;font-size:12pt;font-weight:400;line-height:120%"">&#8226;&#160;&#160;&#160;&#160;Depositary Shares, each representing a 1&#47;1,000</font><font style=""color:#000000;font-family:\'Times New Roman\',serif;font-size:7.8pt;font-weight:400;line-height:120%;position:relative;top:-4.2pt;vertical-align:baseline"">th</font><font style=""color:#000000;font-family:\'Times New Roman\',serif;font-size:12pt;font-weight:400;line-height:120%""> interest in a share of 6.00% Non-Cumulative Preferred Stock, Series GG</font></div><div style=""margin-top:6pt;padding-left:36pt;text-indent:-18pt""><font style=""color:#000000;font-family:\'Times New Roman\',serif;font-size:12pt;font-weight:400;line-height:120%"">&#8226;&#160;&#160;&#160;&#160;Depositary Shares, each representing a 1&#47;1,000</font><font style=""color:#000000;font-family:\'Times New Roman\',serif;font-size:7.8pt;font-weight:400;line-height:120%;position:relative;top:-4.2pt;vertical-align:baseline"">th</font><font style=""color:#000000;font-family:\'Times New Roman\',serif;font-size:12pt;font-weight:400;line-height:120%""> interest in a share of 5.875% Non-Cumulative Preferred Stock, Series HH</font></div><div', ""[WEB ARAMASI KAYNAĞI]: Yerel veri tabanında bulunamayan bilgi için internet ve finansal API'ler üzerinden şu güncel veriler elde edilmiştir:\nThe par value of common stock for Bank of America is $0.01 per share.""]",The par value of common stock for Bank of America is $0.01 per share.,Bank of America's common stock has a par value of $0.01 per share.,0.20519480518796537,1.0,1.0,1.0
What is the par value of common stock for Johnson & Johnson?,"['par value $0.01 per share (the Kenvue Common Stock), at an initial public offering of $22.00 per share for net proceeds of $4.2&#160;billion. The excess of the net proceeds from the IPO over the net book value of the Johnson &amp;amp; Johnson divested interest was $2.5&#160;billion and was recorded to additional paid-in capital. As of the closing of the IPO, Johnson &amp;amp; Johnson owned approximately 89.6% of the total outstanding shares of Kenvue Common Stock and at July 2, 2023, the non-controlling interest of $1.3&#160;billion associated with Kenvue was reflected in equity attributable to non-controlling interests in the consolidated balance sheet in the fiscal second quarter of 2023. &lt;/span&gt;&lt;/div&gt;&lt;div style=""margin-bottom:6pt;margin-top:6pt""&gt;&lt;span style=""color:#000000;font-family:\'Johnson Text\',sans-serif;font-size:9pt;font-weight:400;line-height:130%""&gt;On August 23, 2023, Johnson &amp;amp; Johnson completed the disposition of an additional 80.1% ownership of Kenvue Common Stock through an exchange offer, which resulted in Johnson &amp;amp; Johnson acquiring 190,955,436 shares of the Company&#x2019;s common stock in exchange for 1,533,830,450 shares of Kenvue Common Stock. The $31.4&#160;billion of Johnson &amp;amp; Johnson common stock received in the exchange offer is recorded in Treasury stock. Following the exchange offer, the Company owned 9.5% of the total outstanding shares of Kenvue Common Stock that was recorded in other assets within continuing operations at the fair market value of $4.3&#160;billion as of August 23, 2023. Subsequent changes are reflected in other income/expense and amounted to $0.4&#160;billion expense through December 31, 2023.&lt;/span&gt;&lt;/div&gt;&lt;div style=""margin-bottom:6pt;margin-top:6pt""&gt;&lt;span style=""color:#000000;font-family:\'Johnson Text\',sans-serif;font-size:9pt;font-weight:400;line-height:130%""&gt;Johnson &amp;amp; Johnson divested net assets of $11.6&#160;billion as of August 23,', 'style=""padding:2px 1pt 2px 0;text-align:right;vertical-align:bottom""/></tr><tr><td colspan=""3"" style=""padding:2px 1pt;text-align:left;vertical-align:bottom""><span style=""color:#000000;font-family:\'Johnson Text\',sans-serif;font-size:9pt;font-weight:400;line-height:120%"">Repurchase of common stock</span></td><td colspan=""3"" style=""padding:0 1pt""/><td colspan=""3"" style=""padding:2px 1pt;text-align:right;vertical-align:bottom""><span style=""color:#000000;font-family:\'Arial\',sans-serif;font-size:9pt;font-weight:400;line-height:120%""><ix:nonFraction unitRef=""shares"" contextRef=""c-25"" decimals=""-3"" name=""us-gaap:TreasuryStockSharesAcquired"" format=""ixt:num-dot-decimal"" scale=""3"" id=""f-1825"">31,085</ix:nonFraction></span></td><td colspan=""3"" style=""padding:0 1pt""/><td colspan=""3"" style=""padding:2px 1pt;text-align:right;vertical-align:bottom""><span style=""color:#000000;font-family:\'Arial\',sans-serif;font-size:9pt;font-weight:400;line-height:120%""><ix:nonFraction unitRef=""usd"" contextRef=""c-25"" decimals=""-6"" name=""jnj:TreasuryStockValueAcquiredCostMethodNetOfTax"" format=""ixt:num-dot-decimal"" scale=""6"" id=""f-1826"">5,079</ix:nonFraction></span></td></tr><tr><td colspan=""3"" style=""padding:2px 1pt;text-align:left;vertical-align:bottom""><span style=""color:#000000;font-family:\'Johnson Text\',sans-serif;font-size:9pt;font-weight:400;line-height:120%"">Kenvue share exchange (Note 21)</span></td><td colspan=""3"" style=""padding:0 1pt""/><td colspan=""2"" style=""padding:2px 0 2px 1pt;text-align:right;vertical-align:bottom""><span style=""color:#000000;font-family:\'Arial\',sans-serif;font-size:9pt;font-weight:400;line-height:130%""><ix:nonFraction unitRef=""shares"" contextRef=""c-25"" decimals=""-3"" sign=""-"" name=""jnj:StockholdersEquityNoteSpinoffTransactionShares"" format=""ixt:num-dot-decimal"" scale=""3"" id=""f-1827"">190,955</ix:nonFraction>&#160;</span></td><td style=""padding:2px 1pt 2px 0;text-align:right;vertical-align:bottom""/><td colspan=""3"" style=""padding:0 1pt""/><td colspan=""3"" style=""padding:2px', 'style=""padding:2px 1pt 2px 0;text-align:right;vertical-align:bottom""/></tr><tr><td colspan=""3"" style=""padding:2px 1pt;text-align:left;vertical-align:bottom""><span style=""color:#000000;font-family:\'Johnson Text\',sans-serif;font-size:9pt;font-weight:400;line-height:120%"">Repurchase of common stock</span></td><td colspan=""3"" style=""padding:0 1pt""/><td colspan=""3"" style=""padding:2px 1pt;text-align:right;vertical-align:bottom""><span style=""color:#000000;font-family:\'Arial\',sans-serif;font-size:9pt;font-weight:400;line-height:120%""><ix:nonFraction unitRef=""shares"" contextRef=""c-25"" decimals=""-3"" name=""us-gaap:TreasuryStockSharesAcquired"" format=""ixt:num-dot-decimal"" scale=""3"" id=""f-1825"">31,085</ix:nonFraction></span></td><td colspan=""3"" style=""padding:0 1pt""/><td colspan=""3"" style=""padding:2px 1pt;text-align:right;vertical-align:bottom""><span style=""color:#000000;font-family:\'Arial\',sans-serif;font-size:9pt;font-weight:400;line-height:120%""><ix:nonFraction unitRef=""usd"" contextRef=""c-25"" decimals=""-6"" name=""jnj:TreasuryStockValueAcquiredCostMethodNetOfTax"" format=""ixt:num-dot-decimal"" scale=""6"" id=""f-1826"">5,079</ix:nonFraction></span></td></tr><tr><td colspan=""3"" style=""padding:2px 1pt;text-align:left;vertical-align:bottom""><span style=""color:#000000;font-family:\'Johnson Text\',sans-serif;font-size:9pt;font-weight:400;line-height:120%"">Kenvue share exchange (Note 21)</span></td><td colspan=""3"" style=""padding:0 1pt""/><td colspan=""2"" style=""padding:2px 0 2px 1pt;text-align:right;vertical-align:bottom""><span style=""color:#000000;font-family:\'Arial\',sans-serif;font-size:9pt;font-weight:400;line-height:130%""><ix:nonFraction unitRef=""shares"" contextRef=""c-25"" decimals=""-3"" sign=""-"" name=""jnj:StockholdersEquityNoteSpinoffTransactionShares"" format=""ixt:num-dot-decimal"" scale=""3"" id=""f-1827"">190,955</ix:nonFraction>&#160;</span></td><td style=""padding:2px 1pt 2px 0;text-align:right;vertical-align:bottom""/><td colspan=""3"" style=""padding:0 1pt""/><td colspan=""3"" style=""padding:2px', 'the net book value of the Johnson &amp; Johnson divested interest was $<ix:nonFraction unitRef=""usd"" contextRef=""c-68"" decimals=""-8"" name=""us-gaap:EquityMethodInvestmentRealizedGainLossOnDisposal"" format=""ixt:num-dot-decimal"" scale=""9"" id=""f-3156"">2.5</ix:nonFraction>&#160;billion and was recorded to additional paid-in capital. As of the closing of the IPO, Johnson &amp; Johnson owned approximately <ix:nonFraction unitRef=""number"" contextRef=""c-69"" decimals=""3"" name=""us-gaap:SaleOfStockPercentageOfOwnershipAfterTransaction"" scale=""-2"" id=""f-3157"">89.6</ix:nonFraction>% of the total outstanding shares of Kenvue Common Stock and at July 2, 2023, the non-controlling interest of $<ix:nonFraction unitRef=""usd"" contextRef=""c-1073"" decimals=""-8"" name=""us-gaap:CommonStockValueOutstanding"" format=""ixt:num-dot-decimal"" scale=""9"" id=""f-3158"">1.3</ix:nonFraction>&#160;billion associated with Kenvue was reflected in equity attributable to non-controlling interests in the consolidated balance sheet in the fiscal second quarter of 2023. </span></div><div style=""margin-bottom:6pt;margin-top:6pt""><span style=""color:#000000;font-family:\'Johnson Text\',sans-serif;font-size:9pt;font-weight:400;line-height:130%"">On August 23, 2023, Johnson &amp; Johnson completed the disposition of an additional <ix:nonFraction unitRef=""number"" contextRef=""c-70"" decimals=""3"" name=""jnj:OwnershipPercentageSplitOffPercent"" scale=""-2"" id=""f-3159"">80.1</ix:nonFraction>% ownership of Kenvue Common Stock through an exchange offer, which resulted in Johnson &amp; Johnson acquiring <ix:nonFraction unitRef=""shares"" contextRef=""c-1074"" decimals=""0"" name=""jnj:StockIssuedDuringPeriodSharesExchangeOffer"" format=""ixt:num-dot-decimal"" scale=""0"" id=""f-3160"">190,955,436</ix:nonFraction> shares of the Company&#8217;s common stock in exchange for <ix:nonFraction unitRef=""shares"" contextRef=""c-1075"" decimals=""0"" name=""jnj:StockIssuedDuringPeriodSharesExchangeOffer"" format=""ixt:num-dot-decimal"" scale=""0""', 'the net book value of the Johnson &amp; Johnson divested interest was $<ix:nonFraction unitRef=""usd"" contextRef=""c-68"" decimals=""-8"" name=""us-gaap:EquityMethodInvestmentRealizedGainLossOnDisposal"" format=""ixt:num-dot-decimal"" scale=""9"" id=""f-3156"">2.5</ix:nonFraction>&#160;billion and was recorded to additional paid-in capital. As of the closing of the IPO, Johnson &amp; Johnson owned approximately <ix:nonFraction unitRef=""number"" contextRef=""c-69"" decimals=""3"" name=""us-gaap:SaleOfStockPercentageOfOwnershipAfterTransaction"" scale=""-2"" id=""f-3157"">89.6</ix:nonFraction>% of the total outstanding shares of Kenvue Common Stock and at July 2, 2023, the non-controlling interest of $<ix:nonFraction unitRef=""usd"" contextRef=""c-1073"" decimals=""-8"" name=""us-gaap:CommonStockValueOutstanding"" format=""ixt:num-dot-decimal"" scale=""9"" id=""f-3158"">1.3</ix:nonFraction>&#160;billion associated with Kenvue was reflected in equity attributable to non-controlling interests in the consolidated balance sheet in the fiscal second quarter of 2023. </span></div><div style=""margin-bottom:6pt;margin-top:6pt""><span style=""color:#000000;font-family:\'Johnson Text\',sans-serif;font-size:9pt;font-weight:400;line-height:130%"">On August 23, 2023, Johnson &amp; Johnson completed the disposition of an additional <ix:nonFraction unitRef=""number"" contextRef=""c-70"" decimals=""3"" name=""jnj:OwnershipPercentageSplitOffPercent"" scale=""-2"" id=""f-3159"">80.1</ix:nonFraction>% ownership of Kenvue Common Stock through an exchange offer, which resulted in Johnson &amp; Johnson acquiring <ix:nonFraction unitRef=""shares"" contextRef=""c-1074"" decimals=""0"" name=""jnj:StockIssuedDuringPeriodSharesExchangeOffer"" format=""ixt:num-dot-decimal"" scale=""0"" id=""f-3160"">190,955,436</ix:nonFraction> shares of the Company&#8217;s common stock in exchange for <ix:nonFraction unitRef=""shares"" contextRef=""c-1075"" decimals=""0"" name=""jnj:StockIssuedDuringPeriodSharesExchangeOffer"" format=""ixt:num-dot-decimal"" scale=""0""', 'of preferred stock, without par value. As of the date of this filing, no shares of Johnson &#38; Johnson preferred stock were issued and outstanding.</font></div><div style=""margin-bottom:12pt""><font style=""color:#000000;font-family:\'Times New Roman\',serif;font-size:10pt;font-weight:400;line-height:120%"">The Johnson &#38; Johnson board of directors is authorized to provide for the issuance from time to time of Johnson &#38; Johnson preferred stock in series and, as to each series, to fix the designation&#59; the dividend rate and the preferences, if any, which dividends on that series will have compared to any other class or series of capital stock of Johnson &#38; Johnson&#59; the voting rights, if any&#59; the liquidation preferences, if any&#59; the conversion privileges, if any, and the redemption price or prices and the other terms of redemption, if any, applicable to that series. Cumulative dividends, dividend preferences and conversion, exchange and redemption provisions, to the extent that some or all of these features may be present when shares of Johnson &#38; Johnson preferred stock are issued, could have an adverse effect on the availability of earnings for distribution to the holders of Johnson &#38; Johnson common stock or for other corporate purposes.</font></div><div style=""margin-bottom:12pt""><font style=""color:#000000;font-family:\'Times New Roman\',serif;font-size:10pt;font-weight:700;line-height:100%"">Board of Directors</font></div><div style=""margin-bottom:12pt""><font style=""color:#000000;font-family:\'Times New Roman\',serif;font-size:10pt;font-weight:400;line-height:120%"">The Johnson &#38; Johnson restated certificate of incorporation and the Johnson &#38; Johnson by-laws provide that the total number of Johnson &#38; Johnson directors will be not less than nine nor more than 18, as determined by the Johnson &#38; Johnson board from time to time.</font></div><div style=""margin-bottom:12pt""><font style=""color:#000000;font-family:\'Times New', 'of preferred stock, without par value. As of the date of this filing, no shares of Johnson &#38; Johnson preferred stock were issued and outstanding.</font></div><div style=""margin-bottom:12pt""><font style=""color:#000000;font-family:\'Times New Roman\',serif;font-size:10pt;font-weight:400;line-height:120%"">The Johnson &#38; Johnson board of directors is authorized to provide for the issuance from time to time of Johnson &#38; Johnson preferred stock in series and, as to each series, to fix the designation&#59; the dividend rate and the preferences, if any, which dividends on that series will have compared to any other class or series of capital stock of Johnson &#38; Johnson&#59; the voting rights, if any&#59; the liquidation preferences, if any&#59; the conversion privileges, if any, and the redemption price or prices and the other terms of redemption, if any, applicable to that series. Cumulative dividends, dividend preferences and conversion, exchange and redemption provisions, to the extent that some or all of these features may be present when shares of Johnson &#38; Johnson preferred stock are issued, could have an adverse effect on the availability of earnings for distribution to the holders of Johnson &#38; Johnson common stock or for other corporate purposes.</font></div><div style=""margin-bottom:12pt""><font style=""color:#000000;font-family:\'Times New Roman\',serif;font-size:10pt;font-weight:700;line-height:100%"">Board of Directors</font></div><div style=""margin-bottom:12pt""><font style=""color:#000000;font-family:\'Times New Roman\',serif;font-size:10pt;font-weight:400;line-height:120%"">The Johnson &#38; Johnson restated certificate of incorporation and the Johnson &#38; Johnson by-laws provide that the total number of Johnson &#38; Johnson directors will be not less than nine nor more than 18, as determined by the Johnson &#38; Johnson board from time to time.</font></div><div style=""margin-bottom:12pt""><font style=""color:#000000;font-family:\'Times New', '</td>\n<td class=""text"">&#160;<span></span>\n</td>\n<td class=""text"">&#160;<span></span>\n</td>\n<td class=""text"">&#160;<span></span>\n</td>\n<td class=""text"">&#160;<span></span>\n</td>\n</tr>\n<tr class=""re"">\n<td class=""pl"" style=""border-bottom: 0px;"" valign=""top""><a class=""a"" href=""javascript:void(0);"" onclick=""Show.showAR( this, \'defref_us-gaap_CommonStockParOrStatedValuePerShare\', window );"">Common Stock, Par or Stated Value Per Share | $ / shares</a></td>\n<td class=""text"">&#160;<span></span>\n</td>\n<td class=""text"">&#160;<span></span>\n</td>\n<td class=""nump"">$ 1.00<span></span>\n</td>\n<td class=""nump"">$ 1.00<span></span>\n</td>\n<td class=""text"">&#160;<span></span>\n</td>\n<td class=""text"">&#160;<span></span>\n</td>\n<td class=""text"">&#160;<span></span>\n</td>\n<td class=""text"">&#160;<span></span>\n</td>\n</tr>\n<tr class=""ro"">\n<td class=""pl"" style=""border-bottom: 0px;"" valign=""top""><a class=""a"" href=""javascript:void(0);"" onclick=""Show.showAR( this, \'defref_us-gaap_ProceedsFromIssuanceInitialPublicOffering\', window );"">Proceeds from Kenvue initial public offering</a></td>\n<td class=""text"">&#160;<span></span>\n</td>\n<td class=""text"">&#160;<span></span>\n</td>\n<td class=""nump"">$ 0<span></span>\n</td>\n<td class=""nump"">$ 0<span></span>\n</td>\n<td class=""nump"">$ 4,241<span></span>\n</td>\n<td class=""text"">&#160;<span></span>\n</td>\n<td class=""text"">&#160;<span></span>\n</td>\n<td class=""text"">&#160;<span></span>\n</td>\n</tr>\n<tr class=""re"">\n<td class=""pl"" style=""border-bottom: 0px;"" valign=""top""><a class=""a"" href=""javascript:void(0);"" onclick=""Show.showAR( this, \'defref_us-gaap_EquityMethodInvestmentRealizedGainLossOnDisposal\', window );"">Realized gain (loss) on investment</a></td>\n<td class=""text"">&#160;<span></span>\n</td>\n<td class=""nump"">$ 2,500<span></span>\n</td>\n<td class=""text"">&#160;<span></span>\n</td>\n<td class=""text"">&#160;<span></span>\n</td>\n<td class=""text"">&#160;<span></span>\n</td>\n<td class=""text"">&#160;<span></span>\n</td>\n<td class=""text"">&#160;<span></span>\n</td>', 'Note&#160;19 to the Consolidated Financial Statements included in Item 8 of this report for further information regarding legal&#160;proceedings.</span></div><div style=""margin-bottom:6pt;margin-top:14pt""><span style=""color:#000000;font-family:\'Johnson Display\',sans-serif;font-size:13pt;font-weight:700;line-height:120%"">Common stock</span></div><div style=""margin-bottom:6pt;margin-top:6pt""><span style=""color:#000000;font-family:\'Johnson Text\',sans-serif;font-size:9pt;font-weight:400;line-height:130%"">The Company&#8217;s Common Stock is listed on the New York Stock Exchange under the symbol JNJ. As of February 4, 2026, there were 108,358 record holders of Common Stock of the Company. </span></div><div id=""i4d4483ed6e3e4767b23154f4b8acf0fc_109""></div><div style=""margin-bottom:6pt;margin-top:18pt""><span style=""color:#000000;font-family:\'Johnson Display\',sans-serif;font-size:18pt;font-weight:700;line-height:120%"">Item 7A. Quantitative and qualitative disclosures about market&#160;risk</span></div><div style=""margin-bottom:6pt;margin-top:6pt""><span style=""color:#000000;font-family:\'Johnson Text\',sans-serif;font-size:9pt;font-weight:400;line-height:125%"">The information called for by this item is incorporated herein by reference to Item 7. Management&#8217;s discussion and analysis of results of operations and financial condition&#160;- Liquidity and capital resources - Financing and market risk of this Report; and Note&#160;1 Summary of significant accounting policies&#160;- Financial instruments of the Notes to Consolidated Financial Statements included in Item 8 of this Report.</span></div><div style=""height:45pt;position:relative;width:100%""><div style=""bottom:0;position:absolute;width:100%""><div style=""margin-bottom:6pt;margin-top:6pt""><table style=""border-collapse:collapse;display:inline-table;margin-bottom:5pt;vertical-align:text-bottom;width:100.000%""><tr><td style=""width:1.0%""/><td style=""width:92.947%""/><td style=""width:0.1%""/><td style=""width:1.0%""/><td', 'Note&#160;19 to the Consolidated Financial Statements included in Item 8 of this report for further information regarding legal&#160;proceedings.</span></div><div style=""margin-bottom:6pt;margin-top:14pt""><span style=""color:#000000;font-family:\'Johnson Display\',sans-serif;font-size:13pt;font-weight:700;line-height:120%"">Common stock</span></div><div style=""margin-bottom:6pt;margin-top:6pt""><span style=""color:#000000;font-family:\'Johnson Text\',sans-serif;font-size:9pt;font-weight:400;line-height:130%"">The Company&#8217;s Common Stock is listed on the New York Stock Exchange under the symbol JNJ. As of February 4, 2026, there were 108,358 record holders of Common Stock of the Company. </span></div><div id=""i4d4483ed6e3e4767b23154f4b8acf0fc_109""></div><div style=""margin-bottom:6pt;margin-top:18pt""><span style=""color:#000000;font-family:\'Johnson Display\',sans-serif;font-size:18pt;font-weight:700;line-height:120%"">Item 7A. Quantitative and qualitative disclosures about market&#160;risk</span></div><div style=""margin-bottom:6pt;margin-top:6pt""><span style=""color:#000000;font-family:\'Johnson Text\',sans-serif;font-size:9pt;font-weight:400;line-height:125%"">The information called for by this item is incorporated herein by reference to Item 7. Management&#8217;s discussion and analysis of results of operations and financial condition&#160;- Liquidity and capital resources - Financing and market risk of this Report; and Note&#160;1 Summary of significant accounting policies&#160;- Financial instruments of the Notes to Consolidated Financial Statements included in Item 8 of this Report.</span></div><div style=""height:45pt;position:relative;width:100%""><div style=""bottom:0;position:absolute;width:100%""><div style=""margin-bottom:6pt;margin-top:6pt""><table style=""border-collapse:collapse;display:inline-table;margin-bottom:5pt;vertical-align:text-bottom;width:100.000%""><tr><td style=""width:1.0%""/><td style=""width:92.947%""/><td style=""width:0.1%""/><td style=""width:1.0%""/><td', ""[WEB ARAMASI KAYNAĞI]: Yerel veri tabanında bulunamayan bilgi için internet ve finansal API'ler üzerinden şu güncel veriler elde edilmiştir:\nThe par value of common stock for Johnson & Johnson is **$1.00 per share**.""]",The par value of common stock for Johnson & Johnson is $1.00 per share.,Johnson & Johnson's common stock has a par value of $1.00 per share.,0.15340909090142046,1.0,1.0,0.9999996172786689
What is the par value of Class A common stock for Meta Platforms?,"['Class&#160;A common stock and <ix:nonFraction unitRef=""shares"" contextRef=""c-7"" decimals=""-6"" name=""us-gaap:CommonStockSharesIssued"" format=""ixt:num-dot-decimal"" scale=""6"" id=""f-993""><ix:nonFraction unitRef=""shares"" contextRef=""c-7"" decimals=""-6"" name=""us-gaap:CommonStockSharesOutstanding"" format=""ixt:num-dot-decimal"" scale=""6"" id=""f-994"">343</ix:nonFraction></ix:nonFraction>&#160;million shares of Class&#160;B common stock issued and outstanding.</span></div><div style=""text-indent:27pt""><span><br/></span></div><div style=""text-align:justify""><span style=""color:#000000;font-family:\'Times New Roman\',serif;font-size:10pt;font-style:italic;font-weight:700;line-height:120%"">Capital Return Program</span></div><div style=""text-align:justify;text-indent:27pt""><span><br/></span></div><div style=""text-indent:27pt""><span style=""color:#000000;font-family:\'Times New Roman\',serif;font-size:10pt;font-style:italic;font-weight:400;line-height:120%"">Share Repurchase</span></div><div style=""text-indent:27pt""><span><br/></span></div><div style=""text-align:justify;text-indent:27pt""><span style=""color:#000000;font-family:\'Times New Roman\',serif;font-size:10pt;font-weight:400;line-height:120%"">Our board of directors has authorized a share repurchase program of our Class&#160;A common stock, which commenced in January 2017 and does not have an expiration date. As of December&#160;31, 2024, $<ix:nonFraction unitRef=""usd"" contextRef=""c-6"" decimals=""-7"" name=""us-gaap:StockRepurchaseProgramRemainingAuthorizedRepurchaseAmount1"" format=""ixt:num-dot-decimal"" scale=""9"" id=""f-995"">51.28</ix:nonFraction>&#160;billion remained available and authorized for repurchases under this program. In 2025, we repurchased and subsequently retired <ix:nonFraction unitRef=""shares"" contextRef=""c-85"" decimals=""-6"" name=""us-gaap:StockRepurchasedAndRetiredDuringPeriodShares"" format=""ixt:num-dot-decimal"" scale=""6"" id=""f-996"">40</ix:nonFraction>&#160;million shares of our Class&#160;A common stock for an aggregate', 'of Class A common stock</span></td><td colspan=""2"" style=""background-color:#ffffff;padding:2px 0 2px 1pt;text-align:right;vertical-align:bottom""><span style=""color:#000000;font-family:\'Times New Roman\',serif;font-size:10pt;font-weight:400;line-height:100%"">(<ix:nonFraction unitRef=""usd"" contextRef=""c-1"" decimals=""-6"" name=""us-gaap:PaymentsForRepurchaseOfCommonStock"" format=""ixt:num-dot-decimal"" scale=""6"" id=""f-334"">26,248</ix:nonFraction>)</span></td><td style=""background-color:#ffffff;padding:2px 1pt 2px 0;text-align:right;vertical-align:bottom""/><td colspan=""3"" style=""background-color:#ffffff;padding:0 1pt""/><td colspan=""2"" style=""background-color:#ffffff;padding:2px 0 2px 1pt;text-align:right;vertical-align:bottom""><span style=""color:#000000;font-family:\'Times New Roman\',serif;font-size:10pt;font-weight:400;line-height:100%"">(<ix:nonFraction unitRef=""usd"" contextRef=""c-11"" decimals=""-6"" name=""us-gaap:PaymentsForRepurchaseOfCommonStock"" format=""ixt:num-dot-decimal"" scale=""6"" id=""f-335"">30,125</ix:nonFraction>)</span></td><td style=""background-color:#ffffff;padding:2px 1pt 2px 0;text-align:right;vertical-align:bottom""/><td colspan=""3"" style=""background-color:#ffffff;padding:0 1pt""/><td colspan=""2"" style=""background-color:#ffffff;padding:2px 0 2px 1pt;text-align:right;vertical-align:bottom""><span style=""color:#000000;font-family:\'Times New Roman\',serif;font-size:10pt;font-weight:400;line-height:100%"">(<ix:nonFraction unitRef=""usd"" contextRef=""c-12"" decimals=""-6"" name=""us-gaap:PaymentsForRepurchaseOfCommonStock"" format=""ixt:num-dot-decimal"" scale=""6"" id=""f-336"">19,774</ix:nonFraction>)</span></td><td style=""background-color:#ffffff;padding:2px 1pt 2px 0;text-align:right;vertical-align:bottom""/></tr><tr><td colspan=""3"" style=""background-color:#cceeff;padding:2px 1pt 2px 10pt;text-align:left;vertical-align:bottom""><span style=""color:#000000;font-family:\'Times New Roman\',serif;font-size:10pt;font-weight:400;line-height:100%"">Payments for dividends and dividend', 'scale=""0"" id=""f-987""><ix:nonFraction unitRef=""usdPerShare"" contextRef=""c-9"" decimals=""INF"" name=""us-gaap:CommonStockParOrStatedValuePerShare"" scale=""0"" id=""f-988"">0.000006</ix:nonFraction></ix:nonFraction> per share. Holders of our Class&#160;A common stock and Class&#160;B common stock are entitled to dividends when, as, and if declared by our board of directors, subject to the rights of the holders of all classes of stock outstanding having priority rights to dividends. The holder of each share of Class&#160;A common stock is entitled to <ix:nonFraction unitRef=""vote"" contextRef=""c-9"" decimals=""INF"" name=""meta:CommonStockNumberOfVotesByClass"" format=""ixt-sec:numwordsen"" scale=""0"" id=""f-989"">one</ix:nonFraction> vote, while the holder of each share of Class&#160;B common stock is entitled to <ix:nonFraction unitRef=""vote"" contextRef=""c-7"" decimals=""INF"" name=""meta:CommonStockNumberOfVotesByClass"" format=""ixt-sec:numwordsen"" scale=""0"" id=""f-990"">ten</ix:nonFraction> votes. Shares of our Class&#160;B common stock are convertible into an equivalent number of shares of our Class&#160;A common stock and generally convert into shares of our Class&#160;A common stock upon transfer. Class&#160;A common stock and Class&#160;B common stock are collectively referred to as common stock throughout the notes to these financial statements, unless otherwise noted. As of December&#160;31, 2025, there were <ix:nonFraction unitRef=""shares"" contextRef=""c-9"" decimals=""-6"" name=""us-gaap:CommonStockSharesOutstanding"" format=""ixt:num-dot-decimal"" scale=""6"" id=""f-991""><ix:nonFraction unitRef=""shares"" contextRef=""c-9"" decimals=""-6"" name=""us-gaap:CommonStockSharesIssued"" format=""ixt:num-dot-decimal"" scale=""6"" id=""f-992"">2,187</ix:nonFraction></ix:nonFraction>&#160;million shares of Class&#160;A common stock and <ix:nonFraction unitRef=""shares"" contextRef=""c-7"" decimals=""-6"" name=""us-gaap:CommonStockSharesIssued"" format=""ixt:num-dot-decimal"" scale=""6"" id=""f-993""><ix:nonFraction', 'Common Stock</span></div><div style=""text-align:justify;text-indent:27pt""><span><br/></span></div><div style=""text-align:justify;text-indent:27pt""><span style=""color:#000000;font-family:\'Times New Roman\',serif;font-size:10pt;font-weight:400;line-height:120%"">Our Class&#160;A common stock is trading on the Nasdaq Global Select Market under the ticker symbol \'META\'. Our Class&#160;B common stock is not listed on any stock exchange nor traded on any public market.</span></div><div style=""text-align:justify""><span><br/></span></div><div style=""text-align:justify""><span style=""color:#000000;font-family:\'Times New Roman\',serif;font-size:10pt;font-weight:700;line-height:120%"">Holders of Record</span></div><div style=""text-align:justify;text-indent:27pt""><span><br/></span></div><div style=""text-align:justify;text-indent:27pt""><span style=""color:#000000;font-family:\'Times New Roman\',serif;font-size:10pt;font-weight:400;line-height:120%"">As of December&#160;31, 2025, there were 2,533 stockholders of record of our Class&#160;A common stock, and the closing price of our Class&#160;A common stock was $660.09 per share as reported on the Nasdaq Global Select Market. Because many of our shares of Class&#160;A common stock are held by brokers and other institutions on behalf of stockholders, we are unable to estimate the total number of stockholders represented by these record holders. As of December&#160;31, 2025, there were 25&#160;stockholders of record of our Class&#160;B common stock.</span></div><div style=""text-align:justify""><span><br/></span></div><div style=""text-align:justify""><span style=""color:#000000;font-family:\'Times New Roman\',serif;font-size:10pt;font-weight:700;line-height:120%"">Dividend Policy</span></div><div style=""text-align:justify;text-indent:27pt""><span><br/></span></div><div style=""text-align:justify;text-indent:27pt""><span style=""color:#000000;font-family:\'Times New Roman\',serif;font-size:10pt;font-weight:400;line-height:120%"">Beginning in 2024, our', '<td class=""text"">&#160;<span></span>\n</td>\n<td class=""text"">&#160;<span></span>\n</td>\n</tr>\n<tr class=""re"">\n<td class=""pl"" style=""border-bottom: 0px;"" valign=""top""><a class=""a"" href=""javascript:void(0);"" onclick=""Show.showAR( this, \'defref_us-gaap_CommonStockParOrStatedValuePerShare\', window );"">Common stock, par value (in dollars per share)</a></td>\n<td class=""nump"">$ 0.000006<span></span>\n</td>\n<td class=""nump"">$ 0.000006<span></span>\n</td>\n</tr>\n<tr class=""ro"">\n<td class=""pl"" style=""border-bottom: 0px;"" valign=""top""><a class=""a"" href=""javascript:void(0);"" onclick=""Show.showAR( this, \'defref_us-gaap_CommonStockSharesAuthorized\', window );"">Common stock, shares authorized (in shares)</a></td>\n<td class=""nump"">4,141,000,000<span></span>\n</td>\n<td class=""nump"">4,141,000,000<span></span>\n</td>\n</tr>\n<tr class=""re"">\n<td class=""pl"" style=""border-bottom: 0px;"" valign=""top""><a class=""a"" href=""javascript:void(0);"" onclick=""Show.showAR( this, \'defref_us-gaap_CommonStockSharesIssued\', window );"">Common stock, shares, issued (in shares)</a></td>\n<td class=""nump"">343,000,000<span></span>\n</td>\n<td class=""nump"">344,000,000<span></span>\n</td>\n</tr>\n<tr class=""ro"">\n<td class=""pl"" style=""border-bottom: 0px;"" valign=""top""><a class=""a"" href=""javascript:void(0);"" onclick=""Show.showAR( this, \'defref_us-gaap_CommonStockSharesOutstanding\', window );"">Common stock, shares, outstanding (in shares)</a></td>\n<td class=""nump"">343,000,000<span></span>\n</td>\n<td class=""nump"">344,000,000<span></span>\n</td>\n</tr>\n</table>\n<div style=""display: none;"">\n<table border=""0"" cellpadding=""0"" cellspacing=""0"" class=""authRefData"" style=""display: none;"" id=""defref_us-gaap_CommonStockParOrStatedValuePerShare"">\n<tr><td class=""hide""><a style=""color: white;"" href=""javascript:void(0);"" onclick=""Show.hideAR();"">X</a></td></tr>\n<tr><td><div class=""body"" style=""padding: 2px;"">', '<meta:CommonStockCapitalSharesReservedForFutureIssuancePotentialAnnualIncreasePercentageOfTotalIssuedAndOutstandingShares\n      contextRef=""c-258""\n      decimals=""3""\n      id=""f-1050""\n      unitRef=""number"">0.025</meta:CommonStockCapitalSharesReservedForFutureIssuancePotentialAnnualIncreasePercentageOfTotalIssuedAndOutstandingShares>\n    <meta:CommonStockIncreaseInCapitalSharesReservedForFutureIssuance\n      contextRef=""c-259""\n      decimals=""-6""\n      id=""f-1051""\n      unitRef=""shares"">55000000</meta:CommonStockIncreaseInCapitalSharesReservedForFutureIssuance>', '<td class=""text""><span style=""color:#000000;font-family:\'Times New Roman\',serif;font-size:10pt;font-weight:700;line-height:120%"">Stockholders\' Equity</span><div><span style=""color:#000000;font-family:\'Times New Roman\',serif;font-size:10pt;font-style:italic;font-weight:700;line-height:120%"">Common Stock</span></div><div style=""text-align:justify;text-indent:27pt""><span><br/></span></div><div style=""text-align:justify;text-indent:27pt""><span style=""color:#000000;font-family:\'Times New Roman\',serif;font-size:10pt;font-weight:400;line-height:120%"">Our certificate of incorporation authorizes the issuance of Class&#160;A common stock and Class&#160;B common stock. As of December&#160;31, 2025, we are authorized to issue 5,000&#160;million shares of Class&#160;A common stock and 4,141&#160;million shares of Class&#160;B common stock, each with a par value of $0.000006 per share. Holders of our Class&#160;A common stock and Class&#160;B common stock are entitled to dividends when, as, and if declared by our board of directors, subject to the rights of the holders of all classes of stock outstanding having priority rights to dividends. The holder of each share of Class&#160;A common stock is entitled to one vote, while the holder of each share of Class&#160;B common stock is entitled to ten votes. Shares of our Class&#160;B common stock are convertible into an equivalent number of shares of our Class&#160;A common stock and generally convert into shares of our Class&#160;A common stock upon transfer. Class&#160;A common stock and Class&#160;B common stock are collectively referred to as common stock throughout the notes to these financial statements, unless otherwise noted. As of December&#160;31, 2025, there were 2,187&#160;million shares of Class&#160;A common stock and 343&#160;million shares of Class&#160;B common stock issued and outstanding.</span></div><div style=""text-indent:27pt""><span><br/></span></div><div style=""text-align:justify""><span', '<td class=""nump"">$ 0.000006<span></span>\n</td>\n<td class=""nump"">$ 0.000006<span></span>\n</td>\n</tr>\n<tr class=""ro"">\n<td class=""pl custom"" style=""border-bottom: 0px;"" valign=""top""><a class=""a"" href=""javascript:void(0);"" onclick=""Show.showAR( this, \'defref_meta_CommonStockNumberOfVotesByClass\', window );"">Common stock, number of votes by class | vote</a></td>\n<td class=""nump"">10<span></span>\n</td>\n<td class=""text"">&#160;<span></span>\n</td>\n</tr>\n<tr class=""re"">\n<td class=""pl"" style=""border-bottom: 0px;"" valign=""top""><a class=""a"" href=""javascript:void(0);"" onclick=""Show.showAR( this, \'defref_us-gaap_CommonStockSharesIssued\', window );"">Common stock, shares, issued (in shares)</a></td>\n<td class=""nump"">343,000,000<span></span>\n</td>\n<td class=""nump"">344,000,000<span></span>\n</td>\n</tr>\n<tr class=""ro"">\n<td class=""pl"" style=""border-bottom: 0px;"" valign=""top""><a class=""a"" href=""javascript:void(0);"" onclick=""Show.showAR( this, \'defref_us-gaap_CommonStockSharesOutstanding\', window );"">Common stock, shares, outstanding (in shares)</a></td>\n<td class=""nump"">343,000,000<span></span>\n</td>\n<td class=""nump"">344,000,000<span></span>\n</td>\n</tr>\n</table>\n<div style=""display: none;"">\n<table border=""0"" cellpadding=""0"" cellspacing=""0"" class=""authRefData"" style=""display: none;"" id=""defref_meta_CommonStockNumberOfVotesByClass"">\n<tr><td class=""hide""><a style=""color: white;"" href=""javascript:void(0);"" onclick=""Show.hideAR();"">X</a></td></tr>\n<tr><td><div class=""body"" style=""padding: 2px;"">\n<a href=""javascript:void(0);"" onclick=""Show.toggleNext( this );"">- Definition</a><div><p>Common Stock, Number of Votes by Class</p></div>\n<a href=""javascript:void(0);"" onclick=""Show.toggleNext( this );"">+ References</a><div style=""display: none;""><p>No definition available.</p></div>\n<a href=""javascript:void(0);"" onclick=""Show.toggleNext( this );"">+ Details</a><div style=""display: none;""><table border=""0"" cellpadding=""0"" cellspacing=""0"">\n<tr>\n<td><strong> Name:</strong></td>', '<us-gaap:CommonStockSharesAuthorized contextRef=""c-9"" decimals=""INF"" id=""f-985"" unitRef=""shares"">5000000000</us-gaap:CommonStockSharesAuthorized>\n    <us-gaap:CommonStockSharesAuthorized contextRef=""c-7"" decimals=""INF"" id=""f-986"" unitRef=""shares"">4141000000</us-gaap:CommonStockSharesAuthorized>\n    <us-gaap:CommonStockParOrStatedValuePerShare\n      contextRef=""c-7""\n      decimals=""INF""\n      id=""f-987""\n      unitRef=""usdPerShare"">0.000006</us-gaap:CommonStockParOrStatedValuePerShare>\n    <us-gaap:CommonStockParOrStatedValuePerShare\n      contextRef=""c-9""\n      decimals=""INF""\n      id=""f-988""\n      unitRef=""usdPerShare"">0.000006</us-gaap:CommonStockParOrStatedValuePerShare>\n    <meta:CommonStockNumberOfVotesByClass contextRef=""c-9"" decimals=""INF"" id=""f-989"" unitRef=""vote"">1</meta:CommonStockNumberOfVotesByClass>\n    <meta:CommonStockNumberOfVotesByClass contextRef=""c-7"" decimals=""INF"" id=""f-990"" unitRef=""vote"">10</meta:CommonStockNumberOfVotesByClass>\n    <us-gaap:CommonStockSharesOutstanding contextRef=""c-9"" decimals=""-6"" id=""f-991"" unitRef=""shares"">2187000000</us-gaap:CommonStockSharesOutstanding>\n    <us-gaap:CommonStockSharesIssued contextRef=""c-9"" decimals=""-6"" id=""f-992"" unitRef=""shares"">2187000000</us-gaap:CommonStockSharesIssued>\n    <us-gaap:CommonStockSharesIssued contextRef=""c-7"" decimals=""-6"" id=""f-993"" unitRef=""shares"">343000000</us-gaap:CommonStockSharesIssued>\n    <us-gaap:CommonStockSharesOutstanding contextRef=""c-7"" decimals=""-6"" id=""f-994"" unitRef=""shares"">343000000</us-gaap:CommonStockSharesOutstanding>\n    <us-gaap:StockRepurchaseProgramRemainingAuthorizedRepurchaseAmount1 contextRef=""c-6"" decimals=""-7"" id=""f-995"" unitRef=""usd"">51280000000</us-gaap:StockRepurchaseProgramRemainingAuthorizedRepurchaseAmount1>\n    <us-gaap:StockRepurchasedAndRetiredDuringPeriodShares contextRef=""c-85"" decimals=""-6"" id=""f-996"" unitRef=""shares"">40000000</us-gaap:StockRepurchasedAndRetiredDuringPeriodShares>', '<td class=""text"">&#160;<span></span>\n</td>\n<td class=""text"">&#160;<span></span>\n</td>\n</tr>\n<tr class=""ro"">\n<td class=""pl"" style=""border-bottom: 0px;"" valign=""top""><a class=""a"" href=""javascript:void(0);"" onclick=""Show.showAR( this, \'defref_us-gaap_ClassOfStockLineItems\', window );""><strong>Class of Stock</strong></a></td>\n<td class=""text"">&#160;<span></span>\n</td>\n<td class=""text"">&#160;<span></span>\n</td>\n</tr>\n<tr class=""re"">\n<td class=""pl"" style=""border-bottom: 0px;"" valign=""top""><a class=""a"" href=""javascript:void(0);"" onclick=""Show.showAR( this, \'defref_us-gaap_CommonStockSharesAuthorized\', window );"">Common stock, shares authorized (in shares)</a></td>\n<td class=""nump"">5,000,000,000<span></span>\n</td>\n<td class=""nump"">5,000,000,000<span></span>\n</td>\n</tr>\n<tr class=""ro"">\n<td class=""pl"" style=""border-bottom: 0px;"" valign=""top""><a class=""a"" href=""javascript:void(0);"" onclick=""Show.showAR( this, \'defref_us-gaap_CommonStockParOrStatedValuePerShare\', window );"">Common stock, par value (in dollars per share) | $ / shares</a></td>\n<td class=""nump"">$ 0.000006<span></span>\n</td>\n<td class=""nump"">$ 0.000006<span></span>\n</td>\n</tr>\n<tr class=""re"">\n<td class=""pl custom"" style=""border-bottom: 0px;"" valign=""top""><a class=""a"" href=""javascript:void(0);"" onclick=""Show.showAR( this, \'defref_meta_CommonStockNumberOfVotesByClass\', window );"">Common stock, number of votes by class | vote</a></td>\n<td class=""nump"">1<span></span>\n</td>\n<td class=""text"">&#160;<span></span>\n</td>\n</tr>\n<tr class=""ro"">\n<td class=""pl"" style=""border-bottom: 0px;"" valign=""top""><a class=""a"" href=""javascript:void(0);"" onclick=""Show.showAR( this, \'defref_us-gaap_CommonStockSharesIssued\', window );"">Common stock, shares, issued (in shares)</a></td>\n<td class=""nump"">2,187,000,000<span></span>\n</td>\n<td class=""nump"">2,190,000,000<span></span>\n</td>\n</tr>\n<tr class=""re"">', ""[WEB ARAMASI KAYNAĞI]: Yerel veri tabanında bulunamayan bilgi için internet ve finansal API'ler üzerinden şu güncel veriler elde edilmiştir:\nThe par value of Class A common stock for Meta Platforms, Inc. is **$0.000006**.""]","The par value of Class A common stock for Meta Platforms, Inc. is $0.000006.",Meta's Class A common stock has a par value of $0.000006 per share.,0.49340342196780196,1.0,1.0,0.980050627258031
Compare the par value of common stock for Apple and Tesla.,"['format=""ixt:num-dot-decimal"" scale=""0"" id=""f-1594"">29,402,900</ix:nonFraction> Tesla shares, plus expenses of $<ix:nonFraction unitRef=""usd"" contextRef=""c-373"" decimals=""2"" name=""us-gaap:LossContingencyDamagesSoughtValue"" format=""ixt:num-dot-decimal"" scale=""0"" id=""f-1595"">1,120,115.50</ix:nonFraction>. Tesla opposed the fee request, and at Tesla&#8217;s 2024 Annual Meeting of Stockholders, <ix:nonFraction unitRef=""number"" contextRef=""c-373"" decimals=""INF"" name=""tsla:LossContingencyDamagesSoughtDisinterestedVotingSharesInFavorPercentage"" scale=""-2"" id=""f-1596"">72</ix:nonFraction>% of the disinterested voting shares of Tesla, excluding shares owned by Mr. Musk and Kimbal Musk, voted to ratify the 2018 CEO Performance Award. Because Tesla&#8217;s disinterested stockholders voted to ratify the 2018 CEO Performance Award, Mr. Musk and the other director defendants, joined by Tesla, filed a brief seeking to revise the Court&#8217;s January 30, 2024 opinion. On December 2, 2024, the Court issued an opinion denying the motion to revise the Court&#8217;s January 30, 2024 opinion and awarded Plaintiff&#8217;s counsel fees in the amount of $<ix:nonFraction unitRef=""usd"" contextRef=""c-374"" decimals=""-6"" name=""us-gaap:LossContingencyDamagesAwardedValue"" format=""ixt:num-dot-decimal"" scale=""6"" id=""f-1597"">345</ix:nonFraction>&#160;million. A final judgment was entered by the Court, and the director defendants and Tesla appealed the decisions to the Delaware Supreme Court. Tesla and the Director Defendants filed their response briefs on March 11, 2025. Plaintiffs filed their opening brief on April 25, 2025, and reply briefs were filed on May 16, 2025. Oral argument occurred on October 15, 2025. On December 19, 2025, the Delaware Supreme Court reversed the Court of Chancery&#8217;s rescission order, reinstating Mr. Musk&#8217;s 2018 compensation package, and awarded $<ix:nonFraction unitRef=""usd"" contextRef=""c-375"" decimals=""0"" name=""us-gaap:LossContingencyDamagesAwardedValue""', 'format=""ixt:num-dot-decimal"" scale=""0"" id=""f-1594"">29,402,900</ix:nonFraction> Tesla shares, plus expenses of $<ix:nonFraction unitRef=""usd"" contextRef=""c-373"" decimals=""2"" name=""us-gaap:LossContingencyDamagesSoughtValue"" format=""ixt:num-dot-decimal"" scale=""0"" id=""f-1595"">1,120,115.50</ix:nonFraction>. Tesla opposed the fee request, and at Tesla&#8217;s 2024 Annual Meeting of Stockholders, <ix:nonFraction unitRef=""number"" contextRef=""c-373"" decimals=""INF"" name=""tsla:LossContingencyDamagesSoughtDisinterestedVotingSharesInFavorPercentage"" scale=""-2"" id=""f-1596"">72</ix:nonFraction>% of the disinterested voting shares of Tesla, excluding shares owned by Mr. Musk and Kimbal Musk, voted to ratify the 2018 CEO Performance Award. Because Tesla&#8217;s disinterested stockholders voted to ratify the 2018 CEO Performance Award, Mr. Musk and the other director defendants, joined by Tesla, filed a brief seeking to revise the Court&#8217;s January 30, 2024 opinion. On December 2, 2024, the Court issued an opinion denying the motion to revise the Court&#8217;s January 30, 2024 opinion and awarded Plaintiff&#8217;s counsel fees in the amount of $<ix:nonFraction unitRef=""usd"" contextRef=""c-374"" decimals=""-6"" name=""us-gaap:LossContingencyDamagesAwardedValue"" format=""ixt:num-dot-decimal"" scale=""6"" id=""f-1597"">345</ix:nonFraction>&#160;million. A final judgment was entered by the Court, and the director defendants and Tesla appealed the decisions to the Delaware Supreme Court. Tesla and the Director Defendants filed their response briefs on March 11, 2025. Plaintiffs filed their opening brief on April 25, 2025, and reply briefs were filed on May 16, 2025. Oral argument occurred on October 15, 2025. On December 19, 2025, the Delaware Supreme Court reversed the Court of Chancery&#8217;s rescission order, reinstating Mr. Musk&#8217;s 2018 compensation package, and awarded $<ix:nonFraction unitRef=""usd"" contextRef=""c-375"" decimals=""0"" name=""us-gaap:LossContingencyDamagesAwardedValue""', '""us-gaap_CommonStockSharesOutstanding"": {\n     ""xbrltype"": ""sharesItemType"",\n     ""nsuri"": ""http://fasb.org/us-gaap/2025"",\n     ""localname"": ""CommonStockSharesOutstanding"",\n     ""presentation"": [\n      ""http://www.tesla.com/role/ConsolidatedBalanceSheetsParenthetical""\n     ],\n     ""lang"": {\n      ""en-us"": {\n       ""role"": {\n        ""terseLabel"": ""Common stock, shares outstanding (in shares)"",\n        ""label"": ""Common Stock, Shares, Outstanding"",\n        ""documentation"": ""Number of shares of common stock outstanding. Common stock represent the ownership interest in a corporation.""\n       }\n      }\n     },\n     ""auth_ref"": [\n      ""r11"",\n      ""r78"",\n      ""r1028"",\n      ""r1046"",\n      ""r1692"",\n      ""r1693""\n     ]\n    },\n    ""us-gaap_CommonStockValue"": {\n     ""xbrltype"": ""monetaryItemType"",\n     ""nsuri"": ""http://fasb.org/us-gaap/2025"",\n     ""localname"": ""CommonStockValue"",\n     ""crdr"": ""credit"",\n     ""calculation"": {\n      ""http://www.tesla.com/role/ConsolidatedBalanceSheets"": {\n       ""parentTag"": ""us-gaap_StockholdersEquity"",\n       ""weight"": 1.0,\n       ""order"": 2.0\n      }\n     },\n     ""presentation"": [\n      ""http://www.tesla.com/role/ConsolidatedBalanceSheets""\n     ],\n     ""lang"": {\n      ""en-us"": {\n       ""role"": {\n        ""terseLabel"": ""Common stock; $0.001 par value; 6,000 shares authorized; 3,751 and 3,216 shares issued and outstanding as of December\\u00a031, 2025 and 2024, respectively"",\n        ""label"": ""Common Stock, Value, Issued"",\n        ""documentation"": ""Aggregate par or stated value of issued nonredeemable common stock (or common stock redeemable solely at the option of the issuer). This item includes treasury stock repurchased by the entity. Note: elements for number of nonredeemable common shares, par value and other disclosure concepts are in another section within stockholders\' equity.""\n       }\n      }\n     },\n     ""auth_ref"": [\n      ""r78"",\n      ""r500"",\n      ""r508"",\n      ""r940"",\n      ""r1226""\n     ]\n    },', '""us-gaap_CommonStockSharesOutstanding"": {\n     ""xbrltype"": ""sharesItemType"",\n     ""nsuri"": ""http://fasb.org/us-gaap/2025"",\n     ""localname"": ""CommonStockSharesOutstanding"",\n     ""presentation"": [\n      ""http://www.tesla.com/role/ConsolidatedBalanceSheetsParenthetical""\n     ],\n     ""lang"": {\n      ""en-us"": {\n       ""role"": {\n        ""terseLabel"": ""Common stock, shares outstanding (in shares)"",\n        ""label"": ""Common Stock, Shares, Outstanding"",\n        ""documentation"": ""Number of shares of common stock outstanding. Common stock represent the ownership interest in a corporation.""\n       }\n      }\n     },\n     ""auth_ref"": [\n      ""r11"",\n      ""r78"",\n      ""r1028"",\n      ""r1046"",\n      ""r1692"",\n      ""r1693""\n     ]\n    },\n    ""us-gaap_CommonStockValue"": {\n     ""xbrltype"": ""monetaryItemType"",\n     ""nsuri"": ""http://fasb.org/us-gaap/2025"",\n     ""localname"": ""CommonStockValue"",\n     ""crdr"": ""credit"",\n     ""calculation"": {\n      ""http://www.tesla.com/role/ConsolidatedBalanceSheets"": {\n       ""parentTag"": ""us-gaap_StockholdersEquity"",\n       ""weight"": 1.0,\n       ""order"": 2.0\n      }\n     },\n     ""presentation"": [\n      ""http://www.tesla.com/role/ConsolidatedBalanceSheets""\n     ],\n     ""lang"": {\n      ""en-us"": {\n       ""role"": {\n        ""terseLabel"": ""Common stock; $0.001 par value; 6,000 shares authorized; 3,751 and 3,216 shares issued and outstanding as of December\\u00a031, 2025 and 2024, respectively"",\n        ""label"": ""Common Stock, Value, Issued"",\n        ""documentation"": ""Aggregate par or stated value of issued nonredeemable common stock (or common stock redeemable solely at the option of the issuer). This item includes treasury stock repurchased by the entity. Note: elements for number of nonredeemable common shares, par value and other disclosure concepts are in another section within stockholders\' equity.""\n       }\n      }\n     },\n     ""auth_ref"": [\n      ""r78"",\n      ""r500"",\n      ""r508"",\n      ""r940"",\n      ""r1226""\n     ]\n    },', ']\n    },\n    ""us-gaap_PreferredStockSharesOutstanding"": {\n     ""xbrltype"": ""sharesItemType"",\n     ""nsuri"": ""http://fasb.org/us-gaap/2025"",\n     ""localname"": ""PreferredStockSharesOutstanding"",\n     ""presentation"": [\n      ""http://www.tesla.com/role/ConsolidatedBalanceSheetsParenthetical""\n     ],\n     ""lang"": {\n      ""en-us"": {\n       ""role"": {\n        ""terseLabel"": ""Preferred stock, shares outstanding (in shares)"",\n        ""label"": ""Preferred Stock, Shares Outstanding"",\n        ""documentation"": ""Aggregate share number for all nonredeemable preferred stock (or preferred stock redeemable solely at the option of the issuer) held by stockholders. Does not include preferred shares that have been repurchased.""\n       }\n      }\n     },\n     ""auth_ref"": [\n      ""r77"",\n      ""r1028"",\n      ""r1046"",\n      ""r1692"",\n      ""r1693""\n     ]\n    },\n    ""us-gaap_PreferredStockValue"": {\n     ""xbrltype"": ""monetaryItemType"",\n     ""nsuri"": ""http://fasb.org/us-gaap/2025"",\n     ""localname"": ""PreferredStockValue"",\n     ""crdr"": ""credit"",\n     ""calculation"": {\n      ""http://www.tesla.com/role/ConsolidatedBalanceSheets"": {\n       ""parentTag"": ""us-gaap_StockholdersEquity"",\n       ""weight"": 1.0,\n       ""order"": 1.0\n      }\n     },\n     ""presentation"": [\n      ""http://www.tesla.com/role/ConsolidatedBalanceSheets""\n     ],\n     ""lang"": {\n      ""en-us"": {\n       ""role"": {\n        ""terseLabel"": ""Preferred stock; $0.001 par value; 100 shares authorized; no shares issued and outstanding"",\n        ""label"": ""Preferred Stock, Value, Issued"",\n        ""documentation"": ""Aggregate par or stated value of issued nonredeemable preferred stock (or preferred stock redeemable solely at the option of the issuer). This item includes treasury stock repurchased by the entity. Note: elements for number of nonredeemable preferred shares, par value and other disclosure concepts are in another section within stockholders\' equity.""\n       }\n      }\n     },\n     ""auth_ref"": [\n      ""r77"",\n      ""r500"",\n      ""r507"",', ']\n    },\n    ""us-gaap_PreferredStockSharesOutstanding"": {\n     ""xbrltype"": ""sharesItemType"",\n     ""nsuri"": ""http://fasb.org/us-gaap/2025"",\n     ""localname"": ""PreferredStockSharesOutstanding"",\n     ""presentation"": [\n      ""http://www.tesla.com/role/ConsolidatedBalanceSheetsParenthetical""\n     ],\n     ""lang"": {\n      ""en-us"": {\n       ""role"": {\n        ""terseLabel"": ""Preferred stock, shares outstanding (in shares)"",\n        ""label"": ""Preferred Stock, Shares Outstanding"",\n        ""documentation"": ""Aggregate share number for all nonredeemable preferred stock (or preferred stock redeemable solely at the option of the issuer) held by stockholders. Does not include preferred shares that have been repurchased.""\n       }\n      }\n     },\n     ""auth_ref"": [\n      ""r77"",\n      ""r1028"",\n      ""r1046"",\n      ""r1692"",\n      ""r1693""\n     ]\n    },\n    ""us-gaap_PreferredStockValue"": {\n     ""xbrltype"": ""monetaryItemType"",\n     ""nsuri"": ""http://fasb.org/us-gaap/2025"",\n     ""localname"": ""PreferredStockValue"",\n     ""crdr"": ""credit"",\n     ""calculation"": {\n      ""http://www.tesla.com/role/ConsolidatedBalanceSheets"": {\n       ""parentTag"": ""us-gaap_StockholdersEquity"",\n       ""weight"": 1.0,\n       ""order"": 1.0\n      }\n     },\n     ""presentation"": [\n      ""http://www.tesla.com/role/ConsolidatedBalanceSheets""\n     ],\n     ""lang"": {\n      ""en-us"": {\n       ""role"": {\n        ""terseLabel"": ""Preferred stock; $0.001 par value; 100 shares authorized; no shares issued and outstanding"",\n        ""label"": ""Preferred Stock, Value, Issued"",\n        ""documentation"": ""Aggregate par or stated value of issued nonredeemable preferred stock (or preferred stock redeemable solely at the option of the issuer). This item includes treasury stock repurchased by the entity. Note: elements for number of nonredeemable preferred shares, par value and other disclosure concepts are in another section within stockholders\' equity.""\n       }\n      }\n     },\n     ""auth_ref"": [\n      ""r77"",\n      ""r500"",\n      ""r507"",', '""label"": ""Common Stock, Par or Stated Value Per Share"",\n        ""documentation"": ""Face amount or stated value per share of common stock.""\n       }\n      }\n     },\n     ""auth_ref"": [\n      ""r78""\n     ]\n    },\n    ""us-gaap_CommonStockSharesAuthorized"": {\n     ""xbrltype"": ""sharesItemType"",\n     ""nsuri"": ""http://fasb.org/us-gaap/2025"",\n     ""localname"": ""CommonStockSharesAuthorized"",\n     ""presentation"": [\n      ""http://www.tesla.com/role/ConsolidatedBalanceSheetsParenthetical""\n     ],\n     ""lang"": {\n      ""en-us"": {\n       ""role"": {\n        ""terseLabel"": ""Common stock, shares authorized (in shares)"",\n        ""label"": ""Common Stock, Shares Authorized"",\n        ""documentation"": ""The maximum number of common shares permitted to be issued by an entity\'s charter and bylaws.""\n       }\n      }\n     },\n     ""auth_ref"": [\n      ""r78"",\n      ""r1028""\n     ]\n    },\n    ""us-gaap_CommonStockSharesIssued"": {\n     ""xbrltype"": ""sharesItemType"",\n     ""nsuri"": ""http://fasb.org/us-gaap/2025"",\n     ""localname"": ""CommonStockSharesIssued"",\n     ""presentation"": [\n      ""http://www.tesla.com/role/ConsolidatedBalanceSheetsParenthetical""\n     ],\n     ""lang"": {\n      ""en-us"": {\n       ""role"": {\n        ""terseLabel"": ""Common stock, shares issued (in shares)"",\n        ""label"": ""Common Stock, Shares, Issued"",\n        ""documentation"": ""Total number of common shares of an entity that have been sold or granted to shareholders (includes common shares that were issued, repurchased and remain in the treasury). These shares represent capital invested by the firm\'s shareholders and owners, and may be all or only a portion of the number of shares authorized. Shares issued include shares outstanding and shares held in the treasury.""\n       }\n      }\n     },\n     ""auth_ref"": [\n      ""r78""\n     ]\n    },\n    ""us-gaap_CommonStockSharesOutstanding"": {\n     ""xbrltype"": ""sharesItemType"",\n     ""nsuri"": ""http://fasb.org/us-gaap/2025"",\n     ""localname"": ""CommonStockSharesOutstanding"",\n     ""presentation"": [', '""label"": ""Common Stock, Par or Stated Value Per Share"",\n        ""documentation"": ""Face amount or stated value per share of common stock.""\n       }\n      }\n     },\n     ""auth_ref"": [\n      ""r78""\n     ]\n    },\n    ""us-gaap_CommonStockSharesAuthorized"": {\n     ""xbrltype"": ""sharesItemType"",\n     ""nsuri"": ""http://fasb.org/us-gaap/2025"",\n     ""localname"": ""CommonStockSharesAuthorized"",\n     ""presentation"": [\n      ""http://www.tesla.com/role/ConsolidatedBalanceSheetsParenthetical""\n     ],\n     ""lang"": {\n      ""en-us"": {\n       ""role"": {\n        ""terseLabel"": ""Common stock, shares authorized (in shares)"",\n        ""label"": ""Common Stock, Shares Authorized"",\n        ""documentation"": ""The maximum number of common shares permitted to be issued by an entity\'s charter and bylaws.""\n       }\n      }\n     },\n     ""auth_ref"": [\n      ""r78"",\n      ""r1028""\n     ]\n    },\n    ""us-gaap_CommonStockSharesIssued"": {\n     ""xbrltype"": ""sharesItemType"",\n     ""nsuri"": ""http://fasb.org/us-gaap/2025"",\n     ""localname"": ""CommonStockSharesIssued"",\n     ""presentation"": [\n      ""http://www.tesla.com/role/ConsolidatedBalanceSheetsParenthetical""\n     ],\n     ""lang"": {\n      ""en-us"": {\n       ""role"": {\n        ""terseLabel"": ""Common stock, shares issued (in shares)"",\n        ""label"": ""Common Stock, Shares, Issued"",\n        ""documentation"": ""Total number of common shares of an entity that have been sold or granted to shareholders (includes common shares that were issued, repurchased and remain in the treasury). These shares represent capital invested by the firm\'s shareholders and owners, and may be all or only a portion of the number of shares authorized. Shares issued include shares outstanding and shares held in the treasury.""\n       }\n      }\n     },\n     ""auth_ref"": [\n      ""r78""\n     ]\n    },\n    ""us-gaap_CommonStockSharesOutstanding"": {\n     ""xbrltype"": ""sharesItemType"",\n     ""nsuri"": ""http://fasb.org/us-gaap/2025"",\n     ""localname"": ""CommonStockSharesOutstanding"",\n     ""presentation"": [', '""nsuri"": ""http://www.tesla.com/20251231"",\n     ""localname"": ""ShareBasedCompensationArrangementByShareBasedPaymentAwardOffsetAmountPerShare"",\n     ""presentation"": [\n      ""http://www.tesla.com/role/EquityIncentivePlansAdditionalInformationDetails""\n     ],\n     ""lang"": {\n      ""en-us"": {\n       ""role"": {\n        ""terseLabel"": ""Vesting price (in dollars per share)"",\n        ""label"": ""Share-Based Compensation Arrangement by Share-Based Payment Award, Offset Amount Per Share"",\n        ""documentation"": ""Share-Based Compensation Arrangement by Share-Based Payment Award, Offset Amount Per Share""\n       }\n      }\n     },\n     ""auth_ref"": []\n    },\n    ""us-gaap_ShareBasedCompensationArrangementByShareBasedPaymentAwardOptionsAdditionalDisclosuresAbstract"": {\n     ""xbrltype"": ""stringItemType"",\n     ""nsuri"": ""http://fasb.org/us-gaap/2025"",\n     ""localname"": ""ShareBasedCompensationArrangementByShareBasedPaymentAwardOptionsAdditionalDisclosuresAbstract"",\n     ""presentation"": [\n      ""http://www.tesla.com/role/EquityIncentivePlansSummaryofStockOptionRSUandRestrictedStockActivityDetails""\n     ],\n     ""lang"": {\n      ""en-us"": {\n       ""role"": {\n        ""terseLabel"": ""Share-Based Compensation Arrangement by Share-Based Payment Award, Options, Additional Disclosures [Abstract]"",\n        ""label"": ""Share-Based Compensation Arrangement by Share-Based Payment Award, Options, Additional Disclosures [Abstract]""\n       }\n      }\n     },\n     ""auth_ref"": []\n    },\n    ""tsla_ShareBasedCompensationArrangementByShareBasedPaymentAwardOptionsExercisedOrReleasedInPeriod"": {\n     ""xbrltype"": ""sharesItemType"",\n     ""nsuri"": ""http://www.tesla.com/20251231"",\n     ""localname"": ""ShareBasedCompensationArrangementByShareBasedPaymentAwardOptionsExercisedOrReleasedInPeriod"",\n     ""presentation"": [\n      ""http://www.tesla.com/role/EquityIncentivePlansSummaryofStockOptionRSUandRestrictedStockActivityDetails""\n     ],\n     ""lang"": {\n      ""en-us"": {\n       ""role"": {', '""nsuri"": ""http://www.tesla.com/20251231"",\n     ""localname"": ""ShareBasedCompensationArrangementByShareBasedPaymentAwardOffsetAmountPerShare"",\n     ""presentation"": [\n      ""http://www.tesla.com/role/EquityIncentivePlansAdditionalInformationDetails""\n     ],\n     ""lang"": {\n      ""en-us"": {\n       ""role"": {\n        ""terseLabel"": ""Vesting price (in dollars per share)"",\n        ""label"": ""Share-Based Compensation Arrangement by Share-Based Payment Award, Offset Amount Per Share"",\n        ""documentation"": ""Share-Based Compensation Arrangement by Share-Based Payment Award, Offset Amount Per Share""\n       }\n      }\n     },\n     ""auth_ref"": []\n    },\n    ""us-gaap_ShareBasedCompensationArrangementByShareBasedPaymentAwardOptionsAdditionalDisclosuresAbstract"": {\n     ""xbrltype"": ""stringItemType"",\n     ""nsuri"": ""http://fasb.org/us-gaap/2025"",\n     ""localname"": ""ShareBasedCompensationArrangementByShareBasedPaymentAwardOptionsAdditionalDisclosuresAbstract"",\n     ""presentation"": [\n      ""http://www.tesla.com/role/EquityIncentivePlansSummaryofStockOptionRSUandRestrictedStockActivityDetails""\n     ],\n     ""lang"": {\n      ""en-us"": {\n       ""role"": {\n        ""terseLabel"": ""Share-Based Compensation Arrangement by Share-Based Payment Award, Options, Additional Disclosures [Abstract]"",\n        ""label"": ""Share-Based Compensation Arrangement by Share-Based Payment Award, Options, Additional Disclosures [Abstract]""\n       }\n      }\n     },\n     ""auth_ref"": []\n    },\n    ""tsla_ShareBasedCompensationArrangementByShareBasedPaymentAwardOptionsExercisedOrReleasedInPeriod"": {\n     ""xbrltype"": ""sharesItemType"",\n     ""nsuri"": ""http://www.tesla.com/20251231"",\n     ""localname"": ""ShareBasedCompensationArrangementByShareBasedPaymentAwardOptionsExercisedOrReleasedInPeriod"",\n     ""presentation"": [\n      ""http://www.tesla.com/role/EquityIncentivePlansSummaryofStockOptionRSUandRestrictedStockActivityDetails""\n     ],\n     ""lang"": {\n      ""en-us"": {\n       ""role"": {', ""[WEB ARAMASI KAYNAĞI]: Yerel veri tabanında bulunamayan bilgi için internet ve finansal API'ler üzerinden şu güncel veriler elde edilmiştir:\nThe par values of common stock for Apple and Tesla are as follows:\n\n- **Apple Inc.**: The par value of Apple’s common stock is **$0.00001** per share. [Source](https://contracts.justia.com/companies/apple-111/contract/84984)\n\n- **Tesla Inc.**: The par value of Tesla’s common stock is **$0.001** per share. [Source](https://ir.tesla.com/_flysystem/s3/sec/000119312520236699/d931870d424b5.html)\n\nIn summary, Apple's common stock has a par value of $0.00001, while Tesla's common stock has a par value of $0.001.""]","Apple's common stock has a par value of $0.00001 per share, while Tesla's common stock has a par value of $0.001 per share.","Apple's par value is $0.00001, while Tesla's par value is $0.001.",0.0909090909,1.0,0.5,0.8744586778162167
Compare the par value of common stock for Intel and AMD.,"['""r1152""\n     ]\n    },\n    ""us-gaap_CommonStockSharesIssued"": {\n     ""xbrltype"": ""sharesItemType"",\n     ""nsuri"": ""http://fasb.org/us-gaap/2025"",\n     ""localname"": ""CommonStockSharesIssued"",\n     ""presentation"": [\n      ""http://www.amd.com/role/CommonStockandStockBasedIncentiveCompensationPlansCommonStockActivitiesDetails"",\n      ""http://www.amd.com/role/ConsolidatedBalanceSheetsParenthetical""\n     ],\n     ""lang"": {\n      ""en-us"": {\n       ""role"": {\n        ""terseLabel"": ""Common stock, shares issued (shares)"",\n        ""periodStartLabel"": ""Balance, beginning of period (in shares)"",\n        ""periodEndLabel"": ""Balance, end of period (in shares)"",\n        ""label"": ""Common Stock, Shares, Issued"",\n        ""documentation"": ""Total number of common shares of an entity that have been sold or granted to shareholders (includes common shares that were issued, repurchased and remain in the treasury). These shares represent capital invested by the firm\'s shareholders and owners, and may be all or only a portion of the number of shares authorized. Shares issued include shares outstanding and shares held in the treasury.""\n       }\n      }\n     },\n     ""auth_ref"": [\n      ""r80""\n     ]\n    },\n    ""us-gaap_CommonStockSharesOutstanding"": {\n     ""xbrltype"": ""sharesItemType"",\n     ""nsuri"": ""http://fasb.org/us-gaap/2025"",\n     ""localname"": ""CommonStockSharesOutstanding"",\n     ""presentation"": [\n      ""http://www.amd.com/role/ConsolidatedBalanceSheetsParenthetical""\n     ],\n     ""lang"": {\n      ""en-us"": {\n       ""role"": {\n        ""verboseLabel"": ""Common stock, shares outstanding (shares)"",\n        ""label"": ""Common Stock, Shares, Outstanding"",\n        ""documentation"": ""Number of shares of common stock outstanding. Common stock represent the ownership interest in a corporation.""\n       }\n      }\n     },\n     ""auth_ref"": [\n      ""r11"",\n      ""r80"",\n      ""r1152"",\n      ""r1170"",\n      ""r1958"",\n      ""r1959""\n     ]\n    },\n    ""us-gaap_CommonStockValue"": {\n     ""xbrltype"": ""monetaryItemType"",', '""calculation"": {\n      ""http://www.intel.com/role/ConsolidatedBalanceSheets"": {\n       ""parentTag"": ""us-gaap_StockholdersEquity"",\n       ""weight"": 1.0,\n       ""order"": 2.0\n      }\n     },\n     ""presentation"": [\n      ""http://www.intel.com/role/ConsolidatedBalanceSheets""\n     ],\n     ""lang"": {\n      ""en-us"": {\n       ""role"": {\n        ""terseLabel"": ""Common stock, $0.001 par value, 10,000 shares authorized; 4,994 shares issued and outstanding (4,330 issued and outstanding in 2024) and capital in excess of par value"",\n        ""label"": ""Common Stocks, Including Additional Paid in Capital"",\n        ""documentation"": ""Amount of par value plus amounts in excess of par value or issuance value for common stock issued.""\n       }\n      }\n     },\n     ""auth_ref"": [\n      ""r105"",\n      ""r106"",\n      ""r157""\n     ]\n    },\n    ""ecd_CompActuallyPaidVsCoSelectedMeasureTextBlock"": {\n     ""xbrltype"": ""textBlockItemType"",\n     ""nsuri"": ""http://xbrl.sec.gov/ecd/2025"",\n     ""localname"": ""CompActuallyPaidVsCoSelectedMeasureTextBlock"",\n     ""presentation"": [\n      ""http://xbrl.sec.gov/ecd/role/PvpDisclosure""\n     ],\n     ""lang"": {\n      ""en-us"": {\n       ""role"": {\n        ""terseLabel"": ""Compensation Actually Paid vs. Company Selected Measure"",\n        ""label"": ""Compensation Actually Paid vs. Company Selected Measure [Text Block]""\n       }\n      }\n     },\n     ""auth_ref"": [\n      ""r1617""\n     ]\n    },\n    ""ecd_CompActuallyPaidVsNetIncomeTextBlock"": {\n     ""xbrltype"": ""textBlockItemType"",\n     ""nsuri"": ""http://xbrl.sec.gov/ecd/2025"",\n     ""localname"": ""CompActuallyPaidVsNetIncomeTextBlock"",\n     ""presentation"": [\n      ""http://xbrl.sec.gov/ecd/role/PvpDisclosure""\n     ],\n     ""lang"": {\n      ""en-us"": {\n       ""role"": {\n        ""terseLabel"": ""Compensation Actually Paid vs. Net Income"",\n        ""label"": ""Compensation Actually Paid vs. Net Income [Text Block]""\n       }\n      }\n     },\n     ""auth_ref"": [\n      ""r1616""\n     ]\n    },\n    ""ecd_CompActuallyPaidVsOtherMeasureTextBlock"": {', 'style=""background-color:#ffffff;border-bottom:3pt double #000;border-top:1pt solid #000;padding:2px 0;text-align:right;vertical-align:bottom""><span style=""color:#000000;font-family:\'Arial\',sans-serif;font-size:10pt;font-weight:400;line-height:100%"">4,409&#160;</span></td><td style=""background-color:#ffffff;border-bottom:3pt double #000;border-top:1pt solid #000;padding:2px 1pt 2px 0;text-align:right;vertical-align:bottom""></td></tr></table></div><div style=""margin-top:9pt;text-align:justify""><span style=""color:#000000;font-family:\'Arial\',sans-serif;font-size:9pt;font-weight:400;line-height:120%"">(1) Represented the fair value based on the closing price of AMD common stock on March 28, 2025 of $103.22 per share, as the transaction closed prior to the opening of markets on March 31, 2025.</span></div><div style=""margin-top:9pt;text-align:justify""><span style=""color:#000000;font-family:\'Arial\',sans-serif;font-size:9pt;font-weight:400;line-height:120%"">(2) Represented the estimated fair value of additional consideration of up to 740,961 shares of AMD common stock to be issued and up to $300 million of cash to be paid to former ZT Systems stockholders and warrant holders when the contingencies are fully met.</span></div><div style=""margin-top:14pt""><span style=""color:#000000;font-family:\'Arial\',sans-serif;font-size:10pt;font-weight:400;line-height:120%"">The purchase consideration was preliminarily allocated as follows (in millions): </span><table style=""border-collapse:collapse;display:inline-table;margin-bottom:5pt;vertical-align:text-bottom;width:100.000%""><tr><td style=""width:1.0%""></td><td style=""width:39.250%""></td><td style=""width:0.1%""></td><td style=""width:1.0%""></td><td style=""width:36.473%""></td><td style=""width:0.1%""></td><td style=""width:0.1%""></td><td style=""width:1.992%""></td><td style=""width:0.1%""></td><td style=""width:1.0%""></td><td style=""width:18.785%""></td><td style=""width:0.1%""></td></tr><tr><td colspan=""3"" style=""background-color:#cceeff;padding:2px', '""nsuri"": ""http://fasb.org/us-gaap/2025"",\n     ""localname"": ""ShareBasedCompensationArrangementByShareBasedPaymentAwardFairValueAssumptionsExpectedDividendRate"",\n     ""presentation"": [\n      ""http://www.amd.com/role/CommonStockandStockBasedIncentiveCompensationPlansStockOptionValuationAssumptionsDetails"",\n      ""http://www.amd.com/role/CommonStockandStockBasedIncentiveCompensationPlansWeightedAverageValuationAssumptionsforESPPDetails"",\n      ""http://www.amd.com/role/CommonStockandStockBasedIncentiveCompensationPlansWeightedAverageValuationAssumptionsforPRSUsDetails""\n     ],\n     ""lang"": {\n      ""en-us"": {\n       ""role"": {\n        ""terseLabel"": ""Expected dividends"",\n        ""netLabel"": ""Expected dividends"",\n        ""label"": ""Share-Based Compensation Arrangement by Share-Based Payment Award, Fair Value Assumptions, Expected Dividend Rate"",\n        ""documentation"": ""The estimated dividend rate (a percentage of the share price) to be paid (expected dividends) to holders of the underlying shares over the option\'s term.""\n       }\n      }\n     },\n     ""auth_ref"": [\n      ""r642""\n     ]\n    },\n    ""us-gaap_ShareBasedCompensationArrangementByShareBasedPaymentAwardFairValueAssumptionsRiskFreeInterestRate"": {\n     ""xbrltype"": ""percentItemType"",\n     ""nsuri"": ""http://fasb.org/us-gaap/2025"",\n     ""localname"": ""ShareBasedCompensationArrangementByShareBasedPaymentAwardFairValueAssumptionsRiskFreeInterestRate"",\n     ""presentation"": [\n      ""http://www.amd.com/role/CommonStockandStockBasedIncentiveCompensationPlansStockOptionValuationAssumptionsDetails"",\n      ""http://www.amd.com/role/CommonStockandStockBasedIncentiveCompensationPlansWeightedAverageValuationAssumptionsforESPPDetails"",\n      ""http://www.amd.com/role/CommonStockandStockBasedIncentiveCompensationPlansWeightedAverageValuationAssumptionsforPRSUsDetails""\n     ],\n     ""lang"": {\n      ""en-us"": {\n       ""role"": {\n        ""terseLabel"": ""Risk-free interest rate"",', '""http://www.amd.com/role/ConsolidatedStatementsofStockholdersEquity""\n     ],\n     ""lang"": {\n      ""en-us"": {\n       ""role"": {\n        ""terseLabel"": ""Common stock"",\n        ""label"": ""Common Stock [Member]"",\n        ""documentation"": ""Stock that is subordinate to all other stock of the issuer.""\n       }\n      }\n     },\n     ""auth_ref"": [\n      ""r1469"",\n      ""r1470"",\n      ""r1471"",\n      ""r1473"",\n      ""r1474"",\n      ""r1475"",\n      ""r1476"",\n      ""r1702"",\n      ""r1703"",\n      ""r1705"",\n      ""r1870"",\n      ""r1949"",\n      ""r1958""\n     ]\n    },\n    ""us-gaap_CommonStockParOrStatedValuePerShare"": {\n     ""xbrltype"": ""perShareItemType"",\n     ""nsuri"": ""http://fasb.org/us-gaap/2025"",\n     ""localname"": ""CommonStockParOrStatedValuePerShare"",\n     ""presentation"": [\n      ""http://www.amd.com/role/ConsolidatedBalanceSheetsParenthetical""\n     ],\n     ""lang"": {\n      ""en-us"": {\n       ""role"": {\n        ""terseLabel"": ""Common stock, par value (USD per share)"",\n        ""label"": ""Common Stock, Par or Stated Value Per Share"",\n        ""documentation"": ""Face amount or stated value per share of common stock.""\n       }\n      }\n     },\n     ""auth_ref"": [\n      ""r80""\n     ]\n    },\n    ""us-gaap_CommonStockSharesAuthorized"": {\n     ""xbrltype"": ""sharesItemType"",\n     ""nsuri"": ""http://fasb.org/us-gaap/2025"",\n     ""localname"": ""CommonStockSharesAuthorized"",\n     ""presentation"": [\n      ""http://www.amd.com/role/ConsolidatedBalanceSheetsParenthetical""\n     ],\n     ""lang"": {\n      ""en-us"": {\n       ""role"": {\n        ""terseLabel"": ""Common stock, shares authorized (shares)"",\n        ""label"": ""Common Stock, Shares Authorized"",\n        ""documentation"": ""The maximum number of common shares permitted to be issued by an entity\'s charter and bylaws.""\n       }\n      }\n     },\n     ""auth_ref"": [\n      ""r80"",\n      ""r1152""\n     ]\n    },\n    ""us-gaap_CommonStockSharesIssued"": {\n     ""xbrltype"": ""sharesItemType"",\n     ""nsuri"": ""http://fasb.org/us-gaap/2025"",\n     ""localname"": ""CommonStockSharesIssued"",', '""presentation"": [\n      ""http://www.amd.com/role/ConsolidatedStatementsofStockholdersEquity""\n     ],\n     ""lang"": {\n      ""en-us"": {\n       ""role"": {\n        ""terseLabel"": ""pre-combination unvested restricted stock units assumed"",\n        ""label"": ""pre-combination unvested restricted stock units assumed [Member]"",\n        ""documentation"": ""pre-combination unvested restricted stock units assumed""\n       }\n      }\n     },\n     ""auth_ref"": []\n    },\n    ""us-gaap_PrepaidExpenseAndOtherAssetsCurrent"": {\n     ""xbrltype"": ""monetaryItemType"",\n     ""nsuri"": ""http://fasb.org/us-gaap/2025"",\n     ""localname"": ""PrepaidExpenseAndOtherAssetsCurrent"",\n     ""crdr"": ""debit"",\n     ""calculation"": {\n      ""http://www.amd.com/role/ConsolidatedBalanceSheets"": {\n       ""parentTag"": ""us-gaap_AssetsCurrent"",\n       ""weight"": 1.0,\n       ""order"": 5.0\n      },\n      ""http://www.amd.com/role/SupplementalBalanceSheetInformationDeferredCostsCapitalizedPrepaidandOtherAssetsDisclosureDetails"": {\n       ""parentTag"": null,\n       ""weight"": null,\n       ""order"": null,\n       ""root"": true\n      }\n     },\n     ""presentation"": [\n      ""http://www.amd.com/role/ConsolidatedBalanceSheets"",\n      ""http://www.amd.com/role/SupplementalBalanceSheetInformationDeferredCostsCapitalizedPrepaidandOtherAssetsDisclosureDetails""\n     ],\n     ""lang"": {\n      ""en-us"": {\n       ""role"": {\n        ""terseLabel"": ""Prepaid expenses and other current assets"",\n        ""totalLabel"": ""Prepaid expenses and other current assets"",\n        ""label"": ""Prepaid Expense and Other Assets, Current"",\n        ""documentation"": ""Amount of asset related to consideration paid in advance for costs that provide economic benefits in future periods, and amount of other assets that are expected to be realized or consumed within one year or the normal operating cycle, if longer.""\n       }\n      }\n     },\n     ""auth_ref"": [\n      ""r1628""\n     ]\n    },\n    ""us-gaap_PrepaidExpensesAndOtherCurrentAssetsMember"": {\n     ""xbrltype"": ""domainItemType"",', '""calculation"": {\n      ""http://www.intel.com/role/InvestmentsMarketableDebtInvestmentsContractualMaturityDetails"": {\n       ""parentTag"": ""us-gaap_AvailableForSaleSecuritiesDebtSecurities"",\n       ""weight"": 1.0,\n       ""order"": 4.0\n      }\n     },\n     ""presentation"": [\n      ""http://www.intel.com/role/InvestmentsMarketableDebtInvestmentsContractualMaturityDetails""\n     ],\n     ""lang"": {\n      ""en-us"": {\n       ""role"": {\n        ""terseLabel"": ""Instruments not due at a single maturity date"",\n        ""label"": ""Debt Securities, Available-for-Sale, Maturity, without Single Maturity Date, Fair Value"",\n        ""documentation"": ""Fair value of investment in debt security measured at fair value with change in fair value recognized in other comprehensive income (available-for-sale), without single maturity date and not allocated over maturity grouping.""\n       }\n      }\n     },\n     ""auth_ref"": [\n      ""r388"",\n      ""r1163"",\n      ""r1795""\n     ]\n    },\n    ""us-gaap_AvailableForSaleSecuritiesDebtSecurities"": {\n     ""xbrltype"": ""monetaryItemType"",\n     ""nsuri"": ""http://fasb.org/us-gaap/2025"",\n     ""localname"": ""AvailableForSaleSecuritiesDebtSecurities"",\n     ""crdr"": ""debit"",\n     ""calculation"": {\n      ""http://www.intel.com/role/InvestmentsMarketableDebtInvestmentsContractualMaturityDetails"": {\n       ""parentTag"": null,\n       ""weight"": null,\n       ""order"": null,\n       ""root"": true\n      }\n     },\n     ""presentation"": [\n      ""http://www.intel.com/role/InvestmentsMarketableDebtInvestmentsContractualMaturityDetails""\n     ],\n     ""lang"": {\n      ""en-us"": {\n       ""role"": {\n        ""totalLabel"": ""Debt Securities, Available-for-Sale, Total"",\n        ""label"": ""Debt Securities, Available-for-Sale"",\n        ""documentation"": ""Amount of investment in debt security measured at fair value with change in fair value recognized in other comprehensive income (available-for-sale).""\n       }\n      }\n     },\n     ""auth_ref"": [\n      ""r383"",\n      ""r432"",\n      ""r996"",\n      ""r1022"",', '""http://www.amd.com/role/FinancialInstrumentsNarrativeDetails"",\n      ""http://www.amd.com/role/FinancialInstrumentsTables""\n     ],\n     ""lang"": {\n      ""en-us"": {\n       ""role"": {\n        ""terseLabel"": ""Level 1"",\n        ""label"": ""Fair Value, Inputs, Level 1 [Member]"",\n        ""documentation"": ""Quoted prices in active markets for identical assets or liabilities that the reporting entity can access at the measurement date.""\n       }\n      }\n     },\n     ""auth_ref"": [\n      ""r538"",\n      ""r591"",\n      ""r596"",\n      ""r604"",\n      ""r869"",\n      ""r880"",\n      ""r889"",\n      ""r951"",\n      ""r1297"",\n      ""r1357"",\n      ""r1358"",\n      ""r1359"",\n      ""r1360"",\n      ""r1361"",\n      ""r1428"",\n      ""r1439""\n     ]\n    },\n    ""us-gaap_FairValueInputsLevel2Member"": {\n     ""xbrltype"": ""domainItemType"",\n     ""nsuri"": ""http://fasb.org/us-gaap/2025"",\n     ""localname"": ""FairValueInputsLevel2Member"",\n     ""presentation"": [\n      ""http://www.amd.com/role/FinancialInstrumentsCashCashEquivalentsandMarketableSecuritiesFairValueMeasurementsDetails"",\n      ""http://www.amd.com/role/FinancialInstrumentsFinancialInstrumentsNotRecordedatFairvalueDetails"",\n      ""http://www.amd.com/role/FinancialInstrumentsNarrativeDetails"",\n      ""http://www.amd.com/role/FinancialInstrumentsScheduleofCarryingAmountsandEstimatedFairValuesofFinancialInstrumentsnotRecordedatFairValueDetails"",\n      ""http://www.amd.com/role/FinancialInstrumentsTables""\n     ],\n     ""lang"": {\n      ""en-us"": {\n       ""role"": {\n        ""terseLabel"": ""Level 2"",\n        ""verboseLabel"": ""Level 2"",\n        ""label"": ""Fair Value, Inputs, Level 2 [Member]"",\n        ""documentation"": ""Inputs other than quoted prices included within level 1 that are observable for an asset or liability, either directly or indirectly, including, but not limited to, quoted prices for similar assets or liabilities in active markets, or quoted prices for identical or similar assets or liabilities in inactive markets.""\n       }\n      }\n     },\n     ""auth_ref"": [', '""us-gaap_CashAndCashEquivalentsMember"": {\n     ""xbrltype"": ""domainItemType"",\n     ""nsuri"": ""http://fasb.org/us-gaap/2025"",\n     ""localname"": ""CashAndCashEquivalentsMember"",\n     ""presentation"": [\n      ""http://www.amd.com/role/FinancialInstrumentsCashCashEquivalentsandMarketableSecuritiesFairValueMeasurementsDetails"",\n      ""http://www.amd.com/role/FinancialInstrumentsNarrativeDetails"",\n      ""http://www.amd.com/role/FinancialInstrumentsTables""\n     ],\n     ""lang"": {\n      ""en-us"": {\n       ""role"": {\n        ""terseLabel"": ""Cash and Cash Equivalents"",\n        ""label"": ""Cash and Cash Equivalents [Member]"",\n        ""documentation"": ""Currency on hand as well as demand deposits with banks or financial institutions. Includes other kinds of accounts that have the general characteristics of demand deposits. Also includes short-term, highly liquid investments that are both readily convertible to known amounts of cash and so near their maturity that they present insignificant risk of changes in value because of changes in interest rates.""\n       }\n      }\n     },\n     ""auth_ref"": []\n    },\n    ""us-gaap_CashAndCashEquivalentsUnrestrictedCashAndCashEquivalentsPolicy"": {\n     ""xbrltype"": ""textBlockItemType"",\n     ""nsuri"": ""http://fasb.org/us-gaap/2025"",\n     ""localname"": ""CashAndCashEquivalentsUnrestrictedCashAndCashEquivalentsPolicy"",\n     ""presentation"": [\n      ""http://www.amd.com/role/SummaryofSignificantAccountingPoliciesPolicies""\n     ],\n     ""lang"": {\n      ""en-us"": {\n       ""role"": {\n        ""terseLabel"": ""Cash and Cash Equivalents, Unrestricted Cash and Cash Equivalents, Policy"",\n        ""label"": ""Cash and Cash Equivalents, Unrestricted Cash and Cash Equivalents, Policy [Policy Text Block]"",\n        ""documentation"": ""Disclosure of accounting policy for cash and cash equivalents with respect to unrestricted balances.""\n       }\n      }\n     },\n     ""auth_ref"": [\n      ""r27""\n     ]\n    },\n    ""us-gaap_CashCashEquivalentsRestrictedCashAndRestrictedCashEquivalents"": {', 'style=""color:#000000;font-family:\'Intel Clear\',sans-serif;font-size:10pt;font-weight:400;line-height:120%"">2.</font><font style=""color:#000000;font-family:\'Intel Clear\',sans-serif;font-size:10pt;font-weight:400;line-height:120%;padding-left:27.89pt"">Recommend the purchase or sale of any Intel (or that company&#8217;s) Securities. </font></div><div style=""margin-bottom:6pt;padding-left:54pt;text-indent:-36pt""><font style=""color:#000000;font-family:\'Intel Clear\',sans-serif;font-size:10pt;font-weight:400;line-height:120%"">3.</font><font style=""color:#000000;font-family:\'Intel Clear\',sans-serif;font-size:10pt;font-weight:400;line-height:120%;padding-left:27.89pt"">Disclose material non-public information to people within Intel whose jobs do not require them to have that information, or to persons outside Intel, such as family, friends, business associates, investors, and expert consulting firms, unless disclosure is made in accordance with Intel&#8217;s policies regarding the protection or authorized external disclosure of Intel information. Disclosing material non-public information to others who may trade on it is often referred to as &#8220;</font><font style=""color:#000000;font-family:\'Intel Clear\',sans-serif;font-size:10pt;font-style:italic;font-weight:700;line-height:120%"">tipping</font><font style=""color:#000000;font-family:\'Intel Clear\',sans-serif;font-size:10pt;font-weight:400;line-height:120%"">,&#8221; and it is prohibited by the Policy.</font></div><div style=""padding-left:54pt;text-indent:-36pt""><font style=""color:#000000;font-family:\'Intel Clear\',sans-serif;font-size:10pt;font-weight:400;line-height:120%"">4.</font><font style=""color:#000000;font-family:\'Intel Clear\',sans-serif;font-size:10pt;font-weight:400;line-height:120%;padding-left:27.89pt"">Assist anyone engaged in the above activities.</font></div><div><font><br></font></div><div><font style=""color:#000000;font-family:\'Intel Clear\',sans-serif;font-size:10pt;font-weight:400;line-height:120%"">A', ""[WEB ARAMASI KAYNAĞI]: Yerel veri tabanında bulunamayan bilgi için internet ve finansal API'ler üzerinden şu güncel veriler elde edilmiştir:\nThe par values of common stock for Intel and AMD are as follows:\n\n- **Intel Corporation (INTC)**: The par value of Intel's common stock is **$0.001** per share. This information can be found in various financial reports and stock data sources.\n\n- **Advanced Micro Devices (AMD)**: The par value of AMD's common stock is **$0.01** per share. This is documented in their official filings and financial statements.\n\nIn summary:\n- Intel: **$0.001** per share\n- AMD: **$0.01** per share""]","The par value of common stock for Intel is $0.001 per share, while for AMD it is $0.01 per share.","Intel's par value is $0.001, while AMD's par value is $0.01.",0.0909090909,1.0,1.0,0.8674904973770814
"Which company has a smaller par value, Meta or Amazon?","['annual and monthly fees associated with Amazon Prime memberships, as well as digital video, audiobook, digital music, e-book, and other non-AWS subscription services.&lt;/span&gt;&lt;/div&gt;&lt;span style=""color:#000000;font-family:\'Times New Roman\',serif;font-size:10pt;font-weight:400;line-height:120%""&gt;(6)&lt;/span&gt;Includes sales related to various other offerings (such as shipping services, healthcare services, and certain licensing and distribution of video content) and our co-branded credit card agreements.</us-gaap:DisaggregationOfRevenueTableTextBlock>', 'services&lt;/span&gt;&lt;span style=""color:#000000;font-family:\'Times New Roman\',serif;font-size:10pt;font-weight:400;line-height:120%""&gt; - Our subscription sales include fees associated with Amazon Prime memberships and access to content including digital video, audiobooks, digital music, e-books, and other non-AWS subscription services. Prime memberships provide our customers with access to an evolving suite of benefits that represent a single stand-ready obligation. Subscriptions are paid for at the time of or in advance of delivering the services. Revenue from such arrangements is recognized over the subscription period.&lt;/span&gt;&lt;/div&gt;&lt;div style=""margin-top:5pt;text-indent:24.75pt""&gt;&lt;span style=""color:#000000;font-family:\'Times New Roman\',serif;font-size:10pt;font-style:italic;font-weight:400;line-height:120%""&gt;AWS&lt;/span&gt;&lt;span style=""color:#000000;font-family:\'Times New Roman\',serif;font-size:10pt;font-weight:400;line-height:120%""&gt; - Our AWS arrangements include global sales of compute, storage, database, and other services. Revenue is allocated to services using stand-alone selling prices and is primarily recognized when the customer uses these services, based on the quantity of services rendered, such as compute or storage capacity delivered on-demand. Certain services, including compute and database, are also offered as a fixed quantity over a specified term, for which revenue is recognized ratably. Sales commissions we pay in connection with contracts that exceed one year are capitalized and amortized over the contract term.&lt;/span&gt;&lt;/div&gt;&lt;div style=""margin-top:5pt;text-indent:24.75pt""&gt;&lt;span style=""color:#000000;font-family:\'Times New Roman\',serif;font-size:10pt;font-style:italic;font-weight:400;line-height:120%""&gt;Other&lt;/span&gt;&lt;span style=""color:#000000;font-family:\'Times New Roman\',serif;font-size:10pt;font-weight:400;line-height:120%""&gt; - Other revenue includes sales related to various other', 'or liquidations, and expected recoverable values of each disposition category. The inventory valuation allowance, representing a write-down of inventory, was $3.0 billion and $3.3 billion as of December&#160;31, 2024 and 2025.&lt;/span&gt;&lt;/div&gt;&lt;div style=""margin-top:5pt;text-indent:24.75pt""&gt;&lt;span style=""color:#000000;font-family:\'Times New Roman\',serif;font-size:10pt;font-weight:400;line-height:120%""&gt;We provide Fulfillment by Amazon services in connection with certain of our sellers&#x2019; programs. Third-party sellers maintain ownership of their inventory, regardless of whether fulfillment is provided by us or the third-party sellers, and therefore these products are not included in our inventories.&lt;/span&gt;&lt;/div&gt;&lt;div style=""margin-top:5pt;text-indent:24.75pt""&gt;&lt;span style=""color:#000000;font-family:\'Times New Roman\',serif;font-size:10pt;font-weight:400;line-height:120%""&gt;We also purchase electronic device components from a variety of suppliers and use several contract manufacturers to provide manufacturing services for our products. During the normal course of business, in order to manage manufacturing lead times and help ensure adequate supply, we enter into agreements with contract manufacturers and suppliers for certain electronic device components. We have certain non-cancellable purchase commitments arising from these agreements. These commitments are based on forecasted customer demand. If we reduce these commitments, we may incur additional costs.&lt;/span&gt;&lt;/div&gt;&lt;div style=""margin-top:14pt;text-indent:11.25pt""&gt;&lt;span style=""color:#000000;font-family:\'Times New Roman\',serif;font-size:10pt;font-style:italic;font-weight:700;line-height:120%""&gt;Accounts Receivable, Net and Other&lt;/span&gt;&lt;/div&gt;&lt;div style=""margin-top:5pt;text-indent:24.75pt""&gt;&lt;span style=""color:#000000;font-family:\'Times New Roman\',serif;font-size:10pt;font-weight:400;line-height:120%""&gt;Included in &#x201c;Accounts', 'May 2018, Rensselaer Polytechnic Institute and CF Dynamic Advances LLC filed a complaint against Amazon.com, Inc. in the United States District Court for the Northern District of New York. The complaint alleged, among other things, that &#x201c;Alexa Voice Software and Alexa enabled devices&#x201d; infringe U.S. Patent No. 7,177,798. The complaint sought an injunction, an unspecified amount of damages, enhanced damages&lt;/span&gt;&lt;span style=""background-color:#ffffff;color:#000000;font-family:\'Times New Roman\',serif;font-size:10pt;font-weight:400;line-height:120%""&gt;, an ongoing royalty, interest, attorneys&#x2019; fees, and costs. In March 2023, the plaintiffs alleged in their damages report that in the event of a finding of liability Amazon could be subject to $140 million to $267 million in damages. In March 2024, the district court granted summary judgment ruling that the patent is invalid and dismissed the case. In April 2024, the plaintiffs filed a notice of appeal. We dispute the allegations of wrongdoing and will continue to defend ourselves vigorously in this matter.&lt;/span&gt;&lt;/div&gt;&lt;div style=""margin-top:5pt;text-indent:24.75pt""&gt;&lt;span style=""color:#000000;font-family:\'Times New Roman\',serif;font-size:10pt;font-weight:400;line-height:120%""&gt;In December 2018, Kove IO, Inc. filed a complaint against Amazon Web Services, Inc. in the United States District Court for the Northern District of Illinois. The complaint alleged, among other things, that Amazon S3 and DynamoDB infringe U.S. Patent Nos. 7,814,170; 7,103,640; and 7,233,978. The complaint sought an unspecified amount of damages, enhanced damages, attorneys&#x2019; fees, costs, interest, and injunctive relief. In April 2024, a jury found that Amazon infringed the asserted patents and awarded Kove $525 million in damages. In August 2024, the court awarded Kove $148 million in pre-judgment interest. In September 2024, we filed a notice of appeal. We disagree with the jury&#x2019;s', '""http://www.amazon.com/role/PropertyandEquipmentComponentsDetails""\n     ],\n     ""lang"": {\n      ""en-us"": {\n       ""role"": {\n        ""terseLabel"": ""Heavy equipment"",\n        ""label"": ""Machinery and Equipment [Member]"",\n        ""documentation"": ""Tangible personal property used to produce goods and services, including, but is not limited to, tools, dies and molds, computer and office equipment.""\n       }\n      }\n     },\n     ""auth_ref"": []\n    },\n    ""amzn_March2022ShareRepurchaseProgramMember"": {\n     ""xbrltype"": ""domainItemType"",\n     ""nsuri"": ""http://www.amazon.com/20251231"",\n     ""localname"": ""March2022ShareRepurchaseProgramMember"",\n     ""presentation"": [\n      ""http://www.amazon.com/role/StockholdersEquityAdditionalInformationDetails""\n     ],\n     ""lang"": {\n      ""en-us"": {\n       ""role"": {\n        ""terseLabel"": ""March 2022 Program"",\n        ""label"": ""March 2022 Share Repurchase Program [Member]"",\n        ""documentation"": ""March 2022 Share Repurchase Program""\n       }\n      }\n     },\n     ""auth_ref"": []\n    },\n    ""us-gaap_MarketableSecuritiesCurrent"": {\n     ""xbrltype"": ""monetaryItemType"",\n     ""nsuri"": ""http://fasb.org/us-gaap/2025"",\n     ""localname"": ""MarketableSecuritiesCurrent"",\n     ""crdr"": ""debit"",\n     ""calculation"": {\n      ""http://www.amazon.com/role/ConsolidatedBalanceSheets"": {\n       ""parentTag"": ""us-gaap_AssetsCurrent"",\n       ""weight"": 1.0,\n       ""order"": 2.0\n      }\n     },\n     ""presentation"": [\n      ""http://www.amazon.com/role/ConsolidatedBalanceSheets""\n     ],\n     ""lang"": {\n      ""en-us"": {\n       ""role"": {\n        ""terseLabel"": ""Marketable securities"",\n        ""label"": ""Marketable Securities, Current"",\n        ""documentation"": ""Amount of investment in marketable security, classified as current.""\n       }\n      }\n     },\n     ""auth_ref"": [\n      ""r1419""\n     ]\n    },\n    ""us-gaap_MarketableSecuritiesUnrealizedGainLoss"": {\n     ""xbrltype"": ""monetaryItemType"",\n     ""nsuri"": ""http://fasb.org/us-gaap/2025"",', '""http://www.amazon.com/role/ConsolidatedStatementsofOperations"": {\n       ""parentTag"": ""us-gaap_CostsAndExpenses"",\n       ""weight"": 1.0,\n       ""order"": 1.0\n      }\n     },\n     ""presentation"": [\n      ""http://www.amazon.com/role/ConsolidatedStatementsofOperations""\n     ],\n     ""lang"": {\n      ""en-us"": {\n       ""role"": {\n        ""terseLabel"": ""Cost of sales"",\n        ""label"": ""Cost of Product and Service Sold"",\n        ""documentation"": ""The aggregate costs related to goods produced and sold and services rendered by an entity during the reporting period. This excludes costs incurred during the reporting period related to financial services rendered and other revenue generating activities.""\n       }\n      }\n     },\n     ""auth_ref"": [\n      ""r79"",\n      ""r80"",\n      ""r845"",\n      ""r1139"",\n      ""r1144"",\n      ""r1232"",\n      ""r1473""\n     ]\n    },\n    ""us-gaap_CostOfSalesMember"": {\n     ""xbrltype"": ""domainItemType"",\n     ""nsuri"": ""http://fasb.org/us-gaap/2025"",\n     ""localname"": ""CostOfSalesMember"",\n     ""presentation"": [\n      ""http://www.amazon.com/role/StockholdersEquityStockbasedCompensationExpenseDetails""\n     ],\n     ""lang"": {\n      ""en-us"": {\n       ""role"": {\n        ""terseLabel"": ""Cost of sales"",\n        ""label"": ""Cost of Sales [Member]"",\n        ""documentation"": ""Primary financial statement caption encompassing cost of sales.""\n       }\n      }\n     },\n     ""auth_ref"": [\n      ""r1234""\n     ]\n    },\n    ""us-gaap_CostsAndExpenses"": {\n     ""xbrltype"": ""monetaryItemType"",\n     ""nsuri"": ""http://fasb.org/us-gaap/2025"",\n     ""localname"": ""CostsAndExpenses"",\n     ""crdr"": ""debit"",\n     ""calculation"": {\n      ""http://www.amazon.com/role/ConsolidatedStatementsofOperations"": {\n       ""parentTag"": ""us-gaap_OperatingIncomeLoss"",\n       ""weight"": -1.0,\n       ""order"": 2.0\n      }\n     },\n     ""presentation"": [\n      ""http://www.amazon.com/role/ConsolidatedStatementsofOperations"",', 'filed cases in the U.S., Canada, and the United Kingdom alleging, among other things: price fixing arrangements between each of Amazon and its vendors and Amazon and its third-party sellers; abuse of dominance, monopolization, and attempted monopolization; and consumer protection and unjust enrichment claims, in violation of federal and state antitrust, state consumer protection, and Canadian and U.K. antitrust laws. The first of these complaints was Frame-Wilson v. Amazon.com, Inc., which was filed in the United States District Court for the Western District of Washington (&#x201c;W.D. Wash.&#x201d;). These complaints seek billions of dollars of alleged damages, treble damages, punitive damages, injunctive relief, structural relief, civil penalties, attorneys&#x2019; fees, and costs. Some of the private plaintiff cases include allegations of distinct purported classes, including consumers who purchased a product through Amazon&#x2019;s stores and consumers who purchased a product offered by Amazon through another e-commerce retailer. Some of the cases include allegations that Amazon has a monopoly in markets for online superstores, marketplace services, or intermediation services and that we unlawfully engage in anticompetitive practices relating to our pricing policies, selection of the Featured Offers, use of seller data, advertising practices, the structure of Prime, and promotion of our own products on our website. In the U.S., most of Amazon&#x2019;s motions to dismiss were granted in part, but in each case, at least some of the claims survived. In Canada, class certification was denied in a case before the Federal Court of Canada, finding that plaintiffs had not stated a viable claim, and plaintiffs&#x2019; appeal of that ruling is pending. Two Canadian class actions before other &lt;/span&gt;&lt;/div&gt;&lt;div style=""margin-top:5pt""&gt;&lt;span style=""color:#000000;font-family:\'Times New', '""weight"": 1.0,\n       ""order"": 2.0\n      }\n     },\n     ""presentation"": [\n      ""http://www.amazon.com/role/ConsolidatedStatementsofOperations""\n     ],\n     ""lang"": {\n      ""en-us"": {\n       ""role"": {\n        ""terseLabel"": ""Fulfillment"",\n        ""label"": ""Fulfillment Expense"",\n        ""documentation"": ""Costs incurred to operate and staff fulfillment and customer service centers, including buying, receiving, inspecting, and warehousing inventories; picking, packaging and preparing customer orders for shipment; payment processing and related transaction costs. Fulfillment costs also include amounts paid to third parties that assist us in fulfillment and customer service operations.""\n       }\n      }\n     },\n     ""auth_ref"": []\n    },\n    ""amzn_FulfillmentExpenseMember"": {\n     ""xbrltype"": ""domainItemType"",\n     ""nsuri"": ""http://www.amazon.com/20251231"",\n     ""localname"": ""FulfillmentExpenseMember"",\n     ""presentation"": [\n      ""http://www.amazon.com/role/StockholdersEquityStockbasedCompensationExpenseDetails""\n     ],\n     ""lang"": {\n      ""en-us"": {\n       ""role"": {\n        ""terseLabel"": ""Fulfillment"",\n        ""label"": ""Fulfillment Expense [Member]"",\n        ""documentation"": ""Fulfillment Expense [Member]""\n       }\n      }\n     },\n     ""auth_ref"": []\n    },\n    ""amzn_FulfillmentExpensesPolicyPolicyTextBlock"": {\n     ""xbrltype"": ""textBlockItemType"",\n     ""nsuri"": ""http://www.amazon.com/20251231"",\n     ""localname"": ""FulfillmentExpensesPolicyPolicyTextBlock"",\n     ""presentation"": [\n      ""http://www.amazon.com/role/DescriptionofBusinessAccountingPoliciesandSupplementalDisclosuresPolicies""\n     ],\n     ""lang"": {\n      ""en-us"": {\n       ""role"": {\n        ""terseLabel"": ""Fulfillment"",\n        ""label"": ""Fulfillment Expenses, Policy [Policy Text Block]"",\n        ""documentation"": ""Fulfillment Expenses, Policy [Text Block]""\n       }\n      }\n     },\n     ""auth_ref"": []\n    },\n    ""country_GB"": {\n     ""xbrltype"": ""domainItemType"",', '""auth_ref"": [\n      ""r1666""\n     ]\n    },\n    ""amzn_LeaseLiability"": {\n     ""xbrltype"": ""monetaryItemType"",\n     ""nsuri"": ""http://www.amazon.com/20251231"",\n     ""localname"": ""LeaseLiability"",\n     ""crdr"": ""credit"",\n     ""calculation"": {\n      ""http://www.amazon.com/role/LeasesOperatingandFinanceLeaseReconciliationDetails"": {\n       ""parentTag"": ""amzn_LeaseLiabilityPaymentsDue"",\n       ""weight"": 1.0,\n       ""order"": 2.0\n      }\n     },\n     ""presentation"": [\n      ""http://www.amazon.com/role/LeasesOperatingandFinanceLeaseReconciliationDetails""\n     ],\n     ""lang"": {\n      ""en-us"": {\n       ""role"": {\n        ""totalLabel"": ""Present value of lease liabilities"",\n        ""label"": ""Lease Liability"",\n        ""documentation"": ""Present value of lessee\'s discounted obligation for lease payments from operating lease and finance lease""\n       }\n      }\n     },\n     ""auth_ref"": []\n    },\n    ""amzn_LeaseLiabilityCurrent"": {\n     ""xbrltype"": ""monetaryItemType"",\n     ""nsuri"": ""http://www.amazon.com/20251231"",\n     ""localname"": ""LeaseLiabilityCurrent"",\n     ""crdr"": ""credit"",\n     ""calculation"": {\n      ""http://www.amazon.com/role/LeasesOperatingandFinanceLeaseReconciliationDetails"": {\n       ""parentTag"": ""amzn_LeaseLiability"",\n       ""weight"": 1.0,\n       ""order"": 1.0\n      }\n     },\n     ""presentation"": [\n      ""http://www.amazon.com/role/LeasesOperatingandFinanceLeaseReconciliationDetails""\n     ],\n     ""lang"": {\n      ""en-us"": {\n       ""role"": {\n        ""negatedTotalLabel"": ""Current portion of lease liabilities"",\n        ""label"": ""Lease Liability, Current"",\n        ""documentation"": ""Present value of lessee\'s discounted obligation for lease payments from operating lease and finance lease, classified as current.""\n       }\n      }\n     },\n     ""auth_ref"": []\n    },\n    ""amzn_LeaseLiabilityNoncurrent"": {\n     ""xbrltype"": ""monetaryItemType"",\n     ""nsuri"": ""http://www.amazon.com/20251231"",\n     ""localname"": ""LeaseLiabilityNoncurrent"",\n     ""crdr"": ""credit"",\n     ""calculation"": {', '""localname"": ""MinimumMember"",\n     ""presentation"": [\n      ""http://www.amazon.com/role/AcquisitionsGoodwillandAcquiredIntangibleAssetsAcquiredIntangibleAssetsDetails"",\n      ""http://www.amazon.com/role/CommitmentsandContingenciesLegalProceedingsDetails"",\n      ""http://www.amazon.com/role/DebtLongTermDebtObligationsDetails"",\n      ""http://www.amazon.com/role/DescriptionofBusinessAccountingPoliciesandSupplementalDisclosuresDerivativeInstrumentsDetails"",\n      ""http://www.amazon.com/role/DescriptionofBusinessAccountingPoliciesandSupplementalDisclosuresLeasesDetails"",\n      ""http://www.amazon.com/role/DescriptionofBusinessAccountingPoliciesandSupplementalDisclosuresPropertyandEquipmentNetDetails"",\n      ""http://www.amazon.com/role/StockholdersEquityAdditionalInformationDetails""\n     ],\n     ""lang"": {\n      ""en-us"": {\n       ""role"": {\n        ""terseLabel"": ""Minimum"",\n        ""verboseLabel"": ""Minimum"",\n        ""label"": ""Minimum [Member]"",\n        ""documentation"": ""Lower limit of the provided range.""\n       }\n      }\n     },\n     ""auth_ref"": [\n      ""r145"",\n      ""r147"",\n      ""r149"",\n      ""r150"",\n      ""r152"",\n      ""r169"",\n      ""r171"",\n      ""r172"",\n      ""r184"",\n      ""r185"",\n      ""r297"",\n      ""r451"",\n      ""r452"",\n      ""r453"",\n      ""r454"",\n      ""r537"",\n      ""r565"",\n      ""r566"",\n      ""r567"",\n      ""r575"",\n      ""r748"",\n      ""r842"",\n      ""r941"",\n      ""r943"",\n      ""r951"",\n      ""r978"",\n      ""r979"",\n      ""r1032"",\n      ""r1053"",\n      ""r1058"",\n      ""r1059"",\n      ""r1095"",\n      ""r1106"",\n      ""r1107"",\n      ""r1109"",\n      ""r1110"",\n      ""r1123"",\n      ""r1124"",\n      ""r1163"",\n      ""r1173"",\n      ""r1189"",\n      ""r1194"",\n      ""r1200"",\n      ""r1203"",\n      ""r1240"",\n      ""r1241"",\n      ""r1245"",\n      ""r1263"",\n      ""r1564"",\n      ""r1669"",\n      ""r1670"",\n      ""r1671"",\n      ""r1672"",\n      ""r1673"",\n      ""r1674""\n     ]\n    },\n    ""amzn_MiscellaneousIncomeExpense"": {\n     ""xbrltype"": ""monetaryItemType"",\n     ""nsuri"": ""http://www.amazon.com/20251231"",', ""[WEB ARAMASI KAYNAĞI]: Yerel veri tabanında bulunamayan bilgi için internet ve finansal API'ler üzerinden şu güncel veriler elde edilmiştir:\nMeta Platforms (formerly Facebook) does not have a specified par value for its shares, as it typically issues no-par value stock. In contrast, Amazon has a par value of $0.01 per share.\n\nTherefore, **Amazon has a smaller par value** compared to Meta, which effectively has no par value.""]","Amazon has a smaller par value of $0.01 per share, while Meta has no specified par value for its shares.",Meta has a smaller par value ($0.000006) compared to Amazon ($0.01).,0.0,1.0,1.0,0.8233251604507802
Compare the state of incorporation for Apple and Microsoft.,"['financial condition and stock price.</span></div><div style=""height:42.75pt;position:relative;width:100%""><div style=""bottom:0;position:absolute;width:100%""><div style=""text-align:center""><span style=""color:#000000;font-family:\'Helvetica\',sans-serif;font-size:8pt;font-weight:400;line-height:120%"">Apple Inc. | 2025 Form 10-K | 13</span></div></div></div><hr style=""page-break-after:always""/><div style=""min-height:42.75pt;width:100%""><div style=""text-align:justify""><span><br/></span></div></div><div style=""margin-top:18pt;text-align:justify""><span style=""color:#000000;font-family:\'Helvetica\',sans-serif;font-size:9pt;font-style:italic;font-weight:700;line-height:120%"">The technology industry, including, in some instances, the Company, is subject to intense media, political and regulatory scrutiny, which exposes the Company to increasing regulation, government investigations, legal actions and penalties.</span></div><div style=""margin-top:6pt;text-align:justify""><span style=""color:#000000;font-family:\'Helvetica\',sans-serif;font-size:9pt;font-weight:400;line-height:120%"">From time to time, the Company has made changes to its business, including actions taken in response to litigation, competition, market conditions and legal and regulatory requirements. The Company expects to make further business changes in the future. For example, in the U.S., the Company has implemented changes to how developers communicate with consumers within apps on the U.S. storefront of the iOS and iPadOS App Store regarding alternative purchasing mechanisms and is currently subject to a court order preventing it from imposing any commission or fee on certain purchases that consumers make.</span></div><div style=""margin-top:12pt;text-align:justify""><span style=""color:#000000;font-family:\'Helvetica\',sans-serif;font-size:9pt;font-weight:400;line-height:120%"">Globally, several jurisdictions have adopted, or may in the future adopt, competition-related laws and regulations imposing wide-ranging', 'financial condition and stock price.</span></div><div style=""height:42.75pt;position:relative;width:100%""><div style=""bottom:0;position:absolute;width:100%""><div style=""text-align:center""><span style=""color:#000000;font-family:\'Helvetica\',sans-serif;font-size:8pt;font-weight:400;line-height:120%"">Apple Inc. | 2025 Form 10-K | 13</span></div></div></div><hr style=""page-break-after:always""/><div style=""min-height:42.75pt;width:100%""><div style=""text-align:justify""><span><br/></span></div></div><div style=""margin-top:18pt;text-align:justify""><span style=""color:#000000;font-family:\'Helvetica\',sans-serif;font-size:9pt;font-style:italic;font-weight:700;line-height:120%"">The technology industry, including, in some instances, the Company, is subject to intense media, political and regulatory scrutiny, which exposes the Company to increasing regulation, government investigations, legal actions and penalties.</span></div><div style=""margin-top:6pt;text-align:justify""><span style=""color:#000000;font-family:\'Helvetica\',sans-serif;font-size:9pt;font-weight:400;line-height:120%"">From time to time, the Company has made changes to its business, including actions taken in response to litigation, competition, market conditions and legal and regulatory requirements. The Company expects to make further business changes in the future. For example, in the U.S., the Company has implemented changes to how developers communicate with consumers within apps on the U.S. storefront of the iOS and iPadOS App Store regarding alternative purchasing mechanisms and is currently subject to a court order preventing it from imposing any commission or fee on certain purchases that consumers make.</span></div><div style=""margin-top:12pt;text-align:justify""><span style=""color:#000000;font-family:\'Helvetica\',sans-serif;font-size:9pt;font-weight:400;line-height:120%"">Globally, several jurisdictions have adopted, or may in the future adopt, competition-related laws and regulations imposing wide-ranging', 'for protecting the Company&#8217;s products and services. The Company believes the duration of its intellectual property rights is adequate relative to the expected lives of its products and services.</span></div><div style=""height:42.75pt;position:relative;width:100%""><div style=""bottom:0;position:absolute;width:100%""><div style=""text-align:center""><span style=""color:#000000;font-family:\'Helvetica\',sans-serif;font-size:8pt;font-weight:400;line-height:120%"">Apple Inc. | 2025 Form 10-K | 3</span></div></div></div><hr style=""page-break-after:always""/><div style=""min-height:42.75pt;width:100%""><div style=""text-align:justify""><span><br/></span></div></div><div style=""margin-top:12pt;text-align:justify""><span style=""color:#000000;font-family:\'Helvetica\',sans-serif;font-size:9pt;font-weight:400;line-height:120%"">In addition to Company-owned intellectual property, many of the Company&#8217;s products and services include technology or intellectual property that must be licensed from third parties. It may be necessary in the future to seek or renew licenses relating to various aspects of the Company&#8217;s products, processes and services. While the Company has generally been able to obtain such licenses on commercially reasonable terms in the past, there is no guarantee that such licenses could be obtained in the future on reasonable terms or at all.</span></div><div id=""i719388195b384d85a4e238ad88eba90a_43""></div><div style=""margin-top:18pt;text-align:justify""><span style=""color:#000000;font-family:\'Helvetica\',sans-serif;font-size:9pt;font-weight:700;line-height:120%"">Business Seasonality and Product Introductions</span></div><div style=""margin-top:6pt;text-align:justify""><span style=""color:#000000;font-family:\'Helvetica\',sans-serif;font-size:9pt;font-weight:400;line-height:120%"">The Company has historically experienced higher net sales in its first quarter compared to other quarters in its fiscal year due in part to seasonal holiday demand. Additionally, new product', 'for protecting the Company&#8217;s products and services. The Company believes the duration of its intellectual property rights is adequate relative to the expected lives of its products and services.</span></div><div style=""height:42.75pt;position:relative;width:100%""><div style=""bottom:0;position:absolute;width:100%""><div style=""text-align:center""><span style=""color:#000000;font-family:\'Helvetica\',sans-serif;font-size:8pt;font-weight:400;line-height:120%"">Apple Inc. | 2025 Form 10-K | 3</span></div></div></div><hr style=""page-break-after:always""/><div style=""min-height:42.75pt;width:100%""><div style=""text-align:justify""><span><br/></span></div></div><div style=""margin-top:12pt;text-align:justify""><span style=""color:#000000;font-family:\'Helvetica\',sans-serif;font-size:9pt;font-weight:400;line-height:120%"">In addition to Company-owned intellectual property, many of the Company&#8217;s products and services include technology or intellectual property that must be licensed from third parties. It may be necessary in the future to seek or renew licenses relating to various aspects of the Company&#8217;s products, processes and services. While the Company has generally been able to obtain such licenses on commercially reasonable terms in the past, there is no guarantee that such licenses could be obtained in the future on reasonable terms or at all.</span></div><div id=""i719388195b384d85a4e238ad88eba90a_43""></div><div style=""margin-top:18pt;text-align:justify""><span style=""color:#000000;font-family:\'Helvetica\',sans-serif;font-size:9pt;font-weight:700;line-height:120%"">Business Seasonality and Product Introductions</span></div><div style=""margin-top:6pt;text-align:justify""><span style=""color:#000000;font-family:\'Helvetica\',sans-serif;font-size:9pt;font-weight:400;line-height:120%"">The Company has historically experienced higher net sales in its first quarter compared to other quarters in its fiscal year due in part to seasonal holiday demand. Additionally, new product', 'style=""color:#000000;font-family:\'Helvetica\',sans-serif;font-size:9pt;font-weight:700;line-height:120%"">Report of Independent Registered Public Accounting Firm</span></div><div style=""margin-top:12pt;text-align:justify""><span style=""color:#000000;font-family:\'Helvetica\',sans-serif;font-size:9pt;font-weight:400;line-height:120%"">To the Shareholders and the Board of Directors of Apple Inc.</span></div><div style=""margin-top:12pt;text-align:justify""><span style=""color:#000000;font-family:\'Helvetica\',sans-serif;font-size:9pt;font-weight:700;line-height:120%"">Opinion on Internal Control Over Financial Reporting</span></div><div style=""margin-top:6pt;text-align:justify""><span style=""color:#000000;font-family:\'Helvetica\',sans-serif;font-size:9pt;font-weight:400;line-height:120%"">We have audited Apple Inc.&#8217;s internal control over financial reporting as of September&#160;27, 2025, based on criteria established in </span><span style=""color:#000000;font-family:\'Helvetica\',sans-serif;font-size:9pt;font-style:italic;font-weight:400;line-height:120%"">Internal Control &#8211; Integrated Framework</span><span style=""color:#000000;font-family:\'Helvetica\',sans-serif;font-size:9pt;font-weight:400;line-height:120%""> issued by the Committee of Sponsoring Organizations of the Treadway Commission (2013 framework) (the &#8220;COSO criteria&#8221;). In our opinion, Apple Inc. (the &#8220;Company&#8221;) maintained, in all material respects, effective internal control over financial reporting as of September&#160;27, 2025, based on the COSO criteria.</span></div><div style=""margin-top:12pt;text-align:justify""><span style=""color:#000000;font-family:\'Helvetica\',sans-serif;font-size:9pt;font-weight:400;line-height:120%"">We also have audited, in accordance with the standards of the Public Company Accounting Oversight Board (United States) (&#8220;PCAOB&#8221;), the consolidated balance sheets of the Company as of September&#160;27, 2025 and September&#160;28, 2024, the related', 'style=""color:#000000;font-family:\'Helvetica\',sans-serif;font-size:9pt;font-weight:700;line-height:120%"">Report of Independent Registered Public Accounting Firm</span></div><div style=""margin-top:12pt;text-align:justify""><span style=""color:#000000;font-family:\'Helvetica\',sans-serif;font-size:9pt;font-weight:400;line-height:120%"">To the Shareholders and the Board of Directors of Apple Inc.</span></div><div style=""margin-top:12pt;text-align:justify""><span style=""color:#000000;font-family:\'Helvetica\',sans-serif;font-size:9pt;font-weight:700;line-height:120%"">Opinion on Internal Control Over Financial Reporting</span></div><div style=""margin-top:6pt;text-align:justify""><span style=""color:#000000;font-family:\'Helvetica\',sans-serif;font-size:9pt;font-weight:400;line-height:120%"">We have audited Apple Inc.&#8217;s internal control over financial reporting as of September&#160;27, 2025, based on criteria established in </span><span style=""color:#000000;font-family:\'Helvetica\',sans-serif;font-size:9pt;font-style:italic;font-weight:400;line-height:120%"">Internal Control &#8211; Integrated Framework</span><span style=""color:#000000;font-family:\'Helvetica\',sans-serif;font-size:9pt;font-weight:400;line-height:120%""> issued by the Committee of Sponsoring Organizations of the Treadway Commission (2013 framework) (the &#8220;COSO criteria&#8221;). In our opinion, Apple Inc. (the &#8220;Company&#8221;) maintained, in all material respects, effective internal control over financial reporting as of September&#160;27, 2025, based on the COSO criteria.</span></div><div style=""margin-top:12pt;text-align:justify""><span style=""color:#000000;font-family:\'Helvetica\',sans-serif;font-size:9pt;font-weight:400;line-height:120%"">We also have audited, in accordance with the standards of the Public Company Accounting Oversight Board (United States) (&#8220;PCAOB&#8221;), the consolidated balance sheets of the Company as of September&#160;27, 2025 and September&#160;28, 2024, the related', '""presentation"": [\n      ""http://www.apple.com/role/LeasesLeaseLiabilityMaturitiesDetails""\n     ],\n     ""lang"": {\n      ""en-us"": {\n       ""role"": {\n        ""terseLabel"": ""Operating Leases"",\n        ""label"": ""Lessee, Operating Lease, Liability, to be Paid, Fiscal Year Maturity [Abstract]""\n       }\n      }\n     },\n     ""auth_ref"": []\n    },\n    ""us-gaap_OperatingLeaseLiability"": {\n     ""xbrltype"": ""monetaryItemType"",\n     ""nsuri"": ""http://fasb.org/us-gaap/2025"",\n     ""localname"": ""OperatingLeaseLiability"",\n     ""crdr"": ""credit"",\n     ""calculation"": {\n      ""http://www.apple.com/role/LeasesLeaseLiabilityMaturitiesDetails"": {\n       ""parentTag"": ""aapl_OperatingandFinanceLeaseLiability"",\n       ""weight"": 1.0,\n       ""order"": 1.0\n      },\n      ""http://www.apple.com/role/LeasesLeaseLiabilityMaturitiesDetails_1"": {\n       ""parentTag"": ""us-gaap_LesseeOperatingLeaseLiabilityPaymentsDue"",\n       ""weight"": 1.0,\n       ""order"": 2.0\n      }\n     },\n     ""presentation"": [\n      ""http://www.apple.com/role/LeasesLeaseLiabilityMaturitiesDetails""\n     ],\n     ""lang"": {\n      ""en-us"": {\n       ""role"": {\n        ""terseLabel"": ""Total lease liabilities"",\n        ""label"": ""Operating Lease, Liability"",\n        ""documentation"": ""Present value of lessee\'s discounted obligation for lease payments from operating lease.""\n       }\n      }\n     },\n     ""auth_ref"": [\n      ""r621""\n     ]\n    },\n    ""us-gaap_OperatingLeaseLiabilityCurrent"": {\n     ""xbrltype"": ""monetaryItemType"",\n     ""nsuri"": ""http://fasb.org/us-gaap/2025"",\n     ""localname"": ""OperatingLeaseLiabilityCurrent"",\n     ""crdr"": ""credit"",\n     ""calculation"": {\n      ""http://www.apple.com/role/LeasesROUAssetsandLeaseLiabilitiesDetails"": {\n       ""parentTag"": ""aapl_OperatingandFinanceLeaseLiability"",\n       ""weight"": 1.0,\n       ""order"": 1.0\n      }\n     },\n     ""presentation"": [\n      ""http://www.apple.com/role/LeasesROUAssetsandLeaseLiabilitiesDetails""\n     ],\n     ""lang"": {\n      ""en-us"": {\n       ""role"": {', '""presentation"": [\n      ""http://www.apple.com/role/LeasesLeaseLiabilityMaturitiesDetails""\n     ],\n     ""lang"": {\n      ""en-us"": {\n       ""role"": {\n        ""terseLabel"": ""Operating Leases"",\n        ""label"": ""Lessee, Operating Lease, Liability, to be Paid, Fiscal Year Maturity [Abstract]""\n       }\n      }\n     },\n     ""auth_ref"": []\n    },\n    ""us-gaap_OperatingLeaseLiability"": {\n     ""xbrltype"": ""monetaryItemType"",\n     ""nsuri"": ""http://fasb.org/us-gaap/2025"",\n     ""localname"": ""OperatingLeaseLiability"",\n     ""crdr"": ""credit"",\n     ""calculation"": {\n      ""http://www.apple.com/role/LeasesLeaseLiabilityMaturitiesDetails"": {\n       ""parentTag"": ""aapl_OperatingandFinanceLeaseLiability"",\n       ""weight"": 1.0,\n       ""order"": 1.0\n      },\n      ""http://www.apple.com/role/LeasesLeaseLiabilityMaturitiesDetails_1"": {\n       ""parentTag"": ""us-gaap_LesseeOperatingLeaseLiabilityPaymentsDue"",\n       ""weight"": 1.0,\n       ""order"": 2.0\n      }\n     },\n     ""presentation"": [\n      ""http://www.apple.com/role/LeasesLeaseLiabilityMaturitiesDetails""\n     ],\n     ""lang"": {\n      ""en-us"": {\n       ""role"": {\n        ""terseLabel"": ""Total lease liabilities"",\n        ""label"": ""Operating Lease, Liability"",\n        ""documentation"": ""Present value of lessee\'s discounted obligation for lease payments from operating lease.""\n       }\n      }\n     },\n     ""auth_ref"": [\n      ""r621""\n     ]\n    },\n    ""us-gaap_OperatingLeaseLiabilityCurrent"": {\n     ""xbrltype"": ""monetaryItemType"",\n     ""nsuri"": ""http://fasb.org/us-gaap/2025"",\n     ""localname"": ""OperatingLeaseLiabilityCurrent"",\n     ""crdr"": ""credit"",\n     ""calculation"": {\n      ""http://www.apple.com/role/LeasesROUAssetsandLeaseLiabilitiesDetails"": {\n       ""parentTag"": ""aapl_OperatingandFinanceLeaseLiability"",\n       ""weight"": 1.0,\n       ""order"": 1.0\n      }\n     },\n     ""presentation"": [\n      ""http://www.apple.com/role/LeasesROUAssetsandLeaseLiabilitiesDetails""\n     ],\n     ""lang"": {\n      ""en-us"": {\n       ""role"": {', '&#8220;may,&#8221; and similar terms. Forward-looking statements are not guarantees of future performance and the Company&#8217;s actual results may differ significantly from the results discussed in the forward-looking statements. Factors that might cause such differences include, but are not limited to, those discussed in Part I, Item 1A of this Form 10-K under the heading &#8220;Risk Factors.&#8221; The Company assumes no obligation to revise or update any forward-looking statements for any reason, except as required by law.</span></div><div style=""margin-top:12pt;text-align:justify""><span style=""color:#000000;font-family:\'Helvetica\',sans-serif;font-size:9pt;font-style:italic;font-weight:400;line-height:120%"">Unless otherwise stated, all information presented herein is based on the Company&#8217;s fiscal calendar, and references to particular years, quarters, months or periods refer to the Company&#8217;s fiscal years ended in September and the associated quarters, months and periods of those fiscal years. Each of the terms the &#8220;Company&#8221; and &#8220;Apple&#8221; as used herein refers collectively to Apple Inc. and its wholly owned subsidiaries, unless otherwise stated.</span></div><div style=""margin-top:18pt;text-align:justify""><span style=""color:#000000;font-family:\'Helvetica\',sans-serif;font-size:9pt;font-weight:700;line-height:120%"">PART I</span></div><div id=""i719388195b384d85a4e238ad88eba90a_13""></div><div style=""margin-top:12pt;padding-left:45pt;text-align:justify;text-indent:-45pt""><span style=""color:#000000;font-family:\'Helvetica\',sans-serif;font-size:9pt;font-weight:700;line-height:120%"">Item 1.&#160;&#160;&#160;&#160;Business</span></div><div id=""i719388195b384d85a4e238ad88eba90a_16""></div><div style=""margin-top:9pt;text-align:justify""><span style=""color:#000000;font-family:\'Helvetica\',sans-serif;font-size:9pt;font-weight:700;line-height:120%"">Company Background</span></div><div style=""margin-top:6pt;text-align:justify""><span', '&#8220;may,&#8221; and similar terms. Forward-looking statements are not guarantees of future performance and the Company&#8217;s actual results may differ significantly from the results discussed in the forward-looking statements. Factors that might cause such differences include, but are not limited to, those discussed in Part I, Item 1A of this Form 10-K under the heading &#8220;Risk Factors.&#8221; The Company assumes no obligation to revise or update any forward-looking statements for any reason, except as required by law.</span></div><div style=""margin-top:12pt;text-align:justify""><span style=""color:#000000;font-family:\'Helvetica\',sans-serif;font-size:9pt;font-style:italic;font-weight:400;line-height:120%"">Unless otherwise stated, all information presented herein is based on the Company&#8217;s fiscal calendar, and references to particular years, quarters, months or periods refer to the Company&#8217;s fiscal years ended in September and the associated quarters, months and periods of those fiscal years. Each of the terms the &#8220;Company&#8221; and &#8220;Apple&#8221; as used herein refers collectively to Apple Inc. and its wholly owned subsidiaries, unless otherwise stated.</span></div><div style=""margin-top:18pt;text-align:justify""><span style=""color:#000000;font-family:\'Helvetica\',sans-serif;font-size:9pt;font-weight:700;line-height:120%"">PART I</span></div><div id=""i719388195b384d85a4e238ad88eba90a_13""></div><div style=""margin-top:12pt;padding-left:45pt;text-align:justify;text-indent:-45pt""><span style=""color:#000000;font-family:\'Helvetica\',sans-serif;font-size:9pt;font-weight:700;line-height:120%"">Item 1.&#160;&#160;&#160;&#160;Business</span></div><div id=""i719388195b384d85a4e238ad88eba90a_16""></div><div style=""margin-top:9pt;text-align:justify""><span style=""color:#000000;font-family:\'Helvetica\',sans-serif;font-size:9pt;font-weight:700;line-height:120%"">Company Background</span></div><div style=""margin-top:6pt;text-align:justify""><span', ""[WEB ARAMASI KAYNAĞI]: Yerel veri tabanında bulunamayan bilgi için internet ve finansal API'ler üzerinden şu güncel veriler elde edilmiştir:\n### State of Incorporation for Apple and Microsoft\n\n- **Apple Inc.**: Apple was incorporated in **Cupertino, California** on January 3, 1977. The company has maintained its incorporation in California since its founding. [Source](https://en.wikipedia.org/wiki/Apple_Inc.)\n\n- **Microsoft Corp.**: Microsoft was initially incorporated in **Washington** on June 25, 1981. It later reincorporated in **Delaware** on September 19, 1986, and then reincorporated again in **Washington** on September 22, 1993. [Source](https://www.microsoft.com/en-us/investor/faq)\n\n### Summary\n- **Apple**: Incorporated in California.\n- **Microsoft**: Initially incorporated in Washington, later reincorporated in Delaware, and finally reincorporated back in Washington.""]","Apple Inc. was incorporated in Cupertino, California on January 3, 1977, and has maintained its incorporation in California since its founding. Microsoft Corp. was initially incorporated in Washington on June 25, 1981, later reincorporated in Delaware on September 19, 1986, and then reincorporated back in Washington on September 22, 1993.","Apple is incorporated in California, while Microsoft is incorporated in Washington.",0.0909090909,1.0,1.0,0.7552834497741813
In which state is Microsoft incorporated?,"['<div class=""main-content-container"" style=""z-index:5;position:relative;""><p style=""font-size:10pt;margin-top:0;font-family:Times New Roman;margin-bottom:0;text-align:right;""><font style=""color:#000000;white-space:pre-wrap;font-size:10pt;font-family:Arial;font-kerning:none;min-width:fit-content;"">Exhibit 21</font><font style=""color:#000000;white-space:pre-wrap;font-size:10pt;font-family:Arial;font-kerning:none;min-width:fit-content;""> </font></p><p style=""font-size:10pt;margin-top:13.5pt;font-family:Times New Roman;margin-bottom:0;text-align:center;""><font style=""color:#000000;white-space:pre-wrap;font-weight:bold;font-size:10pt;font-family:Arial;font-kerning:none;min-width:fit-content;"">SUBSIDIARIES OF REGISTRANT</font><font style=""color:#000000;white-space:pre-wrap;font-weight:bold;font-size:10pt;font-family:Arial;font-kerning:none;min-width:fit-content;""> </font></p><p style=""font-size:10pt;margin-top:9pt;font-family:Times New Roman;margin-bottom:0;text-align:justify;""><font style=""color:#000000;white-space:pre-wrap;font-size:10pt;font-family:Arial;font-kerning:none;min-width:fit-content;"">The following is a list of subsidiaries of Microsoft Corporation as of June 30, 2025, omitting subsidiaries which, considered in the aggregate, would not constitute a significant subsidiary.</font><font style=""color:#000000;white-space:pre-wrap;font-size:10pt;font-family:Arial;font-kerning:none;min-width:fit-content;""> </font></p><p style=""font-size:10pt;margin-top:0;font-family:Times New Roman;margin-bottom:0;text-align:justify;""><font style=""white-space:pre-wrap;font-size:9pt;font-family:Arial;font-kerning:none;min-width:fit-content;"">&#160;</font></p>\n   <table style=""margin-left:auto;border-spacing:0;table-layout:auto;width:100.0%;border-collapse:separate;margin-right:auto;"">\n    <tr style=""background-color:#ffffff;font-weight:bold;visibility:collapse;"">\n     <td style=""width:49.24%;box-sizing:content-box;""></td>\n     <td style=""width:1%;box-sizing:content-box;""></td>', '3, 2024.</span></p><p style=""font-size:10pt;margin-top:13.5pt;font-family:Times New Roman;margin-bottom:0;text-align:center;""><span style=""color:#000000;white-space:pre-wrap;text-decoration:underline solid;font-size:10pt;font-family:Arial;font-kerning:none;min-width:fit-content;"">OVERVIEW</span></p><p style=""font-size:10pt;margin-top:9pt;font-family:Times New Roman;margin-bottom:0;text-align:justify;""><span style=""color:#000000;white-space:pre-wrap;font-size:10pt;font-family:Arial;font-kerning:none;min-width:fit-content;"">Microsoft is a technology company committed to making digital technology and artificial intelligence (&#8220;AI&#8221;) available broadly and doing so responsibly, with a mission to empower every person and every organization on the planet to achieve more. We create platforms and tools, powered by AI, that deliver innovative solutions that meet the evolving needs of our customers.</span><span style=""color:#000000;white-space:pre-wrap;font-size:10pt;font-family:Arial;font-kerning:none;min-width:fit-content;""> </span></p><p style=""font-size:10pt;margin-top:9pt;font-family:Times New Roman;margin-bottom:0;text-align:justify;""><span style=""color:#000000;white-space:pre-wrap;font-size:10pt;font-family:Arial;font-kerning:none;min-width:fit-content;"">We generate revenue by offering a wide range of cloud-based solutions, content, and other services to people and businesses; licensing and supporting an array of software products; delivering relevant online advertising to a global audience; and designing and selling devices. Our most significant expenses are related to compensating employees; supporting and investing in our cloud-based services, including datacenter operations; designing, manufacturing, marketing, and selling our other products and services; and income taxes.</span></p><p style=""font-size:10pt;margin-top:9pt;font-family:Times New Roman;margin-bottom:0;text-align:justify;""><span', 'style=""color:#000000;white-space:pre-wrap;text-decoration:underline solid;font-size:10pt;font-family:Arial;font-kerning:none;min-width:fit-content;"">GENERAL</span></p><p style=""font-size:10pt;margin-top:9pt;font-family:Times New Roman;margin-bottom:0;text-align:justify;""><span style=""color:#000000;white-space:pre-wrap;font-size:10pt;font-family:Arial;font-kerning:none;min-width:fit-content;"">Microsoft is a technology company committed to making digital technology and artificial intelligence (&#8220;AI&#8221;) available broadly and doing so responsibly. Our mission is to empower every person and every organization on the planet to achieve more.</span><span style=""color:#000000;white-space:pre-wrap;font-size:10pt;font-family:Arial;font-kerning:none;min-width:fit-content;""> </span></p><p style=""font-size:10pt;margin-top:9pt;font-family:Times New Roman;margin-bottom:0;text-align:justify;""><span style=""color:#000000;white-space:pre-wrap;font-size:10pt;font-family:Arial;font-kerning:none;min-width:fit-content;"">We develop and support a broad portfolio of technology solutions for individuals and businesses, focusing on secure, trusted, and innovative platforms and tools that meet evolving customer needs across cloud computing, productivity and collaboration, and personal computing. We strive to create opportunity, growth, and impact in every country around the world.</span></p><p style=""font-size:10pt;margin-top:9pt;font-family:Times New Roman;margin-bottom:0;text-align:justify;""><span style=""color:#000000;white-space:pre-wrap;font-size:10pt;font-family:Arial;font-kerning:none;min-width:fit-content;"">AI is fundamentally transforming productivity for every individual, organization, and industry. Microsoft\'s AI offerings span every layer of the technology stack, enabling transformative outcomes across sectors and unlocking opportunity for every country, community, and individual.</span><span', 'of partner advisors support many of these sales.</span><span style=""color:#000000;white-space:pre-wrap;font-size:10pt;font-family:Arial;font-kerning:none;min-width:fit-content;""> </span></p><p style=""font-size:10pt;margin-top:9pt;font-family:Times New Roman;margin-bottom:0;text-align:justify;""><span style=""color:#000000;white-space:pre-wrap;font-size:10pt;font-family:Arial;font-kerning:none;min-width:fit-content;"">We also sell commercial and consumer products and services directly to customers, such as cloud services, search, and gaming, through our digital marketplaces and online stores. Additionally, our Microsoft Experience Centers are designed to facilitate deeper engagement with our partners and customers across industries.</span><span style=""color:#000000;white-space:pre-wrap;font-size:10pt;font-family:Arial;font-kerning:none;min-width:fit-content;""> </span></p><p style=""font-size:10pt;margin-top:13.5pt;font-family:Times New Roman;margin-bottom:0;text-align:left;""><span style=""color:#000000;white-space:pre-wrap;font-weight:bold;font-size:10pt;font-family:Arial;font-kerning:none;min-width:fit-content;"">Distributors and Resellers</span><span style=""color:#000000;white-space:pre-wrap;font-weight:bold;font-size:10pt;font-family:Arial;font-kerning:none;min-width:fit-content;""> </span></p><p style=""font-size:10pt;margin-top:9pt;font-family:Times New Roman;margin-bottom:0;text-align:justify;""><span style=""color:#000000;white-space:pre-wrap;font-size:10pt;font-family:Arial;font-kerning:none;min-width:fit-content;"">Organizations also license our products and services indirectly, primarily through licensing solution partners (&#8220;LSP&#8221;), distributors, value-added resellers (&#8220;VAR&#8221;), and retailers. Although each type of reselling partner may reach organizations of all sizes, LSPs are primarily engaged with large organizations, distributors resell primarily to VARs, and VARs typically reach small and medium organizations. ESAs are also typically', 'have audited the internal control over financial reporting of Microsoft Corporation and subsidiaries (the &#8220;Company&#8221;) as of June 30, 2025, based on criteria established in </span><span style=""color:#000000;white-space:pre-wrap;font-size:10pt;font-family:Arial;font-style:italic;font-kerning:none;min-width:fit-content;"">Internal Control &#8212; Integrated Framework (2013)</span><span style=""color:#000000;white-space:pre-wrap;font-size:10pt;font-family:Arial;font-kerning:none;min-width:fit-content;""> issued by the Committee of Sponsoring Organizations of the Treadway Commission (COSO). In our opinion, the Company maintained, in all material respects, effective internal control over financial reporting as of June 30, 2025, based on criteria established in </span><span style=""color:#000000;white-space:pre-wrap;font-size:10pt;font-family:Arial;font-style:italic;font-kerning:none;min-width:fit-content;"">Internal Control &#8212; Integrated Framework (2013)</span><span style=""color:#000000;white-space:pre-wrap;font-size:10pt;font-family:Arial;font-kerning:none;min-width:fit-content;""> issued by COSO.</span></p><p style=""margin-left:1.733%;font-size:10pt;margin-top:9pt;font-family:Times New Roman;margin-bottom:0;margin-right:3.065%;text-align:justify;""><span style=""color:#000000;white-space:pre-wrap;font-size:10pt;font-family:Arial;font-kerning:none;min-width:fit-content;"">We have also audited, in accordance with the standards of the Public Company Accounting Oversight Board (United States) (PCAOB), the consolidated financial statements as of and for the year ended June 30, 2025, of the Company and our report dated July 30, 2025, expressed an unqualified opinion on those financial statements.</span></p><p style=""margin-left:1.733%;font-size:10pt;margin-top:9pt;font-family:Times New Roman;margin-bottom:0;margin-right:3.065%;text-align:left;""><span', ']\n    },\n    ""msft_OperatingLeaseMember"": {\n     ""xbrltype"": ""domainItemType"",\n     ""nsuri"": ""http://www.microsoft.com/20250630"",\n     ""localname"": ""OperatingLeaseMember"",\n     ""presentation"": [\n      ""http://www.microsoft.com/20250630/taxonomy/role/Role_DisclosureLeasesAdditionalInformationDetail""\n     ],\n     ""lang"": {\n      ""en-us"": {\n       ""role"": {\n        ""documentation"": ""Operating lease."",\n        ""label"": ""Operating Lease [Member]"",\n        ""terseLabel"": ""Operating Lease""\n       }\n      }\n     },\n     ""auth_ref"": []\n    },\n    ""us-gaap_OperatingLeasePayments"": {\n     ""xbrltype"": ""monetaryItemType"",\n     ""nsuri"": ""http://fasb.org/us-gaap/2024"",\n     ""localname"": ""OperatingLeasePayments"",\n     ""crdr"": ""credit"",\n     ""presentation"": [\n      ""http://www.microsoft.com/20250630/taxonomy/role/Role_DisclosureSupplementalCashFlowInformationRelatedToLeasesDetail""\n     ],\n     ""lang"": {\n      ""en-us"": {\n       ""role"": {\n        ""label"": ""Operating Lease, Payments"",\n        ""terseLabel"": ""Operating cash flows from operating leases"",\n        ""documentation"": ""Amount of cash outflow from operating lease, excluding payments to bring another asset to condition and location necessary for its intended use.""\n       }\n      }\n     },\n     ""auth_ref"": [\n      ""r716"",\n      ""r721""\n     ]\n    },\n    ""us-gaap_OperatingLeaseRightOfUseAsset"": {\n     ""xbrltype"": ""monetaryItemType"",\n     ""nsuri"": ""http://fasb.org/us-gaap/2024"",\n     ""localname"": ""OperatingLeaseRightOfUseAsset"",\n     ""crdr"": ""debit"",\n     ""calculation"": {\n      ""http://www.microsoft.com/20250630/taxonomy/role/Role_StatementBALANCESHEETS"": {\n       ""parentTag"": ""us-gaap_Assets"",\n       ""weight"": 1.0,\n       ""order"": 2.0\n      }\n     },\n     ""presentation"": [\n      ""http://www.microsoft.com/20250630/taxonomy/role/Role_DisclosureSupplementalBalanceSheetInformationRelatedToLeasesDetail"",\n      ""http://www.microsoft.com/20250630/taxonomy/role/Role_StatementBALANCESHEETS""\n     ],\n     ""lang"": {\n      ""en-us"": {', 'agreement is designed for government and academic organizations to acquire on-premises licenses at any affiliate or department level, while realizing advantages as one organization. Organizations purchase perpetual licenses and SA is optional.</span><span style=""color:#000000;white-space:pre-wrap;font-size:10pt;font-family:Arial;font-kerning:none;min-width:fit-content;""> </span></p><p style=""font-size:10pt;margin-top:13.5pt;font-family:Times New Roman;margin-bottom:0;text-align:left;""><span style=""color:#000000;white-space:pre-wrap;font-weight:bold;font-size:10pt;font-family:Arial;font-kerning:none;min-width:fit-content;"">Partner Programs</span><span style=""color:#000000;white-space:pre-wrap;font-weight:bold;font-size:10pt;font-family:Arial;font-kerning:none;min-width:fit-content;""> </span></p><p style=""font-size:10pt;margin-top:9pt;font-family:Times New Roman;margin-bottom:0;text-align:justify;""><span style=""color:#000000;white-space:pre-wrap;font-size:10pt;font-family:Arial;font-kerning:none;min-width:fit-content;"">The Microsoft Cloud Solution Provider Program offers customers an easy way to license the cloud services they need in combination with the value-added services offered by their systems integrator, managed services provider, or cloud reseller partner. Partners in this program can easily package their own products and services to directly provision, manage, and support their customer subscriptions.</span></p><p style=""font-size:10pt;margin-top:9pt;font-family:Times New Roman;margin-bottom:0;text-align:justify;""><span style=""color:#000000;white-space:pre-wrap;font-size:10pt;font-family:Arial;font-kerning:none;min-width:fit-content;"">The Microsoft Services Provider License Agreement allows hosting service providers and independent software vendors who want to license eligible Microsoft software products to provide hosted applications and software services to their end customers. Partners license software over a three-year period and are billed monthly', '<td style=""padding-top:0in;padding-left:0in;vertical-align:top;padding-bottom:0in;padding-right:0in;""><p style=""font-size:10pt;margin-top:0;font-family:Times New Roman;margin-bottom:0;text-align:left;""><a href=""msft-ex10_8.htm""><span style=""color:#000000;white-space:pre-wrap;font-family:Arial;font-kerning:none;min-width:fit-content;"">Form of Indemnification Agreement and Amended and Restated Directors&#8217; Indemnification Trust Agreement between Microsoft Corporation and The Bank of New York Mellon Trust Company, N.A., as trustee</span></a></p></td>\n     <td style=""padding-top:0in;padding-left:0in;vertical-align:bottom;padding-bottom:0in;padding-right:0in;""><p style=""font-size:7.5pt;margin-top:0;font-family:Times New Roman;margin-bottom:0;text-align:left;""><span style=""white-space:pre-wrap;font-family:Arial;font-kerning:none;min-width:fit-content;"">&#160;</span></p></td>\n     <td style=""padding-top:0in;padding-left:0in;vertical-align:top;padding-bottom:0in;padding-right:0in;text-align:left;""><p style=""font-size:10pt;margin-top:0;font-family:Times New Roman;margin-bottom:0;text-align:center;""><span style=""color:#000000;white-space:pre-wrap;font-family:Arial;font-kerning:none;min-width:fit-content;"">X</span></p></td>\n     <td style=""padding-top:0in;padding-left:0in;vertical-align:bottom;padding-bottom:0in;padding-right:0in;""><p style=""font-size:7.5pt;margin-top:0;font-family:Times New Roman;margin-bottom:0;text-align:left;""><span style=""white-space:pre-wrap;font-family:Arial;font-kerning:none;min-width:fit-content;"">&#160;</span></p></td>\n     <td style=""padding-top:0in;padding-left:0in;vertical-align:top;padding-bottom:0in;padding-right:0in;text-align:center;""><p style=""font-size:10pt;margin-top:0;font-family:Times New Roman;margin-bottom:0;text-align:right;""><span style=""white-space:pre-wrap;font-family:Arial;font-kerning:none;min-width:fit-content;"">&#160;</span></p></td>', '</font></p><p style=""text-indent:6.667%;font-size:10pt;margin-top:9pt;font-family:Times New Roman;margin-bottom:0;text-align:justify;""><font style=""color:#000000;white-space:pre-wrap;font-size:10pt;font-family:Arial;font-kerning:none;min-width:fit-content;"">&#x201c;Board of Directors&#x201d; means the board of directors of Microsoft Corporation as constituted from time to time.</font><font style=""color:#000000;white-space:pre-wrap;font-size:10pt;font-family:Arial;font-kerning:none;min-width:fit-content;""> </font></p><p style=""text-indent:6.667%;font-size:10pt;margin-top:9pt;font-family:Times New Roman;margin-bottom:0;text-align:justify;""><font style=""color:#000000;white-space:pre-wrap;font-size:10pt;font-family:Arial;font-kerning:none;min-width:fit-content;"">&#x201c;Business Day&#x201d; means any day, excluding Saturday, Sunday and any day on which banking institutions located in New York, New York or Seattle, Washington are authorized by applicable law to be closed.</font><font style=""color:#000000;white-space:pre-wrap;font-size:10pt;font-family:Arial;font-kerning:none;min-width:fit-content;""> </font></p><p style=""text-indent:6.667%;font-size:10pt;margin-top:9pt;font-family:Times New Roman;margin-bottom:0;text-align:justify;""><font style=""color:#000000;white-space:pre-wrap;font-size:10pt;font-family:Arial;font-kerning:none;min-width:fit-content;"">&#x201c;Cash&#x201d; means (a) currency of the United States, and (b) certificates of deposit or time deposits having, in each case, a tenor of not more than six (6) months, issued by any U.S. commercial bank or any branch or agency of a non-U.S. bank licensed to conduct business in the U.S. having combined capital and surplus of not less than $250,000,000 (including the Trustee and its affiliates).</font></p><p style=""text-indent:6.667%;font-size:10pt;margin-top:9pt;font-family:Times New Roman;margin-bottom:0;text-align:justify;""><font', '}\n      }\n     },\n     ""auth_ref"": [\n      ""r831"",\n      ""r1290""\n     ]\n    },\n    ""us-gaap_EquitySecuritiesMember"": {\n     ""xbrltype"": ""domainItemType"",\n     ""nsuri"": ""http://fasb.org/us-gaap/2024"",\n     ""localname"": ""EquitySecuritiesMember"",\n     ""presentation"": [\n      ""http://www.microsoft.com/20250630/taxonomy/role/Role_DisclosureInvestmentComponentsDetail"",\n      ""http://www.microsoft.com/20250630/taxonomy/role/Role_DisclosureNetRecognizedGainsLossesOnEquityInvestmentsDetail"",\n      ""http://www.microsoft.com/20250630/taxonomy/role/Role_DisclosureOTHERINCOMEEXPENSENETTables""\n     ],\n     ""lang"": {\n      ""en-us"": {\n       ""role"": {\n        ""label"": ""Equity Securities [Member]"",\n        ""terseLabel"": ""Equity Securities"",\n        ""documentation"": ""Ownership interest or right to acquire or dispose of ownership interest in corporations and other legal entities for which ownership interest is represented by shares of common or preferred stock, convertible securities, stock rights, or stock warrants.""\n       }\n      }\n     },\n     ""auth_ref"": [\n      ""r46"",\n      ""r1071"",\n      ""r1098"",\n      ""r1099"",\n      ""r1100"",\n      ""r1455""\n     ]\n    },\n    ""us-gaap_EquitySecuritiesWithoutReadilyDeterminableFairValueAmount"": {\n     ""xbrltype"": ""monetaryItemType"",\n     ""nsuri"": ""http://fasb.org/us-gaap/2024"",\n     ""localname"": ""EquitySecuritiesWithoutReadilyDeterminableFairValueAmount"",\n     ""crdr"": ""debit"",\n     ""presentation"": [\n      ""http://www.microsoft.com/20250630/taxonomy/role/Role_DisclosureInvestmentsAdditionalInformationDetail""\n     ],\n     ""lang"": {\n      ""en-us"": {\n       ""role"": {\n        ""label"": ""Equity Securities without Readily Determinable Fair Value, Amount"",\n        ""terseLabel"": ""Equity investments without readily determinable fair values measured at cost with adjustments for observable changes in price or impairments"",\n        ""documentation"": ""Amount of investment in equity security without readily determinable fair value.""\n       }\n      }', ""[WEB ARAMASI KAYNAĞI]: Yerel veri tabanında bulunamayan bilgi için internet ve finansal API'ler üzerinden şu güncel veriler elde edilmiştir:\nMicrosoft was originally incorporated in the state of Washington on June 25, 1981. However, it later reincorporated in Delaware on September 19, 1986, and then reincorporated again in Washington on November 1, 1993. Therefore, Microsoft is currently incorporated in the state of Washington.""]",Microsoft is currently incorporated in the state of Washington.,Microsoft is incorporated in the State of Washington.,0.0909090909,1.0,1.0,0.9772650030985209
In which state is Meta Platforms incorporated?,"['""lang"": {\n      ""en-us"": {\n       ""role"": {\n        ""terseLabel"": ""Amaury et al. v. Meta Platforms Ireland Limited"",\n        ""label"": ""Amaury et al. v. Meta Platforms Ireland Limited [Member]"",\n        ""documentation"": ""Amaury et al. v. Meta Platforms Ireland Limited""\n       }\n      }\n     },\n     ""auth_ref"": []\n    },\n    ""dei_AmendmentFlag"": {\n     ""xbrltype"": ""booleanItemType"",\n     ""nsuri"": ""http://xbrl.sec.gov/dei/2025"",\n     ""localname"": ""AmendmentFlag"",\n     ""presentation"": [\n      ""http://www.facebook.com/role/Coverpage""\n     ],\n     ""lang"": {\n      ""en-us"": {\n       ""role"": {\n        ""terseLabel"": ""Amendment Flag"",\n        ""label"": ""Amendment Flag"",\n        ""documentation"": ""Boolean flag that is true when the XBRL content amends previously-filed or accepted submission.""\n       }\n      }\n     },\n     ""auth_ref"": []\n    },\n    ""us-gaap_AmortizationOfIntangibleAssets"": {\n     ""xbrltype"": ""monetaryItemType"",\n     ""nsuri"": ""http://fasb.org/us-gaap/2025"",\n     ""localname"": ""AmortizationOfIntangibleAssets"",\n     ""crdr"": ""debit"",\n     ""presentation"": [\n      ""http://www.facebook.com/role/AcquisitionsGoodwillandIntangibleAssetsNarrativeDetails""\n     ],\n     ""lang"": {\n      ""en-us"": {\n       ""role"": {\n        ""terseLabel"": ""Amortization expense"",\n        ""label"": ""Amortization of Intangible Assets"",\n        ""documentation"": ""The aggregate expense charged against earnings to allocate the cost of intangible assets (nonphysical assets not used in production) in a systematic and rational manner to the periods expected to benefit from such assets.""\n       }\n      }\n     },\n     ""auth_ref"": [\n      ""r6"",\n      ""r199"",\n      ""r363"",\n      ""r370"",\n      ""r974"",\n      ""r977"",\n      ""r978"",\n      ""r980"",\n      ""r982""\n     ]\n    },\n    ""us-gaap_AntidilutiveSecuritiesExcludedFromComputationOfEarningsPerShareAmount"": {\n     ""xbrltype"": ""sharesItemType"",\n     ""nsuri"": ""http://fasb.org/us-gaap/2025"",', 'style=""color:#000000;font-family:\'Times New Roman\',serif;font-size:10pt;font-weight:400;line-height:120%"">We believe the metaverse, an embodied internet where people have immersive experiences beyond two-dimensional screens, is the next evolution in social technology. In 2021, we announced a shift in our business and product strategy to focus on helping to bring the metaverse to life, and we are directing our efforts toward innovations in AI, wearables, and devices to help build next-generation interfaces. We expect this will be a complex, evolving, and long-term initiative that will involve the development of new and emerging technologies, continued investment in infrastructure as well as privacy, safety, and security efforts, and collaboration with other companies, developers, partners, and other participants. However, the metaverse may not develop in accordance with our expectations, and market acceptance of features, products, or services we build is uncertain. We regularly evaluate our product roadmaps and make significant changes as our understanding of the technological challenges and market landscape and our product ideas and designs evolve. In addition, we have relatively limited experience with consumer hardware products and virtual and augmented reality technology, which may enable other companies to compete more effectively than us. We may be unsuccessful in our research and product development efforts, including if we are unable to develop relationships with key participants in the metaverse or develop products that operate effectively with metaverse technologies, products, systems, networks, or standards. For example, some of our consumer hardware products depend on the ability to operate with third-party mobile platforms and these platforms do not necessarily provide our products with the same levels of interoperability that they provide to their own competing products. In addition, our Reality Labs efforts may also divert resources and management', 'reality to help build the next computing platform. Our vision does not center on any single product, but rather an entire ecosystem of experiences, devices, and new technologies powered by AI. While the metaverse is in the very early stages of its development, we believe it will become the next computing platform and the future of social interaction. </span></div><div style=""text-align:justify;text-indent:27pt""><span><br/></span></div><div style=""text-align:justify;text-indent:27pt""><span style=""color:#000000;font-family:\'Times New Roman\',serif;font-size:10pt;font-weight:400;line-height:120%"">Across our work, we are innovating to build new experiences that help make our platform more social, useful, and immersive. Our AI investments support initiatives across our products and services, helping power the systems that rank content in our apps, our discovery engine that recommends relevant content, the tools advertisers use to reach customers, the development of new generative AI experiences, and the tools that make our product development more efficient and productive. We are also working to develop the next generation of AI models and advance our vision to build superintelligence, which we define as AI that surpasses human intelligence. Although it is inherently difficult to predict when superintelligence may be achieved, we are investing now because we believe this has the potential to begin a new era of individual empowerment, where people can direct superintelligence towards what they value in their own lives.</span></div><div><span><br/></span></div><div style=""text-align:justify""><span style=""color:#000000;font-family:\'Times New Roman\',serif;font-size:10pt;font-weight:700;line-height:120%"">Family of Apps Products</span></div><div style=""text-align:justify;text-indent:27pt""><span><br/></span></div><div style=""padding-left:49.5pt;text-align:justify;text-indent:-22.5pt""><span style=""color:#000000;font-family:\'Times New', 'addition, on May 12, 2023, the IDPC issued a Final Decision concluding that Meta Platforms Ireland\'s reliance on Standard Contractual Clauses in respect of certain transfers of European Economic Area (EEA) Facebook user data was not in compliance with the GDPR. The IDPC issued an administrative fine of EUR &#8364;1.2 billion as well as corrective orders requiring Meta Platforms Ireland to suspend the relevant transfers and to bring its processing operations into compliance with Chapter V GDPR by ceasing the unlawful processing, including storage, of such data in the United States. We are appealing this Final Decision and it is currently subject to a stay from the Irish High Court. We have also implemented steps to comply with the above corrective orders and are pending the IDPC\'s confirmation that these address the corrective orders. For additional information, see Part&#160;I, Item&#160;1A, ""Risk Factors&#8212;Our business is subject to complex and evolving U.S. and foreign laws and regulations regarding privacy, data use, data combination, data protection, content, competition, youth, safety, consumer protection, advertising, e-commerce, and other matters"" in this Annual Report on Form 10&#8209;K. Any such inquiries or investigations (including the IDPC proceedings) could subject us to substantial fines and costs, require us to change our business practices, divert resources and the attention of management from our business, lead to additional claims from users, or adversely affect our business. In addition, we are subject to individual and class actions in Europe relating to matters that are or have been the subject of regulatory investigations.</span></div><div style=""text-align:justify;text-indent:27pt""><span><br/></span></div><div style=""text-align:justify;text-indent:27pt""><span style=""color:#000000;font-family:\'Times New Roman\',serif;font-size:10pt;font-weight:400;line-height:120%"">Beginning on June 7, 2021, multiple putative class actions were filed', 'style=""color:#000000;font-family:\'Times New Roman\',serif;font-size:10pt;font-weight:400;line-height:120%"">The majority of our marketers use our self-service ad platform to launch and manage their advertising campaigns. We also have a global sales force that is focused on attracting and retaining advertisers and providing support to them throughout the stages of the marketing cycle from pre-purchase decision-making to real-time optimizations to post-campaign analytics. We work directly with these advertisers, as well as through advertising agencies and resellers. We operate offices in more than 90&#160;cities around the globe, the majority of which have a sales presence. We also invest in and rely on self-service tools to provide direct customer support to our users and partners.</span></div><div style=""text-align:justify;text-indent:27pt""><span><br/></span></div><div style=""text-align:justify;text-indent:27pt""><span style=""color:#000000;font-family:\'Times New Roman\',serif;font-size:10pt;font-weight:400;line-height:120%"">For our RL products, our sales efforts utilize third-party sales channels such as retailers, resellers, and distribution partners, and our direct-to-consumer channel, Meta.com, and several Meta stores. These efforts are focused on driving consumer and enterprise sales and adoption of our Meta Quest portfolio of products and AI glasses. </span></div><div style=""height:54pt;position:relative;width:100%""><div style=""bottom:0;position:absolute;width:100%""><div style=""text-align:center""><span style=""color:#000000;font-family:\'Times New Roman\',serif;font-size:10pt;font-weight:400;line-height:120%"">8</span></div></div></div><hr style=""page-break-after:always""/><div style=""min-height:54pt;width:100%""><div><span><br/></span></div><div><span><br/></span></div><div><span style=""color:#0000ff;font-family:\'Times New Roman\',serif;font-size:10pt;font-weight:400;line-height:120%;text-decoration:underline""><a style=""color:#0000ff;font-family:\'Times New', '""localname"": ""MeasureName"",\n     ""presentation"": [\n      ""http://xbrl.sec.gov/ecd/role/PvpDisclosure""\n     ],\n     ""lang"": {\n      ""en-us"": {\n       ""role"": {\n        ""terseLabel"": ""Name"",\n        ""label"": ""Measure Name""\n       }\n      }\n     },\n     ""auth_ref"": [\n      ""r1179""\n     ]\n    },\n    ""meta_MetaPlatformsIrelandLimitedMember"": {\n     ""xbrltype"": ""domainItemType"",\n     ""nsuri"": ""http://www.facebook.com/20251231"",\n     ""localname"": ""MetaPlatformsIrelandLimitedMember"",\n     ""presentation"": [\n      ""http://www.facebook.com/role/CommitmentsandContingenciesNarrativeDetails""\n     ],\n     ""lang"": {\n      ""en-us"": {\n       ""role"": {\n        ""terseLabel"": ""Meta Ireland"",\n        ""label"": ""Meta Platforms Ireland Limited [Member]"",\n        ""documentation"": ""Meta Platforms Ireland Limited""\n       }\n      }\n     },\n     ""auth_ref"": []\n    },\n    ""srt_MinimumMember"": {\n     ""xbrltype"": ""domainItemType"",\n     ""nsuri"": ""http://fasb.org/srt/2025"",\n     ""localname"": ""MinimumMember"",\n     ""presentation"": [\n      ""http://www.facebook.com/role/CommitmentsandContingenciesNarrativeDetails"",\n      ""http://www.facebook.com/role/LeasesNarrativeDetails"",\n      ""http://www.facebook.com/role/LongtermDebtScheduleofCarryingValuesandEstimatedFairValuesofDebtInstrumentsDetails"",\n      ""http://www.facebook.com/role/SummaryofSignificantAccountingPoliciesEstimatedUsefulLivesofPropertyandEquipmentDetails"",\n      ""http://www.facebook.com/role/SummaryofSignificantAccountingPoliciesNarrativeDetails""\n     ],\n     ""lang"": {\n      ""en-us"": {\n       ""role"": {\n        ""verboseLabel"": ""Minimum"",\n        ""terseLabel"": ""Minimum"",\n        ""label"": ""Minimum [Member]"",\n        ""documentation"": ""Lower limit of the provided range.""\n       }\n      }\n     },\n     ""auth_ref"": [\n      ""r127"",\n      ""r129"",\n      ""r131"",\n      ""r132"",\n      ""r134"",\n      ""r151"",\n      ""r153"",\n      ""r154"",\n      ""r156"",\n      ""r157"",\n      ""r260"",\n      ""r387"",\n      ""r388"",\n      ""r389"",\n      ""r390"",\n      ""r476"",', 'directors and officers alleging violations of securities laws in connection with the disclosure of our earnings results for the fourth quarter of 2021 and seeking unspecified damages (</span><span style=""color:#000000;font-family:\'Times New Roman\',serif;font-size:10pt;font-style:italic;font-weight:400;line-height:120%"">Plumbers &amp; Steamfitters Local 60 Pension Trust v. Meta Platforms, Inc.</span><span style=""color:#000000;font-family:\'Times New Roman\',serif;font-size:10pt;font-weight:400;line-height:120%"">). On July 18, 2023, the court dismissed the claims against Meta and its officers with leave to amend. On September 18, 2023, the plaintiffs filed an amended complaint and on September 17, 2024, the court dismissed the claims with prejudice. On October 14, 2024, plaintiffs filed their notice of appeal and oral argument was held on January 6, 2026.</span></div><div style=""text-indent:27pt""><span><br/></span></div><div style=""text-indent:27pt""><span style=""color:#000000;font-family:\'Times New Roman\',serif;font-size:10pt;font-style:italic;font-weight:400;line-height:120%"">Youth-Related Actions</span></div><div style=""text-align:justify;text-indent:27pt""><span><br/></span></div><div style=""text-align:justify;text-indent:27pt""><span style=""color:#000000;font-family:\'Times New Roman\',serif;font-size:10pt;font-weight:400;line-height:120%"">Beginning in January 2022, we became subject to litigation and other proceedings that were filed in various federal and state courts in the United States as well as other jurisdictions alleging that Facebook and Instagram cause ""social media addiction"" in users, with most proceedings focused on those under 18 years old, resulting in various mental health and other harms. Putative class actions have been filed in the United States, Brazil, Canada, Europe, and elsewhere on behalf of users in those jurisdictions, and numerous school districts, municipalities, and tribal nations have filed public nuisance claims in the United States,', 'FTC filed its opposition and its own motion for partial summary judgment on May 24, 2024. On November 13, 2024, the court granted in part and denied in part both our and the FTC\'s motions for summary judgment. Trial began on April 14, 2025 and concluded on May 27, 2025. On November 18, 2025, the court granted judgment in our favor. On January 20, 2026, the FTC filed a notice of appeal of that ruling. Multiple putative class actions have also been filed in state and federal courts in the United States and in the United Kingdom against us alleging violations of antitrust laws and other causes of action in connection with these acquisitions and/or other alleged anticompetitive conduct, and seeking damages and injunctive relief. Several of the cases brought on behalf of certain advertisers and users in the United States were consolidated in the U.S. District Court for the Northern District of California (</span><span style=""color:#000000;font-family:\'Times New Roman\',serif;font-size:10pt;font-style:italic;font-weight:400;line-height:120%"">Klein et al., v. Meta Platforms, Inc.</span><span style=""color:#000000;font-family:\'Times New Roman\',serif;font-size:10pt;font-weight:400;line-height:120%"">). On December 30, 2024, we filed our motion for summary judgment in the putative class action brought on behalf of certain advertisers, which is pending with the court. On January 24, 2025, the court denied plaintiffs\' motion for class certification in the action brought on behalf of users, permitting it to proceed only on an individual basis as to the named plaintiffs. On September 29, 2025, in the user action, the court granted our motion, entering judgment in our favor. On October 27, 2025, plaintiffs in the user action filed a notice of appeal.</span></div><div style=""text-align:justify;text-indent:27pt""><span><br/></span></div><div style=""text-align:justify;text-indent:27pt""><span style=""color:#000000;font-family:\'Times New', '""lang"": {\n      ""en-us"": {\n       ""role"": {\n        ""terseLabel"": ""City Area Code"",\n        ""label"": ""City Area Code"",\n        ""documentation"": ""Area code of city""\n       }\n      }\n     },\n     ""auth_ref"": []\n    },\n    ""us-gaap_ClassOfStockDomain"": {\n     ""xbrltype"": ""domainItemType"",\n     ""nsuri"": ""http://fasb.org/us-gaap/2025"",\n     ""localname"": ""ClassOfStockDomain"",\n     ""presentation"": [\n      ""http://www.facebook.com/role/AcquisitionsGoodwillandIntangibleAssetsNarrativeDetails"",\n      ""http://www.facebook.com/role/CONSOLIDATEDBALANCESHEETSParenthetical"",\n      ""http://www.facebook.com/role/Coverpage"",\n      ""http://www.facebook.com/role/EarningsperShareScheduleofNumeratorsandDenominatorsofBasicandDilutedEPSComputationsforCommonStockDetails"",\n      ""http://www.facebook.com/role/StockholdersEquityCapitalReturnProgramNarrativeDetails"",\n      ""http://www.facebook.com/role/StockholdersEquityCommonStockNarrativeDetails"",\n      ""http://www.facebook.com/role/StockholdersEquityScheduleofDividenddividendEquivalentActivityDetails""\n     ],\n     ""lang"": {\n      ""en-us"": {\n       ""role"": {\n        ""terseLabel"": ""Class of Stock [Domain]"",\n        ""label"": ""Class of Stock [Domain]"",\n        ""documentation"": ""Share of stock differentiated by the voting rights the holder receives. Examples include, but are not limited to, common stock, redeemable preferred stock, nonredeemable preferred stock, and convertible stock.""\n       }\n      }\n     },\n     ""auth_ref"": [\n      ""r126"",\n      ""r173"",\n      ""r174"",\n      ""r175"",\n      ""r208"",\n      ""r211"",\n      ""r235"",\n      ""r239"",\n      ""r242"",\n      ""r245"",\n      ""r253"",\n      ""r254"",\n      ""r333"",\n      ""r391"",\n      ""r393"",\n      ""r394"",\n      ""r395"",\n      ""r398"",\n      ""r399"",\n      ""r424"",\n      ""r425"",\n      ""r427"",\n      ""r428"",\n      ""r430"",\n      ""r432"",\n      ""r434"",\n      ""r435"",\n      ""r437"",\n      ""r438"",\n      ""r440"",\n      ""r681"",\n      ""r862"",\n      ""r863"",\n      ""r864"",\n      ""r865"",\n      ""r868"",\n      ""r870"",', 'in the United States, Europe, and other jurisdictions. Such investigations, inquiries, and lawsuits concern, among other things, our business practices in the areas of social networking or social media services, digital advertising, and/or mobile or online applications, as well as our acquisitions. For example, in 2019 we became the subject of antitrust </span></div><div style=""text-align:justify""><span style=""color:#000000;font-family:\'Times New Roman\',serif;font-size:10pt;font-weight:400;line-height:120%"">investigations by the FTC and U.S. Department of Justice. On December&#160;9, 2020, the FTC filed a complaint (</span><span style=""color:#000000;font-family:\'Times New Roman\',serif;font-size:10pt;font-style:italic;font-weight:400;line-height:120%"">FTC v. Meta Platforms, Inc.</span><span style=""color:#000000;font-family:\'Times New Roman\',serif;font-size:10pt;font-weight:400;line-height:120%"">) against us in the U.S. District Court for the District of Columbia alleging that we engaged in anticompetitive conduct and unfair methods of competition in violation of Section&#160;5 of the Federal Trade Commission Act and Section&#160;2 of the Sherman Act, including by acquiring Instagram in 2012 and WhatsApp in 2014 and by maintaining conditions on access to our platform. The FTC sought a permanent injunction against our company\'s alleged violations of the antitrust laws, and other equitable relief, including divestiture or reconstruction of Instagram and WhatsApp. On June 28, 2021, the court granted our motion to dismiss the complaint filed by the FTC with leave to amend. On August&#160;19, 2021, the FTC filed an amended complaint, and on October&#160;4, 2021, we filed a motion to dismiss this amended complaint. On January&#160;11, 2022, the court denied our motion to dismiss the FTC\'s amended complaint. On April 5, 2024, we filed our motion for summary judgment and the FTC filed its opposition and its own motion for partial summary judgment on May 24, 2024. On November', ""[WEB ARAMASI KAYNAĞI]: Yerel veri tabanında bulunamayan bilgi için internet ve finansal API'ler üzerinden şu güncel veriler elde edilmiştir:\nMeta Platforms, Inc. is incorporated in the state of Delaware (DE). However, its headquarters is located in Menlo Park, California (CA).""]","Meta Platforms, Inc. is incorporated in the state of Delaware.",Meta Platforms is incorporated in Delaware.,0.0909090909,1.0,1.0,0.9699038890062744
In which state is Walmart incorporated?,"['""Sam\'s Choice,"" ""Scoop,"" ""Spring Valley,"" ""Time and Tru,"" ""Way to Celebrate"" and ""Wonder Nation."" The Company also markets lines of merchandise under licensed brands, some of which include: ""Avia,"" ""Better Homes&#160;&amp; Gardens,"" ""Sofia Jeans by Sofia Vergara"" and ""The Pioneer Woman.""</span></div><div style=""margin-top:5pt""><span style=""color:#000000;font-family:\'Times New Roman\',serif;font-size:10pt;font-weight:400;line-height:120%"">Other offerings in the Walmart U.S. business include advertising solutions for brands and online marketplace sellers, supply chain and fulfillment capabilities to online marketplace sellers, and data analytics and insights for suppliers and brands. Additional offerings include fuel, financial services and related products such as money orders, prepaid access, money transfers, check cashing, bill payment and certain types of installment lending. </span></div><div id=""i6e16e33efce1499a82f13fd9f63b74c6_22""></div><div style=""margin-top:9pt""><span style=""color:#000000;font-family:\'Times New Roman\',serif;font-size:10pt;font-weight:700;line-height:120%"">Walmart International Segment</span></div><div style=""margin-top:5pt""><span style=""color:#000000;font-family:\'Times New Roman\',serif;font-size:10pt;font-weight:400;line-height:120%"">Walmart International is our second largest segment and operates 5,743 stores across 18 countries outside of the U.S. Walmart International operates through our wholly-owned subsidiaries in Canada, Chile, China, and Africa (which includes Botswana, Eswatini, Lesotho, Malawi, Mozambique, Namibia, South Africa and Zambia), and our majority-owned subsidiaries in India, as well as Mexico and Central America (which includes Costa Rica, El Salvador, Guatemala, Honduras and Nicaragua). </span></div><div style=""margin-top:5pt""><span style=""color:#000000;font-family:\'Times New Roman\',serif;font-size:10pt;font-weight:400;line-height:120%"">Walmart International includes numerous formats divided into two major categories:', '<td class=""text"">Summary of Significant Accounting Policies<div style=""margin-top:5pt""><span style=""color:#000000;font-family:\'Times New Roman\',serif;font-size:10pt;font-style:italic;font-weight:700;line-height:120%"">General</span></div><div style=""margin-top:5pt""><span style=""color:#000000;font-family:\'Times New Roman\',serif;font-size:10pt;font-weight:400;line-height:120%"">Walmart Inc. (""Walmart"" or the ""Company"") is a people-led, technology-powered omnichannel retailer dedicated to helping people around the world save money and live better by providing the opportunity to shop in both retail stores and through eCommerce. Through innovation, the Company is striving to continuously improve a customer-centric experience that seamlessly integrates eCommerce and retail stores in an omnichannel offering that saves time for its customers. </span></div><div style=""margin-top:5pt""><span style=""color:#000000;font-family:\'Times New Roman\',serif;font-size:10pt;font-weight:400;line-height:120%"">The Company\'s operations comprise three reportable segments: Walmart U.S., Walmart International and Sam\'s Club U.S.</span></div><div style=""margin-top:9pt""><span style=""color:#000000;font-family:\'Times New Roman\',serif;font-size:10pt;font-style:italic;font-weight:700;line-height:120%"">Principles of Consolidation</span></div><div style=""margin-top:5pt""><span style=""color:#000000;font-family:\'Times New Roman\',serif;font-size:10pt;font-weight:400;line-height:120%"">The Consolidated Financial Statements include the accounts of Walmart and its subsidiaries as of and for the fiscal years ended January&#160;31, 2026 (""fiscal 2026""), January&#160;31, 2025 (""fiscal 2025"") and January&#160;31, 2024 (""fiscal 2024""). Intercompany accounts and transactions have been eliminated in consolidation. The Company consolidates variable interest entities where it has been determined that the Company is the primary beneficiary of those entities\' operations. Investments in common stock or in-substance common', 'href=""https://www.sec.gov/Archives/edgar/data/104169/000010416918000028/exhibit10d.htm"">Walmart Inc. Stock Incentive Plan of 2015, as amended effective February 1, 2018 is incorporated by reference to Exhibit 10(d) to the Annual Report on Form 10-K of the Company for the fiscal year ended January 31, 2018, filed on March 30, 2018</a></span><span style=""color:#000000;font-family:\'Times New Roman\',serif;font-size:6.5pt;font-weight:400;line-height:120%;position:relative;top:-3.5pt;vertical-align:baseline""> (C)</span></div></td></tr><tr style=""height:3pt""><td colspan=""3"" style=""padding:0 1pt""/><td colspan=""6"" style=""padding:0 1pt""/></tr><tr><td colspan=""3"" style=""padding:2px 1pt;text-align:left;vertical-align:top""><div><span style=""color:#000000;font-family:\'Times New Roman\',serif;font-size:10pt;font-weight:400;line-height:100%"">10.5</span></div></td><td colspan=""3"" style=""padding:0 1pt""/><td colspan=""3"" style=""padding:2px 1pt;text-align:left;vertical-align:top""><div><span style=""color:#0000ff;font-family:\'Times New Roman\',serif;font-size:10pt;font-weight:400;line-height:120%;text-decoration:underline""><a style=""-sec-extract:exhibit;color:#0000ff;font-family:\'Times New Roman\',serif;font-size:10pt;font-weight:400;line-height:120%;text-decoration:underline"" href=""https://www.sec.gov/Archives/edgar/data/104169/000010416923000020/wmtexhibit105fy23.htm"">Walmart Inc. Supplemental Executive Retirement Plan, as amended and restated effective February 1, 2023 is incorporated by reference to Exhibit 10.5 to the Annual Report on Form 10-K of the Company for the fiscal year ended January 31, 2023 filed on March 17, 2023</a></span><span style=""color:#000000;font-family:\'Times New Roman\',serif;font-size:10pt;font-weight:400;line-height:120%""> </span><span style=""color:#000000;font-family:\'Times New Roman\',serif;font-size:6.5pt;font-weight:400;line-height:120%;position:relative;top:-3.5pt;vertical-align:baseline"">(C)</span></div></td></tr><tr style=""height:3pt""><td colspan=""3""', '2024 (""fiscal 2024""). During fiscal 2026, we generated total revenues of $713.2 billion, which primarily comprised net sales of $706.4 billion.</span></div><div style=""margin-top:5pt""><span style=""color:#000000;font-family:\'Times New Roman\',serif;font-size:10pt;font-weight:400;line-height:120%"">We maintain our principal offices in Bentonville, Arkansas. Our common stock trades on the Nasdaq Global Select Market under the symbol ""WMT.""</span></div><div style=""margin-top:9pt""><span style=""color:#000000;font-family:\'Times New Roman\',serif;font-size:10pt;font-weight:700;line-height:120%"">The Development of Our Company</span></div><div style=""margin-top:5pt""><span style=""color:#000000;font-family:\'Times New Roman\',serif;font-size:10pt;font-weight:400;line-height:120%"">The businesses conducted by our founders began in 1945 when Sam M. Walton opened a franchise Ben Franklin variety store in Newport, Arkansas. In 1946, his brother, James L. Walton, opened a similar store in Versailles, Missouri. Until 1962, our founders\' business was devoted entirely to the operation of variety stores, at which time we began to open discount stores. We completed our initial public offering in 1970. In 1983, we opened our first Sam\'s Club, and in 1988, we opened our first supercenter. In 1998, we opened our first Walmart Neighborhood Market. In 1991, we began our first international initiative when we entered into a joint venture in Mexico and, as of January&#160;31, 2026, our Walmart International segment conducted business in 18 countries.</span></div><div style=""margin-top:5pt""><span style=""color:#000000;font-family:\'Times New Roman\',serif;font-size:10pt;font-weight:400;line-height:120%"">In 1996, we began our first eCommerce initiative by creating both walmart.com and samsclub.com. Since then, our eCommerce presence has continued to grow. In 2007, leveraging our physical stores, walmart.com launched its Site-to-Store service, enabling customers to make a purchase online and pick up', 'style=""color:#000000;font-family:\'Times New Roman\',serif;font-size:12pt;font-style:italic;font-weight:700;line-height:120%"">Company</font><font style=""color:#000000;font-family:\'Times New Roman\',serif;font-size:12pt;font-weight:400;line-height:120%"">&#8221; shall mean Walmart Inc. a Delaware corporation, together with its subsidiaries and affiliates. </font></div><div style=""height:59.04pt;position:relative;width:100%""><div style=""bottom:0;position:absolute;width:100%""><div style=""text-align:center""><font style=""color:#000000;font-family:\'Times New Roman\',serif;font-size:12pt;font-weight:400;line-height:80%"">1  </font></div></div></div><hr style=""page-break-after:always""><div style=""min-height:46.08pt;width:100%""><div style=""text-align:right""><table style=""border-collapse:collapse;display:inline-table;margin-bottom:5pt;vertical-align:text-bottom;width:9.384%""><tr><td style=""width:1.0%""></td><td style=""width:98.900%""></td><td style=""width:0.1%""></td></tr><tr style=""height:15pt""><td colspan=""3"" style=""padding:0 1pt""><div style=""margin-top:0.6pt;padding-left:1pt""><font><br></font></div></td></tr></table></div></div><div style=""margin-top:0.5pt""><font><br></font></div><div style=""padding-left:78pt;text-indent:-36pt""><font style=""color:#000000;font-family:\'Times New Roman\',serif;font-size:12pt;font-weight:400;line-height:120%"">(g)</font><font style=""color:#000000;font-family:\'Times New Roman\',serif;font-size:12pt;font-weight:400;line-height:120%;padding-left:22.02pt"">&#8220;</font><font style=""color:#000000;font-family:\'Times New Roman\',serif;font-size:12pt;font-style:italic;font-weight:700;line-height:120%"">Effective Date</font><font style=""color:#000000;font-family:\'Times New Roman\',serif;font-size:12pt;font-weight:400;line-height:120%"">&#8221; shall mean October 2, 2023.</font></div><div style=""margin-top:0.5pt""><font><br></font></div><div style=""padding-left:6pt;padding-right:5.85pt;text-align:justify;text-indent:36pt""><font style=""color:#000000;font-family:\'Times', 'Inc.</span></div><div style=""margin-top:5pt;text-align:center""><span style=""color:#000000;font-family:\'Times New Roman\',serif;font-size:10pt;font-weight:700;line-height:120%"">Notes to Consolidated Financial Statements</span></div><div id=""i6e16e33efce1499a82f13fd9f63b74c6_145""></div><div style=""margin-top:9pt""><span style=""color:#000000;font-family:\'Times New Roman\',serif;font-size:10pt;font-weight:700;line-height:120%"">Note 1.  <ix:nonNumeric contextRef=""c-1"" name=""us-gaap:OrganizationConsolidationAndPresentationOfFinancialStatementsDisclosureTextBlock"" id=""f-474"" continuedAt=""f-474-1"" escape=""true"">Summary of Significant Accounting Policies</ix:nonNumeric></span></div><ix:continuation id=""f-474-1"" continuedAt=""f-474-2""><div style=""margin-top:5pt""><span style=""color:#000000;font-family:\'Times New Roman\',serif;font-size:10pt;font-style:italic;font-weight:700;line-height:120%"">General</span></div><div style=""margin-top:5pt""><span style=""color:#000000;font-family:\'Times New Roman\',serif;font-size:10pt;font-weight:400;line-height:120%"">Walmart Inc. (""Walmart"" or the ""Company"") is a people-led, technology-powered omnichannel retailer dedicated to helping people around the world save money and live better by providing the opportunity to shop in both retail stores and through eCommerce. Through innovation, the Company is striving to continuously improve a customer-centric experience that seamlessly integrates eCommerce and retail stores in an omnichannel offering that saves time for its customers. </span></div><div style=""margin-top:5pt""><span style=""color:#000000;font-family:\'Times New Roman\',serif;font-size:10pt;font-weight:400;line-height:120%"">The Company\'s operations comprise <ix:nonFraction unitRef=""segment"" contextRef=""c-1"" decimals=""INF"" name=""us-gaap:NumberOfReportableSegments"" format=""ixt-sec:numwordsen"" scale=""0"" id=""f-475"">three</ix:nonFraction> reportable segments: Walmart U.S., Walmart International and Sam\'s Club U.S.</span></div><ix:nonNumeric', '""http://www.walmart.com/role/SummaryofSignificantAccountingPoliciesScheduleofGoodwillDetails""\n     ],\n     ""lang"": {\n      ""en-us"": {\n       ""role"": {\n        ""terseLabel"": ""Walmart\\u00a0U.S."",\n        ""label"": ""Walmart US [Member]"",\n        ""documentation"": ""Walmart U.S. is a business segment of Wal-Mart Stores, Inc. which includes the Company\'s mass merchant concept in the United States and Puerto Rico, operating under the \\""Walmart\\"" or \\""Wal-Mart\\"" brand, as well as walmart.com.""\n       }\n      }\n     },\n     ""auth_ref"": []\n    },\n    ""us-gaap_WeightedAverageNumberDilutedSharesOutstandingAdjustment"": {\n     ""xbrltype"": ""sharesItemType"",\n     ""nsuri"": ""http://fasb.org/us-gaap/2025"",\n     ""localname"": ""WeightedAverageNumberDilutedSharesOutstandingAdjustment"",\n     ""calculation"": {\n      ""http://www.walmart.com/role/NetIncomePerCommonShareScheduleofCalculationofNumeratorandDenominatorinEarningsPerShareDetails"": {\n       ""parentTag"": ""us-gaap_WeightedAverageNumberOfDilutedSharesOutstanding"",\n       ""weight"": 1.0,\n       ""order"": 2.0\n      }\n     },\n     ""presentation"": [\n      ""http://www.walmart.com/role/NetIncomePerCommonShareScheduleofCalculationofNumeratorandDenominatorinEarningsPerShareDetails""\n     ],\n     ""lang"": {\n      ""en-us"": {\n       ""role"": {\n        ""verboseLabel"": ""Dilutive impact of share-based awards (in shares)"",\n        ""label"": ""Weighted Average Number of Shares Outstanding, Diluted, Adjustment"",\n        ""documentation"": ""The sum of dilutive potential common shares or units used in the calculation of the diluted per-share or per-unit computation.""\n       }\n      }\n     },\n     ""auth_ref"": [\n      ""r1305""\n     ]\n    },\n    ""us-gaap_WeightedAverageNumberOfDilutedSharesOutstanding"": {\n     ""xbrltype"": ""sharesItemType"",\n     ""nsuri"": ""http://fasb.org/us-gaap/2025"",\n     ""localname"": ""WeightedAverageNumberOfDilutedSharesOutstanding"",\n     ""calculation"": {', 'style=""color:#000000;font-family:\'Times New Roman\',serif;font-size:10pt;font-weight:400;line-height:120%"">Walmart International includes numerous formats divided into two major categories: retail and wholesale. These categories consist of many formats, including: supercenters, supermarkets, warehouse clubs (including our membership-only Sam\'s Club format) and cash and carry, as well as eCommerce through websites and mobile applications, including walmart.com.mx, walmart.ca, flipkart.com, PhonePe, samclub.cn and other sites. Walmart International had net sales of $130.4 billion for fiscal 2026, representing 19% of our fiscal 2026 consolidated net sales, and had net sales of $121.9 billion and $114.6 billion for fiscal 2025 and 2024, respectively. </span></div><div style=""margin-top:5pt""><span style=""color:#000000;font-family:\'Times New Roman\',serif;font-size:10pt;font-weight:400;line-height:120%"">Walmart International\'s purpose is to help millions of customers and members save money and live better every day by leveraging our global ecosystem and deep local expertise to provide access to affordable products and services. In addition, we share what we learn in our markets to help the enterprise innovate and grow even faster. We are deliberate about where and how we choose to operate to best enable long-term, sustainable and profitable growth.</span></div><div style=""height:36pt;position:relative;width:100%""><div style=""bottom:0;position:absolute;width:100%""><div style=""text-align:center""><span style=""color:#000000;font-family:\'Times New Roman\',serif;font-size:10pt;font-weight:400;line-height:120%"">7</span></div></div></div><hr style=""page-break-after:always""/><div style=""min-height:36pt;width:100%""><div><span><br/></span></div></div><div style=""margin-top:9pt""><span style=""color:#000000;font-family:\'Times New Roman\',serif;font-size:10pt;font-weight:700;line-height:120%;text-decoration:underline"">Omnichannel.</span><span style=""color:#000000;font-family:\'Times New', 'Plan was initially adopted on March 7, 1991 and ratified by the stockholders of Walmart on June 5, 1992. The Plan was subsequently amended and restated effective January 1,</font><font style=""color:#0c0c0c;font-family:\'Times New Roman\',serif;font-size:12pt;font-weight:700;line-height:122%""> </font><font style=""color:#0c0c0c;font-family:\'Times New Roman\',serif;font-size:12pt;font-weight:400;line-height:122%"">1997 and approved by stockholders at Walmart\'s 1997 Annual Shareholders\' Meeting. The Plan was most recently amended and restated as of January 1, 2009. Walmart reserved and authorized for issuance pursuant to the terms and conditions of the Plan 1,000,000 shares of Common Stock (which number shall be proportionately adjusted to reflect any stock split, reverse stock split, merger, reorganization, spin-off or other similar transaction).</font></div><div style=""margin-top:0.2pt""><font><br></font></div><div style=""padding-left:78.55pt;padding-right:5.6pt;text-align:justify;text-indent:-35.95pt""><font style=""color:#0c0c0c;font-family:\'Times New Roman\',serif;font-size:12pt;font-weight:400;line-height:123%"">(b)</font><font style=""color:#0c0c0c;font-family:\'Times New Roman\',serif;font-size:12pt;font-weight:400;line-height:123%;padding-left:21.97pt"">At its meeting on March 3, 2010, the Committee approved the amendment of this Plan to provide that no further Fees shall be paid or Shares awarded under this Plan on or after June 4, 2010. From and after that date, cash Fees will be paid to Directors as approved by the Board from time to time and Share grants to Directors will be awarded by the Board under the Stock Incentive Plan (subject to approval of an amendment to the Stock Incentive Plan by stockholders).</font></div><div style=""margin-top:11.45pt;padding-left:78.7pt;padding-right:5.6pt;text-align:justify;text-indent:-36.1pt""><font style=""color:#0c0c0c;font-family:\'Times New Roman\',serif;font-size:12pt;font-weight:400;line-height:122%"">(c)</font><font', '}\n      }\n     },\n     ""auth_ref"": [\n      ""r98""\n     ]\n    },\n    ""us-gaap_MinorityInterestDecreaseFromRedemptions"": {\n     ""xbrltype"": ""monetaryItemType"",\n     ""nsuri"": ""http://fasb.org/us-gaap/2025"",\n     ""localname"": ""MinorityInterestDecreaseFromRedemptions"",\n     ""crdr"": ""debit"",\n     ""presentation"": [\n      ""http://www.walmart.com/role/ConsolidatedStatementsofShareholdersEquity"",\n      ""http://www.walmart.com/role/ShareholdersEquityNarrativeDetails""\n     ],\n     ""lang"": {\n      ""en-us"": {\n       ""role"": {\n        ""negatedTerseLabel"": ""Purchase of noncontrolling interest"",\n        ""terseLabel"": ""Purchase of noncontrolling interest"",\n        ""label"": ""Noncontrolling Interest, Decrease from Redemptions or Purchase of Interests"",\n        ""documentation"": ""Decrease in noncontrolling interest (for example, but not limited to, redeeming or purchasing the interests of noncontrolling shareholders, issuance of shares (interests) by the non-wholly owned subsidiary to the parent entity for other than cash, and a buyback of shares (interest) by the non-wholly owned subsidiary from the noncontrolling interests).""\n       }\n      }\n     },\n     ""auth_ref"": [\n      ""r49"",\n      ""r98"",\n      ""r102""\n     ]\n    },\n    ""us-gaap_MinorityInterestOwnershipPercentageByParent"": {\n     ""xbrltype"": ""percentItemType"",\n     ""nsuri"": ""http://fasb.org/us-gaap/2025"",\n     ""localname"": ""MinorityInterestOwnershipPercentageByParent"",\n     ""presentation"": [\n      ""http://www.walmart.com/role/ShareholdersEquityNarrativeDetails""\n     ],\n     ""lang"": {\n      ""en-us"": {\n       ""role"": {\n        ""terseLabel"": ""Aggregate ownership, percent"",\n        ""label"": ""Subsidiary, Ownership Percentage, Parent"",\n        ""documentation"": ""The parent entity\'s interest in net assets of the subsidiary, expressed as a percentage.""\n       }\n      }\n     },\n     ""auth_ref"": []\n    },\n    ""ecd_MnpiDiscTimedForCompValFlag"": {\n     ""xbrltype"": ""booleanItemType"",\n     ""nsuri"": ""http://xbrl.sec.gov/ecd/2025"",', ""[WEB ARAMASI KAYNAĞI]: Yerel veri tabanında bulunamayan bilgi için internet ve finansal API'ler üzerinden şu güncel veriler elde edilmiştir:\nWalmart is incorporated in the state of Delaware. The company was originally incorporated as Wal-Mart, Inc. on October 31, 1969, under Delaware General Corporation Law.""]",Walmart is incorporated in the state of Delaware.,Walmart is incorporated in the State of Delaware.,0.19090909089954547,1.0,1.0,1.0000000000000002
In which state is Nvidia incorporated?,"['style=""color:#000000;font-family:\'NVIDIA Sans\',sans-serif;font-size:9pt;font-weight:400;line-height:120%"">Headquartered in Santa Clara, California, NVIDIA was incorporated in California in April 1993 and reincorporated in Delaware in April 1998.</span></div><div style=""margin-bottom:9pt;text-align:justify""><span style=""color:#000000;font-family:\'NVIDIA Sans\',sans-serif;font-size:9pt;font-weight:400;line-height:120%"">All references to &#8220;NVIDIA,&#8221; &#8220;we,&#8221; &#8220;us,&#8221; &#8220;our&#8221; or the &#8220;Company&#8221; mean NVIDIA Corporation and its subsidiaries.</span></div><div style=""margin-bottom:9pt;text-align:justify""><span style=""color:#000000;font-family:\'NVIDIA Sans\',sans-serif;font-size:9pt;font-weight:400;line-height:120%"">Certain prior fiscal year balances have been reclassified to conform to the current fiscal year presentation. Non-marketable equity securities, previously presented within other assets, were reclassified to be presented separately on our consolidated balance sheets and had no impact to total assets or consolidated statement of cash flows.</span></div></ix:nonNumeric><ix:nonNumeric contextRef=""c-1"" name=""us-gaap:FiscalPeriod"" id=""f-406"" escape=""true""><div style=""margin-bottom:6pt;text-align:justify""><span style=""color:#76b900;font-family:\'NVIDIA Sans\',sans-serif;font-size:9pt;font-weight:700;line-height:120%"">Fiscal Year</span></div><div style=""margin-bottom:9pt;text-align:justify""><span style=""color:#000000;font-family:\'NVIDIA Sans\',sans-serif;font-size:9pt;font-weight:400;line-height:120%"">We operate on a 52- or 53-week year, ending on the last Sunday in January. Fiscal years 2026, 2025 and 2024 were all 52-week years. Fiscal year 2027 will be a 53-week year with the fourth quarter consisting of 14 weeks.</span></div></ix:nonNumeric><ix:nonNumeric contextRef=""c-1"" name=""us-gaap:ConsolidationPolicyTextBlock"" id=""f-407"" escape=""true""><div style=""margin-bottom:6pt;text-align:justify""><span', '<td class=""text""><div style=""margin-bottom:6pt;text-align:justify""><span style=""color:#76b900;font-family:\'NVIDIA Sans\',sans-serif;font-size:9pt;font-weight:700;line-height:120%"">Our Company</span></div><div style=""margin-bottom:9pt;text-align:justify""><span style=""color:#000000;font-family:\'NVIDIA Sans\',sans-serif;font-size:9pt;font-weight:400;line-height:120%"">Headquartered in Santa Clara, California, NVIDIA was incorporated in California in April 1993 and reincorporated in Delaware in April 1998.</span></div><div style=""margin-bottom:9pt;text-align:justify""><span style=""color:#000000;font-family:\'NVIDIA Sans\',sans-serif;font-size:9pt;font-weight:400;line-height:120%"">All references to &#8220;NVIDIA,&#8221; &#8220;we,&#8221; &#8220;us,&#8221; &#8220;our&#8221; or the &#8220;Company&#8221; mean NVIDIA Corporation and its subsidiaries.</span></div><div style=""margin-bottom:9pt;text-align:justify""><span style=""color:#000000;font-family:\'NVIDIA Sans\',sans-serif;font-size:9pt;font-weight:400;line-height:120%"">Certain prior fiscal year balances have been reclassified to conform to the current fiscal year presentation. Non-marketable equity securities, previously presented within other assets, were reclassified to be presented separately on our consolidated balance sheets and had no impact to total assets or consolidated statement of cash flows.</span></div><span></span>\n</td>\n</tr>\n<tr class=""re"">\n<td class=""pl"" style=""border-bottom: 0px;"" valign=""top""><a class=""a"" href=""javascript:void(0);"" onclick=""Show.showAR( this, \'defref_us-gaap_FiscalPeriod\', window );"">Fiscal Year</a></td>', 'Company and Our Businesses</span></div><div style=""margin-bottom:9pt;text-align:justify""><span style=""color:#000000;font-family:\'NVIDIA Sans\',sans-serif;font-size:9pt;font-weight:400;line-height:120%"">NVIDIA pioneered accelerated computing to help solve the most challenging computational problems. Since our original focus on PC graphics, we have expanded to several other large and important computationally intensive fields. Fueled by the sustained demand for exceptional 3D graphics and the scale of the gaming market, NVIDIA has leveraged its GPU architecture to create platforms for scientific computing, AI, data science, autonomous vehicles, robotics, and digital twin applications. NVIDIA is now a data center scale AI infrastructure company reshaping all industries.</span></div><div style=""margin-bottom:9pt;text-align:justify""><span style=""color:#000000;font-family:\'NVIDIA Sans\',sans-serif;font-size:9pt;font-weight:400;line-height:120%"">Our two operating segments are ""Compute &amp; Networking"" and ""Graphics."" Refer to Note 16 of the Notes to the Consolidated Financial Statements in Part IV, Item 15 of this Annual Report on Form 10-K for additional information.</span></div><div style=""margin-bottom:9pt;text-align:justify""><span style=""color:#000000;font-family:\'NVIDIA Sans\',sans-serif;font-size:9pt;font-weight:400;line-height:120%"">Headquartered in Santa Clara, California, NVIDIA was incorporated in California in April 1993 and reincorporated in Delaware in April 1998.</span></div><div id=""i82ea215a7c1f4862b6518f1348ddc832_2280""></div><div style=""margin-bottom:3pt;margin-top:12pt;text-align:justify""><span style=""color:#76b900;font-family:\'NVIDIA Sans\',sans-serif;font-size:9pt;font-weight:700;line-height:120%"">Recent Developments, Future Objectives and Challenges</span></div><div style=""margin-bottom:9pt;text-align:justify""><span style=""color:#000000;font-family:\'NVIDIA Sans\',sans-serif;font-size:9pt;font-weight:400;line-height:120%"">Revenue growth in fiscal year', 'a range of creative, engineering, and design use cases, such as creating visual effects in movies or designing buildings and products. In addition, generative and agentic AI is expanding the market for our workstation-class GPUs, as more enterprise customers develop and deploy AI applications with their data on-premises. </span></div><div style=""margin-bottom:9pt;text-align:justify""><span style=""color:#000000;font-family:\'NVIDIA Sans\',sans-serif;font-size:9pt;font-weight:400;line-height:120%"">Headquartered in Santa Clara, California, NVIDIA was incorporated in California in April 1993 and reincorporated in Delaware in April 1998. </span></div><div id=""i82ea215a7c1f4862b6518f1348ddc832_1845""></div><div style=""margin-bottom:3pt;margin-top:12pt;text-align:justify""><span style=""color:#76b900;font-family:\'NVIDIA Sans\',sans-serif;font-size:9pt;font-weight:700;line-height:120%"">Our Businesses</span></div><div style=""margin-bottom:9pt;text-align:justify""><span style=""color:#000000;font-family:\'NVIDIA Sans\',sans-serif;font-size:9pt;font-weight:400;line-height:120%"">We report our business results in two segments.</span></div><div style=""margin-bottom:9pt;text-align:justify""><span style=""color:#000000;font-family:\'NVIDIA Sans\',sans-serif;font-size:9pt;font-weight:400;line-height:120%"">The Compute &amp; Networking segment includes our Data Center accelerated computing and networking platforms and AI solutions and software, and Automotive platforms and autonomous and electric vehicle solutions including software.</span></div><div style=""margin-bottom:9pt;text-align:justify""><span style=""color:#000000;font-family:\'NVIDIA Sans\',sans-serif;font-size:9pt;font-weight:400;line-height:120%"">The Graphics segment includes GeForce GPUs for gaming and PCs, and Quadro/NVIDIA RTX GPUs for enterprise workstation graphics.</span></div><div id=""i82ea215a7c1f4862b6518f1348ddc832_1861""></div><div style=""margin-bottom:3pt;margin-top:12pt;text-align:justify""><span', '<nvda:NatureOfOperationsPolicyTextBlock contextRef=""c-1"" id=""f-405"">&lt;div style=""margin-bottom:6pt;text-align:justify""&gt;&lt;span style=""color:#76b900;font-family:\'NVIDIA Sans\',sans-serif;font-size:9pt;font-weight:700;line-height:120%""&gt;Our Company&lt;/span&gt;&lt;/div&gt;&lt;div style=""margin-bottom:9pt;text-align:justify""&gt;&lt;span style=""color:#000000;font-family:\'NVIDIA Sans\',sans-serif;font-size:9pt;font-weight:400;line-height:120%""&gt;Headquartered in Santa Clara, California, NVIDIA was incorporated in California in April 1993 and reincorporated in Delaware in April 1998.&lt;/span&gt;&lt;/div&gt;&lt;div style=""margin-bottom:9pt;text-align:justify""&gt;&lt;span style=""color:#000000;font-family:\'NVIDIA Sans\',sans-serif;font-size:9pt;font-weight:400;line-height:120%""&gt;All references to &#x201c;NVIDIA,&#x201d; &#x201c;we,&#x201d; &#x201c;us,&#x201d; &#x201c;our&#x201d; or the &#x201c;Company&#x201d; mean NVIDIA Corporation and its subsidiaries.&lt;/span&gt;&lt;/div&gt;&lt;div style=""margin-bottom:9pt;text-align:justify""&gt;&lt;span style=""color:#000000;font-family:\'NVIDIA Sans\',sans-serif;font-size:9pt;font-weight:400;line-height:120%""&gt;Certain prior fiscal year balances have been reclassified to conform to the current fiscal year presentation. Non-marketable equity securities, previously presented within other assets, were reclassified to be presented separately on our consolidated balance sheets and had no impact to total assets or consolidated statement of cash flows.&lt;/span&gt;&lt;/div&gt;</nvda:NatureOfOperationsPolicyTextBlock>', '<td class=""text"">Organization and Summary of Significant Accounting Policies<div style=""margin-bottom:6pt;text-align:justify""><span style=""color:#76b900;font-family:\'NVIDIA Sans\',sans-serif;font-size:9pt;font-weight:700;line-height:120%"">Our Company</span></div><div style=""margin-bottom:9pt;text-align:justify""><span style=""color:#000000;font-family:\'NVIDIA Sans\',sans-serif;font-size:9pt;font-weight:400;line-height:120%"">Headquartered in Santa Clara, California, NVIDIA was incorporated in California in April 1993 and reincorporated in Delaware in April 1998.</span></div><div style=""margin-bottom:9pt;text-align:justify""><span style=""color:#000000;font-family:\'NVIDIA Sans\',sans-serif;font-size:9pt;font-weight:400;line-height:120%"">All references to &#8220;NVIDIA,&#8221; &#8220;we,&#8221; &#8220;us,&#8221; &#8220;our&#8221; or the &#8220;Company&#8221; mean NVIDIA Corporation and its subsidiaries.</span></div><div style=""margin-bottom:9pt;text-align:justify""><span style=""color:#000000;font-family:\'NVIDIA Sans\',sans-serif;font-size:9pt;font-weight:400;line-height:120%"">Certain prior fiscal year balances have been reclassified to conform to the current fiscal year presentation. Non-marketable equity securities, previously presented within other assets, were reclassified to be presented separately on our consolidated balance sheets and had no impact to total assets or consolidated statement of cash flows.</span></div><div style=""margin-bottom:6pt;text-align:justify""><span style=""color:#76b900;font-family:\'NVIDIA Sans\',sans-serif;font-size:9pt;font-weight:700;line-height:120%"">Fiscal Year</span></div><div style=""margin-bottom:9pt;text-align:justify""><span style=""color:#000000;font-family:\'NVIDIA Sans\',sans-serif;font-size:9pt;font-weight:400;line-height:120%"">We operate on a 52- or 53-week year, ending on the last Sunday in January. Fiscal years 2026, 2025 and 2024 were all 52-week years. Fiscal year 2027 will be a 53-week year with the fourth quarter consisting of 14', '<SEC-DOCUMENT>0001045810-26-000021.txt : 20260225\n<SEC-HEADER>0001045810-26-000021.hdr.sgml : 20260225\n<ACCEPTANCE-DATETIME>20260225164219\nACCESSION NUMBER:\t\t0001045810-26-000021\nCONFORMED SUBMISSION TYPE:\t10-K\nPUBLIC DOCUMENT COUNT:\t\t112\nCONFORMED PERIOD OF REPORT:\t20260125\nFILED AS OF DATE:\t\t20260225\nDATE AS OF CHANGE:\t\t20260225\n\nFILER:\n\n\tCOMPANY DATA:\t\n\t\tCOMPANY CONFORMED NAME:\t\t\tNVIDIA CORP\n\t\tCENTRAL INDEX KEY:\t\t\t0001045810\n\t\tSTANDARD INDUSTRIAL CLASSIFICATION:\tSEMICONDUCTORS & RELATED DEVICES [3674]\n\t\tORGANIZATION NAME:           \t04 Manufacturing\n\t\tEIN:\t\t\t\t943177549\n\t\tSTATE OF INCORPORATION:\t\t\tDE\n\t\tFISCAL YEAR END:\t\t\t0125\n\n\tFILING VALUES:\n\t\tFORM TYPE:\t\t10-K\n\t\tSEC ACT:\t\t1934 Act\n\t\tSEC FILE NUMBER:\t000-23985\n\t\tFILM NUMBER:\t\t26679581\n\n\tBUSINESS ADDRESS:\t\n\t\tSTREET 1:\t\t2788 SAN TOMAS EXPRESSWAY\n\t\tCITY:\t\t\tSANTA CLARA\n\t\tSTATE:\t\t\tCA\n\t\tZIP:\t\t\t95051\n\t\tBUSINESS PHONE:\t\t408-486-2000\n\n\tMAIL ADDRESS:\t\n\t\tSTREET 1:\t\t2788 SAN TOMAS EXPRESSWAY\n\t\tCITY:\t\t\tSANTA CLARA\n\t\tSTATE:\t\t\tCA\n\t\tZIP:\t\t\t95051\n\n\tFORMER COMPANY:\t\n\t\tFORMER CONFORMED NAME:\tNVIDIA CORP/DE\n\t\tDATE OF NAME CHANGE:\t20020612', 'colspan=""3"" style=""padding:0 1pt""/><td colspan=""3"" style=""padding:2px 1pt;text-align:center;vertical-align:top""><span style=""color:#000000;font-family:\'NVIDIA Sans\',sans-serif;font-size:9pt;font-weight:400;line-height:100%"">6/7/2024</span></td></tr><tr><td colspan=""3"" style=""padding:2px 1pt;text-align:center;vertical-align:top""><span style=""color:#000000;font-family:\'NVIDIA Sans\',sans-serif;font-size:9pt;font-weight:400;line-height:100%"">3.4</span></td><td colspan=""3"" style=""padding:0 1pt""/><td colspan=""3"" style=""padding:2px 1pt;text-align:left;vertical-align:top""><div><span style=""color:#0000ff;font-family:\'NVIDIA Sans\',sans-serif;font-size:9pt;font-weight:400;line-height:100%;text-decoration:underline""><a style=""-sec-extract:exhibit;color:#0000ff;font-family:\'NVIDIA Sans\',sans-serif;font-size:9pt;font-weight:400;line-height:100%;text-decoration:underline"" href=""https://www.sec.gov/Archives/edgar/data/1045810/000104581024000069/exhibit31-amendedandrestat.htm"">Bylaws of NVIDIA Corporation, Amended and Restated as of March 12, 2024</a></span></div></td><td colspan=""3"" style=""padding:0 1pt""/><td colspan=""3"" style=""padding:2px 1pt;text-align:center;vertical-align:top""><span style=""color:#000000;font-family:\'NVIDIA Sans\',sans-serif;font-size:9pt;font-weight:400;line-height:100%"">8-K</span></td><td colspan=""3"" style=""padding:0 1pt""/><td colspan=""3"" style=""display:none""/><td colspan=""3"" style=""display:none""/><td colspan=""3"" style=""padding:2px 1pt;text-align:center;vertical-align:top""><span style=""color:#000000;font-family:\'NVIDIA Sans\',sans-serif;font-size:9pt;font-weight:400;line-height:100%"">3.1</span></td><td colspan=""3"" style=""padding:0 1pt""/><td colspan=""3"" style=""padding:2px 1pt;text-align:center;vertical-align:top""><span style=""color:#000000;font-family:\'NVIDIA Sans\',sans-serif;font-size:9pt;font-weight:400;line-height:100%"">3/14/2024</span></td></tr><tr><td colspan=""3"" style=""padding:2px 1pt;text-align:center;vertical-align:top""><span', 'and the Supreme Court&#x2019;s final disposition of the matter. NVIDIA filed a petition for a writ of certiorari on March 4, 2024. On June 17, 2024, the Supreme Court of the United States granted NVIDIA&#x2019;s petition for a writ of certiorari. After briefing and argument, the Supreme Court dismissed NVIDIA&#x2019;s writ of certiorari as improvidently granted on December 11, 2024, and issued judgment on January 13, 2025. On February 20, 2025, the Ninth Circuit&#x2019;s judgment, entered August 25, 2023 and corrected August 28, 2023, took effect, and the case was remanded to the district court for further proceedings.&lt;/span&gt;&lt;/div&gt;&lt;div style=""margin-bottom:9pt;text-align:justify""&gt;&lt;span style=""color:#000000;font-family:\'NVIDIA Sans\',sans-serif;font-size:9pt;font-weight:400;line-height:120%""&gt;The putative derivative lawsuit pending in the United States District Court for the Northern District of California, captioned 4:19-cv-00341-HSG, initially filed January 18, 2019 and titled In re NVIDIA Corporation Consolidated Derivative Litigation, was stayed pending resolution of the plaintiffs&#x2019; appeal in the In Re NVIDIA Corporation Securities Litigation action. On February 22, 2022, the court administratively closed the case, but stated that it would reopen the case once the appeal in the In Re NVIDIA Corporation Securities Litigation action is resolved. The case has not yet been reopened by the court. The lawsuit asserts claims, purportedly on behalf of us, against certain officers and directors of the Company for breach of fiduciary duty, unjust enrichment, waste of corporate assets, and violations of Sections 14(a), 10(b), and 20(a) of the Exchange Act based on the dissemination of allegedly false and misleading statements related to channel inventory and the impact of cryptocurrency mining on GPU demand. The plaintiffs are seeking unspecified damages and other relief, including reforms and improvements to NVIDIA&#x2019;s corporate', 'style=""color:#000000;font-family:\'NVIDIA Sans\',sans-serif;font-size:9pt;font-weight:400;line-height:120%"">NVIDIA pioneered accelerated computing to help solve the most challenging computational problems. NVIDIA is now a data center scale AI infrastructure company reshaping all industries.</span></div><div style=""margin-bottom:9pt;text-align:justify""><span style=""color:#000000;font-family:\'NVIDIA Sans\',sans-serif;font-size:9pt;font-weight:400;line-height:120%"">Our technology stack includes the foundational NVIDIA CUDA development platform that runs on all NVIDIA GPUs, as well as hundreds of domain-specific software libraries, frameworks, algorithms, software development kits, or SDKs, and application programming interfaces, or APIs. This deep and broad software stack accelerates the performance and facilitates the deployment of NVIDIA accelerated computing for computationally intensive workloads such as artificial intelligence, or AI, model training and inference, data analytics, scientific computing, robotics, and 3D graphics, with vertical-specific optimizations to address industries ranging from healthcare and telecom to automotive and manufacturing.</span></div><div style=""margin-bottom:9pt;text-align:justify""><span style=""color:#000000;font-family:\'NVIDIA Sans\',sans-serif;font-size:9pt;font-weight:400;line-height:120%"">Introduced with the Blackwell architecture, our data-center-scale offerings feature extreme co-design where the infrastructure&#8217;s chips, networking, systems, software, and algorithms are holistically architected and optimized to maximize performance and scale. Hundreds of thousands of GPUs can be interconnected to function as a single giant computer. This type of data center architecture and scale is needed for the development and deployment of modern AI and accelerated computing applications. </span></div><div style=""margin-bottom:9pt;text-align:justify""><span style=""color:#000000;font-family:\'NVIDIA', ""[WEB ARAMASI KAYNAĞI]: Yerel veri tabanında bulunamayan bilgi için internet ve finansal API'ler üzerinden şu güncel veriler elde edilmiştir:\nNvidia Corporation, California eyaletinde kurulmuştur. Şirketin merkezi de Santa Clara, California'dadır. Daha fazla bilgi için [Yahoo Finance](https://finance.yahoo.com/quote/NVDA/profile) veya [Wikipedia](https://en.wikipedia.org/wiki/Nvidia) sayfalarını ziyaret edebilirsiniz.""]",Nvidia is incorporated in Delaware.,Nvidia is incorporated in the State of Delaware.,0.9999999999857143,1.0,1.0,0.9071065640500812
What is the exact name of the registrant for ticker GOOGL?,"['FOR REGISTRANT&#8217;S COMMON EQUITY, RELATED STOCKHOLDER MATTERS, AND ISSUER PURCHASES OF EQUITY SECURITIES</span></div><div style=""margin-top:6pt;text-align:justify;text-indent:22.5pt""><span style=""color:#000000;font-family:\'Arial\',sans-serif;font-size:10pt;font-weight:400;line-height:120%"">As of October 2, 2015, Alphabet Inc. became the successor issuer of Google Inc. pursuant to Rule 12g-3(a) under the Exchange Act. Our Class A stock has been listed on the Nasdaq Global Select Market under the symbol &#8220;GOOG&#8221; since August 19, 2004, and under the symbol ""GOOGL"" since April 3, 2014. Prior to August 19, 2004, there was no public market for our stock. Our Class B stock is neither listed nor traded. Our Class C stock has been listed on the Nasdaq Global Select Market under the symbol &#8220;GOOG&#8221; since April 3, 2014.</span></div><div style=""margin-top:6pt;text-align:justify""><span style=""color:#000000;font-family:\'Arial\',sans-serif;font-size:10pt;font-weight:700;line-height:120%"">Holders of Record</span></div><div style=""margin-top:6pt;text-align:justify;text-indent:24.75pt""><span style=""color:#000000;font-family:\'Arial\',sans-serif;font-size:10pt;font-weight:400;line-height:120%"">As of </span><span style=""background-color:#ffffff;color:#000000;font-family:\'Arial\',sans-serif;font-size:10pt;font-weight:400;line-height:120%"">December&#160;31, 2025</span><span style=""color:#000000;font-family:\'Arial\',sans-serif;font-size:10pt;font-weight:400;line-height:120%"">, there were approxim</span><span style=""background-color:#ffffff;color:#000000;font-family:\'Arial\',sans-serif;font-size:10pt;font-weight:400;line-height:120%"">a</span><span style=""color:#000000;font-family:\'Arial\',sans-serif;font-size:10pt;font-weight:400;line-height:120%"">tely 5,861 and 1,611 stock</span><span style=""background-color:#ffffff;color:#000000;font-family:\'Arial\',sans-serif;font-size:10pt;font-weight:400;line-height:120%"">holders of record of our Class&#160;A stock and Class C stock,', 'name=""goog:AccruedCustomerLiabilitiesCurrent"" format=""ixt:num-dot-decimal"" scale=""6"" id=""f-1141"">4,304</ix:nonFraction>&#160;</span></td><td style=""background-color:#cceeff;padding:2px 1pt 2px 0;text-align:right;vertical-align:bottom""/><td colspan=""3"" style=""background-color:#cceeff;padding:0 1pt""/><td colspan=""2"" style=""background-color:#cceeff;padding:2px 0 2px 1pt;text-align:right;vertical-align:bottom""><span style=""color:#000000;font-family:\'Arial\',sans-serif;font-size:10pt;font-weight:400;line-height:100%""><ix:nonFraction unitRef=""usd"" contextRef=""c-20"" decimals=""-6"" name=""goog:AccruedCustomerLiabilitiesCurrent"" format=""ixt:num-dot-decimal"" scale=""6"" id=""f-1142"">5,029</ix:nonFraction>&#160;</span></td><td style=""background-color:#cceeff;padding:2px 1pt 2px 0;text-align:right;vertical-align:bottom""/></tr><tr><td colspan=""3"" style=""background-color:#ffffff;padding:2px 1pt;text-align:left;vertical-align:top""><span style=""color:#000000;font-family:\'Arial\',sans-serif;font-size:10pt;font-weight:400;line-height:100%"">Payables to brokers for unsettled investment trades</span></td><td colspan=""2"" style=""background-color:#ffffff;padding:2px 0 2px 1pt;text-align:right;vertical-align:bottom""><span style=""color:#000000;font-family:\'Arial\',sans-serif;font-size:10pt;font-weight:400;line-height:100%""><ix:nonFraction unitRef=""usd"" contextRef=""c-19"" decimals=""-6"" name=""us-gaap:CommissionsPayableToBrokerDealersAndClearingOrganizations"" format=""ixt:num-dot-decimal"" scale=""6"" id=""f-1143"">3,866</ix:nonFraction>&#160;</span></td><td style=""background-color:#ffffff;padding:2px 1pt 2px 0;text-align:right;vertical-align:bottom""/><td colspan=""3"" style=""background-color:#ffffff;padding:0 1pt""/><td colspan=""2"" style=""background-color:#ffffff;padding:2px 0 2px 1pt;text-align:right;vertical-align:bottom""><span style=""color:#000000;font-family:\'Arial\',sans-serif;font-size:10pt;font-weight:400;line-height:100%""><ix:nonFraction unitRef=""usd"" contextRef=""c-20"" decimals=""-6""', 'href=""googexhibit2101q42025.htm"">Subsidiaries of the Registrant</a></span></div></td><td colspan=""3"" style=""padding:0 1pt""/><td colspan=""3"" style=""padding:0 1pt""/><td colspan=""3"" style=""padding:0 1pt""/><td colspan=""3"" style=""padding:0 1pt""/></tr><tr><td colspan=""3"" style=""padding:2px 1pt;text-align:left;vertical-align:top""><span style=""color:#000000;font-family:\'Arial\',sans-serif;font-size:10pt;font-weight:400;line-height:100%"">23.01</span></td><td colspan=""3"" style=""padding:2px 1pt;text-align:center;vertical-align:top""><span style=""color:#000000;font-family:\'Arial\',sans-serif;font-size:10pt;font-weight:400;line-height:100%"">*</span></td><td colspan=""3"" style=""padding:0 1pt""/><td colspan=""3"" style=""padding:2px 1pt;text-align:left;vertical-align:top""><div><span style=""color:#0000ff;font-family:\'Arial\',sans-serif;font-size:10pt;font-weight:400;line-height:100%;text-decoration:underline""><a style=""-sec-extract:exhibit;color:#0000ff;font-family:\'Arial\',sans-serif;font-size:10pt;font-weight:400;line-height:100%;text-decoration:underline"" href=""googexhibit2301q42025.htm"">Consent of Independent Registered Public Accounting Firm</a></span></div></td><td colspan=""3"" style=""padding:0 1pt""/><td colspan=""3"" style=""padding:0 1pt""/><td colspan=""3"" style=""padding:0 1pt""/><td colspan=""3"" style=""padding:0 1pt""/></tr><tr><td colspan=""3"" style=""padding:2px 1pt;text-align:left;vertical-align:top""><span style=""color:#000000;font-family:\'Arial\',sans-serif;font-size:10pt;font-weight:400;line-height:100%"">24.01</span></td><td colspan=""3"" style=""padding:2px 1pt;text-align:center;vertical-align:top""><span style=""color:#000000;font-family:\'Arial\',sans-serif;font-size:10pt;font-weight:400;line-height:100%"">*</span></td><td colspan=""3"" style=""padding:0 1pt""/><td colspan=""3"" style=""padding:2px 1pt;text-align:left;vertical-align:top""><div><span style=""color:#0000ff;font-family:\'Arial\',sans-serif;font-size:10pt;font-weight:400;line-height:100%;text-decoration:underline""><a', '""lang"": {\n      ""en-us"": {\n       ""role"": {\n        ""terseLabel"": ""Stock Price or TSR Estimation Method"",\n        ""label"": ""Stock Price or TSR Estimation Method [Text Block]""\n       }\n      }\n     },\n     ""auth_ref"": [\n      ""r1326"",\n      ""r1337"",\n      ""r1347"",\n      ""r1380""\n     ]\n    },\n    ""us-gaap_StockAppreciationRightsSARSMember"": {\n     ""xbrltype"": ""domainItemType"",\n     ""nsuri"": ""http://fasb.org/us-gaap/2025"",\n     ""localname"": ""StockAppreciationRightsSARSMember"",\n     ""presentation"": [\n      ""http://xbrl.sec.gov/ecd/role/AwardTimingDisclosure""\n     ],\n     ""lang"": {\n      ""en-us"": {\n       ""role"": {\n        ""terseLabel"": ""Stock Appreciation Rights (SARs)"",\n        ""label"": ""Stock Appreciation Rights (SARs) [Member]"",\n        ""documentation"": ""Right to receive cash or shares equal to appreciation of predetermined number of grantor\'s shares during predetermined time period.""\n       }\n      }\n     },\n     ""auth_ref"": [\n      ""r1619"",\n      ""r1620"",\n      ""r1621"",\n      ""r1622"",\n      ""r1623"",\n      ""r1624"",\n      ""r1625"",\n      ""r1626"",\n      ""r1627"",\n      ""r1628"",\n      ""r1629"",\n      ""r1630"",\n      ""r1631"",\n      ""r1632"",\n      ""r1633"",\n      ""r1634"",\n      ""r1635"",\n      ""r1636"",\n      ""r1637"",\n      ""r1638"",\n      ""r1639"",\n      ""r1640"",\n      ""r1641"",\n      ""r1642"",\n      ""r1643"",\n      ""r1644""\n     ]\n    },\n    ""us-gaap_StockIssuedDuringPeriodSharesNewIssues"": {\n     ""xbrltype"": ""sharesItemType"",\n     ""nsuri"": ""http://fasb.org/us-gaap/2025"",\n     ""localname"": ""StockIssuedDuringPeriodSharesNewIssues"",\n     ""presentation"": [\n      ""http://www.google.com/role/CONSOLIDATEDSTATEMENTSOFSTOCKHOLDERSEQUITY""\n     ],\n     ""lang"": {\n      ""en-us"": {\n       ""role"": {\n        ""terseLabel"": ""Stock issued (in shares)"",\n        ""label"": ""Stock Issued During Period, Shares, New Issues"",\n        ""documentation"": ""Number of new stock issued during the period.""\n       }\n      }\n     },\n     ""auth_ref"": [\n      ""r14"",\n      ""r68"",\n      ""r69"",\n      ""r105"",', '<Position>20</Position>\n    </Report>\n    <Report instance=""goog-20251231.htm"">\n      <IsDefault>false</IsDefault>\n      <HasEmbeddedReports>false</HasEmbeddedReports>\n      <HtmlFileName>R21.htm</HtmlFileName>\n      <LongName>9952169 - Disclosure - Stockholders\' Equity</LongName>\n      <ReportType>Sheet</ReportType>\n      <Role>http://www.google.com/role/StockholdersEquity</Role>\n      <ShortName>Stockholders\' Equity</ShortName>\n      <MenuCategory>Notes</MenuCategory>\n      <Position>21</Position>\n    </Report>\n    <Report instance=""goog-20251231.htm"">\n      <IsDefault>false</IsDefault>\n      <HasEmbeddedReports>false</HasEmbeddedReports>\n      <HtmlFileName>R22.htm</HtmlFileName>\n      <LongName>9952170 - Disclosure - Net Income Per Share</LongName>\n      <ReportType>Sheet</ReportType>\n      <Role>http://www.google.com/role/NetIncomePerShare</Role>\n      <ShortName>Net Income Per Share</ShortName>\n      <MenuCategory>Notes</MenuCategory>\n      <Position>22</Position>\n    </Report>\n    <Report instance=""goog-20251231.htm"">\n      <IsDefault>false</IsDefault>\n      <HasEmbeddedReports>false</HasEmbeddedReports>\n      <HtmlFileName>R23.htm</HtmlFileName>\n      <LongName>9952171 - Disclosure - Compensation Plans</LongName>\n      <ReportType>Sheet</ReportType>\n      <Role>http://www.google.com/role/CompensationPlans</Role>\n      <ShortName>Compensation Plans</ShortName>\n      <MenuCategory>Notes</MenuCategory>\n      <Position>23</Position>\n    </Report>\n    <Report instance=""goog-20251231.htm"">\n      <IsDefault>false</IsDefault>\n      <HasEmbeddedReports>false</HasEmbeddedReports>\n      <HtmlFileName>R24.htm</HtmlFileName>\n      <LongName>9952172 - Disclosure - Income Taxes</LongName>\n      <ReportType>Sheet</ReportType>\n      <Role>http://www.google.com/role/IncomeTaxes</Role>\n      <ShortName>Income Taxes</ShortName>\n      <MenuCategory>Notes</MenuCategory>\n      <Position>24</Position>\n    </Report>\n    <Report instance=""goog-20251231.htm"">', '""unitRef"": ""usd"",\n      ""xsiNil"": ""false"",\n      ""lang"": ""en-US"",\n      ""decimals"": ""-6"",\n      ""ancestors"": [\n       ""span"",\n       ""td"",\n       ""tr"",\n       ""table"",\n       ""div"",\n       ""goog:NonMarketableSecuritiesTableTextBlock"",\n       ""ix:continuation"",\n       ""body"",\n       ""html""\n      ],\n      ""reportCount"": 1,\n      ""baseRef"": ""goog-20251231.htm"",\n      ""first"": true\n     },\n     ""uniqueAnchor"": {\n      ""contextRef"": ""c-1"",\n      ""name"": ""goog:EquitySecuritiesFVNICumulativeGainLossNet"",\n      ""unitRef"": ""usd"",\n      ""xsiNil"": ""false"",\n      ""lang"": ""en-US"",\n      ""decimals"": ""-6"",\n      ""ancestors"": [\n       ""span"",\n       ""div"",\n       ""ix:continuation"",\n       ""body"",\n       ""html""\n      ],\n      ""reportCount"": 1,\n      ""baseRef"": ""goog-20251231.htm"",\n      ""unique"": true\n     }\n    },\n    ""R49"": {\n     ""role"": ""http://www.google.com/role/FinancialInstrumentsContractualMaturityDateofMarketableDebtSecuritiesDetails"",\n     ""longName"": ""9955529 - Disclosure - Financial Instruments - Contractual Maturity Date of Marketable Debt Securities (Details)"",\n     ""shortName"": ""Financial Instruments - Contractual Maturity Date of Marketable Debt Securities (Details)"",\n     ""isDefault"": ""false"",\n     ""groupType"": ""disclosure"",\n     ""subGroupType"": ""details"",\n     ""menuCat"": ""Details"",\n     ""order"": ""49"",\n     ""firstAnchor"": {\n      ""contextRef"": ""c-20"",\n      ""name"": ""us-gaap:AvailableForSaleSecuritiesDebtMaturitiesWithinOneYearFairValue"",\n      ""unitRef"": ""usd"",\n      ""xsiNil"": ""false"",\n      ""lang"": ""en-US"",\n      ""decimals"": ""-6"",\n      ""ancestors"": [\n       ""span"",\n       ""td"",\n       ""tr"",\n       ""table"",\n       ""div"",\n       ""us-gaap:InvestmentsClassifiedByContractualMaturityDateTableTextBlock"",\n       ""ix:continuation"",\n       ""body"",\n       ""html""\n      ],\n      ""reportCount"": 1,\n      ""baseRef"": ""goog-20251231.htm"",\n      ""first"": true,\n      ""unique"": true\n     },\n     ""uniqueAnchor"": {\n      ""contextRef"": ""c-20"",', '""label"": ""November 2025 Senior Unsecured Notes [Member]"",\n        ""documentation"": ""November 2025 Senior Unsecured Notes""\n       }\n      }\n     },\n     ""auth_ref"": []\n    },\n    ""goog_NumberOfClassesOfCommonStock"": {\n     ""xbrltype"": ""integerItemType"",\n     ""nsuri"": ""http://www.google.com/20251231"",\n     ""localname"": ""NumberOfClassesOfCommonStock"",\n     ""presentation"": [\n      ""http://www.google.com/role/StockholdersEquityNarrativeDetails""\n     ],\n     ""lang"": {\n      ""en-us"": {\n       ""role"": {\n        ""terseLabel"": ""Number of authorized classes of stock"",\n        ""label"": ""Number Of Classes Of Common Stock"",\n        ""documentation"": ""Number of classes of common stock authorized by the Board of Directors.""\n       }\n      }\n     },\n     ""auth_ref"": []\n    },\n    ""goog_NumberOfCompaniesEquitySecuritiesWithoutReadilyDeterminableFairValueFVNIUnrealizedGainLoss"": {\n     ""xbrltype"": ""integerItemType"",\n     ""nsuri"": ""http://www.google.com/20251231"",\n     ""localname"": ""NumberOfCompaniesEquitySecuritiesWithoutReadilyDeterminableFairValueFVNIUnrealizedGainLoss"",\n     ""presentation"": [\n      ""http://www.google.com/role/SubsequentEventDetails""\n     ],\n     ""lang"": {\n      ""en-us"": {\n       ""role"": {\n        ""terseLabel"": ""Number of private companies in which unrealized gains were recorded"",\n        ""label"": ""Number Of Companies, Equity Securities Without Readily Determinable Fair Value, FV-NI, Unrealized Gain (Loss)"",\n        ""documentation"": ""Number Of Companies, Equity Securities Without Readily Determinable Fair Value, FV-NI, Unrealized Gain (Loss)""\n       }\n      }\n     },\n     ""auth_ref"": []\n    },\n    ""goog_NumberOfOpenInvestigations"": {\n     ""xbrltype"": ""integerItemType"",\n     ""nsuri"": ""http://www.google.com/20251231"",\n     ""localname"": ""NumberOfOpenInvestigations"",\n     ""presentation"": [\n      ""http://www.google.com/role/CommitmentsandContingenciesDetails""\n     ],\n     ""lang"": {\n      ""en-us"": {\n       ""role"": {', '],\n     ""lang"": {\n      ""en-us"": {\n       ""role"": {\n        ""terseLabel"": ""Share Repurchase Program"",\n        ""label"": ""Share Repurchase Program [Member]"",\n        ""documentation"": ""Share Repurchase Program [Member]""\n       }\n      }\n     },\n     ""auth_ref"": []\n    },\n    ""goog_SharebasedPaymentArrangementNoncashExpenseIncludingLiabilitiesSettled"": {\n     ""xbrltype"": ""monetaryItemType"",\n     ""nsuri"": ""http://www.google.com/20251231"",\n     ""localname"": ""SharebasedPaymentArrangementNoncashExpenseIncludingLiabilitiesSettled"",\n     ""crdr"": ""debit"",\n     ""presentation"": [\n      ""http://www.google.com/role/CompensationPlansNarrativeDetails""\n     ],\n     ""lang"": {\n      ""en-us"": {\n       ""role"": {\n        ""terseLabel"": ""Stock-based compensation expense, awards we expect to settle in Alphabet stock"",\n        ""label"": ""Share-based Payment Arrangement, Noncash Expense, Including Liabilities Settled"",\n        ""documentation"": ""Share-based Payment Arrangement, Noncash Expense, Including Liabilities Settled""\n       }\n      }\n     },\n     ""auth_ref"": []\n    },\n    ""us-gaap_SharesIssued"": {\n     ""xbrltype"": ""sharesItemType"",\n     ""nsuri"": ""http://fasb.org/us-gaap/2025"",\n     ""localname"": ""SharesIssued"",\n     ""presentation"": [\n      ""http://www.google.com/role/CONSOLIDATEDSTATEMENTSOFSTOCKHOLDERSEQUITY""\n     ],\n     ""lang"": {\n      ""en-us"": {\n       ""role"": {\n        ""periodStartLabel"": ""Beginning Balance (in shares)"",\n        ""periodEndLabel"": ""Ending Balance (in shares)"",\n        ""label"": ""Shares, Issued"",\n        ""documentation"": ""Number of shares of stock issued as of the balance sheet date, including shares that had been issued and were previously outstanding but which are now held in the treasury.""\n       }\n      }\n     },\n     ""auth_ref"": [\n      ""r14""\n     ]\n    },\n    ""goog_ShortTermDebtMaximumBorrowingCapacity"": {\n     ""xbrltype"": ""monetaryItemType"",\n     ""nsuri"": ""http://www.google.com/20251231"",\n     ""localname"": ""ShortTermDebtMaximumBorrowingCapacity"",', '""unitRef"": ""usd"",\n      ""xsiNil"": ""false"",\n      ""lang"": ""en-US"",\n      ""decimals"": ""-6"",\n      ""ancestors"": [\n       ""span"",\n       ""div"",\n       ""ix:continuation"",\n       ""body"",\n       ""html""\n      ],\n      ""reportCount"": 1,\n      ""baseRef"": ""goog-20251231.htm"",\n      ""first"": true,\n      ""unique"": true\n     },\n     ""uniqueAnchor"": {\n      ""contextRef"": ""c-20"",\n      ""name"": ""us-gaap:AllowanceForDoubtfulAccountsReceivable"",\n      ""unitRef"": ""usd"",\n      ""xsiNil"": ""false"",\n      ""lang"": ""en-US"",\n      ""decimals"": ""-6"",\n      ""ancestors"": [\n       ""span"",\n       ""div"",\n       ""ix:continuation"",\n       ""body"",\n       ""html""\n      ],\n      ""reportCount"": 1,\n      ""baseRef"": ""goog-20251231.htm"",\n      ""first"": true,\n      ""unique"": true\n     }\n    },\n    ""R70"": {\n     ""role"": ""http://www.google.com/role/SupplementalFinancialStatementInformationPropertyandEquipmentDetails"",\n     ""longName"": ""9955550 - Disclosure - Supplemental Financial Statement Information - Property and Equipment (Details)"",\n     ""shortName"": ""Supplemental Financial Statement Information - Property and Equipment (Details)"",\n     ""isDefault"": ""false"",\n     ""groupType"": ""disclosure"",\n     ""subGroupType"": ""details"",\n     ""menuCat"": ""Details"",\n     ""order"": ""70"",\n     ""firstAnchor"": {\n      ""contextRef"": ""c-20"",\n      ""name"": ""us-gaap:PropertyPlantAndEquipmentAndFinanceLeaseRightOfUseAssetAccumulatedDepreciationAndAmortization"",\n      ""unitRef"": ""usd"",\n      ""xsiNil"": ""false"",\n      ""lang"": ""en-US"",\n      ""decimals"": ""-6"",\n      ""ancestors"": [\n       ""span"",\n       ""td"",\n       ""tr"",\n       ""table"",\n       ""div"",\n       ""us-gaap:PropertyPlantAndEquipmentTextBlock"",\n       ""ix:continuation"",\n       ""body"",\n       ""html""\n      ],\n      ""reportCount"": 1,\n      ""baseRef"": ""goog-20251231.htm"",\n      ""first"": true,\n      ""unique"": true\n     },\n     ""uniqueAnchor"": {\n      ""contextRef"": ""c-20"",', '""ix:continuation"",\n       ""body"",\n       ""html""\n      ],\n      ""reportCount"": 1,\n      ""baseRef"": ""goog-20251231.htm"",\n      ""first"": true,\n      ""unique"": true\n     }\n    },\n    ""R54"": {\n     ""role"": ""http://www.google.com/role/FinancialInstrumentsGainsandLossesonMarketableandNonMarketableEquitySecuritiesDetails"",\n     ""longName"": ""9955534 - Disclosure - Financial Instruments - Gains and Losses on Marketable and Non-Marketable Equity Securities (Details)"",\n     ""shortName"": ""Financial Instruments - Gains and Losses on Marketable and Non-Marketable Equity Securities (Details)"",\n     ""isDefault"": ""false"",\n     ""groupType"": ""disclosure"",\n     ""subGroupType"": ""details"",\n     ""menuCat"": ""Details"",\n     ""order"": ""54"",\n     ""firstAnchor"": {\n      ""contextRef"": ""c-1"",\n      ""name"": ""goog:EquitySecuritiesWithoutReadilyDeterminableFairValueFVNIUnrealizedGain"",\n      ""unitRef"": ""usd"",\n      ""xsiNil"": ""false"",\n      ""lang"": ""en-US"",\n      ""decimals"": ""-6"",\n      ""ancestors"": [\n       ""span"",\n       ""td"",\n       ""tr"",\n       ""table"",\n       ""div"",\n       ""ix:continuation"",\n       ""ix:continuation"",\n       ""body"",\n       ""html""\n      ],\n      ""reportCount"": 1,\n      ""baseRef"": ""goog-20251231.htm"",\n      ""first"": true,\n      ""unique"": true\n     },\n     ""uniqueAnchor"": {\n      ""contextRef"": ""c-1"",\n      ""name"": ""goog:EquitySecuritiesWithoutReadilyDeterminableFairValueFVNIUnrealizedGain"",\n      ""unitRef"": ""usd"",\n      ""xsiNil"": ""false"",\n      ""lang"": ""en-US"",\n      ""decimals"": ""-6"",\n      ""ancestors"": [\n       ""span"",\n       ""td"",\n       ""tr"",\n       ""table"",\n       ""div"",\n       ""ix:continuation"",\n       ""ix:continuation"",\n       ""body"",\n       ""html""\n      ],\n      ""reportCount"": 1,\n      ""baseRef"": ""goog-20251231.htm"",\n      ""first"": true,\n      ""unique"": true\n     }\n    },\n    ""R55"": {\n     ""role"": ""http://www.google.com/role/FinancialInstrumentsDerivativeNotionalAmountsDetails"",', ""[WEB ARAMASI KAYNAĞI]: Yerel veri tabanında bulunamayan bilgi için internet ve finansal API'ler üzerinden şu güncel veriler elde edilmiştir:\nThe exact name of the registrant for ticker GOOGL is **Alphabet Inc.** This company was created through a restructuring of Google on October 2, 2015, and serves as the parent holding company of Google and several former Google subsidiaries.""]",The exact name of the registrant for ticker GOOGL is Alphabet Inc.,The exact name of the registrant is Alphabet Inc.,0.5909090908795455,1.0,1.0,1.0
What is the exact name of the registrant for ticker JPM?,"['""ancestors"": [\n       ""span"",\n       ""td"",\n       ""tr"",\n       ""table"",\n       ""div"",\n       ""body"",\n       ""html""\n      ],\n      ""reportCount"": 1,\n      ""baseRef"": ""jpm-20251231.htm"",\n      ""first"": true\n     },\n     ""uniqueAnchor"": {\n      ""contextRef"": ""c-34"",\n      ""name"": ""jpm:TradingAssets"",\n      ""unitRef"": ""usd"",\n      ""xsiNil"": ""false"",\n      ""lang"": ""en-US"",\n      ""decimals"": ""-6"",\n      ""ancestors"": [\n       ""span"",\n       ""div"",\n       ""td"",\n       ""tr"",\n       ""table"",\n       ""div"",\n       ""body"",\n       ""html""\n      ],\n      ""reportCount"": 1,\n      ""baseRef"": ""jpm-20251231.htm"",\n      ""unique"": true\n     }\n    },\n    ""R7"": {\n     ""role"": ""http://www.jpmorganchase.com/role/ConsolidatedStatementsofChangesinStockholdersEquity"",\n     ""longName"": ""9952155 - Statement - Consolidated Statements of Changes in Stockholders\' Equity"",\n     ""shortName"": ""Consolidated Statements of Changes in Stockholders\' Equity"",\n     ""isDefault"": ""false"",\n     ""groupType"": ""statement"",\n     ""subGroupType"": """",\n     ""menuCat"": ""Statements"",\n     ""order"": ""7"",\n     ""firstAnchor"": {\n      ""contextRef"": ""c-42"",\n      ""name"": ""us-gaap:StockholdersEquity"",\n      ""unitRef"": ""usd"",\n      ""xsiNil"": ""false"",\n      ""lang"": ""en-US"",\n      ""decimals"": ""-6"",\n      ""ancestors"": [\n       ""span"",\n       ""td"",\n       ""tr"",\n       ""table"",\n       ""div"",\n       ""body"",\n       ""html""\n      ],\n      ""reportCount"": 1,\n      ""baseRef"": ""jpm-20251231.htm"",\n      ""first"": true,\n      ""unique"": true\n     },\n     ""uniqueAnchor"": {\n      ""contextRef"": ""c-42"",\n      ""name"": ""us-gaap:StockholdersEquity"",\n      ""unitRef"": ""usd"",\n      ""xsiNil"": ""false"",\n      ""lang"": ""en-US"",\n      ""decimals"": ""-6"",\n      ""ancestors"": [\n       ""span"",\n       ""td"",\n       ""tr"",\n       ""table"",\n       ""div"",\n       ""body"",\n       ""html""\n      ],\n      ""reportCount"": 1,\n      ""baseRef"": ""jpm-20251231.htm"",\n      ""first"": true,\n      ""unique"": true\n     }\n    },\n    ""R8"": {', '<MenuCategory>Details</MenuCategory>\n      <Position>193</Position>\n    </Report>\n    <Report instance=""jpm-20251231.htm"">\n      <IsDefault>false</IsDefault>\n      <HasEmbeddedReports>false</HasEmbeddedReports>\n      <HtmlFileName>R194.htm</HtmlFileName>\n      <LongName>9955658 - Disclosure - Common Stock - Shares Issued (Details)</LongName>\n      <ReportType>Sheet</ReportType>\n      <Role>http://www.jpmorganchase.com/role/CommonStockSharesIssuedDetails</Role>\n      <ShortName>Common Stock - Shares Issued (Details)</ShortName>\n      <MenuCategory>Details</MenuCategory>\n      <Position>194</Position>\n    </Report>\n    <Report instance=""jpm-20251231.htm"">\n      <IsDefault>false</IsDefault>\n      <HasEmbeddedReports>false</HasEmbeddedReports>\n      <HtmlFileName>R195.htm</HtmlFileName>\n      <LongName>9955659 - Disclosure - Common Stock - Repurchases (Details)</LongName>\n      <ReportType>Sheet</ReportType>\n      <Role>http://www.jpmorganchase.com/role/CommonStockRepurchasesDetails</Role>\n      <ShortName>Common Stock - Repurchases (Details)</ShortName>\n      <MenuCategory>Details</MenuCategory>\n      <Position>195</Position>\n    </Report>\n    <Report instance=""jpm-20251231.htm"">\n      <IsDefault>false</IsDefault>\n      <HasEmbeddedReports>false</HasEmbeddedReports>\n      <HtmlFileName>R196.htm</HtmlFileName>\n      <LongName>9955660 - Disclosure - Earnings Per Share (Details)</LongName>\n      <ReportType>Sheet</ReportType>\n      <Role>http://www.jpmorganchase.com/role/EarningsPerShareDetails</Role>\n      <ShortName>Earnings Per Share (Details)</ShortName>\n      <MenuCategory>Details</MenuCategory>\n      <ParentRole>http://www.jpmorganchase.com/role/EarningsPerShareTables</ParentRole>\n      <Position>196</Position>\n    </Report>\n    <Report instance=""jpm-20251231.htm"">\n      <IsDefault>false</IsDefault>\n      <HasEmbeddedReports>false</HasEmbeddedReports>\n      <HtmlFileName>R197.htm</HtmlFileName>', '""div"",\n       ""div"",\n       ""ix:continuation"",\n       ""body"",\n       ""html""\n      ],\n      ""reportCount"": 1,\n      ""baseRef"": ""jpm-20251231.htm"",\n      ""unique"": true\n     }\n    },\n    ""R164"": {\n     ""role"": ""http://www.jpmorganchase.com/role/VariableInterestEntitiesConsolidatedVIEAssetsandLiabilitiesDetails"",\n     ""longName"": ""9955628 - Disclosure - Variable Interest Entities - Consolidated VIE Assets and Liabilities (Details)"",\n     ""shortName"": ""Variable Interest Entities - Consolidated VIE Assets and Liabilities (Details)"",\n     ""isDefault"": ""false"",\n     ""groupType"": ""disclosure"",\n     ""subGroupType"": ""details"",\n     ""menuCat"": ""Details"",\n     ""order"": ""164"",\n     ""firstAnchor"": {\n      ""contextRef"": ""c-30"",\n      ""name"": ""jpm:TradingAssets"",\n      ""unitRef"": ""usd"",\n      ""xsiNil"": ""false"",\n      ""lang"": ""en-US"",\n      ""decimals"": ""-6"",\n      ""ancestors"": [\n       ""span"",\n       ""td"",\n       ""tr"",\n       ""table"",\n       ""div"",\n       ""body"",\n       ""html""\n      ],\n      ""reportCount"": 1,\n      ""baseRef"": ""jpm-20251231.htm"",\n      ""first"": true\n     },\n     ""uniqueAnchor"": {\n      ""contextRef"": ""c-38"",\n      ""name"": ""jpm:BeneficialInterestLiabilityLongTerm"",\n      ""unitRef"": ""usd"",\n      ""xsiNil"": ""false"",\n      ""lang"": ""en-US"",\n      ""decimals"": ""-8"",\n      ""ancestors"": [\n       ""span"",\n       ""div"",\n       ""jpm:InformationOnAssetsAndLiabilitiesRelatedToVIEsThatAreConsolidatedByFirmTableTextBlock"",\n       ""ix:continuation"",\n       ""body"",\n       ""html""\n      ],\n      ""reportCount"": 1,\n      ""baseRef"": ""jpm-20251231.htm"",\n      ""unique"": true\n     }\n    },\n    ""R165"": {\n     ""role"": ""http://www.jpmorganchase.com/role/VariableInterestEntitiesVIEsSponsoredbyThirdPartiesDetails"",\n     ""longName"": ""9955629 - Disclosure - Variable Interest Entities - VIEs Sponsored by Third Parties (Details)"",\n     ""shortName"": ""Variable Interest Entities - VIEs Sponsored by Third Parties (Details)"",\n     ""isDefault"": ""false"",\n     ""groupType"": ""disclosure"",', '""ix:continuation"",\n       ""body"",\n       ""html""\n      ],\n      ""reportCount"": 1,\n      ""baseRef"": ""jpm-20251231.htm"",\n      ""first"": true,\n      ""unique"": true\n     }\n    },\n    ""R108"": {\n     ""role"": ""http://www.jpmorganchase.com/role/NoninterestRevenueandNoninterestExpenseAssetManagementFeesDetails"",\n     ""longName"": ""9955572 - Disclosure - Noninterest Revenue and Noninterest Expense - Asset Management Fees (Details)"",\n     ""shortName"": ""Noninterest Revenue and Noninterest Expense - Asset Management Fees (Details)"",\n     ""isDefault"": ""false"",\n     ""groupType"": ""disclosure"",\n     ""subGroupType"": ""details"",\n     ""menuCat"": ""Details"",\n     ""order"": ""108"",\n     ""firstAnchor"": {\n      ""contextRef"": ""c-1"",\n      ""name"": ""jpm:InvestmentAdvisoryFees1"",\n      ""unitRef"": ""usd"",\n      ""xsiNil"": ""false"",\n      ""lang"": ""en-US"",\n      ""decimals"": ""-6"",\n      ""ancestors"": [\n       ""span"",\n       ""td"",\n       ""tr"",\n       ""table"",\n       ""div"",\n       ""jpm:ComponentsOfAssetManagementFeesTableTextBlock"",\n       ""div"",\n       ""div"",\n       ""ix:continuation"",\n       ""body"",\n       ""html""\n      ],\n      ""reportCount"": 1,\n      ""baseRef"": ""jpm-20251231.htm"",\n      ""first"": true,\n      ""unique"": true\n     },\n     ""uniqueAnchor"": {\n      ""contextRef"": ""c-1"",\n      ""name"": ""jpm:InvestmentAdvisoryFees1"",\n      ""unitRef"": ""usd"",\n      ""xsiNil"": ""false"",\n      ""lang"": ""en-US"",\n      ""decimals"": ""-6"",\n      ""ancestors"": [\n       ""span"",\n       ""td"",\n       ""tr"",\n       ""table"",\n       ""div"",\n       ""jpm:ComponentsOfAssetManagementFeesTableTextBlock"",\n       ""div"",\n       ""div"",\n       ""ix:continuation"",\n       ""body"",\n       ""html""\n      ],\n      ""reportCount"": 1,\n      ""baseRef"": ""jpm-20251231.htm"",\n      ""first"": true,\n      ""unique"": true\n     }\n    },\n    ""R109"": {\n     ""role"": ""http://www.jpmorganchase.com/role/NoninterestRevenueandNoninterestExpenseCommissionsandOtherFeesDetails"",', '""ancestors"": [\n       ""span"",\n       ""td"",\n       ""tr"",\n       ""table"",\n       ""div"",\n       ""jpm:TimeDepositsTwoHundredAndFiftyThousandOrMoreTableTextBlock"",\n       ""ix:continuation"",\n       ""div"",\n       ""div"",\n       ""body"",\n       ""html""\n      ],\n      ""reportCount"": 1,\n      ""baseRef"": ""jpm-20251231.htm"",\n      ""first"": true,\n      ""unique"": true\n     }\n    },\n    ""R182"": {\n     ""role"": ""http://www.jpmorganchase.com/role/DepositsMaturitiesofInterestBearingTimeDepositsDetails"",\n     ""longName"": ""9955646 - Disclosure - Deposits - Maturities of Interest-Bearing Time Deposits (Details)"",\n     ""shortName"": ""Deposits - Maturities of Interest-Bearing Time Deposits (Details)"",\n     ""isDefault"": ""false"",\n     ""groupType"": ""disclosure"",\n     ""subGroupType"": ""details"",\n     ""menuCat"": ""Details"",\n     ""order"": ""182"",\n     ""firstAnchor"": {\n      ""contextRef"": ""c-30"",\n      ""name"": ""us-gaap:TimeDepositMaturitiesNextRollingTwelveMonths"",\n      ""unitRef"": ""usd"",\n      ""xsiNil"": ""false"",\n      ""lang"": ""en-US"",\n      ""decimals"": ""-6"",\n      ""ancestors"": [\n       ""span"",\n       ""td"",\n       ""tr"",\n       ""table"",\n       ""div"",\n       ""us-gaap:TimeDepositMaturitiesTableTextBlock"",\n       ""ix:continuation"",\n       ""div"",\n       ""div"",\n       ""body"",\n       ""html""\n      ],\n      ""reportCount"": 1,\n      ""baseRef"": ""jpm-20251231.htm"",\n      ""first"": true,\n      ""unique"": true\n     },\n     ""uniqueAnchor"": {\n      ""contextRef"": ""c-30"",\n      ""name"": ""us-gaap:TimeDepositMaturitiesNextRollingTwelveMonths"",\n      ""unitRef"": ""usd"",\n      ""xsiNil"": ""false"",\n      ""lang"": ""en-US"",\n      ""decimals"": ""-6"",\n      ""ancestors"": [\n       ""span"",\n       ""td"",\n       ""tr"",\n       ""table"",\n       ""div"",\n       ""us-gaap:TimeDepositMaturitiesTableTextBlock"",\n       ""ix:continuation"",\n       ""div"",\n       ""div"",\n       ""body"",\n       ""html""\n      ],\n      ""reportCount"": 1,\n      ""baseRef"": ""jpm-20251231.htm"",\n      ""first"": true,\n      ""unique"": true\n     }\n    },\n    ""R183"": {', '],\n      ""reportCount"": 1,\n      ""baseRef"": ""jpm-20251231.htm"",\n      ""unique"": true\n     }\n    },\n    ""R195"": {\n     ""role"": ""http://www.jpmorganchase.com/role/CommonStockRepurchasesDetails"",\n     ""longName"": ""9955659 - Disclosure - Common Stock - Repurchases (Details)"",\n     ""shortName"": ""Common Stock - Repurchases (Details)"",\n     ""isDefault"": ""false"",\n     ""groupType"": ""disclosure"",\n     ""subGroupType"": ""details"",\n     ""menuCat"": ""Details"",\n     ""order"": ""195"",\n     ""firstAnchor"": {\n      ""contextRef"": ""c-1962"",\n      ""name"": ""us-gaap:TreasuryStockSharesAcquired"",\n      ""unitRef"": ""shares"",\n      ""xsiNil"": ""false"",\n      ""lang"": ""en-US"",\n      ""decimals"": ""-5"",\n      ""ancestors"": [\n       ""span"",\n       ""td"",\n       ""tr"",\n       ""table"",\n       ""div"",\n       ""us-gaap:ScheduleOfTreasuryStockByClassTextBlock"",\n       ""div"",\n       ""div"",\n       ""ix:continuation"",\n       ""body"",\n       ""html""\n      ],\n      ""reportCount"": 1,\n      ""baseRef"": ""jpm-20251231.htm"",\n      ""first"": true,\n      ""unique"": true\n     },\n     ""uniqueAnchor"": {\n      ""contextRef"": ""c-1962"",\n      ""name"": ""us-gaap:TreasuryStockSharesAcquired"",\n      ""unitRef"": ""shares"",\n      ""xsiNil"": ""false"",\n      ""lang"": ""en-US"",\n      ""decimals"": ""-5"",\n      ""ancestors"": [\n       ""span"",\n       ""td"",\n       ""tr"",\n       ""table"",\n       ""div"",\n       ""us-gaap:ScheduleOfTreasuryStockByClassTextBlock"",\n       ""div"",\n       ""div"",\n       ""ix:continuation"",\n       ""body"",\n       ""html""\n      ],\n      ""reportCount"": 1,\n      ""baseRef"": ""jpm-20251231.htm"",\n      ""first"": true,\n      ""unique"": true\n     }\n    },\n    ""R196"": {\n     ""role"": ""http://www.jpmorganchase.com/role/EarningsPerShareDetails"",\n     ""longName"": ""9955660 - Disclosure - Earnings Per Share (Details)"",\n     ""shortName"": ""Earnings Per Share (Details)"",\n     ""isDefault"": ""false"",\n     ""groupType"": ""disclosure"",\n     ""subGroupType"": ""details"",\n     ""menuCat"": ""Details"",\n     ""order"": ""196"",\n     ""firstAnchor"": {\n      ""contextRef"": ""c-1"",', '""td"",\n       ""tr"",\n       ""table"",\n       ""div"",\n       ""jpm:SecuritizationActivitiesTableTextBlock"",\n       ""ix:continuation"",\n       ""body"",\n       ""html""\n      ],\n      ""reportCount"": 1,\n      ""baseRef"": ""jpm-20251231.htm"",\n      ""first"": true,\n      ""unique"": true\n     },\n     ""uniqueAnchor"": {\n      ""contextRef"": ""c-1711"",\n      ""name"": ""jpm:PrincipalAmountOfFinancialAssetsSoldInSecuritizations"",\n      ""unitRef"": ""usd"",\n      ""xsiNil"": ""false"",\n      ""lang"": ""en-US"",\n      ""decimals"": ""-6"",\n      ""ancestors"": [\n       ""span"",\n       ""td"",\n       ""tr"",\n       ""table"",\n       ""div"",\n       ""jpm:SecuritizationActivitiesTableTextBlock"",\n       ""ix:continuation"",\n       ""body"",\n       ""html""\n      ],\n      ""reportCount"": 1,\n      ""baseRef"": ""jpm-20251231.htm"",\n      ""first"": true,\n      ""unique"": true\n     }\n    },\n    ""R168"": {\n     ""role"": ""http://www.jpmorganchase.com/role/VariableInterestEntitiesLoansSoldtoThirdPartySponsoredSecuritizationEntitiesDetails"",\n     ""longName"": ""9955632 - Disclosure - Variable Interest Entities - Loans Sold to Third-Party Sponsored Securitization Entities (Details)"",\n     ""shortName"": ""Variable Interest Entities - Loans Sold to Third-Party Sponsored Securitization Entities (Details)"",\n     ""isDefault"": ""false"",\n     ""groupType"": ""disclosure"",\n     ""subGroupType"": ""details"",\n     ""menuCat"": ""Details"",\n     ""order"": ""168"",\n     ""firstAnchor"": {\n      ""contextRef"": ""c-1717"",\n      ""name"": ""us-gaap:MortgageLoanRelatedToPropertySales1"",\n      ""unitRef"": ""usd"",\n      ""xsiNil"": ""false"",\n      ""lang"": ""en-US"",\n      ""decimals"": ""-6"",\n      ""ancestors"": [\n       ""span"",\n       ""td"",\n       ""tr"",\n       ""table"",\n       ""div"",\n       ""div"",\n       ""jpm:SummaryOfLoanSaleActivitiesTableTextBlock"",\n       ""div"",\n       ""ix:continuation"",\n       ""body"",\n       ""html""\n      ],\n      ""reportCount"": 1,\n      ""baseRef"": ""jpm-20251231.htm"",\n      ""first"": true,\n      ""unique"": true\n     },\n     ""uniqueAnchor"": {\n      ""contextRef"": ""c-1717"",', '""ix:continuation"",\n       ""body"",\n       ""html""\n      ],\n      ""reportCount"": 1,\n      ""baseRef"": ""jpm-20251231.htm"",\n      ""first"": true,\n      ""unique"": true\n     }\n    },\n    ""R158"": {\n     ""role"": ""http://www.jpmorganchase.com/role/AllowanceforCreditLossesNarrativeDetails"",\n     ""longName"": ""9955622 - Disclosure - Allowance for Credit Losses - Narrative (Details)"",\n     ""shortName"": ""Allowance for Credit Losses - Narrative (Details)"",\n     ""isDefault"": ""false"",\n     ""groupType"": ""disclosure"",\n     ""subGroupType"": ""details"",\n     ""menuCat"": ""Details"",\n     ""order"": ""158"",\n     ""firstAnchor"": {\n      ""contextRef"": ""c-30"",\n      ""name"": ""jpm:ReceivablesAndDebtSecuritiesAllowanceForCreditLossAndOffBalanceSheetCreditLossLiability"",\n      ""unitRef"": ""usd"",\n      ""xsiNil"": ""false"",\n      ""lang"": ""en-US"",\n      ""decimals"": ""-8"",\n      ""ancestors"": [\n       ""span"",\n       ""div"",\n       ""div"",\n       ""div"",\n       ""ix:continuation"",\n       ""body"",\n       ""html""\n      ],\n      ""reportCount"": 1,\n      ""baseRef"": ""jpm-20251231.htm"",\n      ""first"": true,\n      ""unique"": true\n     },\n     ""uniqueAnchor"": {\n      ""contextRef"": ""c-30"",\n      ""name"": ""jpm:ReceivablesAndDebtSecuritiesAllowanceForCreditLossAndOffBalanceSheetCreditLossLiability"",\n      ""unitRef"": ""usd"",\n      ""xsiNil"": ""false"",\n      ""lang"": ""en-US"",\n      ""decimals"": ""-8"",\n      ""ancestors"": [\n       ""span"",\n       ""div"",\n       ""div"",\n       ""div"",\n       ""ix:continuation"",\n       ""body"",\n       ""html""\n      ],\n      ""reportCount"": 1,\n      ""baseRef"": ""jpm-20251231.htm"",\n      ""first"": true,\n      ""unique"": true\n     }\n    },\n    ""R159"": {\n     ""role"": ""http://www.jpmorganchase.com/role/AllowanceforCreditLossesSummaryDetails"",\n     ""longName"": ""9955623 - Disclosure - Allowance for Credit Losses - Summary (Details)"",\n     ""shortName"": ""Allowance for Credit Losses - Summary (Details)"",\n     ""isDefault"": ""false"",\n     ""groupType"": ""disclosure"",\n     ""subGroupType"": ""details"",\n     ""menuCat"": ""Details"",', '""order"": ""53"",\n     ""firstAnchor"": {\n      ""contextRef"": ""c-1"",\n      ""name"": ""jpm:ComponentsOfInvestmentBankingFeesTableTextBlock"",\n      ""unitRef"": null,\n      ""xsiNil"": ""false"",\n      ""lang"": ""en-US"",\n      ""decimals"": null,\n      ""ancestors"": [\n       ""div"",\n       ""div"",\n       ""ix:continuation"",\n       ""body"",\n       ""html""\n      ],\n      ""reportCount"": 1,\n      ""baseRef"": ""jpm-20251231.htm"",\n      ""first"": true,\n      ""unique"": true\n     },\n     ""uniqueAnchor"": {\n      ""contextRef"": ""c-1"",\n      ""name"": ""jpm:ComponentsOfInvestmentBankingFeesTableTextBlock"",\n      ""unitRef"": null,\n      ""xsiNil"": ""false"",\n      ""lang"": ""en-US"",\n      ""decimals"": null,\n      ""ancestors"": [\n       ""div"",\n       ""div"",\n       ""ix:continuation"",\n       ""body"",\n       ""html""\n      ],\n      ""reportCount"": 1,\n      ""baseRef"": ""jpm-20251231.htm"",\n      ""first"": true,\n      ""unique"": true\n     }\n    },\n    ""R54"": {\n     ""role"": ""http://www.jpmorganchase.com/role/InterestIncomeandInterestExpenseTables"",\n     ""longName"": ""9955518 - Disclosure - Interest Income and Interest Expense (Tables)"",\n     ""shortName"": ""Interest Income and Interest Expense (Tables)"",\n     ""isDefault"": ""false"",\n     ""groupType"": ""disclosure"",\n     ""subGroupType"": ""tables"",\n     ""menuCat"": ""Tables"",\n     ""order"": ""54"",\n     ""firstAnchor"": {\n      ""contextRef"": ""c-1"",\n      ""name"": ""us-gaap:InterestIncomeAndInterestExpenseDisclosureTableTextBlock"",\n      ""unitRef"": null,\n      ""xsiNil"": ""false"",\n      ""lang"": ""en-US"",\n      ""decimals"": null,\n      ""ancestors"": [\n       ""div"",\n       ""ix:continuation"",\n       ""body"",\n       ""html""\n      ],\n      ""reportCount"": 1,\n      ""baseRef"": ""jpm-20251231.htm"",\n      ""first"": true,\n      ""unique"": true\n     },\n     ""uniqueAnchor"": {\n      ""contextRef"": ""c-1"",\n      ""name"": ""us-gaap:InterestIncomeAndInterestExpenseDisclosureTableTextBlock"",\n      ""unitRef"": null,\n      ""xsiNil"": ""false"",\n      ""lang"": ""en-US"",\n      ""decimals"": null,\n      ""ancestors"": [\n       ""div"",', '""baseRef"": ""jpm-20251231.htm"",\n      ""first"": true,\n      ""unique"": true\n     }\n    },\n    ""R38"": {\n     ""role"": ""http://www.jpmorganchase.com/role/PledgedAssetsandCollateral"",\n     ""longName"": ""9952186 - Disclosure - Pledged Assets and Collateral"",\n     ""shortName"": ""Pledged Assets and Collateral"",\n     ""isDefault"": ""false"",\n     ""groupType"": ""disclosure"",\n     ""subGroupType"": """",\n     ""menuCat"": ""Notes"",\n     ""order"": ""38"",\n     ""firstAnchor"": {\n      ""contextRef"": ""c-1"",\n      ""name"": ""us-gaap:CommitmentsContingenciesAndGuaranteesTextBlock"",\n      ""unitRef"": null,\n      ""xsiNil"": ""false"",\n      ""lang"": ""en-US"",\n      ""decimals"": null,\n      ""ancestors"": [\n       ""span"",\n       ""div"",\n       ""body"",\n       ""html""\n      ],\n      ""reportCount"": 1,\n      ""baseRef"": ""jpm-20251231.htm"",\n      ""first"": true,\n      ""unique"": true\n     },\n     ""uniqueAnchor"": {\n      ""contextRef"": ""c-1"",\n      ""name"": ""us-gaap:CommitmentsContingenciesAndGuaranteesTextBlock"",\n      ""unitRef"": null,\n      ""xsiNil"": ""false"",\n      ""lang"": ""en-US"",\n      ""decimals"": null,\n      ""ancestors"": [\n       ""span"",\n       ""div"",\n       ""body"",\n       ""html""\n      ],\n      ""reportCount"": 1,\n      ""baseRef"": ""jpm-20251231.htm"",\n      ""first"": true,\n      ""unique"": true\n     }\n    },\n    ""R39"": {\n     ""role"": ""http://www.jpmorganchase.com/role/Litigation"",\n     ""longName"": ""9952187 - Disclosure - Litigation"",\n     ""shortName"": ""Litigation"",\n     ""isDefault"": ""false"",\n     ""groupType"": ""disclosure"",\n     ""subGroupType"": """",\n     ""menuCat"": ""Notes"",\n     ""order"": ""39"",\n     ""firstAnchor"": {\n      ""contextRef"": ""c-1"",\n      ""name"": ""us-gaap:LegalMattersAndContingenciesTextBlock"",\n      ""unitRef"": null,\n      ""xsiNil"": ""false"",\n      ""lang"": ""en-US"",\n      ""decimals"": null,\n      ""ancestors"": [\n       ""span"",\n       ""div"",\n       ""body"",\n       ""html""\n      ],\n      ""reportCount"": 1,\n      ""baseRef"": ""jpm-20251231.htm"",\n      ""first"": true,\n      ""unique"": true\n     },\n     ""uniqueAnchor"": {', ""[WEB ARAMASI KAYNAĞI]: Yerel veri tabanında bulunamayan bilgi için internet ve finansal API'ler üzerinden şu güncel veriler elde edilmiştir:\nThe exact name of the registrant for ticker JPM is **JPMorgan Chase & Co.**""]",The exact name of the registrant for ticker JPM is JPMorgan Chase & Co.,The exact name of the registrant is JPMorgan Chase & Co.,0.0909090909,1.0,1.0,1.0
What is the exact name of the registrant for ticker DIS?,"['style=""color:#000000;font-family:\'Times New Roman\',serif;font-size:8.5pt;font-weight:400;line-height:120%"">Securities Registered Pursuant to Section&#160;12(g) of the Act: None.</span></div><div style=""margin-top:3pt;text-indent:22.5pt""><span style=""color:#000000;font-family:\'Times New Roman\',serif;font-size:8.5pt;font-weight:400;line-height:120%"">Indicate by check mark if the registrant is a well-known seasoned issuer, as defined in Rule 405 of the Securities Act.    <ix:nonNumeric contextRef=""c-1"" name=""dei:EntityWellKnownSeasonedIssuer"" id=""f-17"">Yes</ix:nonNumeric>&#160;</span><span style=""color:#000000;font-family:\'Wingdings\',sans-serif;font-size:8.5pt;font-weight:400;line-height:120%"">x</span><span style=""color:#000000;font-family:\'Times New Roman\',serif;font-size:8.5pt;font-weight:400;line-height:120%"">&#160;No&#160;</span><span style=""color:#000000;font-family:\'Wingdings\',sans-serif;font-size:8.5pt;font-weight:400;line-height:120%"">o</span></div><div style=""margin-top:3pt;text-indent:22.5pt""><span style=""color:#000000;font-family:\'Times New Roman\',serif;font-size:8.5pt;font-weight:400;line-height:120%"">Indicate by check mark if the registrant is not required to file reports pursuant to Section&#160;13 or Section&#160;15(d) of the Act.&#160;   Yes&#160;&#160;</span><span style=""color:#000000;font-family:\'Times New Roman\',serif;font-size:9pt;font-weight:400;line-height:120%"">&#9744;</span><span style=""color:#000000;font-family:\'Times New Roman\',serif;font-size:8.5pt;font-weight:400;line-height:120%"">&#160;<ix:nonNumeric contextRef=""c-1"" name=""dei:EntityVoluntaryFilers"" id=""f-18"">No</ix:nonNumeric>&#160;&#160;</span><span style=""color:#000000;font-family:\'Wingdings\',sans-serif;font-size:8.5pt;font-weight:400;line-height:120%"">x</span></div><div style=""margin-top:3pt;text-indent:22.5pt""><span style=""color:#000000;font-family:\'Times New Roman\',serif;font-size:8.5pt;font-weight:400;line-height:120%"">Indicate by check mark whether the registrant (1)&#160;has filed', '""lang"": ""en-US"",\n      ""decimals"": ""-6"",\n      ""ancestors"": [\n       ""span"",\n       ""td"",\n       ""tr"",\n       ""table"",\n       ""div"",\n       ""us-gaap:LeaseCostTableTextBlock"",\n       ""ix:continuation"",\n       ""ix:continuation"",\n       ""body"",\n       ""html""\n      ],\n      ""reportCount"": 1,\n      ""baseRef"": ""dis-20250927.htm"",\n      ""first"": true,\n      ""unique"": true\n     },\n     ""uniqueAnchor"": {\n      ""contextRef"": ""c-1"",\n      ""name"": ""us-gaap:FinanceLeaseRightOfUseAssetAmortization"",\n      ""unitRef"": ""usd"",\n      ""xsiNil"": ""false"",\n      ""lang"": ""en-US"",\n      ""decimals"": ""-6"",\n      ""ancestors"": [\n       ""span"",\n       ""td"",\n       ""tr"",\n       ""table"",\n       ""div"",\n       ""us-gaap:LeaseCostTableTextBlock"",\n       ""ix:continuation"",\n       ""ix:continuation"",\n       ""body"",\n       ""html""\n      ],\n      ""reportCount"": 1,\n      ""baseRef"": ""dis-20250927.htm"",\n      ""first"": true,\n      ""unique"": true\n     }\n    },\n    ""R125"": {\n     ""role"": ""http://corporate.disney.go.com/role/SummaryofCashFlowsArisingFromLeaseTransactionsDetails"",\n     ""longName"": ""9955605 - Disclosure - Summary of Cash Flows Arising From Lease Transactions (Details)"",\n     ""shortName"": ""Summary of Cash Flows Arising From Lease Transactions (Details)"",\n     ""isDefault"": ""false"",\n     ""groupType"": ""disclosure"",\n     ""subGroupType"": ""details"",\n     ""menuCat"": ""Details"",\n     ""order"": ""125"",\n     ""firstAnchor"": {\n      ""contextRef"": ""c-1"",\n      ""name"": ""us-gaap:OperatingLeasePayments"",\n      ""unitRef"": ""usd"",\n      ""xsiNil"": ""false"",\n      ""lang"": ""en-US"",\n      ""decimals"": ""-6"",\n      ""ancestors"": [\n       ""span"",\n       ""td"",\n       ""tr"",\n       ""table"",\n       ""div"",\n       ""dis:ImpactOfLeasePaymentsOnCashFlowsTableTextBlock"",\n       ""ix:continuation"",\n       ""ix:continuation"",\n       ""body"",\n       ""html""\n      ],\n      ""reportCount"": 1,\n      ""baseRef"": ""dis-20250927.htm"",\n      ""first"": true,\n      ""unique"": true\n     },\n     ""uniqueAnchor"": {\n      ""contextRef"": ""c-1"",', '""unitRef"": ""usd"",\n      ""xsiNil"": ""false"",\n      ""lang"": ""en-US"",\n      ""decimals"": ""-6"",\n      ""ancestors"": [\n       ""span"",\n       ""td"",\n       ""tr"",\n       ""table"",\n       ""div"",\n       ""us-gaap:ScheduleOfDerivativeInstrumentsInStatementOfFinancialPositionFairValueTextBlock"",\n       ""ix:continuation"",\n       ""body"",\n       ""html""\n      ],\n      ""reportCount"": 1,\n      ""baseRef"": ""dis-20250927.htm"",\n      ""first"": true,\n      ""unique"": true\n     },\n     ""uniqueAnchor"": {\n      ""contextRef"": ""c-647"",\n      ""name"": ""us-gaap:DerivativeAssetFairValueGrossAssetIncludingNotSubjectToMasterNettingArrangement"",\n      ""unitRef"": ""usd"",\n      ""xsiNil"": ""false"",\n      ""lang"": ""en-US"",\n      ""decimals"": ""-6"",\n      ""ancestors"": [\n       ""span"",\n       ""td"",\n       ""tr"",\n       ""table"",\n       ""div"",\n       ""us-gaap:ScheduleOfDerivativeInstrumentsInStatementOfFinancialPositionFairValueTextBlock"",\n       ""ix:continuation"",\n       ""body"",\n       ""html""\n      ],\n      ""reportCount"": 1,\n      ""baseRef"": ""dis-20250927.htm"",\n      ""first"": true,\n      ""unique"": true\n     }\n    },\n    ""R131"": {\n     ""role"": ""http://corporate.disney.go.com/role/DerivativeInstrumentsCarryingAmountandCumulativeBasisAdjustmentforFairValueHedgesDetails"",\n     ""longName"": ""9955611 - Disclosure - Derivative Instruments - Carrying Amount and Cumulative Basis Adjustment for Fair Value Hedges (Details)"",\n     ""shortName"": ""Derivative Instruments - Carrying Amount and Cumulative Basis Adjustment for Fair Value Hedges (Details)"",\n     ""isDefault"": ""false"",\n     ""groupType"": ""disclosure"",\n     ""subGroupType"": ""details"",\n     ""menuCat"": ""Details"",\n     ""order"": ""131"",\n     ""firstAnchor"": {\n      ""contextRef"": ""c-31"",\n      ""name"": ""us-gaap:HedgedLiabilityFairValueHedge"",\n      ""unitRef"": ""usd"",\n      ""xsiNil"": ""false"",\n      ""lang"": ""en-US"",\n      ""decimals"": ""-6"",\n      ""ancestors"": [\n       ""span"",\n       ""td"",\n       ""tr"",\n       ""table"",\n       ""div"",', '""div"",\n       ""body"",\n       ""html""\n      ],\n      ""reportCount"": 1,\n      ""baseRef"": ""dis-20250927.htm"",\n      ""first"": true,\n      ""unique"": true\n     }\n    },\n    ""R28"": {\n     ""role"": ""http://xbrl.sec.gov/ecd/role/InsiderTradingArrangements"",\n     ""longName"": ""995445 - Disclosure - Insider Trading Arrangements"",\n     ""shortName"": ""Insider Trading Arrangements"",\n     ""isDefault"": ""false"",\n     ""groupType"": ""disclosure"",\n     ""subGroupType"": """",\n     ""menuCat"": ""Notes"",\n     ""order"": ""28"",\n     ""firstAnchor"": {\n      ""contextRef"": ""c-32"",\n      ""name"": ""ecd:Rule10b51ArrAdoptedFlag"",\n      ""unitRef"": null,\n      ""xsiNil"": ""false"",\n      ""lang"": ""en-US"",\n      ""decimals"": null,\n      ""ancestors"": [\n       ""ecd:Rule10b51ArrTrmntdFlag"",\n       ""span"",\n       ""div"",\n       ""body"",\n       ""html""\n      ],\n      ""reportCount"": 1,\n      ""baseRef"": ""dis-20250927.htm"",\n      ""first"": true,\n      ""unique"": true\n     },\n     ""uniqueAnchor"": {\n      ""contextRef"": ""c-32"",\n      ""name"": ""ecd:Rule10b51ArrAdoptedFlag"",\n      ""unitRef"": null,\n      ""xsiNil"": ""false"",\n      ""lang"": ""en-US"",\n      ""decimals"": null,\n      ""ancestors"": [\n       ""ecd:Rule10b51ArrTrmntdFlag"",\n       ""span"",\n       ""div"",\n       ""body"",\n       ""html""\n      ],\n      ""reportCount"": 1,\n      ""baseRef"": ""dis-20250927.htm"",\n      ""first"": true,\n      ""unique"": true\n     }\n    },\n    ""R29"": {\n     ""role"": ""http://xbrl.sec.gov/ecd/role/InsiderTradingPoliciesProc"",\n     ""longName"": ""995447 - Disclosure - Insider Trading Policies and Procedures"",\n     ""shortName"": ""Insider Trading Policies and Procedures"",\n     ""isDefault"": ""false"",\n     ""groupType"": ""disclosure"",\n     ""subGroupType"": """",\n     ""menuCat"": ""Notes"",\n     ""order"": ""29"",\n     ""firstAnchor"": {\n      ""contextRef"": ""c-1"",\n      ""name"": ""ecd:InsiderTrdPoliciesProcAdoptedFlag"",\n      ""unitRef"": null,\n      ""xsiNil"": ""false"",\n      ""lang"": ""en-US"",\n      ""decimals"": null,\n      ""ancestors"": [\n       ""span"",\n       ""div"",\n       ""body"",\n       ""html""', '""unitRef"": ""usd"",\n      ""xsiNil"": ""false"",\n      ""lang"": ""en-US"",\n      ""decimals"": ""-6"",\n      ""ancestors"": [\n       ""span"",\n       ""div"",\n       ""ix:continuation"",\n       ""body"",\n       ""html""\n      ],\n      ""reportCount"": 1,\n      ""baseRef"": ""dis-20250927.htm"",\n      ""first"": true,\n      ""unique"": true\n     }\n    },\n    ""R67"": {\n     ""role"": ""http://corporate.disney.go.com/role/DispositionsChangesinCarryingAmountofGoodwillDetail"",\n     ""longName"": ""9955547 - Disclosure - Dispositions Changes in Carrying Amount of Goodwill (Detail)"",\n     ""shortName"": ""Dispositions Changes in Carrying Amount of Goodwill (Detail)"",\n     ""isDefault"": ""false"",\n     ""groupType"": ""disclosure"",\n     ""subGroupType"": ""details"",\n     ""menuCat"": ""Details"",\n     ""order"": ""67"",\n     ""firstAnchor"": {\n      ""contextRef"": ""c-35"",\n      ""name"": ""us-gaap:Goodwill"",\n      ""unitRef"": ""usd"",\n      ""xsiNil"": ""false"",\n      ""lang"": ""en-US"",\n      ""decimals"": ""-6"",\n      ""ancestors"": [\n       ""span"",\n       ""td"",\n       ""tr"",\n       ""table"",\n       ""div"",\n       ""body"",\n       ""html""\n      ],\n      ""reportCount"": 1,\n      ""baseRef"": ""dis-20250927.htm"",\n      ""first"": true\n     },\n     ""uniqueAnchor"": {\n      ""contextRef"": ""c-36"",\n      ""name"": ""us-gaap:Goodwill"",\n      ""unitRef"": ""usd"",\n      ""xsiNil"": ""false"",\n      ""lang"": ""en-US"",\n      ""decimals"": ""-6"",\n      ""ancestors"": [\n       ""span"",\n       ""td"",\n       ""tr"",\n       ""table"",\n       ""div"",\n       ""us-gaap:ScheduleOfGoodwillTextBlock"",\n       ""ix:continuation"",\n       ""body"",\n       ""html""\n      ],\n      ""reportCount"": 1,\n      ""baseRef"": ""dis-20250927.htm"",\n      ""unique"": true\n     }\n    },\n    ""R68"": {\n     ""role"": ""http://corporate.disney.go.com/role/AcquisitionsandDispositionsAdditionalInformationDetail"",\n     ""longName"": ""9955548 - Disclosure - Acquisitions and Dispositions - Additional Information (Detail)"",\n     ""shortName"": ""Acquisitions and Dispositions - Additional Information (Detail)"",\n     ""isDefault"": ""false"",', '""order"": ""85"",\n     ""firstAnchor"": {\n      ""contextRef"": ""c-1"",\n      ""name"": ""us-gaap:CurrentFederalTaxExpenseBenefit"",\n      ""unitRef"": ""usd"",\n      ""xsiNil"": ""false"",\n      ""lang"": ""en-US"",\n      ""decimals"": ""-6"",\n      ""ancestors"": [\n       ""span"",\n       ""td"",\n       ""tr"",\n       ""table"",\n       ""div"",\n       ""us-gaap:ScheduleOfComponentsOfIncomeTaxExpenseBenefitTableTextBlock"",\n       ""ix:continuation"",\n       ""body"",\n       ""html""\n      ],\n      ""reportCount"": 1,\n      ""baseRef"": ""dis-20250927.htm"",\n      ""first"": true,\n      ""unique"": true\n     },\n     ""uniqueAnchor"": {\n      ""contextRef"": ""c-1"",\n      ""name"": ""us-gaap:CurrentFederalTaxExpenseBenefit"",\n      ""unitRef"": ""usd"",\n      ""xsiNil"": ""false"",\n      ""lang"": ""en-US"",\n      ""decimals"": ""-6"",\n      ""ancestors"": [\n       ""span"",\n       ""td"",\n       ""tr"",\n       ""table"",\n       ""div"",\n       ""us-gaap:ScheduleOfComponentsOfIncomeTaxExpenseBenefitTableTextBlock"",\n       ""ix:continuation"",\n       ""body"",\n       ""html""\n      ],\n      ""reportCount"": 1,\n      ""baseRef"": ""dis-20250927.htm"",\n      ""first"": true,\n      ""unique"": true\n     }\n    },\n    ""R86"": {\n     ""role"": ""http://corporate.disney.go.com/role/IncomeTaxesDeferredTaxAssetsandLiabilitiesDetail"",\n     ""longName"": ""9955566 - Disclosure - Income Taxes - Deferred Tax Assets and Liabilities (Detail)"",\n     ""shortName"": ""Income Taxes - Deferred Tax Assets and Liabilities (Detail)"",\n     ""isDefault"": ""false"",\n     ""groupType"": ""disclosure"",\n     ""subGroupType"": ""details"",\n     ""menuCat"": ""Details"",\n     ""order"": ""86"",\n     ""firstAnchor"": {\n      ""contextRef"": ""c-31"",\n      ""name"": ""us-gaap:DeferredTaxAssetsOperatingLossCarryforwardsForeign"",\n      ""unitRef"": ""usd"",\n      ""xsiNil"": ""false"",\n      ""lang"": ""en-US"",\n      ""decimals"": ""-6"",\n      ""ancestors"": [\n       ""span"",\n       ""td"",\n       ""tr"",\n       ""table"",\n       ""div"",\n       ""us-gaap:ScheduleOfDeferredTaxAssetsAndLiabilitiesTableTextBlock"",\n       ""ix:continuation"",\n       ""body"",\n       ""html""', '""isDefault"": ""false"",\n     ""groupType"": ""disclosure"",\n     ""subGroupType"": ""details"",\n     ""menuCat"": ""Details"",\n     ""order"": ""112"",\n     ""firstAnchor"": {\n      ""contextRef"": ""c-1"",\n      ""name"": ""us-gaap:StockOptionPlanExpense"",\n      ""unitRef"": ""usd"",\n      ""xsiNil"": ""false"",\n      ""lang"": ""en-US"",\n      ""decimals"": ""-6"",\n      ""ancestors"": [\n       ""span"",\n       ""td"",\n       ""tr"",\n       ""table"",\n       ""div"",\n       ""us-gaap:ScheduleOfCompensationCostForShareBasedPaymentArrangementsAllocationOfShareBasedCompensationCostsByPlanTableTextBlock"",\n       ""ix:continuation"",\n       ""body"",\n       ""html""\n      ],\n      ""reportCount"": 1,\n      ""baseRef"": ""dis-20250927.htm"",\n      ""first"": true,\n      ""unique"": true\n     },\n     ""uniqueAnchor"": {\n      ""contextRef"": ""c-1"",\n      ""name"": ""us-gaap:StockOptionPlanExpense"",\n      ""unitRef"": ""usd"",\n      ""xsiNil"": ""false"",\n      ""lang"": ""en-US"",\n      ""decimals"": ""-6"",\n      ""ancestors"": [\n       ""span"",\n       ""td"",\n       ""tr"",\n       ""table"",\n       ""div"",\n       ""us-gaap:ScheduleOfCompensationCostForShareBasedPaymentArrangementsAllocationOfShareBasedCompensationCostsByPlanTableTextBlock"",\n       ""ix:continuation"",\n       ""body"",\n       ""html""\n      ],\n      ""reportCount"": 1,\n      ""baseRef"": ""dis-20250927.htm"",\n      ""first"": true,\n      ""unique"": true\n     }\n    },\n    ""R113"": {\n     ""role"": ""http://corporate.disney.go.com/role/EquityBasedCompensationInformationaboutStockOptionTransactionsDetail"",\n     ""longName"": ""9955593 - Disclosure - Equity-Based Compensation - Information about Stock Option Transactions (Detail)"",\n     ""shortName"": ""Equity-Based Compensation - Information about Stock Option Transactions (Detail)"",\n     ""isDefault"": ""false"",\n     ""groupType"": ""disclosure"",\n     ""subGroupType"": ""details"",\n     ""menuCat"": ""Details"",\n     ""order"": ""113"",\n     ""firstAnchor"": {\n      ""contextRef"": ""c-35"",\n      ""name"": ""us-gaap:ShareBasedCompensationArrangementByShareBasedPaymentAwardOptionsOutstandingNumber"",', '""firstAnchor"": {\n      ""contextRef"": ""c-1"",\n      ""name"": ""us-gaap:SharebasedCompensationArrangementBySharebasedPaymentAwardOptionsExercisableWeightedAverageRemainingContractualTerm1"",\n      ""unitRef"": null,\n      ""xsiNil"": ""false"",\n      ""lang"": ""en-US"",\n      ""decimals"": null,\n      ""ancestors"": [\n       ""span"",\n       ""div"",\n       ""ix:continuation"",\n       ""body"",\n       ""html""\n      ],\n      ""reportCount"": 1,\n      ""baseRef"": ""dis-20250927.htm"",\n      ""first"": true,\n      ""unique"": true\n     },\n     ""uniqueAnchor"": {\n      ""contextRef"": ""c-1"",\n      ""name"": ""us-gaap:SharebasedCompensationArrangementBySharebasedPaymentAwardOptionsExercisableWeightedAverageRemainingContractualTerm1"",\n      ""unitRef"": null,\n      ""xsiNil"": ""false"",\n      ""lang"": ""en-US"",\n      ""decimals"": null,\n      ""ancestors"": [\n       ""span"",\n       ""div"",\n       ""ix:continuation"",\n       ""body"",\n       ""html""\n      ],\n      ""reportCount"": 1,\n      ""baseRef"": ""dis-20250927.htm"",\n      ""first"": true,\n      ""unique"": true\n     }\n    },\n    ""R117"": {\n     ""role"": ""http://corporate.disney.go.com/role/DetailofCertainBalanceSheetAccountsCurrentReceivablesDetail"",\n     ""longName"": ""9955597 - Disclosure - Detail of Certain Balance Sheet Accounts - Current Receivables (Detail)"",\n     ""shortName"": ""Detail of Certain Balance Sheet Accounts - Current Receivables (Detail)"",\n     ""isDefault"": ""false"",\n     ""groupType"": ""disclosure"",\n     ""subGroupType"": ""details"",\n     ""menuCat"": ""Details"",\n     ""order"": ""117"",\n     ""firstAnchor"": {\n      ""contextRef"": ""c-31"",\n      ""name"": ""us-gaap:AccountsReceivableGrossCurrent"",\n      ""unitRef"": ""usd"",\n      ""xsiNil"": ""false"",\n      ""lang"": ""en-US"",\n      ""decimals"": ""-6"",\n      ""ancestors"": [\n       ""span"",\n       ""td"",\n       ""tr"",\n       ""table"",\n       ""div"",\n       ""us-gaap:ScheduleOfAccountsNotesLoansAndFinancingReceivableTextBlock"",\n       ""ix:continuation"",\n       ""body"",\n       ""html""\n      ],\n      ""reportCount"": 1,\n      ""baseRef"": ""dis-20250927.htm"",', '""order"": ""113"",\n     ""firstAnchor"": {\n      ""contextRef"": ""c-35"",\n      ""name"": ""us-gaap:ShareBasedCompensationArrangementByShareBasedPaymentAwardOptionsOutstandingNumber"",\n      ""unitRef"": ""shares"",\n      ""xsiNil"": ""false"",\n      ""lang"": ""en-US"",\n      ""decimals"": ""-6"",\n      ""ancestors"": [\n       ""span"",\n       ""td"",\n       ""tr"",\n       ""table"",\n       ""div"",\n       ""us-gaap:ScheduleOfShareBasedCompensationStockOptionsActivityTableTextBlock"",\n       ""ix:continuation"",\n       ""body"",\n       ""html""\n      ],\n      ""reportCount"": 1,\n      ""baseRef"": ""dis-20250927.htm"",\n      ""first"": true,\n      ""unique"": true\n     },\n     ""uniqueAnchor"": {\n      ""contextRef"": ""c-35"",\n      ""name"": ""us-gaap:ShareBasedCompensationArrangementByShareBasedPaymentAwardOptionsOutstandingNumber"",\n      ""unitRef"": ""shares"",\n      ""xsiNil"": ""false"",\n      ""lang"": ""en-US"",\n      ""decimals"": ""-6"",\n      ""ancestors"": [\n       ""span"",\n       ""td"",\n       ""tr"",\n       ""table"",\n       ""div"",\n       ""us-gaap:ScheduleOfShareBasedCompensationStockOptionsActivityTableTextBlock"",\n       ""ix:continuation"",\n       ""body"",\n       ""html""\n      ],\n      ""reportCount"": 1,\n      ""baseRef"": ""dis-20250927.htm"",\n      ""first"": true,\n      ""unique"": true\n     }\n    },\n    ""R114"": {\n     ""role"": ""http://corporate.disney.go.com/role/EquityBasedCompensationInformationaboutStockOptionsVestedandExpectedtoVestDetail"",\n     ""longName"": ""9955594 - Disclosure - Equity-Based Compensation - Information about Stock Options Vested and Expected to Vest (Detail)"",\n     ""shortName"": ""Equity-Based Compensation - Information about Stock Options Vested and Expected to Vest (Detail)"",\n     ""isDefault"": ""false"",\n     ""groupType"": ""disclosure"",\n     ""subGroupType"": ""details"",\n     ""menuCat"": ""Details"",\n     ""order"": ""114"",\n     ""firstAnchor"": {\n      ""contextRef"": ""c-572"",\n      ""name"": ""us-gaap:ShareBasedCompensationArrangementByShareBasedPaymentAwardOptionsVestedAndExpectedToVestOutstandingNumber"",\n      ""unitRef"": ""shares"",', '""unitRef"": ""usd"",\n      ""xsiNil"": ""false"",\n      ""lang"": ""en-US"",\n      ""decimals"": ""-6"",\n      ""ancestors"": [\n       ""span"",\n       ""td"",\n       ""tr"",\n       ""table"",\n       ""div"",\n       ""ix:continuation"",\n       ""ix:continuation"",\n       ""body"",\n       ""html""\n      ],\n      ""reportCount"": 1,\n      ""baseRef"": ""dis-20250927.htm"",\n      ""first"": true,\n      ""unique"": true\n     },\n     ""uniqueAnchor"": {\n      ""contextRef"": ""c-1"",\n      ""name"": ""us-gaap:UnrealizedGainLossOnForeignCurrencyDerivativesNetBeforeTax"",\n      ""unitRef"": ""usd"",\n      ""xsiNil"": ""false"",\n      ""lang"": ""en-US"",\n      ""decimals"": ""-6"",\n      ""ancestors"": [\n       ""span"",\n       ""td"",\n       ""tr"",\n       ""table"",\n       ""div"",\n       ""ix:continuation"",\n       ""ix:continuation"",\n       ""body"",\n       ""html""\n      ],\n      ""reportCount"": 1,\n      ""baseRef"": ""dis-20250927.htm"",\n      ""first"": true,\n      ""unique"": true\n     }\n    },\n    ""R134"": {\n     ""role"": ""http://corporate.disney.go.com/role/DerivativeInstrumentsAdditionalInformationDetail"",\n     ""longName"": ""9955615 - Disclosure - Derivative Instruments - Additional Information (Detail)"",\n     ""shortName"": ""Derivative Instruments - Additional Information (Detail)"",\n     ""isDefault"": ""false"",\n     ""groupType"": ""disclosure"",\n     ""subGroupType"": ""details"",\n     ""menuCat"": ""Details"",\n     ""order"": ""134"",\n     ""firstAnchor"": {\n      ""contextRef"": ""c-1"",\n      ""name"": ""us-gaap:CashFlowHedgeGainLossToBeReclassifiedWithinTwelveMonths"",\n      ""unitRef"": ""usd"",\n      ""xsiNil"": ""false"",\n      ""lang"": ""en-US"",\n      ""decimals"": ""-6"",\n      ""ancestors"": [\n       ""span"",\n       ""div"",\n       ""ix:continuation"",\n       ""body"",\n       ""html""\n      ],\n      ""reportCount"": 1,\n      ""baseRef"": ""dis-20250927.htm"",\n      ""first"": true,\n      ""unique"": true\n     },\n     ""uniqueAnchor"": {\n      ""contextRef"": ""c-1"",\n      ""name"": ""us-gaap:CashFlowHedgeGainLossToBeReclassifiedWithinTwelveMonths"",\n      ""unitRef"": ""usd"",\n      ""xsiNil"": ""false"",', ""[WEB ARAMASI KAYNAĞI]: Yerel veri tabanında bulunamayan bilgi için internet ve finansal API'ler üzerinden şu güncel veriler elde edilmiştir:\nThe exact name of the registrant for the ticker DIS is **DISH Network Corporation**. \n\nFor more details, you can refer to the official SEC filing [here](https://www.sec.gov/Archives/edgar/data/1001082/000110465919066428/a19-21818_88a12b.htm).""]",The exact name of the registrant for the ticker DIS is DISH Network Corporation.,The exact name of the registrant is The Walt Disney Company.,0.0,0.0,1.0,0.9955316054955841
"Does Tesla have any preferred stock, and if so, what is its par value?","[']\n    },\n    ""us-gaap_PreferredStockSharesOutstanding"": {\n     ""xbrltype"": ""sharesItemType"",\n     ""nsuri"": ""http://fasb.org/us-gaap/2025"",\n     ""localname"": ""PreferredStockSharesOutstanding"",\n     ""presentation"": [\n      ""http://www.tesla.com/role/ConsolidatedBalanceSheetsParenthetical""\n     ],\n     ""lang"": {\n      ""en-us"": {\n       ""role"": {\n        ""terseLabel"": ""Preferred stock, shares outstanding (in shares)"",\n        ""label"": ""Preferred Stock, Shares Outstanding"",\n        ""documentation"": ""Aggregate share number for all nonredeemable preferred stock (or preferred stock redeemable solely at the option of the issuer) held by stockholders. Does not include preferred shares that have been repurchased.""\n       }\n      }\n     },\n     ""auth_ref"": [\n      ""r77"",\n      ""r1028"",\n      ""r1046"",\n      ""r1692"",\n      ""r1693""\n     ]\n    },\n    ""us-gaap_PreferredStockValue"": {\n     ""xbrltype"": ""monetaryItemType"",\n     ""nsuri"": ""http://fasb.org/us-gaap/2025"",\n     ""localname"": ""PreferredStockValue"",\n     ""crdr"": ""credit"",\n     ""calculation"": {\n      ""http://www.tesla.com/role/ConsolidatedBalanceSheets"": {\n       ""parentTag"": ""us-gaap_StockholdersEquity"",\n       ""weight"": 1.0,\n       ""order"": 1.0\n      }\n     },\n     ""presentation"": [\n      ""http://www.tesla.com/role/ConsolidatedBalanceSheets""\n     ],\n     ""lang"": {\n      ""en-us"": {\n       ""role"": {\n        ""terseLabel"": ""Preferred stock; $0.001 par value; 100 shares authorized; no shares issued and outstanding"",\n        ""label"": ""Preferred Stock, Value, Issued"",\n        ""documentation"": ""Aggregate par or stated value of issued nonredeemable preferred stock (or preferred stock redeemable solely at the option of the issuer). This item includes treasury stock repurchased by the entity. Note: elements for number of nonredeemable preferred shares, par value and other disclosure concepts are in another section within stockholders\' equity.""\n       }\n      }\n     },\n     ""auth_ref"": [\n      ""r77"",\n      ""r500"",\n      ""r507"",', ']\n    },\n    ""us-gaap_PreferredStockSharesOutstanding"": {\n     ""xbrltype"": ""sharesItemType"",\n     ""nsuri"": ""http://fasb.org/us-gaap/2025"",\n     ""localname"": ""PreferredStockSharesOutstanding"",\n     ""presentation"": [\n      ""http://www.tesla.com/role/ConsolidatedBalanceSheetsParenthetical""\n     ],\n     ""lang"": {\n      ""en-us"": {\n       ""role"": {\n        ""terseLabel"": ""Preferred stock, shares outstanding (in shares)"",\n        ""label"": ""Preferred Stock, Shares Outstanding"",\n        ""documentation"": ""Aggregate share number for all nonredeemable preferred stock (or preferred stock redeemable solely at the option of the issuer) held by stockholders. Does not include preferred shares that have been repurchased.""\n       }\n      }\n     },\n     ""auth_ref"": [\n      ""r77"",\n      ""r1028"",\n      ""r1046"",\n      ""r1692"",\n      ""r1693""\n     ]\n    },\n    ""us-gaap_PreferredStockValue"": {\n     ""xbrltype"": ""monetaryItemType"",\n     ""nsuri"": ""http://fasb.org/us-gaap/2025"",\n     ""localname"": ""PreferredStockValue"",\n     ""crdr"": ""credit"",\n     ""calculation"": {\n      ""http://www.tesla.com/role/ConsolidatedBalanceSheets"": {\n       ""parentTag"": ""us-gaap_StockholdersEquity"",\n       ""weight"": 1.0,\n       ""order"": 1.0\n      }\n     },\n     ""presentation"": [\n      ""http://www.tesla.com/role/ConsolidatedBalanceSheets""\n     ],\n     ""lang"": {\n      ""en-us"": {\n       ""role"": {\n        ""terseLabel"": ""Preferred stock; $0.001 par value; 100 shares authorized; no shares issued and outstanding"",\n        ""label"": ""Preferred Stock, Value, Issued"",\n        ""documentation"": ""Aggregate par or stated value of issued nonredeemable preferred stock (or preferred stock redeemable solely at the option of the issuer). This item includes treasury stock repurchased by the entity. Note: elements for number of nonredeemable preferred shares, par value and other disclosure concepts are in another section within stockholders\' equity.""\n       }\n      }\n     },\n     ""auth_ref"": [\n      ""r77"",\n      ""r500"",\n      ""r507"",', '""us-gaap_CommonStockSharesOutstanding"": {\n     ""xbrltype"": ""sharesItemType"",\n     ""nsuri"": ""http://fasb.org/us-gaap/2025"",\n     ""localname"": ""CommonStockSharesOutstanding"",\n     ""presentation"": [\n      ""http://www.tesla.com/role/ConsolidatedBalanceSheetsParenthetical""\n     ],\n     ""lang"": {\n      ""en-us"": {\n       ""role"": {\n        ""terseLabel"": ""Common stock, shares outstanding (in shares)"",\n        ""label"": ""Common Stock, Shares, Outstanding"",\n        ""documentation"": ""Number of shares of common stock outstanding. Common stock represent the ownership interest in a corporation.""\n       }\n      }\n     },\n     ""auth_ref"": [\n      ""r11"",\n      ""r78"",\n      ""r1028"",\n      ""r1046"",\n      ""r1692"",\n      ""r1693""\n     ]\n    },\n    ""us-gaap_CommonStockValue"": {\n     ""xbrltype"": ""monetaryItemType"",\n     ""nsuri"": ""http://fasb.org/us-gaap/2025"",\n     ""localname"": ""CommonStockValue"",\n     ""crdr"": ""credit"",\n     ""calculation"": {\n      ""http://www.tesla.com/role/ConsolidatedBalanceSheets"": {\n       ""parentTag"": ""us-gaap_StockholdersEquity"",\n       ""weight"": 1.0,\n       ""order"": 2.0\n      }\n     },\n     ""presentation"": [\n      ""http://www.tesla.com/role/ConsolidatedBalanceSheets""\n     ],\n     ""lang"": {\n      ""en-us"": {\n       ""role"": {\n        ""terseLabel"": ""Common stock; $0.001 par value; 6,000 shares authorized; 3,751 and 3,216 shares issued and outstanding as of December\\u00a031, 2025 and 2024, respectively"",\n        ""label"": ""Common Stock, Value, Issued"",\n        ""documentation"": ""Aggregate par or stated value of issued nonredeemable common stock (or common stock redeemable solely at the option of the issuer). This item includes treasury stock repurchased by the entity. Note: elements for number of nonredeemable common shares, par value and other disclosure concepts are in another section within stockholders\' equity.""\n       }\n      }\n     },\n     ""auth_ref"": [\n      ""r78"",\n      ""r500"",\n      ""r508"",\n      ""r940"",\n      ""r1226""\n     ]\n    },', '""us-gaap_CommonStockSharesOutstanding"": {\n     ""xbrltype"": ""sharesItemType"",\n     ""nsuri"": ""http://fasb.org/us-gaap/2025"",\n     ""localname"": ""CommonStockSharesOutstanding"",\n     ""presentation"": [\n      ""http://www.tesla.com/role/ConsolidatedBalanceSheetsParenthetical""\n     ],\n     ""lang"": {\n      ""en-us"": {\n       ""role"": {\n        ""terseLabel"": ""Common stock, shares outstanding (in shares)"",\n        ""label"": ""Common Stock, Shares, Outstanding"",\n        ""documentation"": ""Number of shares of common stock outstanding. Common stock represent the ownership interest in a corporation.""\n       }\n      }\n     },\n     ""auth_ref"": [\n      ""r11"",\n      ""r78"",\n      ""r1028"",\n      ""r1046"",\n      ""r1692"",\n      ""r1693""\n     ]\n    },\n    ""us-gaap_CommonStockValue"": {\n     ""xbrltype"": ""monetaryItemType"",\n     ""nsuri"": ""http://fasb.org/us-gaap/2025"",\n     ""localname"": ""CommonStockValue"",\n     ""crdr"": ""credit"",\n     ""calculation"": {\n      ""http://www.tesla.com/role/ConsolidatedBalanceSheets"": {\n       ""parentTag"": ""us-gaap_StockholdersEquity"",\n       ""weight"": 1.0,\n       ""order"": 2.0\n      }\n     },\n     ""presentation"": [\n      ""http://www.tesla.com/role/ConsolidatedBalanceSheets""\n     ],\n     ""lang"": {\n      ""en-us"": {\n       ""role"": {\n        ""terseLabel"": ""Common stock; $0.001 par value; 6,000 shares authorized; 3,751 and 3,216 shares issued and outstanding as of December\\u00a031, 2025 and 2024, respectively"",\n        ""label"": ""Common Stock, Value, Issued"",\n        ""documentation"": ""Aggregate par or stated value of issued nonredeemable common stock (or common stock redeemable solely at the option of the issuer). This item includes treasury stock repurchased by the entity. Note: elements for number of nonredeemable common shares, par value and other disclosure concepts are in another section within stockholders\' equity.""\n       }\n      }\n     },\n     ""auth_ref"": [\n      ""r78"",\n      ""r500"",\n      ""r508"",\n      ""r940"",\n      ""r1226""\n     ]\n    },', '}\n      }\n     },\n     ""auth_ref"": []\n    },\n    ""us-gaap_CommonStockMember"": {\n     ""xbrltype"": ""domainItemType"",\n     ""nsuri"": ""http://fasb.org/us-gaap/2025"",\n     ""localname"": ""CommonStockMember"",\n     ""presentation"": [\n      ""http://www.tesla.com/role/ConsolidatedStatementsofRedeemableNoncontrollingInterestsandEquity""\n     ],\n     ""lang"": {\n      ""en-us"": {\n       ""role"": {\n        ""terseLabel"": ""Common Stock"",\n        ""label"": ""Common Stock [Member]"",\n        ""documentation"": ""Stock that is subordinate to all other stock of the issuer.""\n       }\n      }\n     },\n     ""auth_ref"": [\n      ""r1248"",\n      ""r1249"",\n      ""r1250"",\n      ""r1252"",\n      ""r1253"",\n      ""r1254"",\n      ""r1255"",\n      ""r1469"",\n      ""r1470"",\n      ""r1475"",\n      ""r1614"",\n      ""r1688"",\n      ""r1692""\n     ]\n    },\n    ""tsla_CommonStockNewSpecialShareReserve"": {\n     ""xbrltype"": ""sharesItemType"",\n     ""nsuri"": ""http://www.tesla.com/20251231"",\n     ""localname"": ""CommonStockNewSpecialShareReserve"",\n     ""presentation"": [\n      ""http://www.tesla.com/role/EquityIncentivePlansAdditionalInformationDetails""\n     ],\n     ""lang"": {\n      ""en-us"": {\n       ""role"": {\n        ""terseLabel"": ""New special share reserve (in shares)"",\n        ""label"": ""Common Stock, New Special Share Reserve"",\n        ""documentation"": ""Common Stock, New Special Share Reserve""\n       }\n      }\n     },\n     ""auth_ref"": []\n    },\n    ""us-gaap_CommonStockParOrStatedValuePerShare"": {\n     ""xbrltype"": ""perShareItemType"",\n     ""nsuri"": ""http://fasb.org/us-gaap/2025"",\n     ""localname"": ""CommonStockParOrStatedValuePerShare"",\n     ""presentation"": [\n      ""http://www.tesla.com/role/ConsolidatedBalanceSheetsParenthetical""\n     ],\n     ""lang"": {\n      ""en-us"": {\n       ""role"": {\n        ""terseLabel"": ""Common stock, par value (in dollars per share)"",\n        ""label"": ""Common Stock, Par or Stated Value Per Share"",\n        ""documentation"": ""Face amount or stated value per share of common stock.""\n       }\n      }\n     },', '}\n      }\n     },\n     ""auth_ref"": []\n    },\n    ""us-gaap_CommonStockMember"": {\n     ""xbrltype"": ""domainItemType"",\n     ""nsuri"": ""http://fasb.org/us-gaap/2025"",\n     ""localname"": ""CommonStockMember"",\n     ""presentation"": [\n      ""http://www.tesla.com/role/ConsolidatedStatementsofRedeemableNoncontrollingInterestsandEquity""\n     ],\n     ""lang"": {\n      ""en-us"": {\n       ""role"": {\n        ""terseLabel"": ""Common Stock"",\n        ""label"": ""Common Stock [Member]"",\n        ""documentation"": ""Stock that is subordinate to all other stock of the issuer.""\n       }\n      }\n     },\n     ""auth_ref"": [\n      ""r1248"",\n      ""r1249"",\n      ""r1250"",\n      ""r1252"",\n      ""r1253"",\n      ""r1254"",\n      ""r1255"",\n      ""r1469"",\n      ""r1470"",\n      ""r1475"",\n      ""r1614"",\n      ""r1688"",\n      ""r1692""\n     ]\n    },\n    ""tsla_CommonStockNewSpecialShareReserve"": {\n     ""xbrltype"": ""sharesItemType"",\n     ""nsuri"": ""http://www.tesla.com/20251231"",\n     ""localname"": ""CommonStockNewSpecialShareReserve"",\n     ""presentation"": [\n      ""http://www.tesla.com/role/EquityIncentivePlansAdditionalInformationDetails""\n     ],\n     ""lang"": {\n      ""en-us"": {\n       ""role"": {\n        ""terseLabel"": ""New special share reserve (in shares)"",\n        ""label"": ""Common Stock, New Special Share Reserve"",\n        ""documentation"": ""Common Stock, New Special Share Reserve""\n       }\n      }\n     },\n     ""auth_ref"": []\n    },\n    ""us-gaap_CommonStockParOrStatedValuePerShare"": {\n     ""xbrltype"": ""perShareItemType"",\n     ""nsuri"": ""http://fasb.org/us-gaap/2025"",\n     ""localname"": ""CommonStockParOrStatedValuePerShare"",\n     ""presentation"": [\n      ""http://www.tesla.com/role/ConsolidatedBalanceSheetsParenthetical""\n     ],\n     ""lang"": {\n      ""en-us"": {\n       ""role"": {\n        ""terseLabel"": ""Common stock, par value (in dollars per share)"",\n        ""label"": ""Common Stock, Par or Stated Value Per Share"",\n        ""documentation"": ""Face amount or stated value per share of common stock.""\n       }\n      }\n     },', '""documentation"": ""Face amount or stated value per share of preferred stock nonredeemable or redeemable solely at the option of the issuer.""\n       }\n      }\n     },\n     ""auth_ref"": [\n      ""r77"",\n      ""r510""\n     ]\n    },\n    ""us-gaap_PreferredStockSharesAuthorized"": {\n     ""xbrltype"": ""sharesItemType"",\n     ""nsuri"": ""http://fasb.org/us-gaap/2025"",\n     ""localname"": ""PreferredStockSharesAuthorized"",\n     ""presentation"": [\n      ""http://www.tesla.com/role/ConsolidatedBalanceSheetsParenthetical""\n     ],\n     ""lang"": {\n      ""en-us"": {\n       ""role"": {\n        ""terseLabel"": ""Preferred stock, shares authorized (in shares)"",\n        ""label"": ""Preferred Stock, Shares Authorized"",\n        ""documentation"": ""The maximum number of nonredeemable preferred shares (or preferred stock redeemable solely at the option of the issuer) permitted to be issued by an entity\'s charter and bylaws.""\n       }\n      }\n     },\n     ""auth_ref"": [\n      ""r77"",\n      ""r1028""\n     ]\n    },\n    ""us-gaap_PreferredStockSharesIssued"": {\n     ""xbrltype"": ""sharesItemType"",\n     ""nsuri"": ""http://fasb.org/us-gaap/2025"",\n     ""localname"": ""PreferredStockSharesIssued"",\n     ""presentation"": [\n      ""http://www.tesla.com/role/ConsolidatedBalanceSheetsParenthetical""\n     ],\n     ""lang"": {\n      ""en-us"": {\n       ""role"": {\n        ""terseLabel"": ""Preferred stock, shares issued (in shares)"",\n        ""label"": ""Preferred Stock, Shares Issued"",\n        ""documentation"": ""Number of shares issued for nonredeemable preferred shares and preferred shares redeemable solely at option of issuer. Includes, but is not limited to, preferred shares issued, repurchased, and held as treasury shares. Excludes preferred shares classified as debt.""\n       }\n      }\n     },\n     ""auth_ref"": [\n      ""r77"",\n      ""r510""\n     ]\n    },\n    ""us-gaap_PreferredStockSharesOutstanding"": {\n     ""xbrltype"": ""sharesItemType"",\n     ""nsuri"": ""http://fasb.org/us-gaap/2025"",\n     ""localname"": ""PreferredStockSharesOutstanding"",', '""documentation"": ""Face amount or stated value per share of preferred stock nonredeemable or redeemable solely at the option of the issuer.""\n       }\n      }\n     },\n     ""auth_ref"": [\n      ""r77"",\n      ""r510""\n     ]\n    },\n    ""us-gaap_PreferredStockSharesAuthorized"": {\n     ""xbrltype"": ""sharesItemType"",\n     ""nsuri"": ""http://fasb.org/us-gaap/2025"",\n     ""localname"": ""PreferredStockSharesAuthorized"",\n     ""presentation"": [\n      ""http://www.tesla.com/role/ConsolidatedBalanceSheetsParenthetical""\n     ],\n     ""lang"": {\n      ""en-us"": {\n       ""role"": {\n        ""terseLabel"": ""Preferred stock, shares authorized (in shares)"",\n        ""label"": ""Preferred Stock, Shares Authorized"",\n        ""documentation"": ""The maximum number of nonredeemable preferred shares (or preferred stock redeemable solely at the option of the issuer) permitted to be issued by an entity\'s charter and bylaws.""\n       }\n      }\n     },\n     ""auth_ref"": [\n      ""r77"",\n      ""r1028""\n     ]\n    },\n    ""us-gaap_PreferredStockSharesIssued"": {\n     ""xbrltype"": ""sharesItemType"",\n     ""nsuri"": ""http://fasb.org/us-gaap/2025"",\n     ""localname"": ""PreferredStockSharesIssued"",\n     ""presentation"": [\n      ""http://www.tesla.com/role/ConsolidatedBalanceSheetsParenthetical""\n     ],\n     ""lang"": {\n      ""en-us"": {\n       ""role"": {\n        ""terseLabel"": ""Preferred stock, shares issued (in shares)"",\n        ""label"": ""Preferred Stock, Shares Issued"",\n        ""documentation"": ""Number of shares issued for nonredeemable preferred shares and preferred shares redeemable solely at option of issuer. Includes, but is not limited to, preferred shares issued, repurchased, and held as treasury shares. Excludes preferred shares classified as debt.""\n       }\n      }\n     },\n     ""auth_ref"": [\n      ""r77"",\n      ""r510""\n     ]\n    },\n    ""us-gaap_PreferredStockSharesOutstanding"": {\n     ""xbrltype"": ""sharesItemType"",\n     ""nsuri"": ""http://fasb.org/us-gaap/2025"",\n     ""localname"": ""PreferredStockSharesOutstanding"",', '""r1563""\n     ]\n    },\n    ""us-gaap_SharesIssued"": {\n     ""xbrltype"": ""sharesItemType"",\n     ""nsuri"": ""http://fasb.org/us-gaap/2025"",\n     ""localname"": ""SharesIssued"",\n     ""presentation"": [\n      ""http://www.tesla.com/role/ConsolidatedStatementsofRedeemableNoncontrollingInterestsandEquity""\n     ],\n     ""lang"": {\n      ""en-us"": {\n       ""role"": {\n        ""periodStartLabel"": ""Balance (in shares)"",\n        ""periodEndLabel"": ""Balance (in shares)"",\n        ""label"": ""Shares, Issued"",\n        ""documentation"": ""Number of shares of stock issued as of the balance sheet date, including shares that had been issued and were previously outstanding but which are now held in the treasury.""\n       }\n      }\n     },\n     ""auth_ref"": [\n      ""r11""\n     ]\n    },\n    ""us-gaap_ShortTermInvestments"": {\n     ""xbrltype"": ""monetaryItemType"",\n     ""nsuri"": ""http://fasb.org/us-gaap/2025"",\n     ""localname"": ""ShortTermInvestments"",\n     ""crdr"": ""debit"",\n     ""calculation"": {\n      ""http://www.tesla.com/role/ConsolidatedBalanceSheets"": {\n       ""parentTag"": ""us-gaap_AssetsCurrent"",\n       ""weight"": 1.0,\n       ""order"": 2.0\n      }\n     },\n     ""presentation"": [\n      ""http://www.tesla.com/role/ConsolidatedBalanceSheets"",\n      ""http://www.tesla.com/role/FairValueofFinancialInstrumentsScheduleofCashCashEquivalentsandInvestmentsClassifiedbySecurityTypeDetails""\n     ],\n     ""lang"": {\n      ""en-us"": {\n       ""role"": {\n        ""terseLabel"": ""Short-term investments"",\n        ""label"": ""Short-Term Investments"",\n        ""documentation"": ""Amount of investments including trading securities, available-for-sale securities, held-to-maturity securities, and short-term investments classified as other and current.""\n       }\n      }\n     },\n     ""auth_ref"": [\n      ""r128"",\n      ""r129"",\n      ""r1406""\n     ]\n    },\n    ""us-gaap_SignificantAccountingPoliciesTextBlock"": {\n     ""xbrltype"": ""textBlockItemType"",\n     ""nsuri"": ""http://fasb.org/us-gaap/2025"",', '""r1563""\n     ]\n    },\n    ""us-gaap_SharesIssued"": {\n     ""xbrltype"": ""sharesItemType"",\n     ""nsuri"": ""http://fasb.org/us-gaap/2025"",\n     ""localname"": ""SharesIssued"",\n     ""presentation"": [\n      ""http://www.tesla.com/role/ConsolidatedStatementsofRedeemableNoncontrollingInterestsandEquity""\n     ],\n     ""lang"": {\n      ""en-us"": {\n       ""role"": {\n        ""periodStartLabel"": ""Balance (in shares)"",\n        ""periodEndLabel"": ""Balance (in shares)"",\n        ""label"": ""Shares, Issued"",\n        ""documentation"": ""Number of shares of stock issued as of the balance sheet date, including shares that had been issued and were previously outstanding but which are now held in the treasury.""\n       }\n      }\n     },\n     ""auth_ref"": [\n      ""r11""\n     ]\n    },\n    ""us-gaap_ShortTermInvestments"": {\n     ""xbrltype"": ""monetaryItemType"",\n     ""nsuri"": ""http://fasb.org/us-gaap/2025"",\n     ""localname"": ""ShortTermInvestments"",\n     ""crdr"": ""debit"",\n     ""calculation"": {\n      ""http://www.tesla.com/role/ConsolidatedBalanceSheets"": {\n       ""parentTag"": ""us-gaap_AssetsCurrent"",\n       ""weight"": 1.0,\n       ""order"": 2.0\n      }\n     },\n     ""presentation"": [\n      ""http://www.tesla.com/role/ConsolidatedBalanceSheets"",\n      ""http://www.tesla.com/role/FairValueofFinancialInstrumentsScheduleofCashCashEquivalentsandInvestmentsClassifiedbySecurityTypeDetails""\n     ],\n     ""lang"": {\n      ""en-us"": {\n       ""role"": {\n        ""terseLabel"": ""Short-term investments"",\n        ""label"": ""Short-Term Investments"",\n        ""documentation"": ""Amount of investments including trading securities, available-for-sale securities, held-to-maturity securities, and short-term investments classified as other and current.""\n       }\n      }\n     },\n     ""auth_ref"": [\n      ""r128"",\n      ""r129"",\n      ""r1406""\n     ]\n    },\n    ""us-gaap_SignificantAccountingPoliciesTextBlock"": {\n     ""xbrltype"": ""textBlockItemType"",\n     ""nsuri"": ""http://fasb.org/us-gaap/2025"",', ""[WEB ARAMASI KAYNAĞI]: Yerel veri tabanında bulunamayan bilgi için internet ve finansal API'ler üzerinden şu güncel veriler elde edilmiştir:\nTesla does have preferred stock, with a par value of $0.001. However, it is important to note that there are 100 shares authorized, but no shares are issued and outstanding. \n\nFor more details, you can refer to the [Tesla Investor Relations document](https://ir.tesla.com/_flysystem/s3/sec/000119312520236699/d931870d424b5.html).""]","Yes, Tesla has preferred stock with a par value of $0.001. However, there are 100 shares authorized, but no shares are issued and outstanding.","Yes, Tesla has preferred stock with a par value of $0.001 per share.",0.757575757550505,1.0,1.0,0.9802877412207048
